,dist,conm,busdesc
TSLA,0.0,TESLA INC,"Tesla, Inc. designs, develops, manufactures, leases, and sells electric vehicles, and energy generation and storage systems in the United States, China, Netherlands, Norway, and internationally. The company operates in two segments, Automotive; and Energy Generation and Storage."
NRG,0.0256,NRG ENERGY INC,"NRG Energy, Inc., together with its subsidiaries, operates as an energy company in the United States. It operates through Generation and Retail segments."
BTU,0.0346,PEABODY ENERGY CORP,"Peabody Energy Corporation engages in coal mining business. The company operates through Seaborne Thermal Mining, Seaborne Metallurgical Mining, Powder River Basin Mining, Midwestern U.S. Mining, Western U.S. Mining, and Corporate and Other segments."
SE,0.0571,SEA LTD - ADR,"Sea Limited engages in the digital entertainment, e-commerce, and digital financial service businesses in Southeast Asia, Latin America, rest of Asia, and internationally."
NKTR,0.0742,NEKTAR THERAPEUTICS,"Nektar Therapeutics, a biopharmaceutical company, researches and develops drug candidates for cancer and auto-immune disease in the United States."
CHK,0.103,,
