,dist,conm,busdesc
TLAB,0.0,TELLABS INC,"Tellabs Inc. designs, develops, and supports telecommunication networking products for communication service providers in the United States and internationally. The company operates through four segments: Optical, Data, Access, and Services."
QRVO,0.0262,QORVO INC,"Qorvo, Inc. develops and commercializes technologies and products for wireless and wired connectivity worldwide. The company operates in two segments, Mobile Products, and Infrastructure and Defense Products."
PMCS,0.0396,PMC-SIERRA INC,"Microsemi Storage Solutions, Inc. designs, develops, markets, and supports semiconductor solutions for communications network infrastructure equipment worldwide. Its semiconductor devices enable networking equipment primarily in three markets, including storage, optical, and mobile networks."
MU,0.0557,MICRON TECHNOLOGY INC,"Micron Technology, Inc. designs, manufactures, and sells memory and storage products worldwide. The company operates through four segments: Compute and Networking Business Unit, Mobile Business Unit, Storage Business Unit, and Embedded Business Unit."
H,0.0669,HYATT HOTELS CORP,"Hyatt Hotels Corporation, a hospitality company, develops, owns, operates, manages, franchises, licenses, or provides services to hotels, resorts, and other properties."
WPX,0.0723,WPX ENERGY INC,"WPX Energy, Inc., an independent oil and natural gas exploration and production company, engages in the exploitation and development of unconventional properties in the United States. It produces oil, natural gas, and natural gas liquids."
DXCM,0.0738,DEXCOM INC,"DexCom, Inc., a medical device company, focuses on the design, development, and commercialization of continuous glucose monitoring (CGM) systems in the United States and internationally. The company offers its systems for use by people with diabetes, as well as for use by healthcare providers."
TWTR,0.0748,TWITTER INC,"Twitter, Inc. operates as a platform for public self-expression and conversation in real time United States and internationally."
