,dist,conm,busdesc
PKG,0.0,PACKAGING CORP OF AMERICA,Packaging Corporation of America manufactures and sells containerboard and corrugated packaging products in the United States. The company operates through Packaging and Paper segments.
MDLZ,0.0016,MONDELEZ INTERNATIONAL INC,"Mondelez International, Inc., through its subsidiaries, manufactures, markets, and sells snack food and beverage products worldwide."
GD,0.0024,GENERAL DYNAMICS CORP,"General Dynamics Corporation operates as an aerospace and defense company worldwide. It operates through five segments: Aerospace, Combat Systems, Information Technology, Mission Systems, and Marine Systems."
ACS,0.0033,AFFILIATED COMPUTER SERVICES,"Conduent Business Services, LLC provides digital platforms and services for Fortune 100 companies and government entities worldwide."
TDY,0.0033,TELEDYNE TECHNOLOGIES INC,"Teledyne Technologies Incorporated provides instrumentation, digital imaging, aerospace and defense electronics, and engineered systems in the United States, the United Kingdom, Canada, the Netherlands, and internationally."
ARG,0.0039,AIRGAS INC,"Airgas, Inc. supplies industrial, medical, and specialty gases; and welding equipment and related products. The company operates through two segments, Distribution and All Other Operations."
DXC,0.0052,DXC TECHNOLOGY CO,"DXC Technology Company, together with its subsidiaries, provides information technology services and solutions primarily in North America, Europe, Asia, and Australia. It operates in two segments, Global Business Services (GBS) and Global Infrastructure Services (GIS)."
SWK,0.0052,STANLEY BLACK & DECKER INC,"Stanley Black & Decker, Inc. engages in tools and storage, industrial, and security businesses worldwide."
HSP,0.0072,HOSPIRA INC,"Hospira, Inc. provides injectable drugs and infusion technologies to develop, manufacture, distribute, and market products worldwide. The company operates through Americas, EMEA, and APAC segments."
TJX,0.0073,TJX COS INC (THE),"The TJX Companies, Inc. operates as an off-price apparel and home fashions retailer. It operates through four segments: Marmaxx, HomeGoods, TJX Canada, and TJX International."
HPQ,0.0075,HP INC,"HP Inc., together with its subsidiaries, provides personal computing and other access devices, imaging and printing products, and related technologies, solutions, and services in the United States and internationally."
PRGO,0.0079,PERRIGO CO PLC,Perrigo Company plc provides over-the-counter (OTC) health and wellness solutions that enhance individual well-being by empowering consumers to prevent or treat conditions that can be self-managed.
A,0.008,AGILENT TECHNOLOGIES INC,"Agilent Technologies, Inc. provides application focused solutions to the life sciences, diagnostics, and applied chemical markets worldwide."
SHW,0.0086,SHERWIN-WILLIAMS CO,"The Sherwin-Williams Company develops, manufactures, distributes, and sells paints, coatings, and related products to professional, industrial, commercial, and retail customers. It operates in three segments: The Americas Group, Consumer Brands Group, and Performance Coatings Group."
MWV,0.0087,MEADWESTVACO CORP,"WestRock MWV, LLC provides packaging solutions to the healthcare, beauty and personal care, food, beverage, home and garden, tobacco, and agricultural industries worldwide."
AAP,0.0089,ADVANCE AUTO PARTS INC,"Advance Auto Parts, Inc. provides automotive replacement parts, accessories, batteries, and maintenance items for domestic and imported cars, vans, sport utility vehicles, and light and heavy duty trucks."
FLS,0.0092,FLOWSERVE CORP,"Flowserve Corporation designs, develops, manufactures, distributes, and services industrial flow management equipment in the United States, Europe, the Middle East, Africa, Asia, and internationally."
EQIX,0.0094,EQUINIX INC,"Equinix (Nasdaq: EQIX) is the world's digital infrastructure company, enabling digital leaders to harness a trusted platform to bring together and interconnect the foundational infrastructure that powers their success."
MHS,0.0098,MEDCO HEALTH SOLUTIONS INC,"Medco Health Solutions, Inc. is a healthcare company provides clinically-driven pharmacy services for private and public employers, health plans, labor unions and government agencies, and individuals. Medco Health Solutions, Inc. was formerly known as Merck-Medco Managed Care, L.L.C."
LUV,0.0106,SOUTHWEST AIRLINES,Southwest Airlines Co. operates a passenger airline that provides scheduled air transportation services in the United States and near-international markets.
CNC,0.0112,CENTENE CORP,Centene Corporation operates as a multi-national healthcare enterprise that provides programs and services to under-insured and uninsured individuals in the United States.
AOS,0.0117,SMITH (A.O.),"A. O. Smith Corporation manufactures and markets residential and commercial gas and electric water heaters, boilers, tanks, and water treatment products in North America, China, Europe, and India. It operates through two segments, North America and Rest of World."
HUM,0.0131,HUMANA INC,"Humana Inc., together with its subsidiaries, operates as a health and well-being company in the United States. It operates through Retail, Group and Specialty, and Healthcare Services segments. The company offers medical and supplemental benefit plans to individuals."
T,0.0132,AT&T INC,"AT&T Inc. provides telecommunication, media, and technology services worldwide. The company operates through four segments: Communications, WarnerMedia, Latin America, and Xandr."
RSG,0.0133,REPUBLIC SERVICES INC,"Republic Services, Inc., together with its subsidiaries, provides non-hazardous solid waste collection, transfer, disposal, recycling, and environmental services in the United States. The company serves small-container, large-container, and municipal and residential customers."
WMB,0.0134,WILLIAMS COS INC,"The Williams Companies, Inc., together with its subsidiaries, operates as an energy infrastructure company primarily in the United States. It operates through Atlantic-Gulf, Northeast G&P, and West segments."
ROK,0.0134,ROCKWELL AUTOMATION,"Rockwell Automation, Inc. provides industrial automation and digital transformation solutions. The company operates in two segments, Architecture & Software, and Control Products & Solutions."
ADM,0.0136,ARCHER-DANIELS-MIDLAND CO,"Archer-Daniels-Midland Company procures, transports, stores, processes, and merchandises agricultural commodities, products, and ingredients in the United States and internationally. The company operates through three segments: Ag Services and Oilseeds, Carbohydrate Solutions, and Nutrition."
CMCSA,0.0138,COMCAST CORP,"Comcast Corporation operates as a media and technology company worldwide. It operates through Cable Communications, Cable Networks, Broadcast Television, Filmed Entertainment, Theme Parks, and Sky segments."
AN,0.0145,AUTONATION INC,"AutoNation, Inc., through its subsidiaries, operates as an automotive retailer in the United States. The company operates through three segments: Domestic, Import, and Premium Luxury."
NLOK,0.0169,NORTONLIFELOCK INC,NortonLifeLock Inc. provides cyber safety solutions for consumers worldwide.
MSI,0.018,MOTOROLA SOLUTIONS INC,"Motorola Solutions, Inc. provides mission-critical communication solutions the United States, the United Kingdom, Canada, and internationally. The company operates in two segments, Products and Systems Integration, and Services and Software."
S,0.0218,SPRINT CORP,"Sprint Corporation provides a range of wireless and wireline communications products and services to consumers, businesses, government subscribers, and resellers in the United States, Puerto Rico, and the United States Virgin Islands. It operates in two segments, Wireless and Wireline."
QRVO,0.0287,QORVO INC,"Qorvo, Inc. develops and commercializes technologies and products for wireless and wired connectivity worldwide. The company operates in two segments, Mobile Products, and Infrastructure and Defense Products."
