,dist,conm,busdesc
ALLE,0.0,ALLEGION PLC,Allegion plc manufactures and sells mechanical and electronic security products and solutions worldwide.
HSY,0.0073,HERSHEY CO,"The Hershey Company, together with its subsidiaries, manufactures and sells confectionery products. The company operates through two segments, North America; and International and Other."
AES,0.0125,AES CORP (THE),"The AES Corporation operates as a diversified power generation and utility company. It owns and/or operates power plants to generate and sell power to customers, such as utilities, industrial users, and other intermediaries."
VZ,0.0131,VERIZON COMMUNICATIONS INC,"Verizon Communications Inc. offers communications, information, and entertainment products and services to consumers, businesses, and governmental entities worldwide."
AON,0.0157,AON PLC,"Aon plc, a professional services firm, provides advice and solutions to clients focused on risk, retirement, and health worldwide."
WEN,0.0186,WENDY'S CO,"The Wendy's Company, together with its subsidiaries, operates as a quick-service restaurant company. It operates through three segments: Wendy's U.S., Wendy's International, and Global Real Estate & Development."
AFL,0.0192,AFLAC INC,"Aflac Incorporated, through its subsidiaries, provides supplemental health and life insurance products. It operates through two segments, Aflac Japan and Aflac U.S."
RJF,0.0224,RAYMOND JAMES FINANCIAL CORP,"Raymond James Financial, Inc., through its subsidiaries, engages in the underwriting, distribution, trading, and brokerage of equity and debt securities in the United States, Canada, and Europe."
CMS,0.0275,CMS ENERGY CORP,"CMS Energy Corporation operates as an energy company primarily in Michigan. The company operates in four segments: Electric Utility, Gas Utility, Enterprises, and EnerBank. The Electric Utility segment is involved in the generation, purchase, transmission, distribution, and sale of electricity."
SYF,0.0292,SYNCHRONY FINANCIAL,"Synchrony Financial operates as a consumer financial services company in the United States. It delivers a range of specialized financing programs and consumer banking products to digital, retail, home, auto, travel, health, and pet industries."
HOG,0.0325,HARLEY-DAVIDSON INC,"Harley-Davidson, Inc. manufactures and sells custom, cruiser, and touring motorcycles. The company operates in two segments, Motorcycles and Related Products and Financial Services."
CTXS,0.0326,CITRIX SYSTEMS INC,"Citrix Systems, Inc. provides workspace, networking, and professional services worldwide."
COF,0.0376,CAPITAL ONE FINANCIAL CORP,"Capital One Financial Corporation operates as the financial services holding company for the Capital One Bank (USA), National Association; and Capital One, National Association, which provides various financial products and services in the United States, the United Kingdom, and Canada."
ADP,0.0407,AUTOMATIC DATA PROCESSING,"Automatic Data Processing, Inc. provides cloud-based human capital management solutions worldwide. It operates through two segments, Employer Services and Professional Employer Organization (PEO)."
CLX,0.041,CLOROX CO/DE,"The Clorox Company manufactures and markets consumer and professional products worldwide. It operates through four segments: Health and Wellness, Household, Lifestyle, and International."
CPB,0.0412,CAMPBELL SOUP CO,"Campbell Soup Company, together with its subsidiaries, engages in the manufacture and market food and beverage products. It operates through Meals & Beverages and Snacks segments. The Meals & Beverages segment engages in the retail and foodservice businesses in the United States and Canada."
VIAC,0.0429,VIACOMCBS INC,"ViacomCBS Inc. operates as a media and entertainment company worldwide. The company operates in four segments: TV Entertainment, Cable Networks, Filmed Entertainment, and Publishing."
HRB,0.0431,BLOCK H & R INC,"H&R Block, Inc., through its subsidiaries, provides assisted income tax return preparation, do-it-yourself (DIY) tax, and virtual tax preparation services and products to the general public primarily in the United States, Canada, and Australia."
FE,0.044,FIRSTENERGY CORP,"FirstEnergy Corp., through its subsidiaries, generates, transmits, and distributes electricity in the United States. The company operates through Regulated Distribution and Regulated Transmission segments."
MTD,0.0469,METTLER-TOLEDO INTL INC,"Mettler-Toledo International Inc. manufactures and supplies precision instruments and services worldwide. It operates in five segments: U.S. Operations, Swiss Operations, Western European Operations, Chinese Operations, and Other."
AXP,0.0494,AMERICAN EXPRESS CO,"American Express Company, together with its subsidiaries, provides charge and credit payment card products, and travel-related services worldwide. The company operates through three segments: Global Consumer Services Group, Global Commercial Services, and Global Merchant and Network Services."
ORLY,0.0536,O'REILLY AUTOMOTIVE INC,"O'Reilly Automotive, Inc., together with its subsidiaries, engages in the retail of automotive aftermarket parts, tools, supplies, equipment, and accessories in the United States."
URI,0.0667,UNITED RENTALS INC,"United Rentals, Inc., through its subsidiaries, operates as an equipment rental company. It operates in two segments, General Rentals; and Trench, Power and Fluid Solutions."
