,dist,conm,busdesc
NFX,0.0,NEWFIELD EXPLORATION CO,"Ovintiv Exploration Inc. engages in the exploration, development, and production of crude oil, natural gas, and natural gas liquids in the United States. Ovintiv Exploration Inc. was formerly known as Newfield Exploration Company and changed its name to Ovintiv Exploration Inc. in 2020."
FCX,0.0132,FREEPORT-MCMORAN INC,"Freeport-McMoRan Inc. engages in the mining of mineral properties in North America, South America, and Indonesia. The company primarily explores for copper, gold, molybdenum, silver, and other metals, as well as oil and gas."
APC,0.0415,ANADARKO PETROLEUM CORP,"Anadarko Petroleum Corporation engages in the exploration, development, production, and marketing of oil and gas properties. It operates through three segments: Exploration and Production, WES Midstream, and Other Midstream."
APA,0.0579,APACHE CORP,"Apache Corporation, an independent energy company, explores for, develops, and produces natural gas, crude oil, and natural gas liquids (NGLs)."
NOW,0.1106,SERVICENOW INC,"ServiceNow, Inc. provides enterprise cloud computing solutions that defines, structures, consolidates, manages, and automates services for enterprises worldwide."
