,dist,conm,busdesc
MKC,0.0,MCCORMICK & CO INC,"McCormick & Company, Incorporated manufactures, markets, and distributes spices, seasoning mixes, condiments, and other flavorful products to the food industry. The company operates in two segments, Consumer and Flavor Solutions."
TFX,0.0026,TELEFLEX INC,"Teleflex Incorporated designs, develops, manufactures, and supplies single-use medical devices for common diagnostic and therapeutic procedures in critical care and surgical applications worldwide."
ECL,0.0037,ECOLAB INC,"Ecolab Inc. provides water, hygiene, and energy technologies and services worldwide."
KMI,0.0043,KINDER MORGAN INC,"Kinder Morgan, Inc. operates as an energy infrastructure company in North America. The company operates through Natural Gas Pipelines, Products Pipelines, Terminals, and CO2 segments."
TT,0.005,TRANE TECHNOLOGIES PLC,"Trane Technologies plc provides climate control solutions for buildings, homes, and transportation."
UDR,0.0059,UDR INC,"UDR, Inc."
PLD,0.0064,PROLOGIS INC,"Prologis, Inc. is the global leader in logistics real estate with a focus on high-barrier, high-growth markets."
ROH,0.0068,ROHM AND HAAS CO,Rohm and Haas Company manufactures and markets chemicals.
VIAC,0.0069,VIACOMCBS INC,"ViacomCBS Inc. operates as a media and entertainment company worldwide. The company operates in four segments: TV Entertainment, Cable Networks, Filmed Entertainment, and Publishing."
FMC,0.0071,FMC CORP,"FMC Corporation, an agricultural sciences company, provides crop protection, plant health, and professional pest and turf management products."
EL,0.0072,LAUDER (ESTEE) COS INC -CL A,"The Estee Lauder Companies Inc. manufactures and markets skin care, makeup, fragrance, and hair care products worldwide."
MLM,0.0076,MARTIN MARIETTA MATERIALS,"Martin Marietta Materials, Inc., a natural resource-based building materials company, supplies aggregates and heavy building materials to the construction industry in the United States and internationally."
SRE,0.0078,SEMPRA ENERGY,"Sempra Energy operates as an energy-services holding company in the United States and internationally. The company's San Diego Gas & Electric Company segment generates, transmits, and distributes electricity; and supplies natural gas."
LIN,0.0079,LINDE PLC,"Linde plc operates as an industrial gas company in North and South America, Europe, the Middle East, Africa, and the Asia Pacific. The company offers oxygen, nitrogen, argon, rare gases, carbon monoxide, carbon dioxide, helium, hydrogen, electronic gases, specialty gases, and acetylene."
PEP,0.0087,PEPSICO INC,"PepsiCo, Inc. operates as a food and beverage company worldwide. The company operates through seven segments: FLNA, QFNA, PBNA, LatAm, Europe, AMESA, and APAC."
NDAQ,0.009,NASDAQ INC,"Nasdaq, Inc. operates as a technology company that serves capital markets and other industries worldwide."
DRI,0.009,DARDEN RESTAURANTS INC,"Darden Restaurants, Inc., through its subsidiaries, owns and operates full-service restaurants in the United States and Canada."
AEE,0.0097,AMEREN CORP,"Ameren Corporation, together with its subsidiaries, operates as a public utility holding company in the United States. It operates through four segments: Ameren Missouri, Ameren Illinois Electric Distribution, Ameren Illinois Natural Gas, and Ameren Transmission."
PCS,0.0098,METROPCS COMMUNICATIONS INC,"As of April 30, 2013, MetroPCS Communications, Inc. was acquired by T-Mobile USA Inc., in a reverse merger transaction. MetroPCS Communications, Inc., a wireless telecommunications carrier, together with its subsidiaries, provides wireless broadband mobile services in the United States."
X,0.0104,UNITED STATES STEEL CORP,"United States Steel Corporation produces and sells flat-rolled and tubular steel products primarily in North America and Europe. It operates through three segments: North American Flat-Rolled (Flat-Rolled), U. S. Steel Europe (USSE), and Tubular Products (Tubular)."
PCL,0.0105,PLUM CREEK TIMBER CO INC,"As on February 19, 2016, Plum Creek Timber Co. Inc. was acquired by Weyerhaeuser Co. Plum Creek Timber Company, Inc. is a privately owned real estate investment trust (REIT). The trust owns and manages timberlands in the United States."
TEX,0.0107,TEREX CORP,"Terex Corporation manufactures and sells aerial work platforms, materials processing machinery, and cranes worldwide. The company operates in two segments, Aerial Work Platforms (AWP) and Material Processing (MP)."
ATO,0.0112,ATMOS ENERGY CORP,"Atmos Energy Corporation, together with its subsidiaries, engages in the regulated natural gas distribution, and pipeline and storage businesses in the United States. It operates through Distribution, and Pipeline and Storage segments."
DG,0.0117,DOLLAR GENERAL CORP,"Dollar General Corporation, a discount retailer, provides various merchandise products in the southern, southwestern, Midwestern, and eastern United States."
BBY,0.0121,BEST BUY CO INC,"Best Buy Co., Inc. retails technology products in the United States, Canada, and Mexico. The company operates in two segments, Domestic and International."
CINF,0.0123,CINCINNATI FINANCIAL CORP,"Cincinnati Financial Corporation, together with its subsidiary, provides property casualty insurance products in the United States. The company operates in five segments: Commercial Lines Insurance, Personal Lines Insurance, Excess and Surplus Lines Insurance, Life Insurance, and Investments."
COL,0.0132,ROCKWELL COLLINS,"Collins Aerospace designs, produces and supports communication and aviation systems worldwide."
AMZN,0.0134,AMAZON.COM INC,"Amazon.com, Inc. engages in the retail sale of consumer products and subscriptions in North America and internationally. The company operates through three segments: North America, International, and Amazon Web Services (AWS)."
SYY,0.0139,SYSCO CORP,"Sysco Corporation, through its subsidiaries, markets and distributes a range of food and related products primarily to the foodservice or food-away-from-home industry in the United States, Canada, the United Kingdom, France, and internationally. It operates through three segments: U.S."
VIAB,0.0141,VIACOM INC,"As of December 4, 2019, Viacom Inc. was acquired by CBS Corporation. Viacom Inc. operates media brands that create entertainment content worldwide. It operates in two segments, Media Networks and Filmed Entertainment."
MAS,0.0147,MASCO CORP,"Masco Corporation designs, manufactures, and distributes home improvement and building products in North America, Europe, and internationally. The company operates through two segments, Plumbing Products and Decorative Architectural Products."
CAH,0.0149,CARDINAL HEALTH INC,"Cardinal Health, Inc. operates as an integrated healthcare services and products company in the United States and internationally. It provides customized solutions for hospitals, healthcare systems, pharmacies, ambulatory surgery centers, clinical laboratories, and physician offices."
AWK,0.0153,AMERICAN WATER WORKS CO INC,"American Water Works Company, Inc., through its subsidiaries, provides water and wastewater services in the United States. It offers water and wastewater services to approximately 1,700 communities in 16 states serving approximately 3.4 million active customers."
EQR,0.0157,EQUITY RESIDENTIAL,"Equity Residential is committed to creating communities where people thrive. The Company, a member of the S&P 500, is focused on the acquisition, development and management of residential properties located in and around dynamic cities that attract high quality long-term renters."
VNO,0.0227,VORNADO REALTY TRUST,Vornado's portfolio is concentrated in the nation's key market - New York City - along with the premier asset in both Chicago and San Francisco. Vornado is also the real estate industry leader in sustainability policy.
RAI,0.0233,REYNOLDS AMERICAN INC,"Reynolds American Inc., through its subsidiaries, manufactures and sells cigarettes and other tobacco products in the United States. It operates through RJR Tobacco, Santa Fe, and American Snuff segments."
