,dist,conm,busdesc
STE,0.0,STERIS PLC,"STERIS plc provides infection prevention and other procedural products and services worldwide. It operates in four segments: Healthcare Products, Healthcare Specialty Services, Life Sciences, and Applied Sterilization Technologies."
SJM,0.0042,SMUCKER (JM) CO,"The J. M. Smucker Company manufactures and markets food and beverage products worldwide. It operates in four segments: U.S. Retail Pet Foods, U.S. Retail Coffee, U.S. Retail Consumer Foods, and International and Away From Home."
TYL,0.0044,TYLER TECHNOLOGIES INC,"Tyler Technologies, Inc. provides integrated information management solutions and services for the public sector in the United States and internationally. The company operates in two segments, Enterprise Software; and Appraisal and Tax."
KSS,0.0063,KOHL'S CORP,"Kohl's Corporation operates as a retail company in the United States. Its stores and Website offer apparel, footwear, accessories, beauty, and home products. The company provides its products primarily under the brand names of Apt."
GHC,0.0066,GRAHAM HOLDINGS CO,"Graham Holdings Company, through its subsidiaries, operates as a diversified education and media company worldwide."
PH,0.0096,PARKER-HANNIFIN CORP,"Parker-Hannifin Corporation manufactures and sells motion and control technologies and systems for various mobile, industrial, and aerospace markets worldwide. The company operates through two segments, Diversified Industrial and Aerospace Systems."
EMC,0.0097,EMC CORP/MA,"Dell EMC develops, delivers, and supports information infrastructure and virtual infrastructure technologies, solutions, and services."
COO,0.0116,COOPER COS INC (THE),"The Cooper Companies, Inc. operates as a medical device company worldwide. It operates through CooperVision and CooperSurgical business units."
TT,0.0118,TRANE TECHNOLOGIES PLC,"Trane Technologies plc provides climate control solutions for buildings, homes, and transportation."
VFC,0.0152,VF CORP,"V.F. Corporation engages in the design, production, procurement, marketing, and distribution of branded lifestyle apparel, footwear, and related products for men, women, and children in the Americas, Europe, and the Asia-Pacific. It operates through four segments: Outdoor, Active, and Work."
FDX,0.0166,FEDEX CORP,"FedEx Corporation provides transportation, e-commerce, and business services worldwide. Its FedEx Express segment offers shipping services for delivery of packages and freight."
RTN,0.018,RAYTHEON CO,"Raytheon Company develops technologically advanced and integrated products, services, and solutions for the defense and other government markets worldwide."
GPC,0.0195,GENUINE PARTS CO,"Genuine Parts Company distributes automotive replacement parts, industrial parts and materials, and business products in the United States, Canada, Mexico, Australasia, France, the United Kingdom, Germany, Poland, the Netherlands, and Belgium."
HAR,0.02,HARMAN INTERNATIONAL INDS,"Harman International Industries, Incorporated designs and engineers connected products and solutions for automakers, consumers, and enterprises worldwide. The company operates through four segments: Connected Car, Lifestyle Audio, Professional Solutions, and Connected Services."
RL,0.0201,RALPH LAUREN CORP,"Ralph Lauren Corporation designs, markets, and distributes lifestyle products in North America, Europe, Asia, and internationally."
HRL,0.0204,HORMEL FOODS CORP,"Hormel Foods Corporation produces and markets various meat and food products to retail, foodservice, deli, and commercial customers in the United States and internationally."
CHRW,0.0206,C H ROBINSON WORLDWIDE INC,"C.H. Robinson Worldwide, Inc., a third party logistics company, provides freight transportation services and logistics solutions to companies in various industries worldwide. The company operates through North American Surface Transportation and Global Forwarding segments."
CVG,0.0212,CONVERGYS CORP,"Convergys Corporation provides customer management services to communications and media, technology, financial services, retail, healthcare, government, travel and hospitality, and other vertical markets worldwide."
MFE,0.0214,MCAFEE INC,"McAfee LLC develops and delivers security solutions and services that protect systems, networks, and mobile devices for business and personal use in the United States and internationally."
DLTR,0.0215,DOLLAR TREE INC,"Dollar Tree, Inc. operates discount variety retail stores. It operates through two segments, Dollar Tree and Family Dollar. The Dollar Tree segment offers merchandise at the fixed price of $1.00."
CVS,0.0229,CVS HEALTH CORP,CVS Health Corporation provides health services and plans in the United States.
CTAS,0.0231,CINTAS CORP,"Cintas Corporation provides corporate identity uniforms and related business services primarily in North America, Latin America, Europe, and Asia. It operates through Uniform Rental and Facility Services and First Aid and Safety Services segments."
MHK,0.0236,MOHAWK INDUSTRIES INC,"Mohawk Industries, Inc. designs, manufactures, sources, distributes, and markets flooring products for remodeling and new constructions of residential and commercial spaces in the United States, Europe, Russia, and internationally."
GPS,0.0239,GAP INC,"The Gap, Inc. operates as an apparel retail company worldwide. The company offers apparel, accessories, and personal care products for men, women, and children under the Old Navy, Gap, Banana Republic, Athleta, Intermix, Janie and Jack, and Hill City brands."
WDC,0.024,WESTERN DIGITAL CORP,"Western Digital Corporation develops, manufactures, and sells data storage devices and solutions."
CCU,0.0251,COMPANIA CERVECERIAS UNIDAS,"Compania Cervecerias Unidas S.A. operates as a beverage company principally in Chile, Argentina, Uruguay, Paraguay, Colombia, and Bolivia. The company operates through three segments: Chile, International Business, and Wine."
NUE,0.0252,NUCOR CORP,"Nucor Corporation manufactures and sells steel and steel products. It operates in three segments: Steel Mills, Steel Products, and Raw Materials."
WBA,0.0255,WALGREENS BOOTS ALLIANCE INC,"Walgreens Boots Alliance, Inc. operates as a pharmacy-led health and beauty retail company. It operates through three segments: Retail Pharmacy USA, Retail Pharmacy International, and Pharmaceutical Wholesale."
EXPD,0.0282,EXPEDITORS INTL WASH INC,"Expeditors International of Washington, Inc. provides logistics services in the Americas, North Asia, South Asia, Europe, the Middle East, Africa, and India."
HSIC,0.0285,HENRY SCHEIN INC,"Henry Schein, Inc., a solutions company for health care professionals, provides health care products and services to office-based dental practitioners and laboratories, physician practices, government, institutional health care clinics, and other alternate care clinics worldwide."
NLOK,0.0292,NORTONLIFELOCK INC,NortonLifeLock Inc. provides cyber safety solutions for consumers worldwide.
SIG,0.0302,SIGNET JEWELERS LTD,"Signet Jewelers Limited engages in the retail sale of diamond jewelry, watches, and other products. As of February 02, 2019, it operated 3,334 stores and kiosks. The company operates through three segments: North America, International, and Other."
TIF,0.0305,TIFFANY & CO,"Tiffany & Co., through its subsidiaries, designs, manufactures, and retails jewelry and other items. The company offers jewelry collections, engagement rings, and wedding bands. It also sells watches, home and accessories products, and fragrances; and wholesales diamonds and earnings."
J,0.0353,JACOBS ENGINEERING GROUP INC,"Jacobs Engineering Group Inc. provides consulting, technical, scientific, and project delivery services for the government and private sectors in the United States, Europe, Canada, India, rest of Asia, Australia, New Zealand, South America, Mexico, the Middle East, and Africa."
ASH,0.0398,ASHLAND GLOBAL HOLDINGS INC,"Ashland Global Holdings Inc. provides specialty chemical solutions worldwide. The company's Specialty Ingredients segment offers products, technologies, and resources for solving formulation and product-performance challenges."
JNY,0.0492,JONES GROUP INC,"Premier Brands Group Holdings LLC designs, markets, and wholesales apparel, footwear, jeanswear, jewelry, and handbags in the United States and internationally."
QRVO,0.0752,QORVO INC,"Qorvo, Inc. develops and commercializes technologies and products for wireless and wired connectivity worldwide. The company operates in two segments, Mobile Products, and Infrastructure and Defense Products."
TTWO,0.097,TAKE-TWO INTERACTIVE SFTWR,"Take-Two Interactive Software, Inc. develops, publishes, and markets interactive entertainment solutions for consumers worldwide. The company offers its products under the Rockstar Games and 2K labels, as well as under Private Division and Social Point labels."
