,dist,conm,busdesc
BA,0.0,BOEING CO,"The Boeing Company, together with its subsidiaries, designs, develops, manufactures, sales, services, and supports commercial jetliners, military aircraft, satellites, missile defense, human space flight and launch systems, and services worldwide."
FTNT,0.0057,FORTINET INC,"Fortinet, Inc. provides broad, integrated, and automated cybersecurity solutions worldwide."
YUM,0.0087,YUM BRANDS INC,"YUM! Brands, Inc., together with its subsidiaries, develops, operates, and franchises quick service restaurants worldwide. It operates in three segments: the KFC Division, the Pizza Hut Division, and the Taco Bell Division."
IT,0.0089,GARTNER INC,"Gartner, Inc. operates as a research and advisory company. It operates through three segments: Research, Conferences, and Consulting."
URI,0.0155,UNITED RENTALS INC,"United Rentals, Inc., through its subsidiaries, operates as an equipment rental company. It operates in two segments, General Rentals; and Trench, Power and Fluid Solutions."
F,0.0212,FORD MOTOR CO,"Ford Motor Company designs, manufactures, markets, and services a range of Ford cars, trucks, sport utility vehicles, electrified vehicles, and Lincoln luxury vehicles worldwide. It operates through three segments: Automotive, Mobility, and Ford Credit."
CLX,0.0239,CLOROX CO/DE,"The Clorox Company manufactures and markets consumer and professional products worldwide. It operates through four segments: Health and Wellness, Household, Lifestyle, and International."
WU,0.0295,WESTERN UNION CO,"The Western Union Company provides money movement and payment services worldwide. The company operates in two segments, Consumer-to-Consumer and Business Solutions."
AAL,0.0317,AMERICAN AIRLINES GROUP INC,"American Airlines Group Inc., through its subsidiaries, operates as a network air carrier. It provides scheduled air transportation services for passengers and cargo. As of December 31, 2019, the company operated a mainline fleet of 942 aircraft."
UAL,0.0381,UNITED AIRLINES HOLDINGS INC,"United Airlines Holdings, Inc., through its subsidiaries, provides air transportation services in North America, Asia, Europe, Africa, the Pacific, the Middle East, and Latin America. It transports people and cargo through its mainline and regional fleets."
LYB,0.0497,LYONDELLBASELL INDUSTRIES NV,"LyondellBasell Industries N.V. operates as a chemical company in the United States, Germany, Mexico, Italy, France, Japan, China, the Netherlands, and internationally."
