,dist,conm,busdesc
IPGP,0.0,IPG PHOTONICS CORP,"IPG Photonics Corporation develops and manufactures a range of high-performance fiber lasers, fiber amplifiers, and diode lasers used in various applications primarily in materials processing worldwide."
ISRG,0.0021,INTUITIVE SURGICAL INC,"Intuitive Surgical, Inc., together with its subsidiaries, designs, manufactures, and markets da Vinci surgical systems, and related instruments and accessories in the United States and internationally."
SWKS,0.0034,SKYWORKS SOLUTIONS INC,"Skyworks Solutions, Inc., together with its subsidiaries, designs, develops, manufactures, and markets proprietary semiconductor products, including intellectual property in the United States, China, South Korea, Taiwan, Europe, the Middle East, Africa, and rest of Asia-Pacific."
FB,0.0055,FACEBOOK INC,"Facebook, Inc. develops products that enable people to connect and share with friends and family through mobile devices, personal computers, virtual reality headsets, and in-home devices worldwide."
MKTX,0.0104,MARKETAXESS HOLDINGS INC,"MarketAxess Holdings Inc., together with its subsidiaries, operates an electronic trading platform that enables fixed-income market participants to trade corporate bonds and other types of fixed-income instruments worldwide."
ABMD,0.0124,ABIOMED INC,"Abiomed, Inc. engages in the research, development, and sale of medical devices to assist or replace the pumping function of the failing heart. It also provides a continuum of care to heart failure patients."
PSA,0.0126,PUBLIC STORAGE,"Public Storage, a member of the S&P 500 and FT Global 500, is a REIT that primarily acquires, develops, owns and operates self-storage facilities."
TROW,0.0142,PRICE (T. ROWE) GROUP,"T. Rowe Price Group, Inc. is a publicly owned investment manager. The firm provides its services to individuals, institutional investors, retirement plans, financial intermediaries, and institutions. It launches and manages equity and fixed income mutual funds."
ANSS,0.0183,ANSYS INC,"ANSYS, Inc. develops and markets engineering simulation software and services worldwide."
