,dist,conm,busdesc
AMG,0.0,AFFILIATED MANAGERS GRP INC,"Affiliated Managers Group, Inc., through its affiliates, operates as an asset management company providing investment management services to mutual funds, institutional clients, and high net worth individuals in the United States. It provides advisory or subadvisory services to mutual funds."
EP,0.0078,EL PASO CORP,"El Paso LLC offers natural gas transmission, and exploration and production services primarily in the United States."
PAYX,0.0079,PAYCHEX INC,"Paychex, Inc. provides integrated human capital management solutions for human resources (HR), payroll, benefits, and insurance services for small- to medium-sized businesses in the United States and Europe."
MAC,0.0086,MACERICH CO,"Macerich is a fully integrated, self-managed and self-administered real estate investment trust, which focuses on the acquisition, leasing, management, development and redevelopment of regional malls throughout the United States."
TDG,0.0104,TRANSDIGM GROUP INC,"TransDigm Group Incorporated designs, produces, and supplies aircraft components in the United States and internationally."
LO,0.0184,LORILLARD INC,"Lorillard, LLC, through its subsidiaries, manufactures and sells cigarettes in the United States. It operates through two segments, Cigarettes and Electronic Cigarettes."
MSCI,0.0187,MSCI INC,"MSCI Inc., together with its subsidiaries, provides investment decision support tools for the clients to manage their investment processes worldwide. The company operates through four segments: Index, Analytics, ESG, and Real Estate."
SPG,0.0323,SIMON PROPERTY GROUP INC,"Simon is a real estate investment trust engaged in the ownership of premier shopping, dining, entertainment and mixed-use destinations and an S&P 100 company (Simon Property Group, NYSE: SPG)."
