,dist,conm,busdesc
IDXX,0.0,IDEXX LABS INC,"IDEXX Laboratories, Inc., together with its subsidiaries, develops, manufactures, and distributes products and services primarily for the companion animal veterinary, livestock and poultry, dairy, and water testing markets worldwide."
EXPE,0.0019,EXPEDIA GROUP INC,"Expedia Group, Inc. operates as an online travel company worldwide. It operates through four segments: Core Online Travel Agencies, Trivago, Vrbo, and Egencia."
GENZ,0.0032,GENZYME CORP,"Genzyme Corporation, a biotechnology company, engages in the discovery and development of products and services primarily in the areas of rare genetic diseases, multiple sclerosis, cardiovascular diseases, and endocrinology."
NLOK,0.0049,NORTONLIFELOCK INC,NortonLifeLock Inc. provides cyber safety solutions for consumers worldwide.
RIG,0.0057,TRANSOCEAN LTD,"Transocean Ltd., together with its subsidiaries, provides offshore contract drilling services for oil and gas wells worldwide. The company primarily offers drilling rigs, related equipment, and work crews; and ultra-deepwater and harsh environment drilling services."
NVDA,0.0058,NVIDIA CORP,"NVIDIA Corporation operates as a visual computing company worldwide. It operates in two segments, GPU and Tegra Processor."
UAA,0.0063,UNDER ARMOUR INC,"Under Armour, Inc., together with its subsidiaries, develops, markets, and distributes branded performance apparel, footwear, and accessories for men, women, and youth primarily in North America, Europe, the Middle East, Africa, the Asia-Pacific, and Latin America."
GPN,0.0073,GLOBAL PAYMENTS INC,"Global Payments Inc. provides payment technology and software solutions for card, electronic, check, and digital-based payments in North America, Europe, the Asia-Pacific, and Latin America."
INTC,0.0076,INTEL CORP,"Intel Corporation designs, manufactures, and sells essential technologies for the cloud, smart, and connected devices worldwide. The company operates through DCG, IOTG, Mobileye, NSG, PSG, CCG, and All Other segments."
KLAC,0.0079,KLA CORP,"KLA Corporation designs, manufactures, and markets process control and yield management solutions for the semiconductor and related nanoelectronics industries worldwide."
RHI,0.0083,ROBERT HALF INTL INC,"Robert Half International Inc. provides staffing and risk consulting services in North America, South America, Europe, Asia, and Australia."
MNST,0.0085,MONSTER BEVERAGE CORP,"Monster Beverage Corporation, through its subsidiaries, develops, markets, sells, and distributes energy drink beverages and concentrates in the United States and internationally. It operates through three segments: Monster Energy Drinks, Strategic Brands, and Other."
LRCX,0.0088,LAM RESEARCH CORP,"Lam Research Corporation designs, manufactures, markets, refurbishes, and services semiconductor processing equipment used in the fabrication of integrated circuits worldwide."
TTWO,0.0088,TAKE-TWO INTERACTIVE SFTWR,"Take-Two Interactive Software, Inc. develops, publishes, and markets interactive entertainment solutions for consumers worldwide. The company offers its products under the Rockstar Games and 2K labels, as well as under Private Division and Social Point labels."
GWW,0.0088,GRAINGER (W W) INC,"W.W. Grainger, Inc. distributes maintenance, repair, and operating (MRO) products and services in the United States, Canada, and internationally."
CDW,0.0089,CDW CORP,"CDW Corporation provides integrated information technology (IT) solutions to business, government, education, and healthcare customers in the United States, the United Kingdom, and Canada. It operates through three segments: Corporate, Small Business, and Public."
URBN,0.0108,URBAN OUTFITTERS INC,"Urban Outfitters, Inc. engages in the retail and wholesale of general consumer products. The company operates through three segments: Retail, wholesale, and Subscription."
HOLX,0.0114,HOLOGIC INC,"Hologic, Inc. develops, manufactures, and supplies diagnostics products, medical imaging systems, and surgical products for women's health through early detection and treatment in the United States, Europe, the Asia-Pacific, and internationally."
ADBE,0.0116,ADOBE INC,"Adobe Inc. operates as a diversified software company worldwide. Its Digital Media segment provides tools and solutions that enable individuals, teams, and enterprises to create, publish, promote, and monetize their digital content."
LKQ,0.0116,LKQ CORP,"LKQ Corporation, together with its subsidiaries, distributes replacement parts, components, and systems used in the repair and maintenance of vehicles. It operates in three segments: North America, Europe, and Specialty."
TPR,0.0117,TAPESTRY INC,"Tapestry, Inc. provides luxury accessories and branded lifestyle products in the United States, Japan, China, Hong Kong, Macau, Taiwan, Europe, Canada, South Korea, Malaysia, Singapore, Australia, and New Zealand."
EA,0.0118,ELECTRONIC ARTS INC,"Electronic Arts Inc. develops, markets, publishes, and distributes games, content, and services for game consoles, PCs, mobile phones, and tablets worldwide."
MCHP,0.0126,MICROCHIP TECHNOLOGY INC,"Microchip Technology Incorporated develops, manufactures, and sells semiconductor products for various embedded control applications in the Americas, Europe, and Asia."
MU,0.0128,MICRON TECHNOLOGY INC,"Micron Technology, Inc. designs, manufactures, and sells memory and storage products worldwide. The company operates through four segments: Compute and Networking Business Unit, Mobile Business Unit, Storage Business Unit, and Embedded Business Unit."
ANSS,0.0129,ANSYS INC,"ANSYS, Inc. develops and markets engineering simulation software and services worldwide."
TSS,0.015,TOTAL SYSTEM SERVICES INC,"As of September 17, 2019, Total System Services, Inc. was acquired by Global Payments Inc. Total System Services, Inc. provides payment processing, merchant, and related payment services to financial and nonfinancial institutions worldwide."
WFM,0.0156,WHOLE FOODS MARKET INC,"Whole Foods Market, Inc. operates natural and organic foods supermarkets. The company's stores offers produce, grocery, meat and poultry, seafood, bakery, prepared foods, coffee, tea, beer, wine, cheese, nutritional supplements, vitamins, body care, pet foods, and household goods."
EMC,0.016,EMC CORP/MA,"Dell EMC develops, delivers, and supports information infrastructure and virtual infrastructure technologies, solutions, and services."
AMAT,0.0162,APPLIED MATERIALS INC,"Applied Materials, Inc. provides manufacturing equipment, services, and software to the semiconductor, display, and related industries. It operates through three segments: Semiconductor Systems, Applied Global Services, and Display and Adjacent Markets."
CMG,0.0162,CHIPOTLE MEXICAN GRILL INC,"Chipotle Mexican Grill, Inc., together with its subsidiaries, operates Chipotle Mexican Grill restaurants. As of September 30, 2020, it operated approximately 2,700 restaurants in the United States, Canada, the United Kingdom, France, and Germany."
TXN,0.0163,TEXAS INSTRUMENTS INC,"Texas Instruments Incorporated designs, manufactures, and sells semiconductors to electronics designers and manufacturers worldwide. It operates in two segments, Analog and Embedded Processing."
DISCA,0.0173,DISCOVERY INC,"Discovery, Inc. operates as a media company in the United States and internationally. The company operates in two segments, U.S. Networks and International Networks."
JNS,0.0174,JANUS CAPITAL GROUP INC,"Janus Capital Group, Inc. is a privately owned asset manager. It also provides retirement planning, investment planning, tax planning, investment for college, and tax planning services to its clients."
CTXS,0.0177,CITRIX SYSTEMS INC,"Citrix Systems, Inc. provides workspace, networking, and professional services worldwide."
MOLX,0.018,MOLEX INC,"Molex, LLC designs, develops, and manufactures electronic components and solutions."
TLAB,0.0198,TELLABS INC,"Tellabs Inc. designs, develops, and supports telecommunication networking products for communication service providers in the United States and internationally. The company operates through four segments: Optical, Data, Access, and Services."
FOSL,0.0208,FOSSIL GROUP INC,"Fossil Group, Inc., together with its subsidiaries, designs, develops, markets, and distributes consumer fashion accessories in the United States, Europe, Asia, and internationally."
ILMN,0.0208,ILLUMINA INC,"Illumina, Inc. provides sequencing and array-based solutions for genetic and genomic analysis."
