,dist,conm,busdesc
UNH,0.0,UNITEDHEALTH GROUP INC,"UnitedHealth Group Incorporated operates as a diversified health care company in the United States. It operates through four segments: UnitedHealthcare, OptumHealth, OptumInsight, and OptumRx."
MMC,0.0046,MARSH & MCLENNAN COS,"Marsh & McLennan Companies, Inc., a professional services company, provides advice and solutions to clients in the areas of risk, strategy, and people worldwide. It operates in two segments, Risk and Insurance Services, and Consulting."
SGP,0.0047,SCHERING-PLOUGH,"As of November 3, 2009, Schering-Plough Corporation was acquired by Merck & Co. Inc. Schering-Plough Corporation discovers, develops, manufactures, and sells pharmaceuticals worldwide. It operates in three segments: Prescription Pharmaceuticals, Animal Health, and Consumer Health Care."
AMCR,0.0055,AMCOR PLC,"Amcor plc develops, manufactures, and sells various packaging products for food, beverage, medical and pharmaceutical, fresh produce, snack food, personal care, and other industries worldwide. It operates through two segments, Flexibles and Rigid Packaging."
ETN,0.0055,EATON CORP PLC,Eaton Corporation plc operates as a power management company worldwide.
EQIX,0.0073,EQUINIX INC,"Equinix (Nasdaq: EQIX) is the world's digital infrastructure company, enabling digital leaders to harness a trusted platform to bring together and interconnect the foundational infrastructure that powers their success."
AAP,0.0075,ADVANCE AUTO PARTS INC,"Advance Auto Parts, Inc. provides automotive replacement parts, accessories, batteries, and maintenance items for domestic and imported cars, vans, sport utility vehicles, and light and heavy duty trucks."
LNT,0.0076,ALLIANT ENERGY CORP,"Alliant Energy Corporation operates as a utility holding company that provides regulated electricity and natural gas services in the Midwest region of the United States. It operates through three segments: Utility Electric Operations, Utility Gas Operations, and Utility Other."
SHW,0.0079,SHERWIN-WILLIAMS CO,"The Sherwin-Williams Company develops, manufactures, distributes, and sells paints, coatings, and related products to professional, industrial, commercial, and retail customers. It operates in three segments: The Americas Group, Consumer Brands Group, and Performance Coatings Group."
AN,0.008,AUTONATION INC,"AutoNation, Inc., through its subsidiaries, operates as an automotive retailer in the United States. The company operates through three segments: Domestic, Import, and Premium Luxury."
ADM,0.0087,ARCHER-DANIELS-MIDLAND CO,"Archer-Daniels-Midland Company procures, transports, stores, processes, and merchandises agricultural commodities, products, and ingredients in the United States and internationally. The company operates through three segments: Ag Services and Oilseeds, Carbohydrate Solutions, and Nutrition."
PRGO,0.0094,PERRIGO CO PLC,Perrigo Company plc provides over-the-counter (OTC) health and wellness solutions that enhance individual well-being by empowering consumers to prevent or treat conditions that can be self-managed.
WCG,0.0111,WELLCARE HEALTH PLANS INC,"WellCare Health Plans, Inc. provides government-sponsored managed care services. The company operates in three segments: Medicaid Health Plans, Medicare Health Plans, and Medicare Prescription Drug Plans (PDPs)."
SEE,0.0111,SEALED AIR CORP,"Sealed Air Corporation provides food safety and security, and product protection solutions and equipment in North America, South America, Europe, the Middle East, Africa, and the Asia Pacific. It operates in two segments, Food Care and Product Care."
ROK,0.0115,ROCKWELL AUTOMATION,"Rockwell Automation, Inc. provides industrial automation and digital transformation solutions. The company operates in two segments, Architecture & Software, and Control Products & Solutions."
JCI,0.0117,JOHNSON CONTROLS INTL PLC,"Johnson Controls International plc operates as a diversified technology and multi industrial company worldwide. It operates through Building Solutions North America, Building Solutions EMEA/LA, Building Solutions Asia Pacific, and Global Products segments."
ACS,0.0127,AFFILIATED COMPUTER SERVICES,"Conduent Business Services, LLC provides digital platforms and services for Fortune 100 companies and government entities worldwide."
ARG,0.0132,AIRGAS INC,"Airgas, Inc. supplies industrial, medical, and specialty gases; and welding equipment and related products. The company operates through two segments, Distribution and All Other Operations."
SWY,0.0133,SAFEWAY INC,Safeway Inc. operates as a food and drug retailer in the United States.
NLOK,0.0134,NORTONLIFELOCK INC,NortonLifeLock Inc. provides cyber safety solutions for consumers worldwide.
ALB,0.0138,ALBEMARLE CORP,"Albemarle Corporation develops, manufactures, and markets engineered specialty chemicals worldwide. The company operates in three segments: Lithium, Bromine Specialties, and Catalysts."
JBL,0.0138,JABIL INC,"Jabil Inc. provides manufacturing services and solutions worldwide. The company operates in two segments, Electronics Manufacturing Services and Diversified Manufacturing Services. It offers electronics design, production, and product management services."
RSG,0.0141,REPUBLIC SERVICES INC,"Republic Services, Inc., together with its subsidiaries, provides non-hazardous solid waste collection, transfer, disposal, recycling, and environmental services in the United States. The company serves small-container, large-container, and municipal and residential customers."
JAVA,0.0142,SUN MICROSYSTEMS INC,"Oracle America, Inc. designs, manufactures, and markets network computing infrastructure solutions."
MDP,0.0147,MEREDITH CORP,"Meredith Corporation operates as a diversified media company primarily in the United States. It operates in two segments, National Media and Local Media."
DXC,0.0153,DXC TECHNOLOGY CO,"DXC Technology Company, together with its subsidiaries, provides information technology services and solutions primarily in North America, Europe, Asia, and Australia. It operates in two segments, Global Business Services (GBS) and Global Infrastructure Services (GIS)."
GD,0.0155,GENERAL DYNAMICS CORP,"General Dynamics Corporation operates as an aerospace and defense company worldwide. It operates through five segments: Aerospace, Combat Systems, Information Technology, Mission Systems, and Marine Systems."
TWC,0.0158,TIME WARNER CABLE INC,"Spectrum Management Holding Company, LLC, together with its subsidiaries, provides video, high-speed data, and voice services in the United States. It operates in three segments: Residential Services, Business Services, and Other Operations."
PKG,0.0161,PACKAGING CORP OF AMERICA,Packaging Corporation of America manufactures and sells containerboard and corrugated packaging products in the United States. The company operates through Packaging and Paper segments.
AE,0.0162,ADAMS RESOURCES & ENERGY INC,"Adams Resources & Energy, Inc., through its subsidiaries, primarily engages in the marketing, transportation, and storage of crude oil in the United States."
T,0.0163,AT&T INC,"AT&T Inc. provides telecommunication, media, and technology services worldwide. The company operates through four segments: Communications, WarnerMedia, Latin America, and Xandr."
MWV,0.0173,MEADWESTVACO CORP,"WestRock MWV, LLC provides packaging solutions to the healthcare, beauty and personal care, food, beverage, home and garden, tobacco, and agricultural industries worldwide."
COP,0.0174,CONOCOPHILLIPS,"ConocoPhillips explores for, produces, transports, and markets crude oil, bitumen, natural gas, liquefied natural gas (LNG), and natural gas liquids worldwide."
NOC,0.0176,NORTHROP GRUMMAN CORP,Northrop Grumman Corporation operates as a security company.
MHS,0.018,MEDCO HEALTH SOLUTIONS INC,"Medco Health Solutions, Inc. is a healthcare company provides clinically-driven pharmacy services for private and public employers, health plans, labor unions and government agencies, and individuals. Medco Health Solutions, Inc. was formerly known as Merck-Medco Managed Care, L.L.C."
VMC,0.0185,VULCAN MATERIALS CO,"Vulcan Materials Company produces and supplies construction materials primarily in the United States. The company operates through four segments: Aggregates, Asphalt, Concrete, and Calcium."
CMCSA,0.0192,COMCAST CORP,"Comcast Corporation operates as a media and technology company worldwide. It operates through Cable Communications, Cable Networks, Broadcast Television, Filmed Entertainment, Theme Parks, and Sky segments."
LEN,0.0227,LENNAR CORP,"Lennar Corporation, together with its subsidiaries, operates as a homebuilder primarily under the Lennar brand in the United States. It operates through Homebuilding East, Homebuilding Central, Homebuilding Texas, Homebuilding West, Financial Services, Multifamily, and Lennar Other segments."
PHM,0.0452,PULTEGROUP INC,"PulteGroup, Inc., through its subsidiaries, primarily engages in the homebuilding business in the United States. The company acquires and develops land primarily for residential purposes; and constructs housing on such land."
DHI,0.0614,D R HORTON INC,"D.R. Horton, Inc. operates as a homebuilding company in East, Midwest, Southeast, South Central, Southwest, and West regions in the United States. It engages in the acquisition and development of land; and construction and sale of homes in 29 states and 88 markets under the names of D.R."
