,dist,conm,busdesc
RHI,0.0,ROBERT HALF INTL INC,"Robert Half International Inc. provides staffing and risk consulting services in North America, South America, Europe, Asia, and Australia."
GWW,0.0009,GRAINGER (W W) INC,"W.W. Grainger, Inc. distributes maintenance, repair, and operating (MRO) products and services in the United States, Canada, and internationally."
TMO,0.0042,THERMO FISHER SCIENTIFIC INC,"Thermo Fisher Scientific Inc. provides analytical and other instruments, laboratory equipment, software, consumables, reagents, instrument systems, chemicals, supplies, and services worldwide."
BBBY,0.0107,BED BATH & BEYOND INC,"Bed Bath & Beyond Inc., together with its subsidiaries, operates a chain of retail stores."
SWKS,0.0135,SKYWORKS SOLUTIONS INC,"Skyworks Solutions, Inc., together with its subsidiaries, designs, develops, manufactures, and markets proprietary semiconductor products, including intellectual property in the United States, China, South Korea, Taiwan, Europe, the Middle East, Africa, and rest of Asia-Pacific."
SNDK,0.0138,SANDISK CORP,"SanDisk LLC designs, develops, manufactures, and markets data storage solutions in the United States and internationally."
ORLY,0.0148,O'REILLY AUTOMOTIVE INC,"O'Reilly Automotive, Inc., together with its subsidiaries, engages in the retail of automotive aftermarket parts, tools, supplies, equipment, and accessories in the United States."
CERN,0.018,CERNER CORP,"Cerner Corporation, together with its subsidiaries, provides health care information technology solutions and tech-enabled services in the United States and internationally."
FOSL,0.0194,FOSSIL GROUP INC,"Fossil Group, Inc., together with its subsidiaries, designs, develops, markets, and distributes consumer fashion accessories in the United States, Europe, Asia, and internationally."
NFLX,0.0197,NETFLIX INC,"Netflix, Inc. provides subscription streaming entertainment service. It offers TV series, documentaries, and feature films across various genres and languages."
ALGN,0.0268,ALIGN TECHNOLOGY INC,"Align Technology, Inc., a medical device company, designs, manufactures, and markets Invisalign clear aligners and iTero intraoral scanners and services for orthodontists and general practitioner dentists, and restorative and aesthetic dentistry."
PWR,0.0275,QUANTA SERVICES INC,"Quanta Services, Inc. provides specialty contracting services in the United States, Canada, Australia, Latin America, and internationally."
UAA,0.0298,UNDER ARMOUR INC,"Under Armour, Inc., together with its subsidiaries, develops, markets, and distributes branded performance apparel, footwear, and accessories for men, women, and youth primarily in North America, Europe, the Middle East, Africa, the Asia-Pacific, and Latin America."
SPLS,0.0308,STAPLES INC,"Staples, Inc., together with its subsidiaries, operates office products superstores. It operates in two segments, North American Delivery and North American Retail."
NKE,0.0352,NIKE INC  -CL B,"NIKE, Inc., together with its subsidiaries, designs, develops, markets, and sells athletic footwear, apparel, equipment, and accessories worldwide. The company offers NIKE brand products in six categories, including running, NIKE basketball, the Jordan brand, football, training, and sportswear."
CTXS,0.0359,CITRIX SYSTEMS INC,"Citrix Systems, Inc. provides workspace, networking, and professional services worldwide."
INFO,0.0392,IHS MARKIT LTD,"IHS Markit Ltd. provides critical information, analytics, and solutions for various industries and markets worldwide. The company's information, analytics, and solutions enhance operational efficiency and offer deep insights for customers in business, finance, and government."
KMX,0.0404,CARMAX INC,"CarMax, Inc., through its subsidiaries, operates as a retailer of used vehicles in the United States. The company operates in two segments, CarMax Sales Operations and CarMax Auto Finance."
JEF,0.044,JEFFERIES FINANCIAL GRP INC,"Jefferies Financial Group Inc., a diversified financial services company, engages in investment banking and capital markets, asset management, and direct investing businesses in the Americas, Europe, the Middle East, Africa, and Asia."
IDXX,0.0444,IDEXX LABS INC,"IDEXX Laboratories, Inc., together with its subsidiaries, develops, manufactures, and distributes products and services primarily for the companion animal veterinary, livestock and poultry, dairy, and water testing markets worldwide."
URBN,0.0446,URBAN OUTFITTERS INC,"Urban Outfitters, Inc. engages in the retail and wholesale of general consumer products. The company operates through three segments: Retail, wholesale, and Subscription."
NDAQ,0.0462,NASDAQ INC,"Nasdaq, Inc. operates as a technology company that serves capital markets and other industries worldwide."
EW,0.0463,EDWARDS LIFESCIENCES CORP,"Edwards Lifesciences Corporation provides products and technologies for structural heart disease, and critical care and surgical monitoring in the United States and internationally."
MOLX,0.0464,MOLEX INC,"Molex, LLC designs, develops, and manufactures electronic components and solutions."
CFN,0.0483,CAREFUSION CORP,"CareFusion Corporation, a medical technology company, provides various healthcare products and services. It offers product lines in the areas of medication management, infection prevention, operating room effectiveness, and respiratory care."
NVDA,0.0493,NVIDIA CORP,"NVIDIA Corporation operates as a visual computing company worldwide. It operates in two segments, GPU and Tegra Processor."
JNY,0.0505,JONES GROUP INC,"Premier Brands Group Holdings LLC designs, markets, and wholesales apparel, footwear, jeanswear, jewelry, and handbags in the United States and internationally."
FL,0.0527,FOOT LOCKER INC,"Foot Locker, Inc., through its subsidiaries, operates as an athletic footwear and apparel retailer."
CMG,0.055,CHIPOTLE MEXICAN GRILL INC,"Chipotle Mexican Grill, Inc., together with its subsidiaries, operates Chipotle Mexican Grill restaurants. As of September 30, 2020, it operated approximately 2,700 restaurants in the United States, Canada, the United Kingdom, France, and Germany."
PCP,0.0553,PRECISION CASTPARTS CORP,"Precision Castparts Corp. manufactures and sells metal components and products to the aerospace, power, and general industrial and other markets worldwide. The company operates through three segments: Investment Cast Products, Forged Products, and Airframe Products."
MU,0.0648,MICRON TECHNOLOGY INC,"Micron Technology, Inc. designs, manufactures, and sells memory and storage products worldwide. The company operates through four segments: Compute and Networking Business Unit, Mobile Business Unit, Storage Business Unit, and Embedded Business Unit."
TER,0.0652,TERADYNE INC,"Teradyne, Inc. designs, develops, manufactures, sells, and supports automatic test equipment worldwide. The company operates through Semiconductor Test, System Test, Industrial Automation, and Wireless Test segments."
TLAB,0.0673,TELLABS INC,"Tellabs Inc. designs, develops, and supports telecommunication networking products for communication service providers in the United States and internationally. The company operates through four segments: Optical, Data, Access, and Services."
DISCA,0.0688,DISCOVERY INC,"Discovery, Inc. operates as a media company in the United States and internationally. The company operates in two segments, U.S. Networks and International Networks."
QRVO,0.0761,QORVO INC,"Qorvo, Inc. develops and commercializes technologies and products for wireless and wired connectivity worldwide. The company operates in two segments, Mobile Products, and Infrastructure and Defense Products."
EA,0.0794,ELECTRONIC ARTS INC,"Electronic Arts Inc. develops, markets, publishes, and distributes games, content, and services for game consoles, PCs, mobile phones, and tablets worldwide."
BRCM,0.0878,BROADCOM CORP,"Broadcom Corporation provides semiconductor solutions for wired and wireless communications. Its products offer voice, video, data, and multimedia connectivity in the home, office, and mobile environments."
ABMD,0.2372,ABIOMED INC,"Abiomed, Inc. engages in the research, development, and sale of medical devices to assist or replace the pumping function of the failing heart. It also provides a continuum of care to heart failure patients."
