,dist,conm,busdesc
SHW,0.0,SHERWIN-WILLIAMS CO,"The Sherwin-Williams Company develops, manufactures, distributes, and sells paints, coatings, and related products to professional, industrial, commercial, and retail customers. It operates in three segments: The Americas Group, Consumer Brands Group, and Performance Coatings Group."
LUMN,0.0096,CENTURYLINK INC,"Lumen Technologies, Inc., a facilities-based communications company, provides various integrated services under 'CenturyLink' name to business and residential customers in the United States and internationally."
PCG,0.0173,PG&E CORP,"PG&E Corporation, through its subsidiary, Pacific Gas and Electric Company, engages in the sale and delivery of electricity and natural gas to customers in northern and central California, the United States."
RHT,0.0179,RED HAT INC,"Red Hat, Inc. provides open source software solutions to develop and offer operating system, virtualization, management, middleware, cloud, and storage technologies to various enterprises worldwide."
EMN,0.0195,EASTMAN CHEMICAL CO,Eastman Chemical Company operates as an advanced materials and specialty additives company worldwide.
ROK,0.0209,ROCKWELL AUTOMATION,"Rockwell Automation, Inc. provides industrial automation and digital transformation solutions. The company operates in two segments, Architecture & Software, and Control Products & Solutions."
INCY,0.0209,INCYTE CORP,"Incyte Corporation, a biopharmaceutical company, focuses on the discovery, development, and commercialization of various therapeutics in the United States."
LHX,0.0232,L3HARRIS TECHNOLOGIES INC,"L3Harris Technologies, Inc., an aerospace and defense technology company, provides mission-critical solutions for government and commercial customers worldwide."
DTE,0.0253,DTE ENERGY CO,"DTE Energy Company engages in the utility operations. The company's Electric segment generates, purchases, distributes, and sells electricity to approximately 2.2 million residential, commercial, and industrial customers in southeastern Michigan."
EIX,0.0265,EDISON INTERNATIONAL,"Edison International, through its subsidiaries, engages in the generation, transmission, and distribution of electricity in the United States. The company generates electricity through hydroelectric, diesel/liquid petroleum gas, natural gas, nuclear, and photovoltaic sources."
BDX,0.0273,BECTON DICKINSON & CO,"Becton, Dickinson and Company develops, manufactures, and sells medical supplies, devices, laboratory equipment, and diagnostic products worldwide."
T,0.0274,AT&T INC,"AT&T Inc. provides telecommunication, media, and technology services worldwide. The company operates through four segments: Communications, WarnerMedia, Latin America, and Xandr."
PKG,0.029,PACKAGING CORP OF AMERICA,Packaging Corporation of America manufactures and sells containerboard and corrugated packaging products in the United States. The company operates through Packaging and Paper segments.
LYB,0.0301,LYONDELLBASELL INDUSTRIES NV,"LyondellBasell Industries N.V. operates as a chemical company in the United States, Germany, Mexico, Italy, France, Japan, China, the Netherlands, and internationally."
PPG,0.032,PPG INDUSTRIES INC,"PPG Industries, Inc. manufactures and distributes paints, coatings, and specialty materials worldwide."
NTAP,0.0326,NETAPP INC,"NetApp, Inc. provides software, systems, and services to manage and share data on-premises, and private and public clouds worldwide."
WM,0.0345,WASTE MANAGEMENT INC,"Waste Management, Inc., through its subsidiaries, provides waste management environmental services to residential, commercial, industrial, and municipal customers in North America."
IGT,0.035,INTL GAME TECHNOLOGY PLC,"International Game Technology PLC operates and provides gaming technology products and services worldwide. The company operates through four segments: North America Gaming and Interactive, North America Lottery, International, and Italy."
CB,0.0358,CHUBB LTD,"Chubb Limited, through its subsidiaries, provides insurance and reinsurance products worldwide."
SRE,0.0381,SEMPRA ENERGY,"Sempra Energy operates as an energy-services holding company in the United States and internationally. The company's San Diego Gas & Electric Company segment generates, transmits, and distributes electricity; and supplies natural gas."
GIS,0.0387,GENERAL MILLS INC,"General Mills, Inc. manufactures and markets branded consumer foods worldwide. The company operates in five segments: North America Retail; Convenience Stores & Foodservice; Europe & Australia; Asia & Latin America; and Pet."
GT,0.0412,GOODYEAR TIRE & RUBBER CO,"The Goodyear Tire & Rubber Company, together with its subsidiaries, develops, manufactures, distributes, and sells tires and related products and services worldwide."
TRV,0.0413,TRAVELERS COS INC,"The Travelers Companies, Inc., through its subsidiaries, provides a range of commercial and personal property, and casualty insurance products and services to businesses, government units, associations, and individuals in the United states and internationally."
DAL,0.0426,DELTA AIR LINES INC,"Delta Air Lines, Inc. provides scheduled air transportation for passengers and cargo in the United States and internationally. The company operates through two segments, Airline and Refinery. Its domestic network centered on core hubs in Atlanta, Minneapolis-St."
EXC,0.0427,EXELON CORP,"Exelon Corporation, a utility services holding company, engages in the generation and marketing of energy in the United States and Canada. It owns nuclear, fossil, wind, hydroelectric, biomass, and solar generating facilities."
HII,0.044,HUNTINGTON INGALLS IND INC,"Huntington Ingalls Industries, Inc. engages in the designing, building, overhauling, and repairing military ships in the United States. It operates through three segments: Ingalls Shipbuilding, Newport News Shipbuilding, and Technical Solutions."
DVA,0.0454,DAVITA INC,DaVita Inc. provides kidney dialysis services for patients suffering from chronic kidney failure or end stage renal disease (ESRD). The company operates kidney dialysis centers and provides related lab services in outpatient dialysis centers.
VTRS,0.0459,VIATRIS INC,"Viatris Inc., a healthcare company, manufactures and distributes various medicines for patients in the United States and internationally."
LNT,0.0462,ALLIANT ENERGY CORP,"Alliant Energy Corporation operates as a utility holding company that provides regulated electricity and natural gas services in the Midwest region of the United States. It operates through three segments: Utility Electric Operations, Utility Gas Operations, and Utility Other."
COL,0.0483,ROCKWELL COLLINS,"Collins Aerospace designs, produces and supports communication and aviation systems worldwide."
NLSN,0.0516,NIELSEN HOLDINGS PLC,"Nielsen Holdings plc, together with its subsidiaries, operates as a measurement and data analytics company worldwide. It operates in two segments, Connect and Media."
RTX,0.0519,RAYTHEON TECHNOLOGIES CORP,"Raytheon Technologies Corporation, an aerospace and defense company, provides advanced systems and services for commercial, military, and government customers worldwide."
XRX,0.0528,XEROX HOLDINGS CORP,"Xerox Holdings Corporation designs, develops, and sells document management systems and solutions in the United States, Europe, Canada, and internationally."
XEL,0.0539,XCEL ENERGY INC,"Xcel Energy Inc., through its subsidiaries, generates, purchases, transmits, distributes, and sells electricity. It operates through Regulated Electric Utility, Regulated Natural Gas Utility, and All Other segments."
APTV,0.0545,APTIV PLC,"Aptiv PLC designs, manufacturers, and sells vehicle components worldwide. The company provides electrical, electronic, and safety technology solutions to the automotive and commercial vehicle markets."
L,0.0559,LOEWS CORP,Loews Corporation provides commercial property and casualty insurance in the United States and internationally.
UAL,0.0583,UNITED AIRLINES HOLDINGS INC,"United Airlines Holdings, Inc., through its subsidiaries, provides air transportation services in North America, Asia, Europe, Africa, the Pacific, the Middle East, and Latin America. It transports people and cargo through its mainline and regional fleets."
