,dist,conm,busdesc
QEP,0.0,QEP RESOURCES INC,"QEP Resources, Inc. operates as a crude oil and natural gas exploration and production company in the United States. The company conducts exploration and production activities in the Permian Basin in Western Texas; and Williston Basin in North Dakota."
MSFT,0.0036,MICROSOFT CORP,"Microsoft Corporation develops, licenses, and supports software, services, devices, and solutions worldwide."
ORCL,0.0041,ORACLE CORP,Oracle Corporation provides products and services that address enterprise information technology environments worldwide.
COG,0.0054,CABOT OIL & GAS CORP,"Cabot Oil & Gas Corporation, an independent oil and gas company, explores for, exploits, develops, produces, and markets oil and gas properties in the United States."
FCX,0.0125,FREEPORT-MCMORAN INC,"Freeport-McMoRan Inc. engages in the mining of mineral properties in North America, South America, and Indonesia. The company primarily explores for copper, gold, molybdenum, silver, and other metals, as well as oil and gas."
PM,0.0145,PHILIP MORRIS INTERNATIONAL,"Philip Morris International Inc., through its subsidiaries, manufactures and sells cigarettes, other nicotine-containing products, smoke-free products, and related electronic devices and accessories."
LSI,0.0151,LIFE STORAGE INC,"Life Storage, Inc. is a self-administered and self-managed equity REIT that is in the business of acquiring and managing self-storage facilities. Located in Buffalo, New York, the Company operates more than 900 storage facilities in 30 states and in the province of Ontario, Canada."
JNS,0.023,JANUS CAPITAL GROUP INC,"Janus Capital Group, Inc. is a privately owned asset manager. It also provides retirement planning, investment planning, tax planning, investment for college, and tax planning services to its clients."
AMGN,0.0241,AMGEN INC,"Amgen Inc. discovers, develops, manufactures, and delivers human therapeutics worldwide. It focuses on inflammation, oncology/hematology, bone health, cardiovascular disease, nephrology and neuroscience areas."
CXO,0.0244,CONCHO RESOURCES INC,"Concho Resources Inc., an independent oil and natural gas company, engages in the acquisition, development, and exploration of oil and natural gas properties in the United States. The company's principal operating areas are located in the Permian Basin of West Texas and southeast New Mexico."
NFX,0.0253,NEWFIELD EXPLORATION CO,"Ovintiv Exploration Inc. engages in the exploration, development, and production of crude oil, natural gas, and natural gas liquids in the United States. Ovintiv Exploration Inc. was formerly known as Newfield Exploration Company and changed its name to Ovintiv Exploration Inc. in 2020."
AVB,0.0354,AVALONBAY COMMUNITIES INC,"As of September 30, 2020, the Company owned or held a direct or indirect ownership interest in 294 apartment communities containing 86,676 apartment homes in 11 states and the District of Columbia, of which 19 communities were under development and one community was under redevelopment."
DVN,0.0393,DEVON ENERGY CORP,"Devon Energy Corporation, an independent energy company, primarily engages in the exploration, development, and production of oil, natural gas, and natural gas liquids in the United States. It operates approximately 3,955 gross wells."
SWN,0.0394,SOUTHWESTERN ENERGY CO,"Southwestern Energy Company, an independent energy company, engages in the exploration, development, and production of natural gas, oil, and natural gas liquids (NGLs) in the United States. It operates through Exploration and Production, and Marketing segments."
MA,0.0411,MASTERCARD INC,"Mastercard Incorporated, a technology company, provides transaction processing and other payment-related products and services in the United States and internationally."
REG,0.0432,REGENCY CENTERS CORP,"Regency Centers is the preeminent national owner, operator, and developer of shopping centers located in affluent and densely populated trade areas."
MJN,0.0443,MEAD JOHNSON NUTRITION CO,"Mead Johnson Nutrition Company manufactures and sells infant formula, children's nutrition, and other nutritional products."
MDT,0.0444,MEDTRONIC PLC,"Medtronic plc develops, manufactures, distributes, and sells device-based medical therapies to hospitals, physicians, clinicians, and patients worldwide."
NBL,0.0477,NOBLE ENERGY INC,"Noble Energy, Inc., an independent energy company, engages in the acquisition, exploration, development, and production of crude oil and natural gas worldwide. The company also owns, operates, develops, and acquires domestic midstream infrastructure assets in the DJ and Delaware Basins."
LLY,0.0495,LILLY (ELI) & CO,"Eli Lilly and Company discovers, develops, manufactures, and markets pharmaceutical products worldwide. It offers endocrinology products for diabetes; osteoporosis in postmenopausal women and men; and human growth hormone deficiency and paediatric growth conditions."
KO,0.0506,COCA-COLA CO,"The Coca-Cola Company, a beverage company, manufactures, markets, and sells various nonalcoholic beverages worldwide. The company provides sparkling soft drinks; water, enhanced water, and sports drinks; juice, dairy, and plant-based beverages; tea and coffee; and energy drinks."
RRC,0.0553,RANGE RESOURCES CORP,"Range Resources Corporation operates as an independent natural gas, natural gas liquids (NGLs), and oil company in the United States. The company engages in the exploration, development, and acquisition of natural gas and oil properties."
APA,0.0649,APACHE CORP,"Apache Corporation, an independent energy company, explores for, develops, and produces natural gas, crude oil, and natural gas liquids (NGLs)."
KIM,0.0651,KIMCO REALTY CORP,"Kimco Realty Corp. (NYSE:KIM) is a real estate investment trust (REIT) headquartered in Jericho, N.Y. that is one of North America's largest publicly traded owners and operators of open-air, grocery-anchored shopping centers and mixed-use assets."
WELL,0.0741,WELLTOWER INC,"Welltower Inc. (NYSE:WELL), an S&P 500 company headquartered in Toledo, Ohio, is driving the transformation of health care infrastructure."
XTO,0.0887,XTO ENERGY INC,XTO Energy Inc. extracts natural gas from shale and other tight formations. It also produces crude oil and natural gas liquids in the United States. The company owns interests in various oil and natural gas wells in the United States. XTO Energy Inc.
O,0.1024,REALTY INCOME CORP,"Realty Income, The Monthly Dividend Company<sup></sup>, is an S&P 500 company dedicated to providing stockholders with dependable monthly income."
ICE,0.1033,INTERCONTINENTAL EXCHANGE,"Intercontinental Exchange, Inc. operates regulated exchanges, clearing houses, and listings venues for commodity, financial, fixed income, and equity markets in the United States, the United Kingdom, European Union, Singapore, Israel, and Canada."
ACAS,0.1296,AMERICAN CAPITAL LTD,"American Capital, Ltd. is a business development company specializing in management and employee buyouts, subordinated debt, leveraged finance, mezzanine, acquisition, recapitalization, middle market, early venture, mature, industry consolidation, and growth capital investments."
CME,0.1344,CME GROUP INC,"CME Group Inc., through its subsidiaries, operates contract markets for the trading of futures and options on futures contracts worldwide."
