,dist,conm,busdesc
AA,0.0,ALCOA CORP,"Alcoa Corporation, together with its subsidiaries, produces and sells bauxite, alumina, and aluminum products in the United States, Spain, Australia, Brazil, Canada, and internationally. The company operates through three segments: Bauxite, Alumina, and Aluminum."
PWR,0.0178,QUANTA SERVICES INC,"Quanta Services, Inc. provides specialty contracting services in the United States, Canada, Australia, Latin America, and internationally."
URBN,0.0265,URBAN OUTFITTERS INC,"Urban Outfitters, Inc. engages in the retail and wholesale of general consumer products. The company operates through three segments: Retail, wholesale, and Subscription."
FL,0.0309,FOOT LOCKER INC,"Foot Locker, Inc., through its subsidiaries, operates as an athletic footwear and apparel retailer."
HRL,0.032,HORMEL FOODS CORP,"Hormel Foods Corporation produces and markets various meat and food products to retail, foodservice, deli, and commercial customers in the United States and internationally."
BIO,0.0381,BIO-RAD LABORATORIES INC,"Bio-Rad Laboratories, Inc. develops, manufactures, and markets products and solutions for the life science research and clinical diagnostic markets in Europe, the United States, Canada, and Latin America."
WFM,0.0385,WHOLE FOODS MARKET INC,"Whole Foods Market, Inc. operates natural and organic foods supermarkets. The company's stores offers produce, grocery, meat and poultry, seafood, bakery, prepared foods, coffee, tea, beer, wine, cheese, nutritional supplements, vitamins, body care, pet foods, and household goods."
EXPD,0.0411,EXPEDITORS INTL WASH INC,"Expeditors International of Washington, Inc. provides logistics services in the Americas, North Asia, South Asia, Europe, the Middle East, Africa, and India."
TSCO,0.0534,TRACTOR SUPPLY CO,Tractor Supply Company operates rural lifestyle retail stores in the United States.
FSLR,0.0587,FIRST SOLAR INC,"First Solar, Inc. provides photovoltaic (PV) solar energy solutions in the United States and internationally. It operates in two segments, Modules and Systems."
PMCS,0.0639,PMC-SIERRA INC,"Microsemi Storage Solutions, Inc. designs, develops, markets, and supports semiconductor solutions for communications network infrastructure equipment worldwide. Its semiconductor devices enable networking equipment primarily in three markets, including storage, optical, and mobile networks."
HFC,0.0726,HOLLYFRONTIER CORP,"HollyFrontier Corporation operates as an independent petroleum refiner in the United States. The company operates through three segments: Refining, Lubricants and Specialty Products, and HEP."
BRCM,0.0785,BROADCOM CORP,"Broadcom Corporation provides semiconductor solutions for wired and wireless communications. Its products offer voice, video, data, and multimedia connectivity in the home, office, and mobile environments."
TER,0.0989,TERADYNE INC,"Teradyne, Inc. designs, develops, manufactures, sells, and supports automatic test equipment worldwide. The company operates through Semiconductor Test, System Test, Industrial Automation, and Wireless Test segments."
OXY,0.1298,OCCIDENTAL PETROLEUM CORP,"Occidental Petroleum Corporation, together with its subsidiaries, engages in the acquisition, exploration, and development of oil and gas properties in the United States, the Middle East, and Latin America."
ABMD,0.1309,ABIOMED INC,"Abiomed, Inc. engages in the research, development, and sale of medical devices to assist or replace the pumping function of the failing heart. It also provides a continuum of care to heart failure patients."
ETSY,0.1345,ETSY INC,"Etsy, Inc. operates online market places for buyers and sellers primarily in the United States, the United Kingdom, Canada, Australia, France, and Germany. Its online market places include Etsy.com and Reverb.com."
QLGC,0.1405,QLOGIC CORP,"QLogic Corporation and its subsidiaries design and supply high performance server and storage networking connectivity products that provide, enhance, and manage computer data communication."
DXCM,0.141,DEXCOM INC,"DexCom, Inc., a medical device company, focuses on the design, development, and commercialization of continuous glucose monitoring (CGM) systems in the United States and internationally. The company offers its systems for use by people with diabetes, as well as for use by healthcare providers."
WB,0.1597,WEIBO CORP,"Weibo Corporation, through its subsidiaries, operates as a social media platform for people to create, distribute, and discover content in the People's Republic of China. It operates in two segments, Advertising and Marketing Services; and Value-Added Services."
QRVO,0.161,QORVO INC,"Qorvo, Inc. develops and commercializes technologies and products for wireless and wired connectivity worldwide. The company operates in two segments, Mobile Products, and Infrastructure and Defense Products."
TWTR,0.1679,TWITTER INC,"Twitter, Inc. operates as a platform for public self-expression and conversation in real time United States and internationally."
