,dist,conm,busdesc
PG,0.0,PROCTER & GAMBLE CO,"The Procter & Gamble Company provides branded consumer packaged goods to consumers in North and Latin America, Europe, the Asia Pacific, Greater China, India, the Middle East, and Africa."
JOY,0.0043,JOY GLOBAL INC,"Komatsu Mining Corp. manufactures and services mining equipment for the extraction of coal, copper, iron ore, oil sands, gold, and other minerals worldwide. It operates in two segments, Underground Mining Machinery and Surface Mining Equipment."
MAT,0.0158,MATTEL INC,"Mattel, Inc., a children's entertainment company, designs and produces toys and consumer products worldwide. The company operates through North America, International, and American Girl segments."
WELL,0.0169,WELLTOWER INC,"Welltower Inc. (NYSE:WELL), an S&P 500 company headquartered in Toledo, Ohio, is driving the transformation of health care infrastructure."
FIS,0.0195,FIDELITY NATIONAL INFO SVCS,"Fidelity National Information Services, Inc. operates as a financial services technology company in the United States and internationally. It operates through three segments: Merchant Solutions, Banking Solutions, and Capital Market Solutions."
ITW,0.0206,ILLINOIS TOOL WORKS,Illinois Tool Works Inc. manufactures and sells industrial products and equipment worldwide. It operates through seven segments: Automotive OEM; Food Equipment; Test & Measurement and Electronics; Welding; Polymers & Fluids; Construction Products; and Specialty Products.
EMC,0.0236,EMC CORP/MA,"Dell EMC develops, delivers, and supports information infrastructure and virtual infrastructure technologies, solutions, and services."
VAR,0.0251,VARIAN MEDICAL SYSTEMS INC,"Varian Medical Systems, Inc. designs, manufactures, sells, and services medical devices and software products for treating cancer and other medical conditions worldwide. It operates through Oncology Systems and Proton Solutions segments."
SNA,0.0257,SNAP-ON INC,"Snap-on Incorporated manufactures and markets tools, equipment, diagnostics, and repair information and systems solutions for professional users worldwide."
APH,0.0265,AMPHENOL CORP,"Amphenol Corporation, together with its subsidiaries, primarily designs, manufactures, and markets electrical, electronic, and fiber optic connectors in the United States, China, and internationally."
FOSL,0.0302,FOSSIL GROUP INC,"Fossil Group, Inc., together with its subsidiaries, designs, develops, markets, and distributes consumer fashion accessories in the United States, Europe, Asia, and internationally."
MRK,0.0308,MERCK & CO,"Merck & Co., Inc. provides healthcare solutions worldwide."
MMC,0.0345,MARSH & MCLENNAN COS,"Marsh & McLennan Companies, Inc., a professional services company, provides advice and solutions to clients in the areas of risk, strategy, and people worldwide. It operates in two segments, Risk and Insurance Services, and Consulting."
EQR,0.0377,EQUITY RESIDENTIAL,"Equity Residential is committed to creating communities where people thrive. The Company, a member of the S&P 500, is focused on the acquisition, development and management of residential properties located in and around dynamic cities that attract high quality long-term renters."
CHD,0.0433,CHURCH & DWIGHT INC,"Church & Dwight Co., Inc. develops, manufactures, and markets household, personal care, and specialty products in the United States and internationally. It operates in three segments: Consumer Domestic, Consumer International, and Specialty Products Division."
CDNS,0.045,CADENCE DESIGN SYSTEMS INC,"Cadence Design Systems, Inc. provides software, hardware, services, and reusable integrated circuit (IC) design blocks worldwide. The company offers functional verification services, including emulation and prototyping hardware."
TSS,0.0464,TOTAL SYSTEM SERVICES INC,"As of September 17, 2019, Total System Services, Inc. was acquired by Global Payments Inc. Total System Services, Inc. provides payment processing, merchant, and related payment services to financial and nonfinancial institutions worldwide."
ILMN,0.0466,ILLUMINA INC,"Illumina, Inc. provides sequencing and array-based solutions for genetic and genomic analysis."
IEX,0.047,IDEX CORP,"IDEX Corporation, together with its subsidiaries, operates as an applied solutions company worldwide. The company operates through three segments: Fluid & Metering Technologies (FMT), Health & Science Technologies (HST), and Fire & Safety/Diversified Products (FSDP)."
DOV,0.0473,DOVER CORP,"Dover Corporation provides equipment and components, consumable supplies, aftermarket parts, software and digital solutions, and support services worldwide."
TTWO,0.0497,TAKE-TWO INTERACTIVE SFTWR,"Take-Two Interactive Software, Inc. develops, publishes, and markets interactive entertainment solutions for consumers worldwide. The company offers its products under the Rockstar Games and 2K labels, as well as under Private Division and Social Point labels."
COP,0.0523,CONOCOPHILLIPS,"ConocoPhillips explores for, produces, transports, and markets crude oil, bitumen, natural gas, liquefied natural gas (LNG), and natural gas liquids worldwide."
IFF,0.0525,INTL FLAVORS & FRAGRANCES,"International Flavors & Fragrances Inc., together with its subsidiaries, manufactures flavors and fragrances for use in various consumer products. It operates through two segments, Taste and Scent."
A,0.0531,AGILENT TECHNOLOGIES INC,"Agilent Technologies, Inc. provides application focused solutions to the life sciences, diagnostics, and applied chemical markets worldwide."
COV,0.0545,COVIDIEN PLC,"As of January 26, 2015, Covidien plc was acquired by Medtronic plc. Covidien plc develops, manufactures, and sells healthcare products for use in clinical and home settings worldwide. The company operates through Medical Devices and U.S. Medical Supplies segments."
MMM,0.0546,3M CO,"3M Company develops, manufactures, and markets various products worldwide. It operates through four business segments: Safety and Industrial, Transportation and Electronics, Health Care, and Consumer."
TFX,0.0567,TELEFLEX INC,"Teleflex Incorporated designs, develops, manufactures, and supplies single-use medical devices for common diagnostic and therapeutic procedures in critical care and surgical applications worldwide."
MTD,0.0572,METTLER-TOLEDO INTL INC,"Mettler-Toledo International Inc. manufactures and supplies precision instruments and services worldwide. It operates in five segments: U.S. Operations, Swiss Operations, Western European Operations, Chinese Operations, and Other."
PRGO,0.0579,PERRIGO CO PLC,Perrigo Company plc provides over-the-counter (OTC) health and wellness solutions that enhance individual well-being by empowering consumers to prevent or treat conditions that can be self-managed.
RHT,0.059,RED HAT INC,"Red Hat, Inc. provides open source software solutions to develop and offer operating system, virtualization, management, middleware, cloud, and storage technologies to various enterprises worldwide."
SJM,0.0634,SMUCKER (JM) CO,"The J. M. Smucker Company manufactures and markets food and beverage products worldwide. It operates in four segments: U.S. Retail Pet Foods, U.S. Retail Coffee, U.S. Retail Consumer Foods, and International and Away From Home."
AME,0.0668,AMETEK INC,"AMETEK, Inc. manufactures and sells electronic instruments and electromechanical devices worldwide. It operates through two segments, Electronic Instruments (EIG) and Electromechanical (EMG)."
IDXX,0.0709,IDEXX LABS INC,"IDEXX Laboratories, Inc., together with its subsidiaries, develops, manufactures, and distributes products and services primarily for the companion animal veterinary, livestock and poultry, dairy, and water testing markets worldwide."
TIF,0.0725,TIFFANY & CO,"Tiffany & Co., through its subsidiaries, designs, manufactures, and retails jewelry and other items. The company offers jewelry collections, engagement rings, and wedding bands. It also sells watches, home and accessories products, and fragrances; and wholesales diamonds and earnings."
EBAY,0.0738,EBAY INC,eBay Inc. operates the marketplace and classifieds platforms that connect buyers and sellers worldwide.
BDX,0.0781,BECTON DICKINSON & CO,"Becton, Dickinson and Company develops, manufactures, and sells medical supplies, devices, laboratory equipment, and diagnostic products worldwide."
TXN,0.0803,TEXAS INSTRUMENTS INC,"Texas Instruments Incorporated designs, manufactures, and sells semiconductors to electronics designers and manufacturers worldwide. It operates in two segments, Analog and Embedded Processing."
DIS,0.0907,DISNEY (WALT) CO,"The Walt Disney Company, together with its subsidiaries, operates as an entertainment company worldwide."
TDC,0.0934,TERADATA CORP,"Teradata Corporation provides hybrid cloud analytics software. Its solutions and services comprise software, hardware, and related business consulting and support services to deliver analytics in company's analytical ecosystem."
