,dist,conm,busdesc
ANDV,0.0,ANDEAVOR,"Andeavor, through its subsidiaries, operates as an independent petroleum refining, logistics, and marketing company in the United States. The company operates in three segments: Marketing, Logistics, and Refining."
DDS,0.0092,DILLARDS INC  -CL A,"Dillard's, Inc. operates retail department stores primarily in the Southeastern, Southwestern, and Midwestern areas of the United States."
VLO,0.0142,VALERO ENERGY CORP,"Valero Energy Corporation manufactures and sells transportation fuels and petrochemical products in the United States, Canada, the United Kingdom, Ireland, and internationally. It operates through three segments: Refining, Ethanol, and Renewable Diesel."
H,0.0147,HYATT HOTELS CORP,"Hyatt Hotels Corporation, a hospitality company, develops, owns, operates, manages, franchises, licenses, or provides services to hotels, resorts, and other properties."
OXY,0.017,OCCIDENTAL PETROLEUM CORP,"Occidental Petroleum Corporation, together with its subsidiaries, engages in the acquisition, exploration, and development of oil and gas properties in the United States, the Middle East, and Latin America."
HSIC,0.0198,HENRY SCHEIN INC,"Henry Schein, Inc., a solutions company for health care professionals, provides health care products and services to office-based dental practitioners and laboratories, physician practices, government, institutional health care clinics, and other alternate care clinics worldwide."
MPC,0.0205,MARATHON PETROLEUM CORP,"Marathon Petroleum Corporation, together with its subsidiaries, engages in refining, marketing, retailing, and transporting petroleum products primarily in the United States. It operates through three segments: Refining & Marketing, Retail, and Midstream."
CF,0.0219,CF INDUSTRIES HOLDINGS INC,"CF Industries Holdings, Inc. manufactures and distributes nitrogen fertilizers and other nitrogen products worldwide. Its principal nitrogen fertilizer products include anhydrous ammonia, granular urea, urea ammonium nitrate solution, and ammonium nitrate."
DVN,0.023,DEVON ENERGY CORP,"Devon Energy Corporation, an independent energy company, primarily engages in the exploration, development, and production of oil, natural gas, and natural gas liquids in the United States. It operates approximately 3,955 gross wells."
GME,0.0257,GAMESTOP CORP,"GameStop Corp. operates as a multichannel video game, consumer electronics, and collectibles retailer in the United States, Canada, Australia, and Europe."
ADM,0.026,ARCHER-DANIELS-MIDLAND CO,"Archer-Daniels-Midland Company procures, transports, stores, processes, and merchandises agricultural commodities, products, and ingredients in the United States and internationally. The company operates through three segments: Ag Services and Oilseeds, Carbohydrate Solutions, and Nutrition."
NBL,0.0298,NOBLE ENERGY INC,"Noble Energy, Inc., an independent energy company, engages in the acquisition, exploration, development, and production of crude oil and natural gas worldwide. The company also owns, operates, develops, and acquires domestic midstream infrastructure assets in the DJ and Delaware Basins."
COTY,0.0307,COTY INC,"Coty Inc., together with its subsidiaries, manufactures, markets, distributes, and sells beauty products worldwide."
SSP,0.0329,EW SCRIPPS  -CL A,"The E.W. Scripps Company, together with its subsidiaries, operates as a media enterprise through a portfolio of local and national media brands. The company operates through Local Media, National Media, and Other segments."
CRM,0.033,SALESFORCE.COM INC,"salesforce.com, inc. develops enterprise cloud computing solutions with a focus on customer relationship management worldwide."
UAA,0.0332,UNDER ARMOUR INC,"Under Armour, Inc., together with its subsidiaries, develops, markets, and distributes branded performance apparel, footwear, and accessories for men, women, and youth primarily in North America, Europe, the Middle East, Africa, the Asia-Pacific, and Latin America."
WBA,0.0356,WALGREENS BOOTS ALLIANCE INC,"Walgreens Boots Alliance, Inc. operates as a pharmacy-led health and beauty retail company. It operates through three segments: Retail Pharmacy USA, Retail Pharmacy International, and Pharmaceutical Wholesale."
FTI,0.0359,TECHNIPFMC PLC,"TechnipFMC plc engages in the oil and gas projects, technologies, and systems and services businesses. It operates through three segments: Subsea, Technip Energies, and Surface Technologies."
PSX,0.0385,PHILLIPS 66,"Phillips 66 operates as an energy manufacturing and logistics company. It operates through four segments: Midstream, Chemicals, Refining, and Marketing and Specialties (M&S)."
SANM,0.0388,SANMINA CORP,"Sanmina Corporation provides integrated manufacturing solutions, components, products and repair, logistics, and after-market services worldwide. It operates in two segments, Integrated Manufacturing Solutions; and Components, Products and Services."
MOS,0.0416,MOSAIC CO,"The Mosaic Company, through its subsidiaries, produces and markets concentrated phosphate and potash crop nutrients in North America and internationally. The company operates through three segments: Phosphates, Potash, and Mosaic Fertilizantes."
DG,0.0423,DOLLAR GENERAL CORP,"Dollar General Corporation, a discount retailer, provides various merchandise products in the southern, southwestern, Midwestern, and eastern United States."
PDCO,0.0426,PATTERSON COS INC,"Patterson Companies, Inc. distributes and sells dental and animal health products in the United States, the United Kingdom, and Canada. It operates through three segments; Dental, Animal Health, and Corporate segments."
GCI,0.0446,GANNETT CO INC,"Gannett Co., Inc. operates as a media and marketing solutions company in the United States. It operates in Publishing and Marketing Solutions segments."
PVH,0.0454,PVH CORP,PVH Corp. operates as an apparel company in the United States and internationally.
LKQ,0.0457,LKQ CORP,"LKQ Corporation, together with its subsidiaries, distributes replacement parts, components, and systems used in the repair and maintenance of vehicles. It operates in three segments: North America, Europe, and Specialty."
CMI,0.0509,CUMMINS INC,"Cummins Inc. designs, manufactures, distributes, and services diesel and natural gas engines, products worldwide. It operates through five segments: Engine, Distribution, Components, Power Systems, and New Power."
MTW,0.0513,MANITOWOC CO,"The Manitowoc Company, Inc. provides engineered lifting equipment for the construction industry in the Americas, Europe, Africa, the Middle East, and the Asia Pacific."
TSCO,0.0525,TRACTOR SUPPLY CO,Tractor Supply Company operates rural lifestyle retail stores in the United States.
AE,0.06,ADAMS RESOURCES & ENERGY INC,"Adams Resources & Energy, Inc., through its subsidiaries, primarily engages in the marketing, transportation, and storage of crude oil in the United States."
SLB,0.0629,SCHLUMBERGER LTD,"Schlumberger Limited supplies technology for reservoir characterization, drilling, production, and processing to the oil and gas industry worldwide. It operates in four divisions: Digital & Integration, Reservoir Performance, Well Construction, and Production Systems."
COG,0.0795,CABOT OIL & GAS CORP,"Cabot Oil & Gas Corporation, an independent oil and gas company, explores for, exploits, develops, produces, and markets oil and gas properties in the United States."
DXCM,0.0843,DEXCOM INC,"DexCom, Inc., a medical device company, focuses on the design, development, and commercialization of continuous glucose monitoring (CGM) systems in the United States and internationally. The company offers its systems for use by people with diabetes, as well as for use by healthcare providers."
QEP,0.0942,QEP RESOURCES INC,"QEP Resources, Inc. operates as a crude oil and natural gas exploration and production company in the United States. The company conducts exploration and production activities in the Permian Basin in Western Texas; and Williston Basin in North Dakota."
WPX,0.0998,WPX ENERGY INC,"WPX Energy, Inc., an independent oil and natural gas exploration and production company, engages in the exploitation and development of unconventional properties in the United States. It produces oil, natural gas, and natural gas liquids."
MRO,0.1193,MARATHON OIL CORP,Marathon Oil Corporation operates as an independent exploration and production company in the United States and Equatorial Guinea.
HES,0.1429,HESS CORP,"Hess Corporation, an exploration and production company, explores, develops, produces, purchases, transports, and sells crude oil, natural gas liquids (NGLs), and natural gas. It operates through two segments, Exploration and Production, and Midstream."
