,dist,conm,busdesc
ROH,0.0,ROHM AND HAAS CO,Rohm and Haas Company manufactures and markets chemicals.
M,0.0007,MACY'S INC,"Macy's, Inc., an omnichannel retail organization, operates stores, websites, and mobile applications under the Macy's, Bloomingdale's, and bluemercury brands."
TJX,0.0027,TJX COS INC (THE),"The TJX Companies, Inc. operates as an off-price apparel and home fashions retailer. It operates through four segments: Marmaxx, HomeGoods, TJX Canada, and TJX International."
WY,0.0063,WEYERHAEUSER CO,"Weyerhaeuser Company, one of the world's largest private owners of timberlands, began operations in 1900. We own or control approximately 11 million acres of timberlands in the U.S. and manage additional timberlands under long-term licenses in Canada."
NOC,0.0066,NORTHROP GRUMMAN CORP,Northrop Grumman Corporation operates as a security company.
TT,0.0066,TRANE TECHNOLOGIES PLC,"Trane Technologies plc provides climate control solutions for buildings, homes, and transportation."
AMCR,0.007,AMCOR PLC,"Amcor plc develops, manufactures, and sells various packaging products for food, beverage, medical and pharmaceutical, fresh produce, snack food, personal care, and other industries worldwide. It operates through two segments, Flexibles and Rigid Packaging."
HAR,0.0073,HARMAN INTERNATIONAL INDS,"Harman International Industries, Incorporated designs and engineers connected products and solutions for automakers, consumers, and enterprises worldwide. The company operates through four segments: Connected Car, Lifestyle Audio, Professional Solutions, and Connected Services."
UIS,0.0097,UNISYS CORP,"Unisys Corporation operates as an information technology company worldwide. It operates in two segments, Services and Technology. The Services segment offers cloud and infrastructure services, application services, and business process outsourcing services."
PVH,0.0102,PVH CORP,PVH Corp. operates as an apparel company in the United States and internationally.
CAH,0.0115,CARDINAL HEALTH INC,"Cardinal Health, Inc. operates as an integrated healthcare services and products company in the United States and internationally. It provides customized solutions for hospitals, healthcare systems, pharmacies, ambulatory surgery centers, clinical laboratories, and physician offices."
HON,0.0122,HONEYWELL INTERNATIONAL INC,Honeywell International Inc. operates as a diversified technology and manufacturing company worldwide.
PPG,0.0123,PPG INDUSTRIES INC,"PPG Industries, Inc. manufactures and distributes paints, coatings, and specialty materials worldwide."
DDS,0.0129,DILLARDS INC  -CL A,"Dillard's, Inc. operates retail department stores primarily in the Southeastern, Southwestern, and Midwestern areas of the United States."
MAR,0.0132,MARRIOTT INTL INC,"Marriott International, Inc. operates, franchises, and licenses hotel, residential, and timeshare properties worldwide. The company operates through North American Full-Service, North American Limited-Service, and Asia Pacific segments."
JBHT,0.0132,HUNT (JB) TRANSPRT SVCS INC,"J.B. Hunt Transport Services, Inc., together with its subsidiaries, provides surface transportation and delivery services in the continental United States, Canada, and Mexico."
PCP,0.0134,PRECISION CASTPARTS CORP,"Precision Castparts Corp. manufactures and sells metal components and products to the aerospace, power, and general industrial and other markets worldwide. The company operates through three segments: Investment Cast Products, Forged Products, and Airframe Products."
WEN,0.0167,WENDY'S CO,"The Wendy's Company, together with its subsidiaries, operates as a quick-service restaurant company. It operates through three segments: Wendy's U.S., Wendy's International, and Global Real Estate & Development."
POM,0.0167,PEPCO HOLDINGS INC,"Pepco Holdings LLC operates as a utility services holding company. The company operates through Pepco, DPL, and ACE segments."
J,0.0173,JACOBS ENGINEERING GROUP INC,"Jacobs Engineering Group Inc. provides consulting, technical, scientific, and project delivery services for the government and private sectors in the United States, Europe, Canada, India, rest of Asia, Australia, New Zealand, South America, Mexico, the Middle East, and Africa."
LLL,0.0176,L3 TECHNOLOGIES INC,"L3 Technologies, Inc. provides aircraft sustainment, simulation and training, night vision and image intensification equipment, and security and detection systems used on military, homeland security, and commercial platforms in the United States and internationally."
LRCX,0.0178,LAM RESEARCH CORP,"Lam Research Corporation designs, manufactures, markets, refurbishes, and services semiconductor processing equipment used in the fabrication of integrated circuits worldwide."
ATI,0.0179,ALLEGHENY TECHNOLOGIES INC,"Allegheny Technologies Incorporated manufactures and sells specialty materials and components worldwide. The company operates in two segments, High Performance Materials & Components and Advanced Alloys & Solutions."
MAT,0.0186,MATTEL INC,"Mattel, Inc., a children's entertainment company, designs and produces toys and consumer products worldwide. The company operates through North America, International, and American Girl segments."
BC,0.0198,BRUNSWICK CORP,"Brunswick Corporation designs, manufactures, and markets recreation products worldwide."
MEE,0.0212,MASSEY ENERGY CO,"Alpha Appalachia Holdings, Inc., through its subsidiaries, operates coal mines and processing facilities primarily in the United States."
RCL,0.0227,ROYAL CARIBBEAN GROUP,"Royal Caribbean Group operates as a cruise company. The company operates cruises under the Royal Caribbean International, Celebrity Cruises, Azamara Club Cruises, and Silversea Cruises brands."
AOS,0.0234,SMITH (A.O.),"A. O. Smith Corporation manufactures and markets residential and commercial gas and electric water heaters, boilers, tanks, and water treatment products in North America, China, Europe, and India. It operates through two segments, North America and Rest of World."
SPGI,0.0243,S&P GLOBAL INC,"S&P Global Inc., together with its subsidiaries, provides ratings, benchmarks, analytics, and data to the capital and commodity markets worldwide."
NEE,0.0244,NEXTERA ENERGY INC,"NextEra Energy, Inc., through its subsidiaries, generates, transmits, and distributes electric power in North America. The company generates electricity through wind, solar, nuclear, coal, oil, and natural gas facilities."
SYY,0.0247,SYSCO CORP,"Sysco Corporation, through its subsidiaries, markets and distributes a range of food and related products primarily to the foodservice or food-away-from-home industry in the United States, Canada, the United Kingdom, France, and internationally. It operates through three segments: U.S."
JOY,0.025,JOY GLOBAL INC,"Komatsu Mining Corp. manufactures and services mining equipment for the extraction of coal, copper, iron ore, oil sands, gold, and other minerals worldwide. It operates in two segments, Underground Mining Machinery and Surface Mining Equipment."
GPS,0.0254,GAP INC,"The Gap, Inc. operates as an apparel retail company worldwide. The company offers apparel, accessories, and personal care products for men, women, and children under the Old Navy, Gap, Banana Republic, Athleta, Intermix, Janie and Jack, and Hill City brands."
BAX,0.0287,BAXTER INTERNATIONAL INC,"Baxter International Inc., through its subsidiaries, develops and provides a portfolio of healthcare products. The company operates through North and South America; Europe, Middle East and Africa; and Asia-Pacific segments."
APC,0.0304,ANADARKO PETROLEUM CORP,"Anadarko Petroleum Corporation engages in the exploration, development, production, and marketing of oil and gas properties. It operates through three segments: Exploration and Production, WES Midstream, and Other Midstream."
