,dist,conm,busdesc
SEE,0.0,SEALED AIR CORP,"Sealed Air Corporation provides food safety and security, and product protection solutions and equipment in North America, South America, Europe, the Middle East, Africa, and the Asia Pacific. It operates in two segments, Food Care and Product Care."
CBRE,0.0017,CBRE GROUP INC,"CBRE Group, Inc. operates as a commercial real estate services and investment company worldwide. It operates through Advisory Services, Global Workplace Solutions, and Real Estate Investments segments."
PCAR,0.0022,PACCAR INC,"PACCAR Inc designs, manufactures, and distributes light, medium, and heavy-duty commercial trucks in the United States, Europe, and internationally. The company operates in three segments: Truck, Parts, and Financial Services."
ATO,0.0039,ATMOS ENERGY CORP,"Atmos Energy Corporation, together with its subsidiaries, engages in the regulated natural gas distribution, and pipeline and storage businesses in the United States. It operates through Distribution, and Pipeline and Storage segments."
LMT,0.0039,LOCKHEED MARTIN CORP,"Lockheed Martin Corporation, a security and aerospace company, engages in the research, design, development, manufacture, integration, and sustainment of technology systems, products, and services worldwide."
IRM,0.004,IRON MOUNTAIN INC,"Iron Mountain Incorporated (NYSE: IRM), founded in 1951, is the global leader for storage and information management services."
PG,0.0042,PROCTER & GAMBLE CO,"The Procter & Gamble Company provides branded consumer packaged goods to consumers in North and Latin America, Europe, the Asia Pacific, Greater China, India, the Middle East, and Africa."
MEE,0.0057,MASSEY ENERGY CO,"Alpha Appalachia Holdings, Inc., through its subsidiaries, operates coal mines and processing facilities primarily in the United States."
SO,0.0059,SOUTHERN CO,"The Southern Company, through its subsidiaries, engages in the generation, transmission, and distribution of electricity. It operates in four segments: Gas Distribution Operations, Gas Pipeline Investments, Wholesale Gas Services, and Gas Marketing Services."
ATI,0.0061,ALLEGHENY TECHNOLOGIES INC,"Allegheny Technologies Incorporated manufactures and sells specialty materials and components worldwide. The company operates in two segments, High Performance Materials & Components and Advanced Alloys & Solutions."
EMN,0.0062,EASTMAN CHEMICAL CO,Eastman Chemical Company operates as an advanced materials and specialty additives company worldwide.
NI,0.0062,NISOURCE INC,"NiSource Inc., an energy holding company, operates as a regulated natural gas and electric utility company in the United States. The company operates through two segments, Gas Distribution Operations and Electric Operations."
SCG,0.0066,SCANA CORP,"SCANA Corporation, through its subsidiaries, generates, transmits, distributes, and sells electricity to wholesale and retail customers. The company operates through Electric Operations, Gas Distribution, and Gas Marketing segments."
PTV,0.007,PACTIV CORP,"Pactiv LLC manufactures and distributes food packaging and foodservice products. Its product lines include custom and stock foam, plastic, aluminum, pressed-paperboard, PE coated board, and molded-fiber packaging."
MCK,0.0075,MCKESSON CORP,"McKesson Corporation provides pharmaceuticals and medical supplies in the United States and internationally. It operates through four segments: U.S. Pharmaceutical, Prescription Technology Solutions, International, and Medical-Surgical Solutions. The U.S."
FE,0.0078,FIRSTENERGY CORP,"FirstEnergy Corp., through its subsidiaries, generates, transmits, and distributes electricity in the United States. The company operates through Regulated Distribution and Regulated Transmission segments."
OMX,0.0079,OFFICEMAX INC,"OfficeMax Incorporated, together with its subsidiaries, distributes business-to-business and retail office products."
MTW,0.0088,MANITOWOC CO,"The Manitowoc Company, Inc. provides engineered lifting equipment for the construction industry in the Americas, Europe, Africa, the Middle East, and the Asia Pacific."
TEX,0.0093,TEREX CORP,"Terex Corporation manufactures and sells aerial work platforms, materials processing machinery, and cranes worldwide. The company operates in two segments, Aerial Work Platforms (AWP) and Material Processing (MP)."
EVRG,0.0098,EVERGY INC,"Evergy, Inc., through its subsidiaries, engages in the generation, transmission, distribution, and sale of electricity in Kansas and Missouri."
IP,0.011,INTL PAPER CO,"International Paper Company operates as a paper and packaging company primarily in United States, the Middle East, Europe, Africa, Pacific Rim, Asia, and the Americas. It operates through three segments: Industrial Packaging, Global Cellulose Fibers, and Printing Papers."
ACN,0.0116,ACCENTURE PLC,"Accenture plc, a professional services company, provides strategy and consulting, interactive, and technology and operations services worldwide. The company also provides outsourcing services."
COL,0.0118,ROCKWELL COLLINS,"Collins Aerospace designs, produces and supports communication and aviation systems worldwide."
MMC,0.0122,MARSH & MCLENNAN COS,"Marsh & McLennan Companies, Inc., a professional services company, provides advice and solutions to clients in the areas of risk, strategy, and people worldwide. It operates in two segments, Risk and Insurance Services, and Consulting."
NVR,0.0122,NVR INC,"NVR, Inc. operates as a homebuilder in the United States. The company operates in two segments, Homebuilding and Mortgage Banking. It primarily constructs and sells single-family detached homes, townhomes, and condominium buildings under the Ryan Homes, NVHomes, and Heartland Homes names."
KMI,0.0133,KINDER MORGAN INC,"Kinder Morgan, Inc. operates as an energy infrastructure company in North America. The company operates through Natural Gas Pipelines, Products Pipelines, Terminals, and CO2 segments."
WM,0.0153,WASTE MANAGEMENT INC,"Waste Management, Inc., through its subsidiaries, provides waste management environmental services to residential, commercial, industrial, and municipal customers in North America."
PNW,0.0157,PINNACLE WEST CAPITAL CORP,"Pinnacle West Capital Corporation, through its subsidiary, Arizona Public Service Company, provides retail and wholesale electric services primarily in the state of Arizona."
CMI,0.0159,CUMMINS INC,"Cummins Inc. designs, manufactures, distributes, and services diesel and natural gas engines, products worldwide. It operates through five segments: Engine, Distribution, Components, Power Systems, and New Power."
ED,0.0167,CONSOLIDATED EDISON INC,"Consolidated Edison, Inc., through its subsidiaries, engages in regulated electric, gas, and steam delivery businesses in the United States."
PAYX,0.0183,PAYCHEX INC,"Paychex, Inc. provides integrated human capital management solutions for human resources (HR), payroll, benefits, and insurance services for small- to medium-sized businesses in the United States and Europe."
PXD,0.0198,PIONEER NATURAL RESOURCES CO,"Pioneer Natural Resources Company operates as an independent oil and gas exploration and production company in the United States. The company explores for, develops, and produces oil, natural gas liquids (NGLs), and gas. It has operations primarily in the Permian Basin in West Texas."
CME,0.0224,CME GROUP INC,"CME Group Inc., through its subsidiaries, operates contract markets for the trading of futures and options on futures contracts worldwide."
