,dist,conm,busdesc
SYY,0.0,SYSCO CORP,"Sysco Corporation, through its subsidiaries, markets and distributes a range of food and related products primarily to the foodservice or food-away-from-home industry in the United States, Canada, the United Kingdom, France, and internationally. It operates through three segments: U.S."
POOL,0.0028,POOL CORP,"Pool Corporation distributes swimming pool supplies, equipment, and related leisure products in the United States and internationally."
SWY,0.009,SAFEWAY INC,Safeway Inc. operates as a food and drug retailer in the United States.
MEE,0.0094,MASSEY ENERGY CO,"Alpha Appalachia Holdings, Inc., through its subsidiaries, operates coal mines and processing facilities primarily in the United States."
A,0.0097,AGILENT TECHNOLOGIES INC,"Agilent Technologies, Inc. provides application focused solutions to the life sciences, diagnostics, and applied chemical markets worldwide."
TGT,0.0097,TARGET CORP,Target Corporation operates as a general merchandise retailer in the United States.
PCAR,0.0117,PACCAR INC,"PACCAR Inc designs, manufactures, and distributes light, medium, and heavy-duty commercial trucks in the United States, Europe, and internationally. The company operates in three segments: Truck, Parts, and Financial Services."
JBHT,0.0125,HUNT (JB) TRANSPRT SVCS INC,"J.B. Hunt Transport Services, Inc., together with its subsidiaries, provides surface transportation and delivery services in the continental United States, Canada, and Mexico."
CAH,0.0137,CARDINAL HEALTH INC,"Cardinal Health, Inc. operates as an integrated healthcare services and products company in the United States and internationally. It provides customized solutions for hospitals, healthcare systems, pharmacies, ambulatory surgery centers, clinical laboratories, and physician offices."
ATO,0.0146,ATMOS ENERGY CORP,"Atmos Energy Corporation, together with its subsidiaries, engages in the regulated natural gas distribution, and pipeline and storage businesses in the United States. It operates through Distribution, and Pipeline and Storage segments."
VIAC,0.0159,VIACOMCBS INC,"ViacomCBS Inc. operates as a media and entertainment company worldwide. The company operates in four segments: TV Entertainment, Cable Networks, Filmed Entertainment, and Publishing."
AE,0.0166,ADAMS RESOURCES & ENERGY INC,"Adams Resources & Energy, Inc., through its subsidiaries, primarily engages in the marketing, transportation, and storage of crude oil in the United States."
DD,0.0166,DUPONT DE NEMOURS INC,"DuPont de Nemours, Inc. provides technology-based materials, ingredients, and solutions in the United States, Canada, the Asia Pacific, Latin America, Europe, the Middle East, and Africa."
ITT,0.0171,ITT INC,"ITT Inc. manufactures and sells engineered critical components and customized technology solutions for the energy, transportation, and industrial markets worldwide. The company operates through three segments: Motion Technologies, Industrial Process, and Connect & Control Technologies."
EL,0.0176,LAUDER (ESTEE) COS INC -CL A,"The Estee Lauder Companies Inc. manufactures and markets skin care, makeup, fragrance, and hair care products worldwide."
MHS,0.018,MEDCO HEALTH SOLUTIONS INC,"Medco Health Solutions, Inc. is a healthcare company provides clinically-driven pharmacy services for private and public employers, health plans, labor unions and government agencies, and individuals. Medco Health Solutions, Inc. was formerly known as Merck-Medco Managed Care, L.L.C."
LVS,0.0185,LAS VEGAS SANDS CORP,"Las Vegas Sands Corp., together with its subsidiaries, develops, owns, and operates integrated resorts in Asia and the United States."
SHW,0.0193,SHERWIN-WILLIAMS CO,"The Sherwin-Williams Company develops, manufactures, distributes, and sells paints, coatings, and related products to professional, industrial, commercial, and retail customers. It operates in three segments: The Americas Group, Consumer Brands Group, and Performance Coatings Group."
LYV,0.021,LIVE NATION ENTERTAINMENT,"Live Nation Entertainment, Inc. operates as a live entertainment company. It operates through Concerts, Ticketing, and Sponsorship & Advertising segments."
HPQ,0.0212,HP INC,"HP Inc., together with its subsidiaries, provides personal computing and other access devices, imaging and printing products, and related technologies, solutions, and services in the United States and internationally."
TT,0.0224,TRANE TECHNOLOGIES PLC,"Trane Technologies plc provides climate control solutions for buildings, homes, and transportation."
LNT,0.0244,ALLIANT ENERGY CORP,"Alliant Energy Corporation operates as a utility holding company that provides regulated electricity and natural gas services in the Midwest region of the United States. It operates through three segments: Utility Electric Operations, Utility Gas Operations, and Utility Other."
CNC,0.025,CENTENE CORP,Centene Corporation operates as a multi-national healthcare enterprise that provides programs and services to under-insured and uninsured individuals in the United States.
AMCR,0.0254,AMCOR PLC,"Amcor plc develops, manufactures, and sells various packaging products for food, beverage, medical and pharmaceutical, fresh produce, snack food, personal care, and other industries worldwide. It operates through two segments, Flexibles and Rigid Packaging."
FTI,0.0266,TECHNIPFMC PLC,"TechnipFMC plc engages in the oil and gas projects, technologies, and systems and services businesses. It operates through three segments: Subsea, Technip Energies, and Surface Technologies."
MAS,0.0278,MASCO CORP,"Masco Corporation designs, manufactures, and distributes home improvement and building products in North America, Europe, and internationally. The company operates through two segments, Plumbing Products and Decorative Architectural Products."
S,0.0305,SPRINT CORP,"Sprint Corporation provides a range of wireless and wireline communications products and services to consumers, businesses, government subscribers, and resellers in the United States, Puerto Rico, and the United States Virgin Islands. It operates in two segments, Wireless and Wireline."
ROK,0.0324,ROCKWELL AUTOMATION,"Rockwell Automation, Inc. provides industrial automation and digital transformation solutions. The company operates in two segments, Architecture & Software, and Control Products & Solutions."
LB,0.0345,L BRANDS INC,"L Brands, Inc. operates as a specialty retailer of women's intimate and other apparel, personal care, and beauty and home fragrance products. The company operates in three segments: Victoria's Secret, Bath & Body Works, and Victoria's Secret and Bath & Body Works International."
LXK,0.0351,LEXMARK INTL INC  -CL A,"Lexmark International, Inc., together with its subsidiaries, operates as a developer, manufacturer, and supplier of printing, imaging, device management, and document workflow solutions."
XRX,0.0363,XEROX HOLDINGS CORP,"Xerox Holdings Corporation designs, develops, and sells document management systems and solutions in the United States, Europe, Canada, and internationally."
ESRX,0.0363,EXPRESS SCRIPTS HOLDING CO,Express Scripts Holding Company operates as a pharmacy benefit management (PBM) company in the United States and Canada.
JAVA,0.0494,SUN MICROSYSTEMS INC,"Oracle America, Inc. designs, manufactures, and markets network computing infrastructure solutions."
DHI,0.0612,D R HORTON INC,"D.R. Horton, Inc. operates as a homebuilding company in East, Midwest, Southeast, South Central, Southwest, and West regions in the United States. It engages in the acquisition and development of land; and construction and sale of homes in 29 states and 88 markets under the names of D.R."
TEX,0.0641,TEREX CORP,"Terex Corporation manufactures and sells aerial work platforms, materials processing machinery, and cranes worldwide. The company operates in two segments, Aerial Work Platforms (AWP) and Material Processing (MP)."
LEN,0.069,LENNAR CORP,"Lennar Corporation, together with its subsidiaries, operates as a homebuilder primarily under the Lennar brand in the United States. It operates through Homebuilding East, Homebuilding Central, Homebuilding Texas, Homebuilding West, Financial Services, Multifamily, and Lennar Other segments."
X,0.0757,UNITED STATES STEEL CORP,"United States Steel Corporation produces and sells flat-rolled and tubular steel products primarily in North America and Europe. It operates through three segments: North American Flat-Rolled (Flat-Rolled), U. S. Steel Europe (USSE), and Tubular Products (Tubular)."
CIEN,0.0816,CIENA CORP,"Ciena Corporation provides network hardware, software, and services that support the transport, routing, switching, aggregation, service delivery, and management of video, data, and voice traffic on communications networks worldwide."
PHM,0.1134,PULTEGROUP INC,"PulteGroup, Inc., through its subsidiaries, primarily engages in the homebuilding business in the United States. The company acquires and develops land primarily for residential purposes; and constructs housing on such land."
