,dist,conm,busdesc
ROH,0.0,ROHM AND HAAS CO,Rohm and Haas Company manufactures and markets chemicals.
GD,0.0023,GENERAL DYNAMICS CORP,"General Dynamics Corporation operates as an aerospace and defense company worldwide. It operates through five segments: Aerospace, Combat Systems, Information Technology, Mission Systems, and Marine Systems."
KMB,0.0032,KIMBERLY-CLARK CORP,"Kimberly-Clark Corporation, together with its subsidiaries, manufactures and markets personal care and consumer tissue products worldwide. It operates through three segments: Personal Care, Consumer Tissue, and K-C Professional."
WST,0.0047,WEST PHARMACEUTICAL SVSC INC,"West Pharmaceutical Services, Inc. manufactures and sells containment and delivery systems for injectable drugs and healthcare products in the United States, Germany, Ireland, France, Other European countries, and internationally."
WCG,0.0053,WELLCARE HEALTH PLANS INC,"WellCare Health Plans, Inc. provides government-sponsored managed care services. The company operates in three segments: Medicaid Health Plans, Medicare Health Plans, and Medicare Prescription Drug Plans (PDPs)."
DRI,0.0062,DARDEN RESTAURANTS INC,"Darden Restaurants, Inc., through its subsidiaries, owns and operates full-service restaurants in the United States and Canada."
HOT,0.0067,STARWOOD HOTELS&RESORTS WRLD,"Starwood Hotels & Resorts Worldwide, Inc., together with its subsidiaries, operates as a hotel and leisure company worldwide."
FISV,0.0068,FISERV INC,"Fiserv, Inc., together with its subsidiaries, provides financial services technology worldwide."
SWK,0.0069,STANLEY BLACK & DECKER INC,"Stanley Black & Decker, Inc. engages in tools and storage, industrial, and security businesses worldwide."
M,0.0073,MACY'S INC,"Macy's, Inc., an omnichannel retail organization, operates stores, websites, and mobile applications under the Macy's, Bloomingdale's, and bluemercury brands."
MOS,0.0075,MOSAIC CO,"The Mosaic Company, through its subsidiaries, produces and markets concentrated phosphate and potash crop nutrients in North America and internationally. The company operates through three segments: Phosphates, Potash, and Mosaic Fertilizantes."
LVS,0.0087,LAS VEGAS SANDS CORP,"Las Vegas Sands Corp., together with its subsidiaries, develops, owns, and operates integrated resorts in Asia and the United States."
ARG,0.0088,AIRGAS INC,"Airgas, Inc. supplies industrial, medical, and specialty gases; and welding equipment and related products. The company operates through two segments, Distribution and All Other Operations."
EQR,0.0089,EQUITY RESIDENTIAL,"Equity Residential is committed to creating communities where people thrive. The Company, a member of the S&P 500, is focused on the acquisition, development and management of residential properties located in and around dynamic cities that attract high quality long-term renters."
TGT,0.009,TARGET CORP,Target Corporation operates as a general merchandise retailer in the United States.
CBE,0.0092,COOPER INDUSTRIES PLC,"Cooper Industries plc manufactures and sells electrical components and tools in the United States and internationally. It operates in two segments, Energy and Safety Solutions, and Electrical Products Group."
JOY,0.0096,JOY GLOBAL INC,"Komatsu Mining Corp. manufactures and services mining equipment for the extraction of coal, copper, iron ore, oil sands, gold, and other minerals worldwide. It operates in two segments, Underground Mining Machinery and Surface Mining Equipment."
VIAB,0.0099,VIACOM INC,"As of December 4, 2019, Viacom Inc. was acquired by CBS Corporation. Viacom Inc. operates media brands that create entertainment content worldwide. It operates in two segments, Media Networks and Filmed Entertainment."
VTRS,0.0101,VIATRIS INC,"Viatris Inc., a healthcare company, manufactures and distributes various medicines for patients in the United States and internationally."
JWN,0.0117,NORDSTROM INC,"Nordstrom, Inc., a fashion retailer, provides apparels, shoes, cosmetics, and accessories for women, men, young adults, and children."
DDS,0.012,DILLARDS INC  -CL A,"Dillard's, Inc. operates retail department stores primarily in the Southeastern, Southwestern, and Midwestern areas of the United States."
PLD,0.0123,PROLOGIS INC,"Prologis, Inc. is the global leader in logistics real estate with a focus on high-barrier, high-growth markets."
ROL,0.0123,ROLLINS INC,"Rollins, Inc., through its subsidiaries, provides pest and termite control services to residential and commercial customers."
STZ,0.0128,CONSTELLATION BRANDS,"Constellation Brands, Inc., together with its subsidiaries, produces, imports, and markets beer, wine, and spirits in the United States, Canada, Mexico, New Zealand, and Italy."
MRO,0.0128,MARATHON OIL CORP,Marathon Oil Corporation operates as an independent exploration and production company in the United States and Equatorial Guinea.
EQIX,0.013,EQUINIX INC,"Equinix (Nasdaq: EQIX) is the world's digital infrastructure company, enabling digital leaders to harness a trusted platform to bring together and interconnect the foundational infrastructure that powers their success."
AMG,0.0132,AFFILIATED MANAGERS GRP INC,"Affiliated Managers Group, Inc., through its affiliates, operates as an asset management company providing investment management services to mutual funds, institutional clients, and high net worth individuals in the United States. It provides advisory or subadvisory services to mutual funds."
DLR,0.0147,DIGITAL REALTY TRUST INC,"Digital Realty supports the world's leading enterprises and service providers by delivering the full spectrum of data center, colocation and interconnection solutions."
BC,0.015,BRUNSWICK CORP,"Brunswick Corporation designs, manufactures, and markets recreation products worldwide."
UNH,0.0152,UNITEDHEALTH GROUP INC,"UnitedHealth Group Incorporated operates as a diversified health care company in the United States. It operates through four segments: UnitedHealthcare, OptumHealth, OptumInsight, and OptumRx."
LXK,0.0157,LEXMARK INTL INC  -CL A,"Lexmark International, Inc., together with its subsidiaries, operates as a developer, manufacturer, and supplier of printing, imaging, device management, and document workflow solutions."
BXP,0.0175,BOSTON PROPERTIES INC,"Boston Properties (NYSE: BXP) is the largest publicly-held developer and owner of Class A office properties in the United States, concentrated in five markets - Boston, Los Angeles, New York, San Francisco and Washington, DC."
COG,0.0193,CABOT OIL & GAS CORP,"Cabot Oil & Gas Corporation, an independent oil and gas company, explores for, exploits, develops, produces, and markets oil and gas properties in the United States."
TDG,0.0207,TRANSDIGM GROUP INC,"TransDigm Group Incorporated designs, produces, and supplies aircraft components in the United States and internationally."
XTO,0.0272,XTO ENERGY INC,XTO Energy Inc. extracts natural gas from shale and other tight formations. It also produces crude oil and natural gas liquids in the United States. The company owns interests in various oil and natural gas wells in the United States. XTO Energy Inc.
PEAK,0.0307,HEALTHPEAK PROPERTIES INC,"Healthpeak Properties, Inc. is a fully integrated real estate investment trust (REIT) and S&P 500 company."
