,dist,conm,busdesc
SNV,0.0,SYNOVUS FINANCIAL CORP,"Synovus Financial Corp. operates as the bank holding company for Synovus Bank that provides various financial products and services. It operates through three segments: Community Banking, Wholesale Banking, and Financial Management Services."
ZION,0.013,ZIONS BANCORPORATION NA,"Zions Bancorporation, National Association provides various banking and related services primarily in Arizona, California, Colorado, Idaho, Nevada, New Mexico, Oregon, Texas, Utah, Washington, and Wyoming."
HBAN,0.0691,HUNTINGTON BANCSHARES,"Huntington Bancshares Incorporated operates as a holding company for The Huntington National Bank that provides commercial, small business, consumer, and mortgage banking services."
KEY,0.0726,KEYCORP,"KeyCorp operates as the holding company for KeyBank National Association that provides various retail and commercial banking services in the United States. It operates in two segments, Consumer Bank and Commercial Bank."
CIT,0.084,CIT GROUP INC,"CIT Group Inc. operates as the holding company for CIT Bank, N.A. that provides banking and related services to commercial and individual customers. The company operates through Commercial Banking and Consumer Banking segments."
MTG,0.0862,MGIC INVESTMENT CORP/WI,"MGIC Investment Corporation, through its subsidiaries, provides private mortgage insurance, other mortgage credit risk management solutions, and ancillary services to lenders and government sponsored entities in the United States, Puerto Rico, and Guam."
NKTR,0.1121,NEKTAR THERAPEUTICS,"Nektar Therapeutics, a biopharmaceutical company, researches and develops drug candidates for cancer and auto-immune disease in the United States."
INCY,0.1273,INCYTE CORP,"Incyte Corporation, a biopharmaceutical company, focuses on the discovery, development, and commercialization of various therapeutics in the United States."
DXCM,0.1363,DEXCOM INC,"DexCom, Inc., a medical device company, focuses on the design, development, and commercialization of continuous glucose monitoring (CGM) systems in the United States and internationally. The company offers its systems for use by people with diabetes, as well as for use by healthcare providers."
