,dist,conm,busdesc
NEM,0.0,NEWMONT CORP,"Newmont Corporation engages in the production and exploration of gold, copper, silver, zinc, and lead. The company has operations and/or assets in the United States, Canada, Mexico, Dominican Republic, Peru, Suriname, Argentina, Chile, Australia, and Ghana."
DIS,0.0027,DISNEY (WALT) CO,"The Walt Disney Company, together with its subsidiaries, operates as an entertainment company worldwide."
AAPL,0.0028,APPLE INC,"Apple Inc. designs, manufactures, and markets smartphones, personal computers, tablets, wearables, and accessories worldwide. It also sells various related services."
HAL,0.0028,HALLIBURTON CO,Halliburton Company provides a range of services and products to oil and natural gas companies worldwide.
IEX,0.0042,IDEX CORP,"IDEX Corporation, together with its subsidiaries, operates as an applied solutions company worldwide. The company operates through three segments: Fluid & Metering Technologies (FMT), Health & Science Technologies (HST), and Fire & Safety/Diversified Products (FSDP)."
SIAL,0.0045,SIGMA-ALDRICH CORP,"Sigma-Aldrich Corporation, a life science and high technology company, develops, manufactures, purchases, and distributes various chemicals, biochemicals, and equipment products worldwide."
ADSK,0.0048,AUTODESK INC,"Autodesk, Inc. operates as a software design and services company worldwide."
TDC,0.006,TERADATA CORP,"Teradata Corporation provides hybrid cloud analytics software. Its solutions and services comprise software, hardware, and related business consulting and support services to deliver analytics in company's analytical ecosystem."
SLB,0.0071,SCHLUMBERGER LTD,"Schlumberger Limited supplies technology for reservoir characterization, drilling, production, and processing to the oil and gas industry worldwide. It operates in four divisions: Digital & Integration, Reservoir Performance, Well Construction, and Production Systems."
BKNG,0.0089,BOOKING HOLDINGS INC,Booking Holdings Inc. provides travel and restaurant online reservation and related services worldwide.
MWW,0.0089,MONSTER WORLDWIDE INC,"Monster Worldwide, Inc., together with its subsidiaries, provides online and mobile employment and recruitment solutions worldwide. The company operates in three segments: Careers-North America, Careers-International, and Internet Advertising & Fees."
CVX,0.0095,CHEVRON CORP,"Chevron Corporation, through its subsidiaries, engages in integrated energy, chemicals, and petroleum operations worldwide. The company operates in two segments, Upstream and Downstream."
VAR,0.0101,VARIAN MEDICAL SYSTEMS INC,"Varian Medical Systems, Inc. designs, manufactures, sells, and services medical devices and software products for treating cancer and other medical conditions worldwide. It operates through Oncology Systems and Proton Solutions segments."
MON,0.0115,MONSANTO CO,"Monsanto Company, together with its subsidiaries, provides agricultural products for farmers worldwide. It operates in two segments, Seeds and Genomics, and Agricultural Productivity."
TYC,0.0131,TYCO INTERNATIONAL PLC,"As of September 2, 2016, Tyco International plc was acquired by Johnson Controls International plc. Tyco International plc provides security products and services, fire detection and suppression products and services, and life safety products worldwide."
BIO,0.0131,BIO-RAD LABORATORIES INC,"Bio-Rad Laboratories, Inc. develops, manufactures, and markets products and solutions for the life science research and clinical diagnostic markets in Europe, the United States, Canada, and Latin America."
MDT,0.0133,MEDTRONIC PLC,"Medtronic plc develops, manufactures, distributes, and sells device-based medical therapies to hospitals, physicians, clinicians, and patients worldwide."
PKI,0.0138,PERKINELMER INC,"PerkinElmer, Inc. provides products, services, and solutions to the diagnostics, life sciences, and applied services markets worldwide. The company operates in two segments, Discovery & Analytical Solutions and Diagnostics."
XOM,0.0148,EXXON MOBIL CORP,"Exxon Mobil Corporation explores for and produces crude oil and natural gas in the United States, Canada/other Americas, Europe, Africa, Asia, and Australia/Oceania. It operates through Upstream, Downstream, and Chemical segments."
ALXN,0.0153,ALEXION PHARMACEUTICALS INC,"Alexion Pharmaceuticals, Inc. develops and commercializes various therapeutic products."
KO,0.0167,COCA-COLA CO,"The Coca-Cola Company, a beverage company, manufactures, markets, and sells various nonalcoholic beverages worldwide. The company provides sparkling soft drinks; water, enhanced water, and sports drinks; juice, dairy, and plant-based beverages; tea and coffee; and energy drinks."
DISCA,0.018,DISCOVERY INC,"Discovery, Inc. operates as a media company in the United States and internationally. The company operates in two segments, U.S. Networks and International Networks."
KG,0.0188,KING PHARMACEUTICALS INC,"King Pharmaceuticals LLC develops, and markets prescription pharmaceutical products and animal health products worldwide."
ODFL,0.0195,OLD DOMINION FREIGHT,"Old Dominion Freight Line, Inc. operates as a less-than-truckload (LTL) motor carrier in the United States and North America. It provides regional, inter-regional, and national LTL services, including expedited transportation."
LEG,0.0198,LEGGETT & PLATT INC,"Leggett & Platt, Incorporated designs and produces various engineered components and products worldwide. It operates through three segments: Bedding Products; Furniture, Flooring & Textile Products; and Specialized Products."
J,0.0209,JACOBS ENGINEERING GROUP INC,"Jacobs Engineering Group Inc. provides consulting, technical, scientific, and project delivery services for the government and private sectors in the United States, Europe, Canada, India, rest of Asia, Australia, New Zealand, South America, Mexico, the Middle East, and Africa."
STJ,0.0211,ST JUDE MEDICAL INC,"St. Jude Medical, Inc. was acquired by St. Jude Medical, LLC. St."
PFE,0.022,PFIZER INC,"Pfizer Inc. develops, manufactures, and sells healthcare products worldwide."
ORCL,0.0224,ORACLE CORP,Oracle Corporation provides products and services that address enterprise information technology environments worldwide.
SWN,0.0244,SOUTHWESTERN ENERGY CO,"Southwestern Energy Company, an independent energy company, engages in the exploration, development, and production of natural gas, oil, and natural gas liquids (NGLs) in the United States. It operates through Exploration and Production, and Marketing segments."
CF,0.0244,CF INDUSTRIES HOLDINGS INC,"CF Industries Holdings, Inc. manufactures and distributes nitrogen fertilizers and other nitrogen products worldwide. Its principal nitrogen fertilizer products include anhydrous ammonia, granular urea, urea ammonium nitrate solution, and ammonium nitrate."
AMGN,0.0282,AMGEN INC,"Amgen Inc. discovers, develops, manufactures, and delivers human therapeutics worldwide. It focuses on inflammation, oncology/hematology, bone health, cardiovascular disease, nephrology and neuroscience areas."
NBL,0.0319,NOBLE ENERGY INC,"Noble Energy, Inc., an independent energy company, engages in the acquisition, exploration, development, and production of crude oil and natural gas worldwide. The company also owns, operates, develops, and acquires domestic midstream infrastructure assets in the DJ and Delaware Basins."
EOG,0.0464,EOG RESOURCES INC,"EOG Resources, Inc., together with its subsidiaries, explores for, develops, produces, and markets crude oil, and natural gas and natural gas liquids."
WELL,0.0478,WELLTOWER INC,"Welltower Inc. (NYSE:WELL), an S&P 500 company headquartered in Toledo, Ohio, is driving the transformation of health care infrastructure."
