,dist,conm,busdesc
WFC,0.0,WELLS FARGO & CO,"Wells Fargo & Company, a diversified financial services company, provides banking, investment, mortgage, and consumer and commercial finance products and services to individuals, businesses, and institutions in the United States and internationally."
TFC,0.0017,TRUIST FINANCIAL CORP,"Truist Financial Corporation, a holding company, provides banking and trust services for small and mid-size businesses, public agencies, local governments, corporations, and individuals in the Southeastern and Mid-Atlantic United States."
STI,0.0022,SUNTRUST BANKS INC,"As of December 6, 2019, SunTrust Banks, Inc. was acquired by BB&T Corporation. SunTrust Banks, Inc. operates as the holding company for SunTrust Bank that provides various financial services for consumers, businesses, corporations, institutions, and not-for-profit entities in the United States."
SCHW,0.0032,SCHWAB (CHARLES) CORP,"The Charles Schwab Corporation, through its subsidiaries, provides wealth management, securities brokerage, banking, asset management, custody, and financial advisory services. The company operates through two segments, Investor Services and Advisor Services."
BAC,0.0032,BANK OF AMERICA CORP,"Bank of America Corporation, through its subsidiaries, provides banking and financial products and services for individual consumers, small- and middle-market businesses, institutional investors, large corporations, and governments worldwide."
FITB,0.0032,FIFTH THIRD BANCORP,Fifth Third Bancorp operates as a diversified financial services company in the United States.
JPM,0.004,JPMORGAN CHASE & CO,"JPMorgan Chase & Co. operates as a financial services company worldwide. It operates in four segments: Consumer & Community Banking (CCB), Corporate & Investment Bank (CIB), Commercial Banking (CB), and Asset & Wealth Management (AWM)."
NCC,0.0043,NATIONAL CITY CORP,"As of November 6, 2009, National City Corporation was acquired by PNC Bank, National Association."
CMA,0.0048,COMERICA INC,"Comerica Incorporated, through its subsidiaries, provides various financial products and services. It operates through three segments: Business Bank, Retail Bank, and Wealth Management."
KEY,0.005,KEYCORP,"KeyCorp operates as the holding company for KeyBank National Association that provides various retail and commercial banking services in the United States. It operates in two segments, Consumer Bank and Commercial Bank."
HBAN,0.005,HUNTINGTON BANCSHARES,"Huntington Bancshares Incorporated operates as a holding company for The Huntington National Bank that provides commercial, small business, consumer, and mortgage banking services."
ZION,0.0058,ZIONS BANCORPORATION NA,"Zions Bancorporation, National Association provides various banking and related services primarily in Arizona, California, Colorado, Idaho, Nevada, New Mexico, Oregon, Texas, Utah, Washington, and Wyoming."
MTB,0.0074,M & T BANK CORP,"M&T Bank Corporation operates as the holding company for Manufacturers and Traders Trust Company; and Wilmington Trust, National Association that provide banking services."
FRC,0.0077,FIRST REPUBLIC BANK,"First Republic Bank, together with its subsidiaries, provides private banking, private business banking, real estate lending, and wealth management services to clients in metropolitan areas in the United States. It operates through two segments, Commercial Banking and Wealth Management."
BK,0.0082,BANK OF NEW YORK MELLON CORP,"The Bank of New York Mellon Corporation provides a range of financial products and services to in the United States and internationally. The company operates through two segments, Investment Management and Investment Services."
AIG,0.0086,AMERICAN INTERNATIONAL GROUP,"American International Group, Inc. provides insurance products for commercial, institutional, and individual customers in North America and internationally."
PNC,0.0091,PNC FINANCIAL SVCS GROUP INC,"The PNC Financial Services Group, Inc. operates as a diversified financial services company in the United States."
WLTW,0.0095,WILLIS TOWERS WATSON PLC,"Willis Towers Watson Public Limited Company operates as an advisory, broking, and solutions company worldwide."
USB,0.0096,U S BANCORP,"U.S. Bancorp, a financial services holding company, provides various financial services in the United States."
AXP,0.01,AMERICAN EXPRESS CO,"American Express Company, together with its subsidiaries, provides charge and credit payment card products, and travel-related services worldwide. The company operates through three segments: Global Consumer Services Group, Global Commercial Services, and Global Merchant and Network Services."
FHN,0.0102,FIRST HORIZON CORP,"First Horizon Corporation operates as the bank holding company for First Horizon Bank that provides various financial services. The company operates through four segments: Regional Banking, Fixed Income, Corporate, and Non-Strategic."
AZO,0.0104,AUTOZONE INC,"AutoZone, Inc. retails and distributes automotive replacement parts and accessories. The company offers various products for cars, sport utility vehicles, vans, and light trucks, including new and remanufactured automotive hard parts, maintenance items, accessories, and non-automotive products."
STT,0.0112,STATE STREET CORP,"State Street Corporation, through its subsidiaries, provides a range of financial products and services to institutional investors worldwide."
HPC,0.0122,HERCULES INC,"Hercules Incorporated manufactures and markets chemical specialties used in making products for home, office, and industrial markets. It operates in two segments, Paper Technologies and Ventures (PTV), and Aqualon Group (Aqualon)."
NTRS,0.0124,NORTHERN TRUST CORP,"Northern Trust Corporation, a financial holding company, provides wealth management, asset servicing, asset management, and banking solutions for corporations, institutions, families, and individuals worldwide."
LNC,0.0124,LINCOLN NATIONAL CORP,"Lincoln National Corporation, through its subsidiaries, operates multiple insurance and retirement businesses in the United States. It operates through four segments: Annuities, Retirement Plan Services, Life Insurance, and Group Protection."
AMP,0.0127,AMERIPRISE FINANCIAL INC,"Ameriprise Financial, Inc., through its subsidiaries, provides various financial products and services to individual and institutional clients in the United States and internationally."
GNW,0.0136,GENWORTH FINANCIAL INC,"Genworth Financial, Inc. provides insurance products in the United States and internationally. It operates through four segments: U.S. Mortgage Insurance, Australia Mortgage Insurance, U.S. Life Insurance, and Runoff. The U.S."
ETFC,0.0137,E TRADE FINANCIAL CORP,"E*TRADE Financial Corporation, a financial services company, provides brokerage, and related products and services for traders, investors, registered investment advisors (RIAs), and stock plan administrators and participants."
CI,0.0137,CIGNA CORP,"Cigna Corporation provides insurance and related products and services. It operates through Health Services, Integrated Medical, International Markets, and Group Disability and Other segments."
CNP,0.0139,CENTERPOINT ENERGY INC,"CenterPoint Energy, Inc. operates as a public utility holding company in the United States. The company's Houston Electric T&D segment electric transmission and distribution services to electric utility."
PBCT,0.0141,PEOPLE'S UNITED FINL INC,"People's United Financial, Inc. operates as the bank holding company for People's United Bank, National Association that provides commercial banking, retail banking, and wealth management services to individual, corporate, and municipal customers."
CE,0.0145,CELANESE CORP,"Celanese Corporation, a technology and specialty materials company, manufactures and sells high performance engineered polymers in the United States and internationally. The company operates through Engineered Materials, Acetate Tow, and Acetyl Chain segments."
C,0.0155,CITIGROUP INC,"Citigroup Inc., a diversified financial services holding company, provides various financial products and services to consumers, corporations, governments, and institutions in North America, Latin America, Asia, Europe, the Middle East, and Africa."
SNV,0.0156,SYNOVUS FINANCIAL CORP,"Synovus Financial Corp. operates as the bank holding company for Synovus Bank that provides various financial products and services. It operates through three segments: Community Banking, Wholesale Banking, and Financial Management Services."
TIN,0.0157,TEMPLE-INLAND INC,"Temple-Inland LLC went out of business. Temple-Inland LLC, through its subsidiaries, manufactures and sells corrugated packaging and building products in the United States and Mexico."
BA,0.0168,BOEING CO,"The Boeing Company, together with its subsidiaries, designs, develops, manufactures, sales, services, and supports commercial jetliners, military aircraft, satellites, missile defense, human space flight and launch systems, and services worldwide."
MCO,0.0169,MOODY'S CORP,"Moody's Corporation provides credit ratings and assessment services; and credit, capital markets, and economic research, data, and analytical tools worldwide. It operates through two segments, Moody's Investors Service and Moody's Analytics."
PBI,0.0171,PITNEY BOWES INC,"Pitney Bowes Inc., a technology company, provides commerce solutions in the United States and internationally. The company operates through Global Ecommerce, Presort Services and SendTech Solutions segments."
LO,0.0173,LORILLARD INC,"Lorillard, LLC, through its subsidiaries, manufactures and sells cigarettes in the United States. It operates through two segments, Cigarettes and Electronic Cigarettes."
MET,0.0179,METLIFE INC,"MetLife, Inc. engages in the insurance, annuities, employee benefits, and asset management businesses worldwide. It operates through five segments: U.S.; Asia; Latin America; Europe, the Middle East and Africa; and MetLife Holdings."
HIG,0.0186,HARTFORD FINANCIAL SERVICES,"The Hartford Financial Services Group, Inc. provides insurance and financial services to individual and business customers in the United States and internationally."
AMZN,0.0187,AMAZON.COM INC,"Amazon.com, Inc. engages in the retail sale of consumer products and subscriptions in North America and internationally. The company operates through three segments: North America, International, and Amazon Web Services (AWS)."
PRU,0.02,PRUDENTIAL FINANCIAL INC,"Prudential Financial, Inc., through its subsidiaries, provides insurance, investment management, and other financial products and services."
SIVB,0.0201,SVB FINANCIAL GROUP,"SVB Financial Group, a diversified financial services company, provides various banking and financial products and services. The company operates through four segments: Global Commercial Bank, SVB Private Bank, SVB Capital, and SVB Leerink."
OI,0.0201,O-I GLASS INC,"O-I Glass, Inc., through its subsidiaries, manufactures and sells glass containers to food and beverage manufacturers primarily in the Americas, Europe, and the Asia Pacific. It produces glass containers for alcoholic beverages, including beer, flavored malt beverages, spirits, and wine."
PFG,0.0203,PRINCIPAL FINANCIAL GRP INC,"Principal Financial Group, Inc. provides retirement, asset management, and insurance products and services to businesses, individuals, and institutional clients worldwide. The company operates through Retirement and Income Solutions, Principal Global Investors, Principal International, and U.S."
CIT,0.0207,CIT GROUP INC,"CIT Group Inc. operates as the holding company for CIT Bank, N.A. that provides banking and related services to commercial and individual customers. The company operates through Commercial Banking and Consumer Banking segments."
AKS,0.0218,AK STEEL HOLDING CORP,"AK Steel Holding Corporation, through its subsidiary, AK Steel Corporation, produces flat-rolled carbon, and stainless and electrical steel products in the United States and internationally."
GS,0.0298,GOLDMAN SACHS GROUP INC,"The Goldman Sachs Group, Inc. operates as an investment banking, securities, and investment management company worldwide. It operates in four segments: Investment Banking, Global Markets, Asset Management, and Consumer & Wealth Management."
MS,0.0346,MORGAN STANLEY,"Morgan Stanley, a financial holding company, provides various financial products and services to corporations, governments, financial institutions, and individuals in the Americas, Europe, the Middle East, Africa, and Asia."
NAVI,0.0402,NAVIENT CORP,"Navient Corporation provides education loan management and business processing solutions for education, healthcare, and government clients at the federal, state, and local levels in the United States."
