,dist,conm,busdesc
EXC,0.0,EXELON CORP,"Exelon Corporation, a utility services holding company, engages in the generation and marketing of energy in the United States and Canada. It owns nuclear, fossil, wind, hydroelectric, biomass, and solar generating facilities."
SPGI,0.0138,S&P GLOBAL INC,"S&P Global Inc., together with its subsidiaries, provides ratings, benchmarks, analytics, and data to the capital and commodity markets worldwide."
D,0.0158,DOMINION ENERGY INC,"Dominion Energy, Inc. produces and transports energy. The company's Dominion Energy Virginia segment engages in the regulated electric generation, transmission, and distribution operations that serve residential, commercial, industrial, and governmental customers in Virginia and North Carolina."
PPL,0.0172,PPL CORP,"PPL Corporation, a utility holding company, delivers electricity and natural gas in the United States and the United Kingdom. The company operates through three segments: U.K. Regulated, Kentucky Regulated, and Pennsylvania Regulated."
GL,0.0179,GLOBE LIFE INC,"Globe Life Inc., through its subsidiaries, provides various life and supplemental health insurance products, and annuities to lower middle to middle income households in the United States."
NEE,0.0193,NEXTERA ENERGY INC,"NextEra Energy, Inc., through its subsidiaries, generates, transmits, and distributes electric power in North America. The company generates electricity through wind, solar, nuclear, coal, oil, and natural gas facilities."
HRB,0.0214,BLOCK H & R INC,"H&R Block, Inc., through its subsidiaries, provides assisted income tax return preparation, do-it-yourself (DIY) tax, and virtual tax preparation services and products to the general public primarily in the United States, Canada, and Australia."
PCL,0.0307,PLUM CREEK TIMBER CO INC,"As on February 19, 2016, Plum Creek Timber Co. Inc. was acquired by Weyerhaeuser Co. Plum Creek Timber Company, Inc. is a privately owned real estate investment trust (REIT). The trust owns and manages timberlands in the United States."
MAA,0.0329,MID-AMERICA APT CMNTYS INC,"MAA, an S&P 500 company, is a real estate investment trust, or REIT, focused on delivering full-cycle and superior investment performance for shareholders through the ownership, management, acquisition, development and redevelopment of quality apartment communities throughout the United States."
BMC,0.0331,BMC SOFTWARE INC,"BMC Software, Inc. develops software that provides system and service management solutions for enterprises in the United States and internationally. It operates in two business units, Enterprise Service Management (ESM) and Mainframe Service Management (MSM)."
PNW,0.0345,PINNACLE WEST CAPITAL CORP,"Pinnacle West Capital Corporation, through its subsidiary, Arizona Public Service Company, provides retail and wholesale electric services primarily in the state of Arizona."
HOG,0.0349,HARLEY-DAVIDSON INC,"Harley-Davidson, Inc. manufactures and sells custom, cruiser, and touring motorcycles. The company operates in two segments, Motorcycles and Related Products and Financial Services."
ENDP,0.0398,ENDO INTERNATIONAL PLC,Endo International plc manufactures and sells generic and branded pharmaceuticals in the United States and internationally.
SO,0.0465,SOUTHERN CO,"The Southern Company, through its subsidiaries, engages in the generation, transmission, and distribution of electricity. It operates in four segments: Gas Distribution Operations, Gas Pipeline Investments, Wholesale Gas Services, and Gas Marketing Services."
AES,0.0468,AES CORP (THE),"The AES Corporation operates as a diversified power generation and utility company. It owns and/or operates power plants to generate and sell power to customers, such as utilities, industrial users, and other intermediaries."
CL,0.0514,COLGATE-PALMOLIVE CO,"Colgate-Palmolive Company, together with its subsidiaries, manufactures and sells consumer products worldwide. The company operates through two segments, Oral, Personal and Home Care; and Pet Nutrition."
EVRG,0.0538,EVERGY INC,"Evergy, Inc., through its subsidiaries, engages in the generation, transmission, distribution, and sale of electricity in Kansas and Missouri."
IRM,0.0579,IRON MOUNTAIN INC,"Iron Mountain Incorporated (NYSE: IRM), founded in 1951, is the global leader for storage and information management services."
WMB,0.0598,WILLIAMS COS INC,"The Williams Companies, Inc., together with its subsidiaries, operates as an energy infrastructure company primarily in the United States. It operates through Atlantic-Gulf, Northeast G&P, and West segments."
CSX,0.0621,CSX CORP,"CSX Corporation, together with its subsidiaries, provides rail-based freight transportation services."
STR,0.0788,QUESTAR CORP,Dominion Energy Questar Corporation operates as an integrated natural gas company in the United States.
