,dist,conm,busdesc
GM,0.0,GENERAL MOTORS CO,"General Motors Company designs, builds, and sells cars, trucks, crossovers, and automobile parts worldwide. The company operates through GM North America, GM International, Cruise, and GM Financial segments."
KMX,0.0056,CARMAX INC,"CarMax, Inc., through its subsidiaries, operates as a retailer of used vehicles in the United States. The company operates in two segments, CarMax Sales Operations and CarMax Auto Finance."
M,0.0072,MACY'S INC,"Macy's, Inc., an omnichannel retail organization, operates stores, websites, and mobile applications under the Macy's, Bloomingdale's, and bluemercury brands."
NFLX,0.0153,NETFLIX INC,"Netflix, Inc. provides subscription streaming entertainment service. It offers TV series, documentaries, and feature films across various genres and languages."
GE,0.0163,GENERAL ELECTRIC CO,"General Electric Company operates as a high-tech industrial company in the United States, Europe, Asia, the Americas, the Middle East, and Africa. It operates through Power, Renewable Energy, Aviation, Healthcare, and Capital segments."
TTWO,0.0196,TAKE-TWO INTERACTIVE SFTWR,"Take-Two Interactive Software, Inc. develops, publishes, and markets interactive entertainment solutions for consumers worldwide. The company offers its products under the Rockstar Games and 2K labels, as well as under Private Division and Social Point labels."
CIEN,0.02,CIENA CORP,"Ciena Corporation provides network hardware, software, and services that support the transport, routing, switching, aggregation, service delivery, and management of video, data, and voice traffic on communications networks worldwide."
KR,0.0213,KROGER CO,"The Kroger Co. operates as a retailer in the United States. The company operates supermarkets, multi-department stores, marketplace stores, and price impact warehouse stores."
R,0.0224,RYDER SYSTEM INC,"Ryder System, Inc. provides transportation and supply chain management solutions worldwide. The company operates through three segments: Fleet Management Solutions (FMS), Supply Chain Solutions (SCS), and Dedicated Transportation Solutions (DTS)."
SAIC,0.0226,SCIENCE APPLICATIONS INTL CP,"Science Applications International Corporation provides technical, engineering, and enterprise information technology (IT) services primarily in the United States."
ALL,0.0228,ALLSTATE CORP,"The Allstate Corporation, through its subsidiaries, provides property and casualty, and other insurance products in the United States and Canada. The company operates through Allstate Protection, Service Businesses, Allstate Life, and Allstate Benefits segments."
ZBRA,0.0237,ZEBRA TECHNOLOGIES CP  -CL A,"Zebra Technologies Corporation, together with its subsidiaries, provides enterprise asset intelligence solutions in the automatic identification and data capture solutions industry worldwide."
MTW,0.0256,MANITOWOC CO,"The Manitowoc Company, Inc. provides engineered lifting equipment for the construction industry in the Americas, Europe, Africa, the Middle East, and the Asia Pacific."
AIG,0.026,AMERICAN INTERNATIONAL GROUP,"American International Group, Inc. provides insurance products for commercial, institutional, and individual customers in North America and internationally."
AMCR,0.0263,AMCOR PLC,"Amcor plc develops, manufactures, and sells various packaging products for food, beverage, medical and pharmaceutical, fresh produce, snack food, personal care, and other industries worldwide. It operates through two segments, Flexibles and Rigid Packaging."
NCR,0.0272,NCR CORP,"NCR Corporation provides software and services worldwide. The company operates through Banking, Retail, Hospitality, and Other segments."
CAH,0.0276,CARDINAL HEALTH INC,"Cardinal Health, Inc. operates as an integrated healthcare services and products company in the United States and internationally. It provides customized solutions for hospitals, healthcare systems, pharmacies, ambulatory surgery centers, clinical laboratories, and physician offices."
AVY,0.0279,AVERY DENNISON CORP,Avery Dennison Corporation produces and sells pressure-sensitive materials worldwide.
AMZN,0.0285,AMAZON.COM INC,"Amazon.com, Inc. engages in the retail sale of consumer products and subscriptions in North America and internationally. The company operates through three segments: North America, International, and Amazon Web Services (AWS)."
INCY,0.0292,INCYTE CORP,"Incyte Corporation, a biopharmaceutical company, focuses on the discovery, development, and commercialization of various therapeutics in the United States."
WRB,0.0321,BERKLEY (W R) CORP,"W. R. Berkley Corporation, an insurance holding company, operates as a commercial lines writer in the United States and internationally. It operates through two segments, Insurance and Reinsurance & Monoline Excess."
MCK,0.0343,MCKESSON CORP,"McKesson Corporation provides pharmaceuticals and medical supplies in the United States and internationally. It operates through four segments: U.S. Pharmaceutical, Prescription Technology Solutions, International, and Medical-Surgical Solutions. The U.S."
CDW,0.035,CDW CORP,"CDW Corporation provides integrated information technology (IT) solutions to business, government, education, and healthcare customers in the United States, the United Kingdom, and Canada. It operates through three segments: Corporate, Small Business, and Public."
AN,0.0358,AUTONATION INC,"AutoNation, Inc., through its subsidiaries, operates as an automotive retailer in the United States. The company operates through three segments: Domestic, Import, and Premium Luxury."
JEF,0.0362,JEFFERIES FINANCIAL GRP INC,"Jefferies Financial Group Inc., a diversified financial services company, engages in investment banking and capital markets, asset management, and direct investing businesses in the Americas, Europe, the Middle East, Africa, and Asia."
JBL,0.0366,JABIL INC,"Jabil Inc. provides manufacturing services and solutions worldwide. The company operates in two segments, Electronics Manufacturing Services and Diversified Manufacturing Services. It offers electronics design, production, and product management services."
LOW,0.0371,LOWE'S COS INC,"Lowe's Companies, Inc., together with its subsidiaries, operates as a home improvement retailer in the United States, Canada, and Mexico. The company offers a line of products for construction, maintenance, repair, remodeling, and decorating."
CBRE,0.039,CBRE GROUP INC,"CBRE Group, Inc. operates as a commercial real estate services and investment company worldwide. It operates through Advisory Services, Global Workplace Solutions, and Real Estate Investments segments."
S,0.0394,SPRINT CORP,"Sprint Corporation provides a range of wireless and wireline communications products and services to consumers, businesses, government subscribers, and resellers in the United States, Puerto Rico, and the United States Virgin Islands. It operates in two segments, Wireless and Wireline."
ODP,0.0415,ODP CORP,"The ODP Corporation provides business services and supplies, products, and technology solutions for small, medium, and enterprise businesses. The company operates in three divisions: Business Solutions, Retail, and CompuCom."
GT,0.0456,GOODYEAR TIRE & RUBBER CO,"The Goodyear Tire & Rubber Company, together with its subsidiaries, develops, manufactures, distributes, and sells tires and related products and services worldwide."
HII,0.0462,HUNTINGTON INGALLS IND INC,"Huntington Ingalls Industries, Inc. engages in the designing, building, overhauling, and repairing military ships in the United States. It operates through three segments: Ingalls Shipbuilding, Newport News Shipbuilding, and Technical Solutions."
AT,0.0465,ATLANTIC POWER CORP,Atlantic Power Corporation owns and operates a fleet of power generation assets in the United States and Canada.
AIZ,0.0481,ASSURANT INC,"Assurant, Inc., together with its subsidiaries, provides lifestyle and housing solutions that support, protect, and connect consumer purchases in North America, Latin America, Europe, and the Asia Pacific."
