,dist,conm,busdesc
JOY,0.0,JOY GLOBAL INC,"Komatsu Mining Corp. manufactures and services mining equipment for the extraction of coal, copper, iron ore, oil sands, gold, and other minerals worldwide. It operates in two segments, Underground Mining Machinery and Surface Mining Equipment."
D,0.0017,DOMINION ENERGY INC,"Dominion Energy, Inc. produces and transports energy. The company's Dominion Energy Virginia segment engages in the regulated electric generation, transmission, and distribution operations that serve residential, commercial, industrial, and governmental customers in Virginia and North Carolina."
AEP,0.0045,AMERICAN ELECTRIC POWER CO,"American Electric Power Company, Inc., an electric public utility holding company, engages in the generation, transmission, and distribution of electricity for sale to retail and wholesale customers in the United States."
EIX,0.0045,EDISON INTERNATIONAL,"Edison International, through its subsidiaries, engages in the generation, transmission, and distribution of electricity in the United States. The company generates electricity through hydroelectric, diesel/liquid petroleum gas, natural gas, nuclear, and photovoltaic sources."
COL,0.0072,ROCKWELL COLLINS,"Collins Aerospace designs, produces and supports communication and aviation systems worldwide."
NEE,0.0101,NEXTERA ENERGY INC,"NextEra Energy, Inc., through its subsidiaries, generates, transmits, and distributes electric power in North America. The company generates electricity through wind, solar, nuclear, coal, oil, and natural gas facilities."
CNX,0.0111,CNX RESOURCES CORPORATION,"CNX Resources Corporation, an independent oil and gas company, explores for, develops, and produces natural gas properties primarily in the Appalachian Basin. The company operates through two divisions, Exploration and Production (E&P), and Midstream."
PTV,0.0111,PACTIV CORP,"Pactiv LLC manufactures and distributes food packaging and foodservice products. Its product lines include custom and stock foam, plastic, aluminum, pressed-paperboard, PE coated board, and molded-fiber packaging."
HRB,0.0125,BLOCK H & R INC,"H&R Block, Inc., through its subsidiaries, provides assisted income tax return preparation, do-it-yourself (DIY) tax, and virtual tax preparation services and products to the general public primarily in the United States, Canada, and Australia."
PNW,0.0126,PINNACLE WEST CAPITAL CORP,"Pinnacle West Capital Corporation, through its subsidiary, Arizona Public Service Company, provides retail and wholesale electric services primarily in the state of Arizona."
SCG,0.0139,SCANA CORP,"SCANA Corporation, through its subsidiaries, generates, transmits, distributes, and sells electricity to wholesale and retail customers. The company operates through Electric Operations, Gas Distribution, and Gas Marketing segments."
WRK,0.0147,WESTROCK CO,"WestRock Company manufactures and sells paper and packaging solutions in North America, South America, Europe, Asia, and Australia. The company operates through Corrugated Packaging and Consumer Packaging segments."
DTE,0.0154,DTE ENERGY CO,"DTE Energy Company engages in the utility operations. The company's Electric segment generates, purchases, distributes, and sells electricity to approximately 2.2 million residential, commercial, and industrial customers in southeastern Michigan."
TRV,0.0173,TRAVELERS COS INC,"The Travelers Companies, Inc., through its subsidiaries, provides a range of commercial and personal property, and casualty insurance products and services to businesses, government units, associations, and individuals in the United states and internationally."
CB,0.0185,CHUBB LTD,"Chubb Limited, through its subsidiaries, provides insurance and reinsurance products worldwide."
AJG,0.0189,ARTHUR J GALLAGHER & CO,"Arthur J. Gallagher & Co., together with its subsidiaries, provides insurance brokerage, consulting, and third party claims settlement and administration services in the United States, Australia, Bermuda, Canada, the Caribbean, New Zealand, and the United Kingdom."
TGNA,0.0195,TEGNA INC,TEGNA Inc. operates as a media company in the United States. The company operates television stations and radio stations that deliver television programming and digital content. It offers content and information to consumers across various platforms.
L,0.0196,LOEWS CORP,Loews Corporation provides commercial property and casualty insurance in the United States and internationally.
VTRS,0.02,VIATRIS INC,"Viatris Inc., a healthcare company, manufactures and distributes various medicines for patients in the United States and internationally."
ES,0.0205,EVERSOURCE ENERGY,"Eversource Energy, a public utility holding company, engages in the energy delivery business. The company operates in four segments: Electric Distribution, Electric Transmission, Natural Gas Distribution, and Water Distribution."
PCG,0.0212,PG&E CORP,"PG&E Corporation, through its subsidiary, Pacific Gas and Electric Company, engages in the sale and delivery of electricity and natural gas to customers in northern and central California, the United States."
XEL,0.022,XCEL ENERGY INC,"Xcel Energy Inc., through its subsidiaries, generates, purchases, transmits, distributes, and sells electricity. It operates through Regulated Electric Utility, Regulated Natural Gas Utility, and All Other segments."
IFF,0.0224,INTL FLAVORS & FRAGRANCES,"International Flavors & Fragrances Inc., together with its subsidiaries, manufactures flavors and fragrances for use in various consumer products. It operates through two segments, Taste and Scent."
TE,0.0227,TECO ENERGY INC,"TECO Energy, Inc., an electric and gas utility holding company, engages in the regulated electric and gas utility operations."
PPL,0.0229,PPL CORP,"PPL Corporation, a utility holding company, delivers electricity and natural gas in the United States and the United Kingdom. The company operates through three segments: U.K. Regulated, Kentucky Regulated, and Pennsylvania Regulated."
SPGI,0.0246,S&P GLOBAL INC,"S&P Global Inc., together with its subsidiaries, provides ratings, benchmarks, analytics, and data to the capital and commodity markets worldwide."
CL,0.025,COLGATE-PALMOLIVE CO,"Colgate-Palmolive Company, together with its subsidiaries, manufactures and sells consumer products worldwide. The company operates through two segments, Oral, Personal and Home Care; and Pet Nutrition."
AYE,0.0255,ALLEGHENY ENERGY INC,"As of January 1, 2014, Allegheny Energy Inc. was acquired by FirstEnergy Corp. Allegheny Energy, Inc. owns & operates electric generation facilities & delivers electric services to customers in Pennsylvania, West Virginia, Maryland & Virginia."
NWL,0.0261,NEWELL BRANDS INC,"Newell Brands Inc. designs, manufactures, sources, and distributes consumer and commercial products worldwide. The company operates through four segments: Appliances and Cookware, Food and Commercial, Home and Outdoor Living, and Learning and Development."
ACN,0.0265,ACCENTURE PLC,"Accenture plc, a professional services company, provides strategy and consulting, interactive, and technology and operations services worldwide. The company also provides outsourcing services."
EVRG,0.0265,EVERGY INC,"Evergy, Inc., through its subsidiaries, engages in the generation, transmission, distribution, and sale of electricity in Kansas and Missouri."
ETR,0.027,ENTERGY CORP,"Entergy Corporation, together with its subsidiaries, engages in the production and distribution of electricity in the United States. The company generates electricity through gas/oil, nuclear, coal, hydro, and solar power sources."
AON,0.0276,AON PLC,"Aon plc, a professional services firm, provides advice and solutions to clients focused on risk, retirement, and health worldwide."
PGR,0.0303,PROGRESSIVE CORP-OHIO,"The Progressive Corporation, through its subsidiaries, provides personal and commercial auto insurance, residential property insurance, and other specialty property-casualty insurance and related services primarily in the United States."
BUD,0.031,ANHEUSER-BUSCH INBEV,"Anheuser-Busch InBev SA/NV, a brewing company, engages in the production, distribution, and sale of beer, alcoholic beverages, and soft drinks worldwide."
WEC,0.0329,WEC ENERGY GROUP INC,"WEC Energy Group, Inc., through its subsidiaries, provides regulated natural gas and electricity, and nonregulated renewable energy services in the United States."
HOG,0.0337,HARLEY-DAVIDSON INC,"Harley-Davidson, Inc. manufactures and sells custom, cruiser, and touring motorcycles. The company operates in two segments, Motorcycles and Related Products and Financial Services."
CCI,0.0342,CROWN CASTLE INTL CORP,"Crown Castle owns, operates and leases more than 40,000 cell towers and approximately 80,000 route miles of fiber supporting small cells and fiber solutions across every major U.S. market."
NFLX,0.0344,NETFLIX INC,"Netflix, Inc. provides subscription streaming entertainment service. It offers TV series, documentaries, and feature films across various genres and languages."
EXC,0.0349,EXELON CORP,"Exelon Corporation, a utility services holding company, engages in the generation and marketing of energy in the United States and Canada. It owns nuclear, fossil, wind, hydroelectric, biomass, and solar generating facilities."
AES,0.0371,AES CORP (THE),"The AES Corporation operates as a diversified power generation and utility company. It owns and/or operates power plants to generate and sell power to customers, such as utilities, industrial users, and other intermediaries."
MAC,0.0372,MACERICH CO,"Macerich is a fully integrated, self-managed and self-administered real estate investment trust, which focuses on the acquisition, leasing, management, development and redevelopment of regional malls throughout the United States."
MAA,0.0385,MID-AMERICA APT CMNTYS INC,"MAA, an S&P 500 company, is a real estate investment trust, or REIT, focused on delivering full-cycle and superior investment performance for shareholders through the ownership, management, acquisition, development and redevelopment of quality apartment communities throughout the United States."
PBCT,0.0387,PEOPLE'S UNITED FINL INC,"People's United Financial, Inc. operates as the bank holding company for People's United Bank, National Association that provides commercial banking, retail banking, and wealth management services to individual, corporate, and municipal customers."
GL,0.0466,GLOBE LIFE INC,"Globe Life Inc., through its subsidiaries, provides various life and supplemental health insurance products, and annuities to lower middle to middle income households in the United States."
ADP,0.0481,AUTOMATIC DATA PROCESSING,"Automatic Data Processing, Inc. provides cloud-based human capital management solutions worldwide. It operates through two segments, Employer Services and Professional Employer Organization (PEO)."
IBM,0.0489,INTL BUSINESS MACHINES CORP,International Business Machines Corporation provides integrated solutions and services worldwide.
VRSN,0.0497,VERISIGN INC,"VeriSign, Inc., together with its subsidiaries, provides domain name registry services and Internet infrastructure that enables Internet navigation for various recognized domain names worldwide."
PAYX,0.0565,PAYCHEX INC,"Paychex, Inc. provides integrated human capital management solutions for human resources (HR), payroll, benefits, and insurance services for small- to medium-sized businesses in the United States and Europe."
SPG,0.0743,SIMON PROPERTY GROUP INC,"Simon is a real estate investment trust engaged in the ownership of premier shopping, dining, entertainment and mixed-use destinations and an S&P 100 company (Simon Property Group, NYSE: SPG)."
