,dist,conm,busdesc
ALXN,0.0,ALEXION PHARMACEUTICALS INC,"Alexion Pharmaceuticals, Inc. develops and commercializes various therapeutic products."
MTG,0.0293,MGIC INVESTMENT CORP/WI,"MGIC Investment Corporation, through its subsidiaries, provides private mortgage insurance, other mortgage credit risk management solutions, and ancillary services to lenders and government sponsored entities in the United States, Puerto Rico, and Guam."
NKTR,0.1067,NEKTAR THERAPEUTICS,"Nektar Therapeutics, a biopharmaceutical company, researches and develops drug candidates for cancer and auto-immune disease in the United States."
VRTX,0.137,VERTEX PHARMACEUTICALS INC,Vertex Pharmaceuticals Incorporated engages in developing and commercializing therapies for treating cystic fibrosis.
DXCM,0.1491,DEXCOM INC,"DexCom, Inc., a medical device company, focuses on the design, development, and commercialization of continuous glucose monitoring (CGM) systems in the United States and internationally. The company offers its systems for use by people with diabetes, as well as for use by healthcare providers."
REGN,0.1743,REGENERON PHARMACEUTICALS,"Regeneron Pharmaceuticals, Inc., a biopharmaceutical company, discovers, invents, develops, manufactures, and commercializes medicines for treating various medical conditions worldwide."
INCY,0.2384,INCYTE CORP,"Incyte Corporation, a biopharmaceutical company, focuses on the discovery, development, and commercialization of various therapeutics in the United States."
