,dist,conm,busdesc
PXD,0.0,PIONEER NATURAL RESOURCES CO,"Pioneer Natural Resources Company operates as an independent oil and gas exploration and production company in the United States. The company explores for, develops, and produces oil, natural gas liquids (NGLs), and gas. It has operations primarily in the Permian Basin in West Texas."
FTNT,0.0104,FORTINET INC,"Fortinet, Inc. provides broad, integrated, and automated cybersecurity solutions worldwide."
EMR,0.0122,EMERSON ELECTRIC CO,"Emerson Electric Co. designs and manufactures technology and engineering products for industrial, commercial, and consumer markets worldwide. It operates through Automation Solutions and Commercial & Residential Solutions segments."
EQIX,0.0142,EQUINIX INC,"Equinix (Nasdaq: EQIX) is the world's digital infrastructure company, enabling digital leaders to harness a trusted platform to bring together and interconnect the foundational infrastructure that powers their success."
GPN,0.0146,GLOBAL PAYMENTS INC,"Global Payments Inc. provides payment technology and software solutions for card, electronic, check, and digital-based payments in North America, Europe, the Asia-Pacific, and Latin America."
BR,0.0173,BROADRIDGE FINANCIAL SOLUTNS,"Broadridge Financial Solutions, Inc. provides investor communications and technology-driven solutions for the financial services industry worldwide."
NTAP,0.0178,NETAPP INC,"NetApp, Inc. provides software, systems, and services to manage and share data on-premises, and private and public clouds worldwide."
MKC,0.018,MCCORMICK & CO INC,"McCormick & Company, Incorporated manufactures, markets, and distributes spices, seasoning mixes, condiments, and other flavorful products to the food industry. The company operates in two segments, Consumer and Flavor Solutions."
APD,0.0182,AIR PRODUCTS & CHEMICALS INC,"Air Products and Chemicals, Inc. provides atmospheric gases, process and specialty gases, equipment, and services worldwide."
T,0.0235,AT&T INC,"AT&T Inc. provides telecommunication, media, and technology services worldwide. The company operates through four segments: Communications, WarnerMedia, Latin America, and Xandr."
LHX,0.027,L3HARRIS TECHNOLOGIES INC,"L3Harris Technologies, Inc., an aerospace and defense technology company, provides mission-critical solutions for government and commercial customers worldwide."
APC,0.0283,ANADARKO PETROLEUM CORP,"Anadarko Petroleum Corporation engages in the exploration, development, production, and marketing of oil and gas properties. It operates through three segments: Exploration and Production, WES Midstream, and Other Midstream."
BTU,0.0289,PEABODY ENERGY CORP,"Peabody Energy Corporation engages in coal mining business. The company operates through Seaborne Thermal Mining, Seaborne Metallurgical Mining, Powder River Basin Mining, Midwestern U.S. Mining, Western U.S. Mining, and Corporate and Other segments."
FIS,0.0315,FIDELITY NATIONAL INFO SVCS,"Fidelity National Information Services, Inc. operates as a financial services technology company in the United States and internationally. It operates through three segments: Merchant Solutions, Banking Solutions, and Capital Market Solutions."
JOY,0.0333,JOY GLOBAL INC,"Komatsu Mining Corp. manufactures and services mining equipment for the extraction of coal, copper, iron ore, oil sands, gold, and other minerals worldwide. It operates in two segments, Underground Mining Machinery and Surface Mining Equipment."
MMC,0.0338,MARSH & MCLENNAN COS,"Marsh & McLennan Companies, Inc., a professional services company, provides advice and solutions to clients in the areas of risk, strategy, and people worldwide. It operates in two segments, Risk and Insurance Services, and Consulting."
ECL,0.035,ECOLAB INC,"Ecolab Inc. provides water, hygiene, and energy technologies and services worldwide."
AME,0.0355,AMETEK INC,"AMETEK, Inc. manufactures and sells electronic instruments and electromechanical devices worldwide. It operates through two segments, Electronic Instruments (EIG) and Electromechanical (EMG)."
LVS,0.0366,LAS VEGAS SANDS CORP,"Las Vegas Sands Corp., together with its subsidiaries, develops, owns, and operates integrated resorts in Asia and the United States."
TEL,0.0386,TE CONNECTIVITY LTD,"TE Connectivity Ltd., together with its subsidiaries, manufactures and sells connectivity and sensor solutions in Europe, the Middle East, Africa, the Asia-Pacific, and the Americas."
DGX,0.0392,QUEST DIAGNOSTICS INC,"Quest Diagnostics Incorporated provides diagnostic testing, information, and services in the United States and internationally."
TYL,0.0403,TYLER TECHNOLOGIES INC,"Tyler Technologies, Inc. provides integrated information management solutions and services for the public sector in the United States and internationally. The company operates in two segments, Enterprise Software; and Appraisal and Tax."
AT,0.0407,ATLANTIC POWER CORP,Atlantic Power Corporation owns and operates a fleet of power generation assets in the United States and Canada.
RSG,0.0411,REPUBLIC SERVICES INC,"Republic Services, Inc., together with its subsidiaries, provides non-hazardous solid waste collection, transfer, disposal, recycling, and environmental services in the United States. The company serves small-container, large-container, and municipal and residential customers."
VZ,0.0415,VERIZON COMMUNICATIONS INC,"Verizon Communications Inc. offers communications, information, and entertainment products and services to consumers, businesses, and governmental entities worldwide."
COV,0.0418,COVIDIEN PLC,"As of January 26, 2015, Covidien plc was acquired by Medtronic plc. Covidien plc develops, manufactures, and sells healthcare products for use in clinical and home settings worldwide. The company operates through Medical Devices and U.S. Medical Supplies segments."
HOLX,0.0438,HOLOGIC INC,"Hologic, Inc. develops, manufactures, and supplies diagnostics products, medical imaging systems, and surgical products for women's health through early detection and treatment in the United States, Europe, the Asia-Pacific, and internationally."
FLS,0.044,FLOWSERVE CORP,"Flowserve Corporation designs, develops, manufactures, distributes, and services industrial flow management equipment in the United States, Europe, the Middle East, Africa, Asia, and internationally."
ALB,0.0442,ALBEMARLE CORP,"Albemarle Corporation develops, manufactures, and markets engineered specialty chemicals worldwide. The company operates in three segments: Lithium, Bromine Specialties, and Catalysts."
LH,0.0453,LABORATORY CP OF AMER HLDGS,"Laboratory Corporation of America Holdings operates as an independent clinical laboratory company worldwide. It operates in two segments, LabCorp Diagnostics (LCD) and Covance Drug Development."
SEE,0.0454,SEALED AIR CORP,"Sealed Air Corporation provides food safety and security, and product protection solutions and equipment in North America, South America, Europe, the Middle East, Africa, and the Asia Pacific. It operates in two segments, Food Care and Product Care."
IVZ,0.0476,INVESCO LTD,Invesco Ltd. is a publicly owned investment manager.
HAS,0.0476,HASBRO INC,"Hasbro, Inc., together with its subsidiaries, operates as a play and entertainment company. The company's U.S."
COG,0.0478,CABOT OIL & GAS CORP,"Cabot Oil & Gas Corporation, an independent oil and gas company, explores for, exploits, develops, produces, and markets oil and gas properties in the United States."
PKG,0.0488,PACKAGING CORP OF AMERICA,Packaging Corporation of America manufactures and sells containerboard and corrugated packaging products in the United States. The company operates through Packaging and Paper segments.
MAT,0.0497,MATTEL INC,"Mattel, Inc., a children's entertainment company, designs and produces toys and consumer products worldwide. The company operates through North America, International, and American Girl segments."
PG,0.0511,PROCTER & GAMBLE CO,"The Procter & Gamble Company provides branded consumer packaged goods to consumers in North and Latin America, Europe, the Asia Pacific, Greater China, India, the Middle East, and Africa."
LIN,0.0517,LINDE PLC,"Linde plc operates as an industrial gas company in North and South America, Europe, the Middle East, Africa, and the Asia Pacific. The company offers oxygen, nitrogen, argon, rare gases, carbon monoxide, carbon dioxide, helium, hydrogen, electronic gases, specialty gases, and acetylene."
CBE,0.0532,COOPER INDUSTRIES PLC,"Cooper Industries plc manufactures and sells electrical components and tools in the United States and internationally. It operates in two segments, Energy and Safety Solutions, and Electrical Products Group."
EXPE,0.0537,EXPEDIA GROUP INC,"Expedia Group, Inc. operates as an online travel company worldwide. It operates through four segments: Core Online Travel Agencies, Trivago, Vrbo, and Egencia."
TFX,0.0556,TELEFLEX INC,"Teleflex Incorporated designs, develops, manufactures, and supplies single-use medical devices for common diagnostic and therapeutic procedures in critical care and surgical applications worldwide."
CMCSA,0.072,COMCAST CORP,"Comcast Corporation operates as a media and technology company worldwide. It operates through Cable Communications, Cable Networks, Broadcast Television, Filmed Entertainment, Theme Parks, and Sky segments."
