,dist,conm,busdesc
SWY,0.0,SAFEWAY INC,Safeway Inc. operates as a food and drug retailer in the United States.
BRYN,0.0138,RNETHEALTH INC,"BRYN Resources Inc. provides corporate, capital, and communication services for small businesses worldwide. The company operates VybeOffice, an online tool that allows you to manage company online from a single portal. It also offers stock issuance, transfer, custodial, and registrar services."
PETM,0.0206,PETSMART INC,"PetSmart, Inc., together with its subsidiaries, operates as a specialty retailer of products, services, and solutions for pets in the United States, Puerto Rico, and Canada."
CFN,0.0271,CAREFUSION CORP,"CareFusion Corporation, a medical technology company, provides various healthcare products and services. It offers product lines in the areas of medication management, infection prevention, operating room effectiveness, and respiratory care."
CTX,0.0329,QWEST CORP 7.00 NOTES 2052,
UST,0.0446,PROSHARES ULTRA 7-10 YR TRES,ProShares Trust - ProShares Ultra 7-10 Year Treasury is an exchange traded fund launched and managed by ProShare Advisors LLC. The fund invests in the fixed income markets of the United States.
LO,0.071,LORILLARD INC,"Lorillard, LLC, through its subsidiaries, manufactures and sells cigarettes in the United States. It operates through two segments, Cigarettes and Electronic Cigarettes."
POM,0.0756,PEPCO HOLDINGS INC,"Pepco Holdings LLC operates as a utility services holding company. The company operates through Pepco, DPL, and ACE segments."
FDO,0.1815,FAMILY DOLLAR STORES,"Family Dollar Stores, Inc. operates a chain of general merchandise retail discount stores primarily for low- and middle-income consumers in the United States."
RSG,0.1905,REPUBLIC SERVICES INC,"Republic Services, Inc., together with its subsidiaries, provides non-hazardous solid waste collection, transfer, disposal, recycling, and environmental services in the United States. The company serves small-container, large-container, and municipal and residential customers."
WELL,0.1955,WELLTOWER INC,"Welltower Inc. (NYSE:WELL), an S&P 500 company headquartered in Toledo, Ohio, is driving the transformation of health care infrastructure."
PEAK,0.2084,HEALTHPEAK PROPERTIES INC,"Healthpeak Properties, Inc. is a fully integrated real estate investment trust (REIT) and S&P 500 company."
SO,0.2101,SOUTHERN CO,"The Southern Company, through its subsidiaries, engages in the generation, transmission, and distribution of electricity. It operates in four segments: Gas Distribution Operations, Gas Pipeline Investments, Wholesale Gas Services, and Gas Marketing Services."
VTR,0.2114,VENTAS INC,"Ventas, an S&P 500 company, operates at the intersection of two powerful and dynamic industries - healthcare and real estate."
O,0.2127,REALTY INCOME CORP,"Realty Income, The Monthly Dividend Company<sup></sup>, is an S&P 500 company dedicated to providing stockholders with dependable monthly income."
WM,0.2134,WASTE MANAGEMENT INC,"Waste Management, Inc., through its subsidiaries, provides waste management environmental services to residential, commercial, industrial, and municipal customers in North America."
PCL,0.2184,PLUM CREEK TIMBER CO INC,"As on February 19, 2016, Plum Creek Timber Co. Inc. was acquired by Weyerhaeuser Co. Plum Creek Timber Company, Inc. is a privately owned real estate investment trust (REIT). The trust owns and manages timberlands in the United States."
DLR,0.2338,DIGITAL REALTY TRUST INC,"Digital Realty supports the world's leading enterprises and service providers by delivering the full spectrum of data center, colocation and interconnection solutions."
VRSK,0.2555,VERISK ANALYTICS INC,"Verisk Analytics, Inc. provides data analytics solutions in the United States and internationally."
EXR,0.2559,EXTRA SPACE STORAGE INC,"Extra Space Storage Inc., headquartered in Salt Lake City, Utah, is a self-administered and self-managed REIT and a member of the S&P 500. As of September 30, 2020, the Company owned and/or operated 1,906 self-storage stores in 40 states, Washington, D.C. and Puerto Rico."
PCG,0.2774,PG&E CORP,"PG&E Corporation, through its subsidiary, Pacific Gas and Electric Company, engages in the sale and delivery of electricity and natural gas to customers in northern and central California, the United States."
T,0.2892,AT&T INC,"AT&T Inc. provides telecommunication, media, and technology services worldwide. The company operates through four segments: Communications, WarnerMedia, Latin America, and Xandr."
COL,0.317,ROCKWELL COLLINS,"Collins Aerospace designs, produces and supports communication and aviation systems worldwide."
PPL,0.3174,PPL CORP,"PPL Corporation, a utility holding company, delivers electricity and natural gas in the United States and the United Kingdom. The company operates through three segments: U.K. Regulated, Kentucky Regulated, and Pennsylvania Regulated."
EFX,0.3195,EQUIFAX INC,"Equifax Inc. provides information solutions and human resources business process outsourcing services for businesses, governments, and consumers. The company operates through four segments: U.S. Information Solutions (USIS), Workforce Solutions, International, and Global Consumer Solutions."
SRCL,0.3276,STERICYCLE INC,"Stericycle, Inc., together with its subsidiaries, provides regulated and compliance solutions to the healthcare, retail, and commercial businesses in the United States, Europe, and internationally."
MO,0.3584,ALTRIA GROUP INC,"Altria Group, Inc., through its subsidiaries, manufactures and sells cigarettes, smokeless products, and wine in the United States."
HST,0.3589,HOST HOTELS & RESORTS INC,"Host Hotels & Resorts, Inc. is an S&P 500 company and is the largest lodging real estate investment trust and one of the largest owners of luxury and upper-upscale hotels."
KO,0.3875,COCA-COLA CO,"The Coca-Cola Company, a beverage company, manufactures, markets, and sells various nonalcoholic beverages worldwide. The company provides sparkling soft drinks; water, enhanced water, and sports drinks; juice, dairy, and plant-based beverages; tea and coffee; and energy drinks."
WY,0.3879,WEYERHAEUSER CO,"Weyerhaeuser Company, one of the world's largest private owners of timberlands, began operations in 1900. We own or control approximately 11 million acres of timberlands in the U.S. and manage additional timberlands under long-term licenses in Canada."
DIS,0.3913,DISNEY (WALT) CO,"The Walt Disney Company, together with its subsidiaries, operates as an entertainment company worldwide."
ABC,0.4084,AMERISOURCEBERGEN CORP,AmerisourceBergen Corporation sources and distributes pharmaceutical products in the United States and internationally.
VZ,0.4133,VERIZON COMMUNICATIONS INC,"Verizon Communications Inc. offers communications, information, and entertainment products and services to consumers, businesses, and governmental entities worldwide."
PBI,0.417,PITNEY BOWES INC,"Pitney Bowes Inc., a technology company, provides commerce solutions in the United States and internationally. The company operates through Global Ecommerce, Presort Services and SendTech Solutions segments."
RAI,0.4182,REYNOLDS AMERICAN INC,"Reynolds American Inc., through its subsidiaries, manufactures and sells cigarettes and other tobacco products in the United States. It operates through RJR Tobacco, Santa Fe, and American Snuff segments."
CLX,0.4201,CLOROX CO/DE,"The Clorox Company manufactures and markets consumer and professional products worldwide. It operates through four segments: Health and Wellness, Household, Lifestyle, and International."
BIO,0.4287,BIO-RAD LABORATORIES INC,"Bio-Rad Laboratories, Inc. develops, manufactures, and markets products and solutions for the life science research and clinical diagnostic markets in Europe, the United States, Canada, and Latin America."
MAC,0.432,MACERICH CO,"Macerich is a fully integrated, self-managed and self-administered real estate investment trust, which focuses on the acquisition, leasing, management, development and redevelopment of regional malls throughout the United States."
TFX,0.4343,TELEFLEX INC,"Teleflex Incorporated designs, develops, manufactures, and supplies single-use medical devices for common diagnostic and therapeutic procedures in critical care and surgical applications worldwide."
IRM,0.4419,IRON MOUNTAIN INC,"Iron Mountain Incorporated (NYSE: IRM), founded in 1951, is the global leader for storage and information management services."
SIG,0.4497,SIGNET JEWELERS LTD,"Signet Jewelers Limited engages in the retail sale of diamond jewelry, watches, and other products. As of February 02, 2019, it operated 3,334 stores and kiosks. The company operates through three segments: North America, International, and Other."
AJG,0.4686,ARTHUR J GALLAGHER & CO,"Arthur J. Gallagher & Co., together with its subsidiaries, provides insurance brokerage, consulting, and third party claims settlement and administration services in the United States, Australia, Bermuda, Canada, the Caribbean, New Zealand, and the United Kingdom."
DVA,0.4735,DAVITA INC,DaVita Inc. provides kidney dialysis services for patients suffering from chronic kidney failure or end stage renal disease (ESRD). The company operates kidney dialysis centers and provides related lab services in outpatient dialysis centers.
LUMN,0.4745,CENTURYLINK INC,"Lumen Technologies, Inc., a facilities-based communications company, provides various integrated services under 'CenturyLink' name to business and residential customers in the United States and internationally."
SAIC,0.4771,SCIENCE APPLICATIONS INTL CP,"Science Applications International Corporation provides technical, engineering, and enterprise information technology (IT) services primarily in the United States."
CCL,0.483,CARNIVAL CORPORATION & PLC,"Carnival Corporation & Plc operates as a leisure travel company. The company's ships visit approximately 700 ports under the Carnival Cruise Line, Princess Cruises, Holland America Line, Seabourn, P&O Cruises (Australia), Costa Cruises, AIDA Cruises, P&O Cruises (UK), and Cunard brand names."
NAVI,0.4841,NAVIENT CORP,"Navient Corporation provides education loan management and business processing solutions for education, healthcare, and government clients at the federal, state, and local levels in the United States."
TDG,0.4971,TRANSDIGM GROUP INC,"TransDigm Group Incorporated designs, produces, and supplies aircraft components in the United States and internationally."
BMS,0.5,BEMIS CO INC,"Bemis Company, Inc. manufactures and sells packaging products in the United States, Brazil, other Americas, Europe, and the Asia-Pacific. It operates through three segments: U.S. Packaging, Latin America Packaging, and Rest of World Packaging."
ARG,0.5068,AIRGAS INC,"Airgas, Inc. supplies industrial, medical, and specialty gases; and welding equipment and related products. The company operates through two segments, Distribution and All Other Operations."
KR,0.5115,KROGER CO,"The Kroger Co. operates as a retailer in the United States. The company operates supermarkets, multi-department stores, marketplace stores, and price impact warehouse stores."
AZO,0.5148,AUTOZONE INC,"AutoZone, Inc. retails and distributes automotive replacement parts and accessories. The company offers various products for cars, sport utility vehicles, vans, and light trucks, including new and remanufactured automotive hard parts, maintenance items, accessories, and non-automotive products."
S,0.5184,SPRINT CORP,"Sprint Corporation provides a range of wireless and wireline communications products and services to consumers, businesses, government subscribers, and resellers in the United States, Puerto Rico, and the United States Virgin Islands. It operates in two segments, Wireless and Wireline."
RTN,0.5304,RAYTHEON CO,"Raytheon Company develops technologically advanced and integrated products, services, and solutions for the defense and other government markets worldwide."
MCK,0.5323,MCKESSON CORP,"McKesson Corporation provides pharmaceuticals and medical supplies in the United States and internationally. It operates through four segments: U.S. Pharmaceutical, Prescription Technology Solutions, International, and Medical-Surgical Solutions. The U.S."
EVHC,0.5329,ENVISION HEALTHCARE CORP,"Envision Healthcare Corporation, through its subsidiaries, provides various healthcare services in the United States. The company operates through two segments, Physician Services and Ambulatory Services."
CVS,0.5329,CVS HEALTH CORP,CVS Health Corporation provides health services and plans in the United States.
SII,0.5344,SPROTT INC,"Sprott Inc. is a publicly owned asset management holding company. Through its subsidiaries, the firm provides asset management, portfolio management, wealth management, fund management, and administrative and consulting services to its clients."
ANET,0.5355,ARISTA NETWORKS INC,"Arista Networks, Inc. develops, markets, and sells cloud networking solutions in the Americas, Europe, the Middle East, Africa, and the Asia-Pacific."
PFE,0.5415,PFIZER INC,"Pfizer Inc. develops, manufactures, and sells healthcare products worldwide."
WLTW,0.5435,WILLIS TOWERS WATSON PLC,"Willis Towers Watson Public Limited Company operates as an advisory, broking, and solutions company worldwide."
KEYS,0.5569,KEYSIGHT TECHNOLOGIES INC,"Keysight Technologies, Inc. provides electronic design and test solutions to commercial communications, networking, aerospace, defense and government, automotive, energy, semiconductor, electronic, and education industries in the Americas, Europe, and the Asia Pacific."
PM,0.5672,PHILIP MORRIS INTERNATIONAL,"Philip Morris International Inc., through its subsidiaries, manufactures and sells cigarettes, other nicotine-containing products, smoke-free products, and related electronic devices and accessories."
ORCL,0.5676,ORACLE CORP,Oracle Corporation provides products and services that address enterprise information technology environments worldwide.
SUN,0.5692,SUNOCO LP,"Sunoco LP, together with its subsidiaries, engages in the distribution and retailing of motor fuels in the United States. It operates through two segments, Fuel Distribution and Marketing, and All Other."
MRK,0.5718,MERCK & CO,"Merck & Co., Inc. provides healthcare solutions worldwide."
LIN,0.5804,LINDE PLC,"Linde plc operates as an industrial gas company in North and South America, Europe, the Middle East, Africa, and the Asia Pacific. The company offers oxygen, nitrogen, argon, rare gases, carbon monoxide, carbon dioxide, helium, hydrogen, electronic gases, specialty gases, and acetylene."
GD,0.5844,GENERAL DYNAMICS CORP,"General Dynamics Corporation operates as an aerospace and defense company worldwide. It operates through five segments: Aerospace, Combat Systems, Information Technology, Mission Systems, and Marine Systems."
ENDP,0.5897,ENDO INTERNATIONAL PLC,Endo International plc manufactures and sells generic and branded pharmaceuticals in the United States and internationally.
LLY,0.5917,LILLY (ELI) & CO,"Eli Lilly and Company discovers, develops, manufactures, and markets pharmaceutical products worldwide. It offers endocrinology products for diabetes; osteoporosis in postmenopausal women and men; and human growth hormone deficiency and paediatric growth conditions."
BDX,0.5921,BECTON DICKINSON & CO,"Becton, Dickinson and Company develops, manufactures, and sells medical supplies, devices, laboratory equipment, and diagnostic products worldwide."
DHR,0.5962,DANAHER CORP,"Danaher Corporation designs, manufactures, and markets professional, medical, industrial, and commercial products and services worldwide. The company operates through three segments; Life Sciences, Diagnostics, and Environmental & Applied Solutions."
SYY,0.5992,SYSCO CORP,"Sysco Corporation, through its subsidiaries, markets and distributes a range of food and related products primarily to the foodservice or food-away-from-home industry in the United States, Canada, the United Kingdom, France, and internationally. It operates through three segments: U.S."
QCOM,0.6032,QUALCOMM INC,"QUALCOMM Incorporated engages in the development and commercialization of foundational technologies and products are used in mobile devices and other wireless products, including network equipment, broadband gateway equipment, consumer electronic devices, and other connected devices worldwide."
NEM,0.607,NEWMONT CORP,"Newmont Corporation engages in the production and exploration of gold, copper, silver, zinc, and lead. The company has operations and/or assets in the United States, Canada, Mexico, Dominican Republic, Peru, Suriname, Argentina, Chile, Australia, and Ghana."
FFIV,0.6087,F5 NETWORKS INC,"F5 Networks, Inc. provides multi-cloud application services for the security, performance, and availability of network applications, servers, and storage systems."
COO,0.6111,COOPER COS INC (THE),"The Cooper Companies, Inc. operates as a medical device company worldwide. It operates through CooperVision and CooperSurgical business units."
TSG,0.6164,STARS GROUP INC,"The Stars Group Inc. engages in online gaming and betting businesses primarily in Europe, Australia, and the Americas."
TEL,0.6174,TE CONNECTIVITY LTD,"TE Connectivity Ltd., together with its subsidiaries, manufactures and sells connectivity and sensor solutions in Europe, the Middle East, Africa, the Asia-Pacific, and the Americas."
TYC,0.6267,TYCO INTERNATIONAL PLC,"As of September 2, 2016, Tyco International plc was acquired by Johnson Controls International plc. Tyco International plc provides security products and services, fire detection and suppression products and services, and life safety products worldwide."
MDP,0.63,MEREDITH CORP,"Meredith Corporation operates as a diversified media company primarily in the United States. It operates in two segments, National Media and Local Media."
KRFT,0.6306,KRAFT FOODS GROUP INC,"As of July 2, 2015, Kraft Foods Group, Inc was acquired by The Kraft Heinz Company. Kraft Foods Group, Inc. operates as a consumer packaged food and beverage company. It operates through six segments: Cheese, Refrigerated Meals, Beverages, Meals & Desserts, Enhancers & Snack Nuts, and Canada."
CPRT,0.6325,COPART INC,"Copart, Inc. provides online auctions and vehicle remarketing services in the United States, Canada, the United Kingdom, Brazil, the Republic of Ireland, Germany, Finland, the United Arab Emirates, Oman, Bahrain, and Spain."
CTAS,0.6332,CINTAS CORP,"Cintas Corporation provides corporate identity uniforms and related business services primarily in North America, Latin America, Europe, and Asia. It operates through Uniform Rental and Facility Services and First Aid and Safety Services segments."
SLM,0.64,SLM CORP,"SLM Corporation, through its subsidiaries, originates and services private education loans to students and their families to finance the cost of their education in the United States."
SYK,0.6417,STRYKER CORP,"Stryker Corporation operates as a medical technology company. The company operates through three segments: Orthopaedics, MedSurg, and Neurotechnology and Spine. The Orthopaedics segment provides implants for use in hip and knee joint replacements, and trauma and extremities surgeries."
MON,0.6429,MONSANTO CO,"Monsanto Company, together with its subsidiaries, provides agricultural products for farmers worldwide. It operates in two segments, Seeds and Genomics, and Agricultural Productivity."
WFM,0.6433,WHOLE FOODS MARKET INC,"Whole Foods Market, Inc. operates natural and organic foods supermarkets. The company's stores offers produce, grocery, meat and poultry, seafood, bakery, prepared foods, coffee, tea, beer, wine, cheese, nutritional supplements, vitamins, body care, pet foods, and household goods."
LEG,0.646,LEGGETT & PLATT INC,"Leggett & Platt, Incorporated designs and produces various engineered components and products worldwide. It operates through three segments: Bedding Products; Furniture, Flooring & Textile Products; and Specialized Products."
EW,0.6481,EDWARDS LIFESCIENCES CORP,"Edwards Lifesciences Corporation provides products and technologies for structural heart disease, and critical care and surgical monitoring in the United States and internationally."
BMY,0.6483,BRISTOL-MYERS SQUIBB CO,"Bristol-Myers Squibb Company discovers, develops, licenses, manufactures, and markets biopharmaceutical products worldwide. It offers products in hematology, oncology, cardiovascular, and immunology therapeutic classes."
SJM,0.6566,SMUCKER (JM) CO,"The J. M. Smucker Company manufactures and markets food and beverage products worldwide. It operates in four segments: U.S. Retail Pet Foods, U.S. Retail Coffee, U.S. Retail Consumer Foods, and International and Away From Home."
APOL,0.6598,APOLLO EDUCATION GROUP INC,"Apollo Education Group, Inc. provides private education services in the United States and internationally. The company offers online and on-campus undergraduate, graduate, certificate, and non-degree educational programs and services to unemployed and employed learners."
ROL,0.6649,ROLLINS INC,"Rollins, Inc., through its subsidiaries, provides pest and termite control services to residential and commercial customers."
HON,0.665,HONEYWELL INTERNATIONAL INC,Honeywell International Inc. operates as a diversified technology and manufacturing company worldwide.
AOS,0.6724,SMITH (A.O.),"A. O. Smith Corporation manufactures and markets residential and commercial gas and electric water heaters, boilers, tanks, and water treatment products in North America, China, Europe, and India. It operates through two segments, North America and Rest of World."
LVLT,0.6769,LEVEL 3 COMMUNICATIONS INC,"Level 3 Parent, LLC provides various integrated communications services for enterprise, government, wholesale, and small and medium business customers in North America, Latin America, Europe, the Asia Pacific, the Middle East, and Africa."
SUNW,0.6812,SUNWORKS INC,"Sunworks, Inc., through its subsidiaries, provides photovoltaic based power systems for the agricultural, commercial, industrial, public works, and residential markets in California, Massachusetts, Nevada, Oregon, New Jersey, and Washington."
SNPS,0.6814,SYNOPSYS INC,"Synopsys, Inc. provides electronic design automation software products used to design and test integrated circuits."
LLL,0.6815,L3 TECHNOLOGIES INC,"L3 Technologies, Inc. provides aircraft sustainment, simulation and training, night vision and image intensification equipment, and security and detection systems used on military, homeland security, and commercial platforms in the United States and internationally."
NWS,0.6847,NEWS CORP,"News Corporation, a media and information services company, creates and distributes content for consumers and businesses worldwide. It operates in six segments: Digital Real Estate Services, Subscription Video Services, Dow Jones, Book Publishing, News Media, and Other."
RTX,0.6957,RAYTHEON TECHNOLOGIES CORP,"Raytheon Technologies Corporation, an aerospace and defense company, provides advanced systems and services for commercial, military, and government customers worldwide."
ASH,0.7112,ASHLAND GLOBAL HOLDINGS INC,"Ashland Global Holdings Inc. provides specialty chemical solutions worldwide. The company's Specialty Ingredients segment offers products, technologies, and resources for solving formulation and product-performance challenges."
DFS,0.7139,DISCOVER FINANCIAL SVCS,"Discover Financial Services, through its subsidiaries, operates as a direct banking and payment services company in the United States. It operates in two segments, Direct Banking and Payment Services."
NCLH,0.7148,NORWEGIAN CRUISE LINE HLDGS,"Norwegian Cruise Line Holdings Ltd., together with its subsidiaries, operates as a cruise company in the North America, Europe, the Asia-Pacific, and internationally. The company operates the Norwegian Cruise Line, Oceania Cruises, and Regent Seven Seas Cruises brands."
SHW,0.7179,SHERWIN-WILLIAMS CO,"The Sherwin-Williams Company develops, manufactures, distributes, and sells paints, coatings, and related products to professional, industrial, commercial, and retail customers. It operates in three segments: The Americas Group, Consumer Brands Group, and Performance Coatings Group."
IPGP,0.7198,IPG PHOTONICS CORP,"IPG Photonics Corporation develops and manufactures a range of high-performance fiber lasers, fiber amplifiers, and diode lasers used in various applications primarily in materials processing worldwide."
AXP,0.7202,AMERICAN EXPRESS CO,"American Express Company, together with its subsidiaries, provides charge and credit payment card products, and travel-related services worldwide. The company operates through three segments: Global Consumer Services Group, Global Commercial Services, and Global Merchant and Network Services."
WAT,0.7286,WATERS CORP,"Waters Corporation, a specialty measurement company, provides analytical workflow solutions in Asia, the Americas, and Europe. It operates through two segments, Waters and TA."
PKI,0.7382,PERKINELMER INC,"PerkinElmer, Inc. provides products, services, and solutions to the diagnostics, life sciences, and applied services markets worldwide. The company operates in two segments, Discovery & Analytical Solutions and Diagnostics."
LDOS,0.7495,LEIDOS HOLDINGS INC,"Leidos Holdings, Inc. provides services and solutions in the defense, intelligence, civil, and health markets in the United States and internationally. It operates through three segments: Defense Solutions, Civil, and Health."
OMC,0.7516,OMNICOM GROUP,"Omnicom Group Inc., together with its subsidiaries, provides advertising, marketing, and corporate communications services. It provides a range of services in the areas of advertising, customer relationship management, public relations, and healthcare."
