,dist,conm,busdesc
CDNS,0.0,CADENCE DESIGN SYSTEMS INC,"Cadence Design Systems, Inc. provides software, hardware, services, and reusable integrated circuit (IC) design blocks worldwide. The company offers functional verification services, including emulation and prototyping hardware."
SNPS,0.282,SYNOPSYS INC,"Synopsys, Inc. provides electronic design automation software products used to design and test integrated circuits."
NVDA,0.4522,NVIDIA CORP,"NVIDIA Corporation operates as a visual computing company worldwide. It operates in two segments, GPU and Tegra Processor."
PYPL,0.5235,PAYPAL HOLDINGS INC,"PayPal Holdings, Inc. operates as a technology platform and digital payments company that enables digital and mobile payments on behalf of consumers and merchants worldwide. Its payment solutions include PayPal, PayPal Credit, Braintree, Venmo, Xoom, and iZettle products."
INTU,0.5378,INTUIT INC,"Intuit Inc. provides financial management and compliance products and services for consumers, small businesses, self-employed, and accounting professionals in the United States, Canada, and internationally."
MSCI,0.5512,MSCI INC,"MSCI Inc., together with its subsidiaries, provides investment decision support tools for the clients to manage their investment processes worldwide. The company operates through four segments: Index, Analytics, ESG, and Real Estate."
AMD,0.5554,ADVANCED MICRO DEVICES,"Advanced Micro Devices, Inc. operates as a semiconductor company worldwide. The company operates in two segments, Computing and Graphics; and Enterprise, Embedded and Semi-Custom."
CTLT,0.6446,CATALENT INC,"Catalent, Inc., together with its subsidiaries, provides delivery technologies and development solutions for drugs, biologics, and consumer and animal health products worldwide."
ETSY,0.7145,ETSY INC,"Etsy, Inc. operates online market places for buyers and sellers primarily in the United States, the United Kingdom, Canada, Australia, France, and Germany. Its online market places include Etsy.com and Reverb.com."
