,dist,conm,busdesc
PRGO,0.7562,PERRIGO CO PLC,Perrigo Company plc provides over-the-counter (OTC) health and wellness solutions that enhance individual well-being by empowering consumers to prevent or treat conditions that can be self-managed.
GE,0.7643,GENERAL ELECTRIC CO,"General Electric Company operates as a high-tech industrial company in the United States, Europe, Asia, the Americas, the Middle East, and Africa. It operates through Power, Renewable Energy, Aviation, Healthcare, and Capital segments."
VRSN,0.7669,VERISIGN INC,"VeriSign, Inc., together with its subsidiaries, provides domain name registry services and Internet infrastructure that enables Internet navigation for various recognized domain names worldwide."
GM,0.7699,GENERAL MOTORS CO,"General Motors Company designs, builds, and sells cars, trucks, crossovers, and automobile parts worldwide. The company operates through GM North America, GM International, Cruise, and GM Financial segments."
SYF,0.7776,SYNCHRONY FINANCIAL,"Synchrony Financial operates as a consumer financial services company in the United States. It delivers a range of specialized financing programs and consumer banking products to digital, retail, home, auto, travel, health, and pet industries."
HSP,0.78,HOSPIRA INC,"Hospira, Inc. provides injectable drugs and infusion technologies to develop, manufacture, distribute, and market products worldwide. The company operates through Americas, EMEA, and APAC segments."
MJN,0.7819,MEAD JOHNSON NUTRITION CO,"Mead Johnson Nutrition Company manufactures and sells infant formula, children's nutrition, and other nutritional products."
ZBRA,0.7893,ZEBRA TECHNOLOGIES CP  -CL A,"Zebra Technologies Corporation, together with its subsidiaries, provides enterprise asset intelligence solutions in the automatic identification and data capture solutions industry worldwide."
WDC,0.7923,WESTERN DIGITAL CORP,"Western Digital Corporation develops, manufactures, and sells data storage devices and solutions."
AMD,0.7952,ADVANCED MICRO DEVICES,"Advanced Micro Devices, Inc. operates as a semiconductor company worldwide. The company operates in two segments, Computing and Graphics; and Enterprise, Embedded and Semi-Custom."
QLGC,0.8044,QLOGIC CORP,"QLogic Corporation and its subsidiaries design and supply high performance server and storage networking connectivity products that provide, enhance, and manage computer data communication."
V,0.8156,VISA INC,"Visa Inc. operates as a payments technology company worldwide. The company facilitates digital payments among consumers, merchants, financial institutions, businesses, strategic partners, and government entities."
WB,0.85,WEIBO CORP,"Weibo Corporation, through its subsidiaries, operates as a social media platform for people to create, distribute, and discover content in the People's Republic of China. It operates in two segments, Advertising and Marketing Services; and Value-Added Services."
