,dist,conm,busdesc
RHT,0.0,RED HAT INC,"Red Hat, Inc. provides open source software solutions to develop and offer operating system, virtualization, management, middleware, cloud, and storage technologies to various enterprises worldwide."
UST,0.1464,PROSHARES ULTRA 7-10 YR TRES,ProShares Trust - ProShares Ultra 7-10 Year Treasury is an exchange traded fund launched and managed by ProShare Advisors LLC. The fund invests in the fixed income markets of the United States.
SAF,0.3048,SARATOGA INVT CORP 6.25 NT,
CBH,0.4042,ALLIANZGI CON INCM 2024 TARG,AllianzGI Convertible & Income 2024 Target Term Fund is a closed ended balanced mutual fund launched and managed by Allianz Global Investors U.S. LLC. The fund invests in the public equity and fixed incomes markets of the United States.
MCD,0.4563,MCDONALD'S CORP,"McDonald's Corporation operates and franchises McDonald's restaurants in the United States and internationally. Its restaurants offer various food products and beverages, as well as breakfast menu. As of December 31, 2019, the company operated 38,695 restaurants."
CNP,0.4812,CENTERPOINT ENERGY INC,"CenterPoint Energy, Inc. operates as a public utility holding company in the United States. The company's Houston Electric T&D segment electric transmission and distribution services to electric utility."
BMS,0.4953,BEMIS CO INC,"Bemis Company, Inc. manufactures and sells packaging products in the United States, Brazil, other Americas, Europe, and the Asia-Pacific. It operates through three segments: U.S. Packaging, Latin America Packaging, and Rest of World Packaging."
WMT,0.508,WALMART INC,"Walmart Inc. engages in the retail and wholesale operations in various formats worldwide. The company operates in three segments: Walmart U.S., Walmart International, and Sam's Club."
CBOE,0.5228,CBOE GLOBAL MARKETS INC,"Cboe Global Markets, Inc., through its subsidiaries, operates as an options exchange in the United States. It operates in five segments: Options, U.S. Equities, Futures, European Equities, and Global FX. The Options segment trades in listed market indices. The U.S."
WRB,0.5258,BERKLEY (W R) CORP,"W. R. Berkley Corporation, an insurance holding company, operates as a commercial lines writer in the United States and internationally. It operates through two segments, Insurance and Reinsurance & Monoline Excess."
AFL,0.545,AFLAC INC,"Aflac Incorporated, through its subsidiaries, provides supplemental health and life insurance products. It operates through two segments, Aflac Japan and Aflac U.S."
RE,0.5497,EVEREST RE GROUP LTD,"Everest Re Group, Ltd., through its subsidiaries, provides reinsurance and insurance products in the United States, Bermuda, and internationally. The company operates through four segments: U.S. Reinsurance, International, Bermuda, and Insurance. The U.S."
SJM,0.5585,SMUCKER (JM) CO,"The J. M. Smucker Company manufactures and markets food and beverage products worldwide. It operates in four segments: U.S. Retail Pet Foods, U.S. Retail Coffee, U.S. Retail Consumer Foods, and International and Away From Home."
TRV,0.5748,TRAVELERS COS INC,"The Travelers Companies, Inc., through its subsidiaries, provides a range of commercial and personal property, and casualty insurance products and services to businesses, government units, associations, and individuals in the United states and internationally."
CCU,0.5803,COMPANIA CERVECERIAS UNIDAS,"Compania Cervecerias Unidas S.A. operates as a beverage company principally in Chile, Argentina, Uruguay, Paraguay, Colombia, and Bolivia. The company operates through three segments: Chile, International Business, and Wine."
SYY,0.6102,SYSCO CORP,"Sysco Corporation, through its subsidiaries, markets and distributes a range of food and related products primarily to the foodservice or food-away-from-home industry in the United States, Canada, the United Kingdom, France, and internationally. It operates through three segments: U.S."
GHC,0.6117,GRAHAM HOLDINGS CO,"Graham Holdings Company, through its subsidiaries, operates as a diversified education and media company worldwide."
SUN,0.6257,SUNOCO LP,"Sunoco LP, together with its subsidiaries, engages in the distribution and retailing of motor fuels in the United States. It operates through two segments, Fuel Distribution and Marketing, and All Other."
T,0.6465,AT&T INC,"AT&T Inc. provides telecommunication, media, and technology services worldwide. The company operates through four segments: Communications, WarnerMedia, Latin America, and Xandr."
JNJ,0.6473,JOHNSON & JOHNSON,"Johnson & Johnson researches and develops, manufactures, and sells various products in the health care field worldwide. It operates in three segments: Consumer, Pharmaceutical, and Medical Devices."
WEN,0.6507,WENDY'S CO,"The Wendy's Company, together with its subsidiaries, operates as a quick-service restaurant company. It operates through three segments: Wendy's U.S., Wendy's International, and Global Real Estate & Development."
ACT,0.6749,ADVISORSHARES VICE ETF,"AdvisorShares Trust - AdvisorShares Vice ETF is an exchange traded fund launched and managed by AdvisorShares Investments, LLC. It invests in public equity markets of the United States."
AZO,0.6752,AUTOZONE INC,"AutoZone, Inc. retails and distributes automotive replacement parts and accessories. The company offers various products for cars, sport utility vehicles, vans, and light trucks, including new and remanufactured automotive hard parts, maintenance items, accessories, and non-automotive products."
ORLY,0.6762,O'REILLY AUTOMOTIVE INC,"O'Reilly Automotive, Inc., together with its subsidiaries, engages in the retail of automotive aftermarket parts, tools, supplies, equipment, and accessories in the United States."
HIG,0.6776,HARTFORD FINANCIAL SERVICES,"The Hartford Financial Services Group, Inc. provides insurance and financial services to individual and business customers in the United States and internationally."
ALL,0.6852,ALLSTATE CORP,"The Allstate Corporation, through its subsidiaries, provides property and casualty, and other insurance products in the United States and Canada. The company operates through Allstate Protection, Service Businesses, Allstate Life, and Allstate Benefits segments."
LLY,0.6999,LILLY (ELI) & CO,"Eli Lilly and Company discovers, develops, manufactures, and markets pharmaceutical products worldwide. It offers endocrinology products for diabetes; osteoporosis in postmenopausal women and men; and human growth hormone deficiency and paediatric growth conditions."
CTXS,0.7104,CITRIX SYSTEMS INC,"Citrix Systems, Inc. provides workspace, networking, and professional services worldwide."
DRI,0.7122,DARDEN RESTAURANTS INC,"Darden Restaurants, Inc., through its subsidiaries, owns and operates full-service restaurants in the United States and Canada."
WU,0.7292,WESTERN UNION CO,"The Western Union Company provides money movement and payment services worldwide. The company operates in two segments, Consumer-to-Consumer and Business Solutions."
GPC,0.7294,GENUINE PARTS CO,"Genuine Parts Company distributes automotive replacement parts, industrial parts and materials, and business products in the United States, Canada, Mexico, Australasia, France, the United Kingdom, Germany, Poland, the Netherlands, and Belgium."
CELG,0.7306,CELGENE CORP,"Celgene Corporation, a biopharmaceutical company, discovers, develops, and commercializes therapies for the treatment of cancer and inflammatory diseases worldwide."
PGR,0.7512,PROGRESSIVE CORP-OHIO,"The Progressive Corporation, through its subsidiaries, provides personal and commercial auto insurance, residential property insurance, and other specialty property-casualty insurance and related services primarily in the United States."
BRYN,0.7579,RNETHEALTH INC,"BRYN Resources Inc. provides corporate, capital, and communication services for small businesses worldwide. The company operates VybeOffice, an online tool that allows you to manage company online from a single portal. It also offers stock issuance, transfer, custodial, and registrar services."
DG,0.7604,DOLLAR GENERAL CORP,"Dollar General Corporation, a discount retailer, provides various merchandise products in the southern, southwestern, Midwestern, and eastern United States."
CMCSA,0.7737,COMCAST CORP,"Comcast Corporation operates as a media and technology company worldwide. It operates through Cable Communications, Cable Networks, Broadcast Television, Filmed Entertainment, Theme Parks, and Sky segments."
DLTR,0.7758,DOLLAR TREE INC,"Dollar Tree, Inc. operates discount variety retail stores. It operates through two segments, Dollar Tree and Family Dollar. The Dollar Tree segment offers merchandise at the fixed price of $1.00."
AAP,0.7766,ADVANCE AUTO PARTS INC,"Advance Auto Parts, Inc. provides automotive replacement parts, accessories, batteries, and maintenance items for domestic and imported cars, vans, sport utility vehicles, and light and heavy duty trucks."
SEE,0.781,SEALED AIR CORP,"Sealed Air Corporation provides food safety and security, and product protection solutions and equipment in North America, South America, Europe, the Middle East, Africa, and the Asia Pacific. It operates in two segments, Food Care and Product Care."
AE,0.7861,ADAMS RESOURCES & ENERGY INC,"Adams Resources & Energy, Inc., through its subsidiaries, primarily engages in the marketing, transportation, and storage of crude oil in the United States."
HRB,0.7868,BLOCK H & R INC,"H&R Block, Inc., through its subsidiaries, provides assisted income tax return preparation, do-it-yourself (DIY) tax, and virtual tax preparation services and products to the general public primarily in the United States, Canada, and Australia."
DIS,0.8054,DISNEY (WALT) CO,"The Walt Disney Company, together with its subsidiaries, operates as an entertainment company worldwide."
KR,0.806,KROGER CO,"The Kroger Co. operates as a retailer in the United States. The company operates supermarkets, multi-department stores, marketplace stores, and price impact warehouse stores."
KMX,0.8372,CARMAX INC,"CarMax, Inc., through its subsidiaries, operates as a retailer of used vehicles in the United States. The company operates in two segments, CarMax Sales Operations and CarMax Auto Finance."
DPZ,0.8402,DOMINO'S PIZZA INC,"Domino's Pizza, Inc., through its subsidiaries, operates as a pizza delivery company in the United States and internationally. It operates through three segments: U.S. Stores, International Franchise, and Supply Chain."
TGT,0.8463,TARGET CORP,Target Corporation operates as a general merchandise retailer in the United States.
S,0.878,SPRINT CORP,"Sprint Corporation provides a range of wireless and wireline communications products and services to consumers, businesses, government subscribers, and resellers in the United States, Puerto Rico, and the United States Virgin Islands. It operates in two segments, Wireless and Wireline."
EBAY,0.9028,EBAY INC,eBay Inc. operates the marketplace and classifieds platforms that connect buyers and sellers worldwide.
