,dist,conm,busdesc
IEX,0.0,IDEX CORP,"IDEX Corporation, together with its subsidiaries, operates as an applied solutions company worldwide. The company operates through three segments: Fluid & Metering Technologies (FMT), Health & Science Technologies (HST), and Fire & Safety/Diversified Products (FSDP)."
ITT,0.5199,ITT INC,"ITT Inc. manufactures and sells engineered critical components and customized technology solutions for the energy, transportation, and industrial markets worldwide. The company operates through three segments: Motion Technologies, Industrial Process, and Connect & Control Technologies."
TEX,0.5317,TEREX CORP,"Terex Corporation manufactures and sells aerial work platforms, materials processing machinery, and cranes worldwide. The company operates in two segments, Aerial Work Platforms (AWP) and Material Processing (MP)."
ITW,0.5604,ILLINOIS TOOL WORKS,Illinois Tool Works Inc. manufactures and sells industrial products and equipment worldwide. It operates through seven segments: Automotive OEM; Food Equipment; Test & Measurement and Electronics; Welding; Polymers & Fluids; Construction Products; and Specialty Products.
PBI,0.5667,PITNEY BOWES INC,"Pitney Bowes Inc., a technology company, provides commerce solutions in the United States and internationally. The company operates through Global Ecommerce, Presort Services and SendTech Solutions segments."
TT,0.5766,TRANE TECHNOLOGIES PLC,"Trane Technologies plc provides climate control solutions for buildings, homes, and transportation."
URI,0.5962,UNITED RENTALS INC,"United Rentals, Inc., through its subsidiaries, operates as an equipment rental company. It operates in two segments, General Rentals; and Trench, Power and Fluid Solutions."
PH,0.5985,PARKER-HANNIFIN CORP,"Parker-Hannifin Corporation manufactures and sells motion and control technologies and systems for various mobile, industrial, and aerospace markets worldwide. The company operates through two segments, Diversified Industrial and Aerospace Systems."
CMI,0.6229,CUMMINS INC,"Cummins Inc. designs, manufactures, distributes, and services diesel and natural gas engines, products worldwide. It operates through five segments: Engine, Distribution, Components, Power Systems, and New Power."
HON,0.6238,HONEYWELL INTERNATIONAL INC,Honeywell International Inc. operates as a diversified technology and manufacturing company worldwide.
WAB,0.6276,WABTEC CORP,"Wabtec Corporation provides technology-based equipment, systems, and services for the freight rail and passenger transit vehicle industries worldwide. It operates through two segments, Freight and Transit."
SNA,0.6507,SNAP-ON INC,"Snap-on Incorporated manufactures and markets tools, equipment, diagnostics, and repair information and systems solutions for professional users worldwide."
RHI,0.6517,ROBERT HALF INTL INC,"Robert Half International Inc. provides staffing and risk consulting services in North America, South America, Europe, Asia, and Australia."
XYL,0.6598,XYLEM INC,"Xylem Inc. engages in the design, manufacture, and servicing of engineered products and solutions for the water and wastewater applications in the United States, Europe, the Asia Pacific, and internationally."
BC,0.6624,BRUNSWICK CORP,"Brunswick Corporation designs, manufactures, and markets recreation products worldwide."
BWA,0.6652,BORGWARNER INC,"BorgWarner Inc. provides solutions for combustion, hybrid, and electric vehicles worldwide."
AOS,0.6675,SMITH (A.O.),"A. O. Smith Corporation manufactures and markets residential and commercial gas and electric water heaters, boilers, tanks, and water treatment products in North America, China, Europe, and India. It operates through two segments, North America and Rest of World."
TXT,0.6807,TEXTRON INC,"Textron Inc. operates in the aircraft, defense, industrial, and finance businesses worldwide."
APTV,0.6891,APTIV PLC,"Aptiv PLC designs, manufacturers, and sells vehicle components worldwide. The company provides electrical, electronic, and safety technology solutions to the automotive and commercial vehicle markets."
JBL,0.6895,JABIL INC,"Jabil Inc. provides manufacturing services and solutions worldwide. The company operates in two segments, Electronics Manufacturing Services and Diversified Manufacturing Services. It offers electronics design, production, and product management services."
KSU,0.7008,KANSAS CITY SOUTHERN,"Kansas City Southern, a transportation holding company, provides domestic and international rail transportation services in North America."
XRX,0.7025,XEROX HOLDINGS CORP,"Xerox Holdings Corporation designs, develops, and sells document management systems and solutions in the United States, Europe, Canada, and internationally."
CE,0.704,CELANESE CORP,"Celanese Corporation, a technology and specialty materials company, manufactures and sells high performance engineered polymers in the United States and internationally. The company operates through Engineered Materials, Acetate Tow, and Acetyl Chain segments."
PNR,0.7053,PENTAIR PLC,"Pentair plc provides various smart water solutions worldwide. It operates through three segments: Aquatic Systems, Filtration Solutions, and Flow Technologies."
SWK,0.7162,STANLEY BLACK & DECKER INC,"Stanley Black & Decker, Inc. engages in tools and storage, industrial, and security businesses worldwide."
UNP,0.7257,UNION PACIFIC CORP,"Union Pacific Corporation, through its subsidiary, Union Pacific Railroad Company, engages in the railroad business in the United States."
LVS,0.7358,LAS VEGAS SANDS CORP,"Las Vegas Sands Corp., together with its subsidiaries, develops, owns, and operates integrated resorts in Asia and the United States."
MTD,0.7373,METTLER-TOLEDO INTL INC,"Mettler-Toledo International Inc. manufactures and supplies precision instruments and services worldwide. It operates in five segments: U.S. Operations, Swiss Operations, Western European Operations, Chinese Operations, and Other."
ROP,0.7461,ROPER TECHNOLOGIES INC,"Roper Technologies, Inc. designs and develops software, and engineered products and solutions worldwide."
MSCI,0.7462,MSCI INC,"MSCI Inc., together with its subsidiaries, provides investment decision support tools for the clients to manage their investment processes worldwide. The company operates through four segments: Index, Analytics, ESG, and Real Estate."
LXK,0.7486,LEXMARK INTL INC  -CL A,"Lexmark International, Inc., together with its subsidiaries, operates as a developer, manufacturer, and supplier of printing, imaging, device management, and document workflow solutions."
VIAB,0.7509,VIACOM INC,"As of December 4, 2019, Viacom Inc. was acquired by CBS Corporation. Viacom Inc. operates media brands that create entertainment content worldwide. It operates in two segments, Media Networks and Filmed Entertainment."
GPC,0.7516,GENUINE PARTS CO,"Genuine Parts Company distributes automotive replacement parts, industrial parts and materials, and business products in the United States, Canada, Mexico, Australasia, France, the United Kingdom, Germany, Poland, the Netherlands, and Belgium."
CVG,0.7556,CONVERGYS CORP,"Convergys Corporation provides customer management services to communications and media, technology, financial services, retail, healthcare, government, travel and hospitality, and other vertical markets worldwide."
PPG,0.76,PPG INDUSTRIES INC,"PPG Industries, Inc. manufactures and distributes paints, coatings, and specialty materials worldwide."
JKHY,0.7631,HENRY (JACK) & ASSOCIATES,"Jack Henry & Associates, Inc. provides technology solutions and payment processing services primarily for financial services organizations in the United States."
NYT,0.7641,NEW YORK TIMES CO  -CL A,"The New York Times Company, together with its subsidiaries, provides news and information for readers and viewers across various platforms worldwide."
SSP,0.765,EW SCRIPPS  -CL A,"The E.W. Scripps Company, together with its subsidiaries, operates as a media enterprise through a portfolio of local and national media brands. The company operates through Local Media, National Media, and Other segments."
EFX,0.7656,EQUIFAX INC,"Equifax Inc. provides information solutions and human resources business process outsourcing services for businesses, governments, and consumers. The company operates through four segments: U.S. Information Solutions (USIS), Workforce Solutions, International, and Global Consumer Solutions."
TGNA,0.7699,TEGNA INC,TEGNA Inc. operates as a media company in the United States. The company operates television stations and radio stations that deliver television programming and digital content. It offers content and information to consumers across various platforms.
TDY,0.7803,TELEDYNE TECHNOLOGIES INC,"Teledyne Technologies Incorporated provides instrumentation, digital imaging, aerospace and defense electronics, and engineered systems in the United States, the United Kingdom, Canada, the Netherlands, and internationally."
CPRT,0.7926,COPART INC,"Copart, Inc. provides online auctions and vehicle remarketing services in the United States, Canada, the United Kingdom, Brazil, the Republic of Ireland, Germany, Finland, the United Arab Emirates, Oman, Bahrain, and Spain."
DPZ,0.7938,DOMINO'S PIZZA INC,"Domino's Pizza, Inc., through its subsidiaries, operates as a pizza delivery company in the United States and internationally. It operates through three segments: U.S. Stores, International Franchise, and Supply Chain."
MDP,0.7988,MEREDITH CORP,"Meredith Corporation operates as a diversified media company primarily in the United States. It operates in two segments, National Media and Local Media."
FMC,0.8,FMC CORP,"FMC Corporation, an agricultural sciences company, provides crop protection, plant health, and professional pest and turf management products."
GM,0.8037,GENERAL MOTORS CO,"General Motors Company designs, builds, and sells cars, trucks, crossovers, and automobile parts worldwide. The company operates through GM North America, GM International, Cruise, and GM Financial segments."
HBI,0.805,HANESBRANDS INC,"Hanesbrands Inc., a consumer goods company, designs, manufactures, sources, and sells a range of basic apparel for men, women, and children in the United States. The company operates through three segments: Innerwear, Activewear, and International."
F,0.8082,FORD MOTOR CO,"Ford Motor Company designs, manufactures, markets, and services a range of Ford cars, trucks, sport utility vehicles, electrified vehicles, and Lincoln luxury vehicles worldwide. It operates through three segments: Automotive, Mobility, and Ford Credit."
ROL,0.8098,ROLLINS INC,"Rollins, Inc., through its subsidiaries, provides pest and termite control services to residential and commercial customers."
AT,0.8346,ATLANTIC POWER CORP,Atlantic Power Corporation owns and operates a fleet of power generation assets in the United States and Canada.
WEN,0.844,WENDY'S CO,"The Wendy's Company, together with its subsidiaries, operates as a quick-service restaurant company. It operates through three segments: Wendy's U.S., Wendy's International, and Global Real Estate & Development."
ASH,0.8461,ASHLAND GLOBAL HOLDINGS INC,"Ashland Global Holdings Inc. provides specialty chemical solutions worldwide. The company's Specialty Ingredients segment offers products, technologies, and resources for solving formulation and product-performance challenges."
CDW,0.8463,CDW CORP,"CDW Corporation provides integrated information technology (IT) solutions to business, government, education, and healthcare customers in the United States, the United Kingdom, and Canada. It operates through three segments: Corporate, Small Business, and Public."
ACAS,0.8533,AMERICAN CAPITAL LTD,"American Capital, Ltd. is a business development company specializing in management and employee buyouts, subordinated debt, leveraged finance, mezzanine, acquisition, recapitalization, middle market, early venture, mature, industry consolidation, and growth capital investments."
SVU,0.8537,SUPERVALU INC,"SUPERVALU INC., together with its subsidiaries, operates as a grocery wholesaler and retailer in the United States and internationally. It operates through two segments, Wholesale and Retail."
CHRW,0.8554,C H ROBINSON WORLDWIDE INC,"C.H. Robinson Worldwide, Inc., a third party logistics company, provides freight transportation services and logistics solutions to companies in various industries worldwide. The company operates through North American Surface Transportation and Global Forwarding segments."
RRD,0.8573,DONNELLEY (R R) & SONS CO,"R.R. Donnelley & Sons Company, an integrated communications provider, enables organizations to create, manage, deliver, and optimize their multichannel marketing and business communications."
LHX,0.8641,L3HARRIS TECHNOLOGIES INC,"L3Harris Technologies, Inc., an aerospace and defense technology company, provides mission-critical solutions for government and commercial customers worldwide."
CTAS,0.883,CINTAS CORP,"Cintas Corporation provides corporate identity uniforms and related business services primarily in North America, Latin America, Europe, and Asia. It operates through Uniform Rental and Facility Services and First Aid and Safety Services segments."
