,dist,conm,busdesc
PPG,0.0,PPG INDUSTRIES INC,"PPG Industries, Inc. manufactures and distributes paints, coatings, and specialty materials worldwide."
DD,0.2955,DUPONT DE NEMOURS INC,"DuPont de Nemours, Inc. provides technology-based materials, ingredients, and solutions in the United States, Canada, the Asia Pacific, Latin America, Europe, the Middle East, and Africa."
EMN,0.3466,EASTMAN CHEMICAL CO,Eastman Chemical Company operates as an advanced materials and specialty additives company worldwide.
LIN,0.3668,LINDE PLC,"Linde plc operates as an industrial gas company in North and South America, Europe, the Middle East, Africa, and the Asia Pacific. The company offers oxygen, nitrogen, argon, rare gases, carbon monoxide, carbon dioxide, helium, hydrogen, electronic gases, specialty gases, and acetylene."
CAT,0.4154,CATERPILLAR INC,"Caterpillar Inc. manufactures and sells construction and mining equipment, diesel and natural gas engines, and industrial gas turbines."
NUE,0.4825,NUCOR CORP,"Nucor Corporation manufactures and sells steel and steel products. It operates in three segments: Steel Mills, Steel Products, and Raw Materials."
AVY,0.4974,AVERY DENNISON CORP,Avery Dennison Corporation produces and sells pressure-sensitive materials worldwide.
ECL,0.498,ECOLAB INC,"Ecolab Inc. provides water, hygiene, and energy technologies and services worldwide."
TT,0.5001,TRANE TECHNOLOGIES PLC,"Trane Technologies plc provides climate control solutions for buildings, homes, and transportation."
SWK,0.5181,STANLEY BLACK & DECKER INC,"Stanley Black & Decker, Inc. engages in tools and storage, industrial, and security businesses worldwide."
ITW,0.5264,ILLINOIS TOOL WORKS,Illinois Tool Works Inc. manufactures and sells industrial products and equipment worldwide. It operates through seven segments: Automotive OEM; Food Equipment; Test & Measurement and Electronics; Welding; Polymers & Fluids; Construction Products; and Specialty Products.
MMM,0.5282,3M CO,"3M Company develops, manufactures, and markets various products worldwide. It operates through four business segments: Safety and Industrial, Transportation and Electronics, Health Care, and Consumer."
VMC,0.5325,VULCAN MATERIALS CO,"Vulcan Materials Company produces and supplies construction materials primarily in the United States. The company operates through four segments: Aggregates, Asphalt, Concrete, and Calcium."
FMC,0.544,FMC CORP,"FMC Corporation, an agricultural sciences company, provides crop protection, plant health, and professional pest and turf management products."
CBE,0.5513,COOPER INDUSTRIES PLC,"Cooper Industries plc manufactures and sells electrical components and tools in the United States and internationally. It operates in two segments, Energy and Safety Solutions, and Electrical Products Group."
WHR,0.5527,WHIRLPOOL CORP,"Whirlpool Corporation manufactures and markets home appliances and related products. It operates through four segments: North America; Europe, Middle East and Africa; Latin America; and Asia."
PH,0.5733,PARKER-HANNIFIN CORP,"Parker-Hannifin Corporation manufactures and sells motion and control technologies and systems for various mobile, industrial, and aerospace markets worldwide. The company operates through two segments, Diversified Industrial and Aerospace Systems."
IFF,0.5792,INTL FLAVORS & FRAGRANCES,"International Flavors & Fragrances Inc., together with its subsidiaries, manufactures flavors and fragrances for use in various consumer products. It operates through two segments, Taste and Scent."
HPC,0.5821,HERCULES INC,"Hercules Incorporated manufactures and markets chemical specialties used in making products for home, office, and industrial markets. It operates in two segments, Paper Technologies and Ventures (PTV), and Aqualon Group (Aqualon)."
ALB,0.5853,ALBEMARLE CORP,"Albemarle Corporation develops, manufactures, and markets engineered specialty chemicals worldwide. The company operates in three segments: Lithium, Bromine Specialties, and Catalysts."
EMR,0.605,EMERSON ELECTRIC CO,"Emerson Electric Co. designs and manufactures technology and engineering products for industrial, commercial, and consumer markets worldwide. It operates through Automation Solutions and Commercial & Residential Solutions segments."
TXT,0.628,TEXTRON INC,"Textron Inc. operates in the aircraft, defense, industrial, and finance businesses worldwide."
ATI,0.6382,ALLEGHENY TECHNOLOGIES INC,"Allegheny Technologies Incorporated manufactures and sells specialty materials and components worldwide. The company operates in two segments, High Performance Materials & Components and Advanced Alloys & Solutions."
FDX,0.6614,FEDEX CORP,"FedEx Corporation provides transportation, e-commerce, and business services worldwide. Its FedEx Express segment offers shipping services for delivery of packages and freight."
GR,0.6722,GOODRICH CORP,"Goodrich Corporation supplies aerospace components, systems, and services for the commercial and general aviation airplane, and defense and space markets primarily in the United States, Europe, Canada, and the Asia Pacific."
MHK,0.6766,MOHAWK INDUSTRIES INC,"Mohawk Industries, Inc. designs, manufactures, sources, distributes, and markets flooring products for remodeling and new constructions of residential and commercial spaces in the United States, Europe, Russia, and internationally."
SIAL,0.6795,SIGMA-ALDRICH CORP,"Sigma-Aldrich Corporation, a life science and high technology company, develops, manufactures, purchases, and distributes various chemicals, biochemicals, and equipment products worldwide."
BDK,0.6847,BLACK & DECKER CORP,"The Black & Decker Corporation designs and manufactures power tools, outdoor yard care equipment, and home products."
GWW,0.6962,GRAINGER (W W) INC,"W.W. Grainger, Inc. distributes maintenance, repair, and operating (MRO) products and services in the United States, Canada, and internationally."
F,0.7191,FORD MOTOR CO,"Ford Motor Company designs, manufactures, markets, and services a range of Ford cars, trucks, sport utility vehicles, electrified vehicles, and Lincoln luxury vehicles worldwide. It operates through three segments: Automotive, Mobility, and Ford Credit."
BC,0.724,BRUNSWICK CORP,"Brunswick Corporation designs, manufactures, and markets recreation products worldwide."
UNH,0.7266,UNITEDHEALTH GROUP INC,"UnitedHealth Group Incorporated operates as a diversified health care company in the United States. It operates through four segments: UnitedHealthcare, OptumHealth, OptumInsight, and OptumRx."
MTW,0.7332,MANITOWOC CO,"The Manitowoc Company, Inc. provides engineered lifting equipment for the construction industry in the Americas, Europe, Africa, the Middle East, and the Asia Pacific."
R,0.7417,RYDER SYSTEM INC,"Ryder System, Inc. provides transportation and supply chain management solutions worldwide. The company operates through three segments: Fleet Management Solutions (FMS), Supply Chain Solutions (SCS), and Dedicated Transportation Solutions (DTS)."
HAS,0.7505,HASBRO INC,"Hasbro, Inc., together with its subsidiaries, operates as a play and entertainment company. The company's U.S."
