,dist,conm,busdesc
STI,0.0,SUNTRUST BANKS INC,"As of December 6, 2019, SunTrust Banks, Inc. was acquired by BB&T Corporation. SunTrust Banks, Inc. operates as the holding company for SunTrust Bank that provides various financial services for consumers, businesses, corporations, institutions, and not-for-profit entities in the United States."
PNC,0.1568,PNC FINANCIAL SVCS GROUP INC,"The PNC Financial Services Group, Inc. operates as a diversified financial services company in the United States."
FITB,0.1597,FIFTH THIRD BANCORP,Fifth Third Bancorp operates as a diversified financial services company in the United States.
CFG,0.172,CITIZENS FINANCIAL GROUP INC,"Citizens Financial Group, Inc. operates as the bank holding company for Citizens Bank, National Association that provides retail and commercial banking products and services in the United States. The company operates in two segments, Consumer Banking and Commercial Banking."
RF,0.1771,REGIONS FINANCIAL CORP,"Regions Financial Corporation, a financial holding company, provides banking and bank-related services to individual and corporate customers. It operates through three segments: Corporate Bank, Consumer Bank, and Wealth Management."
HBAN,0.1779,HUNTINGTON BANCSHARES,"Huntington Bancshares Incorporated operates as a holding company for The Huntington National Bank that provides commercial, small business, consumer, and mortgage banking services."
KEY,0.183,KEYCORP,"KeyCorp operates as the holding company for KeyBank National Association that provides various retail and commercial banking services in the United States. It operates in two segments, Consumer Bank and Commercial Bank."
BAC,0.1916,BANK OF AMERICA CORP,"Bank of America Corporation, through its subsidiaries, provides banking and financial products and services for individual consumers, small- and middle-market businesses, institutional investors, large corporations, and governments worldwide."
TFC,0.1932,TRUIST FINANCIAL CORP,"Truist Financial Corporation, a holding company, provides banking and trust services for small and mid-size businesses, public agencies, local governments, corporations, and individuals in the Southeastern and Mid-Atlantic United States."
MTB,0.2061,M & T BANK CORP,"M&T Bank Corporation operates as the holding company for Manufacturers and Traders Trust Company; and Wilmington Trust, National Association that provide banking services."
ZION,0.2099,ZIONS BANCORPORATION NA,"Zions Bancorporation, National Association provides various banking and related services primarily in Arizona, California, Colorado, Idaho, Nevada, New Mexico, Oregon, Texas, Utah, Washington, and Wyoming."
USB,0.2152,U S BANCORP,"U.S. Bancorp, a financial services holding company, provides various financial services in the United States."
SNV,0.2183,SYNOVUS FINANCIAL CORP,"Synovus Financial Corp. operates as the bank holding company for Synovus Bank that provides various financial products and services. It operates through three segments: Community Banking, Wholesale Banking, and Financial Management Services."
FHN,0.2495,FIRST HORIZON CORP,"First Horizon Corporation operates as the bank holding company for First Horizon Bank that provides various financial services. The company operates through four segments: Regional Banking, Fixed Income, Corporate, and Non-Strategic."
PBCT,0.2524,PEOPLE'S UNITED FINL INC,"People's United Financial, Inc. operates as the bank holding company for People's United Bank, National Association that provides commercial banking, retail banking, and wealth management services to individual, corporate, and municipal customers."
LNC,0.2572,LINCOLN NATIONAL CORP,"Lincoln National Corporation, through its subsidiaries, operates multiple insurance and retirement businesses in the United States. It operates through four segments: Annuities, Retirement Plan Services, Life Insurance, and Group Protection."
UNM,0.3038,UNUM GROUP,"Unum Group, together with its subsidiaries, provides financial protection benefit solutions in the United States, the United Kingdom, Poland, and internationally. It operates through Unum US, Unum International, Colonial Life, and Closed Block segments."
RJF,0.3187,RAYMOND JAMES FINANCIAL CORP,"Raymond James Financial, Inc., through its subsidiaries, engages in the underwriting, distribution, trading, and brokerage of equity and debt securities in the United States, Canada, and Europe."
SCHW,0.3216,SCHWAB (CHARLES) CORP,"The Charles Schwab Corporation, through its subsidiaries, provides wealth management, securities brokerage, banking, asset management, custody, and financial advisory services. The company operates through two segments, Investor Services and Advisor Services."
PRU,0.3574,PRUDENTIAL FINANCIAL INC,"Prudential Financial, Inc., through its subsidiaries, provides insurance, investment management, and other financial products and services."
SIVB,0.3593,SVB FINANCIAL GROUP,"SVB Financial Group, a diversified financial services company, provides various banking and financial products and services. The company operates through four segments: Global Commercial Bank, SVB Private Bank, SVB Capital, and SVB Leerink."
GS,0.3824,GOLDMAN SACHS GROUP INC,"The Goldman Sachs Group, Inc. operates as an investment banking, securities, and investment management company worldwide. It operates in four segments: Investment Banking, Global Markets, Asset Management, and Consumer & Wealth Management."
FRC,0.4455,FIRST REPUBLIC BANK,"First Republic Bank, together with its subsidiaries, provides private banking, private business banking, real estate lending, and wealth management services to clients in metropolitan areas in the United States. It operates through two segments, Commercial Banking and Wealth Management."
COF,0.4474,CAPITAL ONE FINANCIAL CORP,"Capital One Financial Corporation operates as the financial services holding company for the Capital One Bank (USA), National Association; and Capital One, National Association, which provides various financial products and services in the United States, the United Kingdom, and Canada."
AMP,0.4478,AMERIPRISE FINANCIAL INC,"Ameriprise Financial, Inc., through its subsidiaries, provides various financial products and services to individual and institutional clients in the United States and internationally."
GL,0.448,GLOBE LIFE INC,"Globe Life Inc., through its subsidiaries, provides various life and supplemental health insurance products, and annuities to lower middle to middle income households in the United States."
ETFC,0.4723,E TRADE FINANCIAL CORP,"E*TRADE Financial Corporation, a financial services company, provides brokerage, and related products and services for traders, investors, registered investment advisors (RIAs), and stock plan administrators and participants."
BK,0.4737,BANK OF NEW YORK MELLON CORP,"The Bank of New York Mellon Corporation provides a range of financial products and services to in the United States and internationally. The company operates through two segments, Investment Management and Investment Services."
JEF,0.4856,JEFFERIES FINANCIAL GRP INC,"Jefferies Financial Group Inc., a diversified financial services company, engages in investment banking and capital markets, asset management, and direct investing businesses in the Americas, Europe, the Middle East, Africa, and Asia."
DFS,0.5003,DISCOVER FINANCIAL SVCS,"Discover Financial Services, through its subsidiaries, operates as a direct banking and payment services company in the United States. It operates in two segments, Direct Banking and Payment Services."
CIT,0.5028,CIT GROUP INC,"CIT Group Inc. operates as the holding company for CIT Bank, N.A. that provides banking and related services to commercial and individual customers. The company operates through Commercial Banking and Consumer Banking segments."
STT,0.5068,STATE STREET CORP,"State Street Corporation, through its subsidiaries, provides a range of financial products and services to institutional investors worldwide."
NTRS,0.508,NORTHERN TRUST CORP,"Northern Trust Corporation, a financial holding company, provides wealth management, asset servicing, asset management, and banking solutions for corporations, institutions, families, and individuals worldwide."
MET,0.5084,METLIFE INC,"MetLife, Inc. engages in the insurance, annuities, employee benefits, and asset management businesses worldwide. It operates through five segments: U.S.; Asia; Latin America; Europe, the Middle East and Africa; and MetLife Holdings."
AXP,0.5759,AMERICAN EXPRESS CO,"American Express Company, together with its subsidiaries, provides charge and credit payment card products, and travel-related services worldwide. The company operates through three segments: Global Consumer Services Group, Global Commercial Services, and Global Merchant and Network Services."
CME,0.607,CME GROUP INC,"CME Group Inc., through its subsidiaries, operates contract markets for the trading of futures and options on futures contracts worldwide."
SYF,0.6243,SYNCHRONY FINANCIAL,"Synchrony Financial operates as a consumer financial services company in the United States. It delivers a range of specialized financing programs and consumer banking products to digital, retail, home, auto, travel, health, and pet industries."
PWR,0.6274,QUANTA SERVICES INC,"Quanta Services, Inc. provides specialty contracting services in the United States, Canada, Australia, Latin America, and internationally."
NAVI,0.6448,NAVIENT CORP,"Navient Corporation provides education loan management and business processing solutions for education, healthcare, and government clients at the federal, state, and local levels in the United States."
MTG,0.6727,MGIC INVESTMENT CORP/WI,"MGIC Investment Corporation, through its subsidiaries, provides private mortgage insurance, other mortgage credit risk management solutions, and ancillary services to lenders and government sponsored entities in the United States, Puerto Rico, and Guam."
TEX,0.7242,TEREX CORP,"Terex Corporation manufactures and sells aerial work platforms, materials processing machinery, and cranes worldwide. The company operates in two segments, Aerial Work Platforms (AWP) and Material Processing (MP)."
NSM,0.7291,NATIONSTAR MORTGAGE HOLDINGS,"Nationstar Mortgage Holdings Inc., together with its subsidiaries, provides servicing, origination, and transaction based services primarily to single-family residences in the United States. It operates in three segments: Servicing, Originations, and Xome."
WRK,0.7379,WESTROCK CO,"WestRock Company manufactures and sells paper and packaging solutions in North America, South America, Europe, Asia, and Australia. The company operates through Corrugated Packaging and Consumer Packaging segments."
ADS,0.7404,ALLIANCE DATA SYSTEMS CORP,"Alliance Data Systems Corporation provides data-driven marketing and loyalty solutions in the United States, Canada, Europe, the Middle East, Africa, the Asia Pacific, and others. It operates through two segments, LoyaltyOne and Card Services."
SSP,0.7845,EW SCRIPPS  -CL A,"The E.W. Scripps Company, together with its subsidiaries, operates as a media enterprise through a portfolio of local and national media brands. The company operates through Local Media, National Media, and Other segments."
IP,0.7877,INTL PAPER CO,"International Paper Company operates as a paper and packaging company primarily in United States, the Middle East, Europe, Africa, Pacific Rim, Asia, and the Americas. It operates through three segments: Industrial Packaging, Global Cellulose Fibers, and Printing Papers."
BHF,0.8012,BRIGHTHOUSE FINANL INC,"Brighthouse Financial, Inc. provides annuity and life insurance products in the United States. It operates through three segments: Annuities, Life, and Run-off."
NCLH,0.8555,NORWEGIAN CRUISE LINE HLDGS,"Norwegian Cruise Line Holdings Ltd., together with its subsidiaries, operates as a cruise company in the North America, Europe, the Asia-Pacific, and internationally. The company operates the Norwegian Cruise Line, Oceania Cruises, and Regent Seven Seas Cruises brands."
