,dist,conm,busdesc
HES,0.0,HESS CORP,"Hess Corporation, an exploration and production company, explores, develops, produces, purchases, transports, and sells crude oil, natural gas liquids (NGLs), and natural gas. It operates through two segments, Exploration and Production, and Midstream."
COP,0.2289,CONOCOPHILLIPS,"ConocoPhillips explores for, produces, transports, and markets crude oil, bitumen, natural gas, liquefied natural gas (LNG), and natural gas liquids worldwide."
MUR,0.2474,MURPHY OIL CORP,"Murphy Oil Corporation operates as an oil and natural gas exploration and production company in the United States, Canada, and internationally. It explores for and produces crude oil, natural gas, and natural gas liquids."
MRO,0.2589,MARATHON OIL CORP,Marathon Oil Corporation operates as an independent exploration and production company in the United States and Equatorial Guinea.
DVN,0.2651,DEVON ENERGY CORP,"Devon Energy Corporation, an independent energy company, primarily engages in the exploration, development, and production of oil, natural gas, and natural gas liquids in the United States. It operates approximately 3,955 gross wells."
EOG,0.2691,EOG RESOURCES INC,"EOG Resources, Inc., together with its subsidiaries, explores for, develops, produces, and markets crude oil, and natural gas and natural gas liquids."
OXY,0.27,OCCIDENTAL PETROLEUM CORP,"Occidental Petroleum Corporation, together with its subsidiaries, engages in the acquisition, exploration, and development of oil and gas properties in the United States, the Middle East, and Latin America."
NBR,0.2973,NABORS INDUSTRIES LTD,"Nabors Industries Ltd. provides drilling and drilling-related services for land-based and offshore oil and natural gas wells. It operates through five segments: U.S. Drilling, Canada Drilling, International Drilling, Drilling Solutions, and Rig Technologies."
HP,0.2993,HELMERICH & PAYNE,"Helmerich & Payne, Inc., together with its subsidiaries, provides drilling services and solutions for exploration and production companies. The company operates through three segments: North America Solutions, Offshore Gulf of Mexico, and International Solutions."
APC,0.3038,ANADARKO PETROLEUM CORP,"Anadarko Petroleum Corporation engages in the exploration, development, production, and marketing of oil and gas properties. It operates through three segments: Exploration and Production, WES Midstream, and Other Midstream."
APA,0.305,APACHE CORP,"Apache Corporation, an independent energy company, explores for, develops, and produces natural gas, crude oil, and natural gas liquids (NGLs)."
CVX,0.3086,CHEVRON CORP,"Chevron Corporation, through its subsidiaries, engages in integrated energy, chemicals, and petroleum operations worldwide. The company operates in two segments, Upstream and Downstream."
QEP,0.3189,QEP RESOURCES INC,"QEP Resources, Inc. operates as a crude oil and natural gas exploration and production company in the United States. The company conducts exploration and production activities in the Permian Basin in Western Texas; and Williston Basin in North Dakota."
WPX,0.339,WPX ENERGY INC,"WPX Energy, Inc., an independent oil and natural gas exploration and production company, engages in the exploitation and development of unconventional properties in the United States. It produces oil, natural gas, and natural gas liquids."
XEC,0.3469,CIMAREX ENERGY CO,"Cimarex Energy Co. operates as an independent oil and gas exploration and production company primarily in Texas, Oklahoma, and New Mexico."
PXD,0.3534,PIONEER NATURAL RESOURCES CO,"Pioneer Natural Resources Company operates as an independent oil and gas exploration and production company in the United States. The company explores for, develops, and produces oil, natural gas liquids (NGLs), and gas. It has operations primarily in the Permian Basin in West Texas."
SLB,0.3578,SCHLUMBERGER LTD,"Schlumberger Limited supplies technology for reservoir characterization, drilling, production, and processing to the oil and gas industry worldwide. It operates in four divisions: Digital & Integration, Reservoir Performance, Well Construction, and Production Systems."
HAL,0.3726,HALLIBURTON CO,Halliburton Company provides a range of services and products to oil and natural gas companies worldwide.
CXO,0.3817,CONCHO RESOURCES INC,"Concho Resources Inc., an independent oil and natural gas company, engages in the acquisition, development, and exploration of oil and natural gas properties in the United States. The company's principal operating areas are located in the Permian Basin of West Texas and southeast New Mexico."
NFX,0.383,NEWFIELD EXPLORATION CO,"Ovintiv Exploration Inc. engages in the exploration, development, and production of crude oil, natural gas, and natural gas liquids in the United States. Ovintiv Exploration Inc. was formerly known as Newfield Exploration Company and changed its name to Ovintiv Exploration Inc. in 2020."
NBL,0.39,NOBLE ENERGY INC,"Noble Energy, Inc., an independent energy company, engages in the acquisition, exploration, development, and production of crude oil and natural gas worldwide. The company also owns, operates, develops, and acquires domestic midstream infrastructure assets in the DJ and Delaware Basins."
XOM,0.407,EXXON MOBIL CORP,"Exxon Mobil Corporation explores for and produces crude oil and natural gas in the United States, Canada/other Americas, Europe, Africa, Asia, and Australia/Oceania. It operates through Upstream, Downstream, and Chemical segments."
RRC,0.4337,RANGE RESOURCES CORP,"Range Resources Corporation operates as an independent natural gas, natural gas liquids (NGLs), and oil company in the United States. The company engages in the exploration, development, and acquisition of natural gas and oil properties."
RIG,0.4347,TRANSOCEAN LTD,"Transocean Ltd., together with its subsidiaries, provides offshore contract drilling services for oil and gas wells worldwide. The company primarily offers drilling rigs, related equipment, and work crews; and ultra-deepwater and harsh environment drilling services."
FANG,0.4609,DIAMONDBACK ENERGY INC,"Diamondback Energy, Inc., an independent oil and natural gas company, focuses on the acquisition, development, exploration, and exploitation of unconventional and onshore oil and natural gas reserves in the Permian Basin in West Texas."
RDC,0.4639,ROWAN COMPANIES LTD,"Rowan Companies Limited provides offshore contract drilling services to the oil and gas industry. It operates through three segments: Deepwater, Jack-ups, and ARO. The Deepwater segment operates 4 ultra-deepwater drillships. The Jack-ups segment operates 15 self-elevating jack-up rigs."
BHI,0.4735,BAKER HUGHES INC,"Baker Hughes Holdings LLC operates as an energy technology company. The company operates through four segments: Oilfield Services, Oilfield Equipment, Turbomachinery & Process Solutions, and Digital Solutions."
NOV,0.4785,NATIONAL OILWELL VARCO INC,"National Oilwell Varco, Inc. designs, constructs, manufactures, and sells systems, components, and products for oil and gas drilling and production worldwide. It operates through three segments: Wellbore Technologies, Completion & Production Solutions, and Rig Technologies."
LYB,0.4887,LYONDELLBASELL INDUSTRIES NV,"LyondellBasell Industries N.V. operates as a chemical company in the United States, Germany, Mexico, Italy, France, Japan, China, the Netherlands, and internationally."
CNX,0.4955,CNX RESOURCES CORPORATION,"CNX Resources Corporation, an independent oil and gas company, explores for, develops, and produces natural gas properties primarily in the Appalachian Basin. The company operates through two divisions, Exploration and Production (E&P), and Midstream."
FCX,0.4962,FREEPORT-MCMORAN INC,"Freeport-McMoRan Inc. engages in the mining of mineral properties in North America, South America, and Indonesia. The company primarily explores for copper, gold, molybdenum, silver, and other metals, as well as oil and gas."
SWN,0.5062,SOUTHWESTERN ENERGY CO,"Southwestern Energy Company, an independent energy company, engages in the exploration, development, and production of natural gas, oil, and natural gas liquids (NGLs) in the United States. It operates through Exploration and Production, and Marketing segments."
EQT,0.5333,EQT CORP,"EQT Corporation operates as a natural gas production company in the United States. The company produces natural gas, natural gas liquids (NGLs), and crude oil."
OKE,0.5399,ONEOK INC,"ONEOK, Inc., together with its subsidiaries, engages in gathering, processing, storage, and transportation of natural gas in the United States. It operates through Natural Gas Gathering and Processing, Natural Gas Liquids, and Natural Gas Pipelines segments."
FPL,0.5606,FIRST TR NEW OPP MLP &ENERGY,First Trust New Opportunities MLP & Energy Fund is a closed-ended balanced mutual fund launched and managed by First Trust Advisors L.P. It is co-managed by Energy Income Partners LLC. The fund invests in the public equity and fixed income markets of the United States.
KMI,0.5612,KINDER MORGAN INC,"Kinder Morgan, Inc. operates as an energy infrastructure company in North America. The company operates through Natural Gas Pipelines, Products Pipelines, Terminals, and CO2 segments."
COG,0.5885,CABOT OIL & GAS CORP,"Cabot Oil & Gas Corporation, an independent oil and gas company, explores for, exploits, develops, produces, and markets oil and gas properties in the United States."
EMN,0.5902,EASTMAN CHEMICAL CO,Eastman Chemical Company operates as an advanced materials and specialty additives company worldwide.
AKS,0.6278,AK STEEL HOLDING CORP,"AK Steel Holding Corporation, through its subsidiary, AK Steel Corporation, produces flat-rolled carbon, and stainless and electrical steel products in the United States and internationally."
WMB,0.644,WILLIAMS COS INC,"The Williams Companies, Inc., together with its subsidiaries, operates as an energy infrastructure company primarily in the United States. It operates through Atlantic-Gulf, Northeast G&P, and West segments."
CPGX,0.6523,COLUMBIA PIPELINE GROUP INC,"Columbia Pipeline Group, Inc., together with its subsidiaries, owns, operates, and develops a portfolio of pipelines, storage, and related midstream assets."
CAM,0.6596,CAMERON INTERNATIONAL CORP,"Cameron International Corporation provides flow equipment products, systems, and services worldwide."
DD,0.6754,DUPONT DE NEMOURS INC,"DuPont de Nemours, Inc. provides technology-based materials, ingredients, and solutions in the United States, Canada, the Asia Pacific, Latin America, Europe, the Middle East, and Africa."
OI,0.6807,O-I GLASS INC,"O-I Glass, Inc., through its subsidiaries, manufactures and sells glass containers to food and beverage manufacturers primarily in the Americas, Europe, and the Asia Pacific. It produces glass containers for alcoholic beverages, including beer, flavored malt beverages, spirits, and wine."
NUE,0.6815,NUCOR CORP,"Nucor Corporation manufactures and sells steel and steel products. It operates in three segments: Steel Mills, Steel Products, and Raw Materials."
CLF,0.6879,CLEVELAND-CLIFFS INC,"Cleveland-Cliffs Inc. operates as an independent iron ore mining company in the United States, Canada, and internationally. It operates in two segments, Mining and Pelletizing, and Metallics."
MOS,0.6993,MOSAIC CO,"The Mosaic Company, through its subsidiaries, produces and markets concentrated phosphate and potash crop nutrients in North America and internationally. The company operates through three segments: Phosphates, Potash, and Mosaic Fertilizantes."
X,0.7095,UNITED STATES STEEL CORP,"United States Steel Corporation produces and sells flat-rolled and tubular steel products primarily in North America and Europe. It operates through three segments: North American Flat-Rolled (Flat-Rolled), U. S. Steel Europe (USSE), and Tubular Products (Tubular)."
CE,0.7344,CELANESE CORP,"Celanese Corporation, a technology and specialty materials company, manufactures and sells high performance engineered polymers in the United States and internationally. The company operates through Engineered Materials, Acetate Tow, and Acetyl Chain segments."
JEF,0.7366,JEFFERIES FINANCIAL GRP INC,"Jefferies Financial Group Inc., a diversified financial services company, engages in investment banking and capital markets, asset management, and direct investing businesses in the Americas, Europe, the Middle East, Africa, and Asia."
ECL,0.7633,ECOLAB INC,"Ecolab Inc. provides water, hygiene, and energy technologies and services worldwide."
CSX,0.783,CSX CORP,"CSX Corporation, together with its subsidiaries, provides rail-based freight transportation services."
KSU,0.7833,KANSAS CITY SOUTHERN,"Kansas City Southern, a transportation holding company, provides domestic and international rail transportation services in North America."
XRX,0.8421,XEROX HOLDINGS CORP,"Xerox Holdings Corporation designs, develops, and sells document management systems and solutions in the United States, Europe, Canada, and internationally."
NSC,0.8431,NORFOLK SOUTHERN CORP,"Norfolk Southern Corporation, together with its subsidiaries, engages in the rail transportation of raw materials, intermediate products, and finished goods in the United States."
ODP,0.8552,ODP CORP,"The ODP Corporation provides business services and supplies, products, and technology solutions for small, medium, and enterprise businesses. The company operates in three divisions: Business Solutions, Retail, and CompuCom."
TWTR,0.8616,TWITTER INC,"Twitter, Inc. operates as a platform for public self-expression and conversation in real time United States and internationally."
PPG,0.87,PPG INDUSTRIES INC,"PPG Industries, Inc. manufactures and distributes paints, coatings, and specialty materials worldwide."
IGT,0.8938,INTL GAME TECHNOLOGY PLC,"International Game Technology PLC operates and provides gaming technology products and services worldwide. The company operates through four segments: North America Gaming and Interactive, North America Lottery, International, and Italy."
