,dist,conm,busdesc
ETN,0.0,EATON CORP PLC,Eaton Corporation plc operates as a power management company worldwide.
PH,0.4253,PARKER-HANNIFIN CORP,"Parker-Hannifin Corporation manufactures and sells motion and control technologies and systems for various mobile, industrial, and aerospace markets worldwide. The company operates through two segments, Diversified Industrial and Aerospace Systems."
CAT,0.502,CATERPILLAR INC,"Caterpillar Inc. manufactures and sells construction and mining equipment, diesel and natural gas engines, and industrial gas turbines."
TEL,0.5221,TE CONNECTIVITY LTD,"TE Connectivity Ltd., together with its subsidiaries, manufactures and sells connectivity and sensor solutions in Europe, the Middle East, Africa, the Asia-Pacific, and the Americas."
DOV,0.5359,DOVER CORP,"Dover Corporation provides equipment and components, consumable supplies, aftermarket parts, software and digital solutions, and support services worldwide."
ITW,0.5439,ILLINOIS TOOL WORKS,Illinois Tool Works Inc. manufactures and sells industrial products and equipment worldwide. It operates through seven segments: Automotive OEM; Food Equipment; Test & Measurement and Electronics; Welding; Polymers & Fluids; Construction Products; and Specialty Products.
JCI,0.5493,JOHNSON CONTROLS INTL PLC,"Johnson Controls International plc operates as a diversified technology and multi industrial company worldwide. It operates through Building Solutions North America, Building Solutions EMEA/LA, Building Solutions Asia Pacific, and Global Products segments."
PNR,0.5513,PENTAIR PLC,"Pentair plc provides various smart water solutions worldwide. It operates through three segments: Aquatic Systems, Filtration Solutions, and Flow Technologies."
TT,0.5646,TRANE TECHNOLOGIES PLC,"Trane Technologies plc provides climate control solutions for buildings, homes, and transportation."
CBE,0.5926,COOPER INDUSTRIES PLC,"Cooper Industries plc manufactures and sells electrical components and tools in the United States and internationally. It operates in two segments, Energy and Safety Solutions, and Electrical Products Group."
HON,0.6107,HONEYWELL INTERNATIONAL INC,Honeywell International Inc. operates as a diversified technology and manufacturing company worldwide.
FAST,0.6167,FASTENAL CO,"Fastenal Company, together with its subsidiaries, engages in the wholesale distribution of industrial and construction supplies in the United States, Canada, Mexico, North America, and internationally."
NSC,0.6274,NORFOLK SOUTHERN CORP,"Norfolk Southern Corporation, together with its subsidiaries, engages in the rail transportation of raw materials, intermediate products, and finished goods in the United States."
IEX,0.6289,IDEX CORP,"IDEX Corporation, together with its subsidiaries, operates as an applied solutions company worldwide. The company operates through three segments: Fluid & Metering Technologies (FMT), Health & Science Technologies (HST), and Fire & Safety/Diversified Products (FSDP)."
EMR,0.639,EMERSON ELECTRIC CO,"Emerson Electric Co. designs and manufactures technology and engineering products for industrial, commercial, and consumer markets worldwide. It operates through Automation Solutions and Commercial & Residential Solutions segments."
RHI,0.6485,ROBERT HALF INTL INC,"Robert Half International Inc. provides staffing and risk consulting services in North America, South America, Europe, Asia, and Australia."
OMX,0.6528,OFFICEMAX INC,"OfficeMax Incorporated, together with its subsidiaries, distributes business-to-business and retail office products."
SNA,0.6576,SNAP-ON INC,"Snap-on Incorporated manufactures and markets tools, equipment, diagnostics, and repair information and systems solutions for professional users worldwide."
UIS,0.6756,UNISYS CORP,"Unisys Corporation operates as an information technology company worldwide. It operates in two segments, Services and Technology. The Services segment offers cloud and infrastructure services, application services, and business process outsourcing services."
XRX,0.6879,XEROX HOLDINGS CORP,"Xerox Holdings Corporation designs, develops, and sells document management systems and solutions in the United States, Europe, Canada, and internationally."
MWW,0.694,MONSTER WORLDWIDE INC,"Monster Worldwide, Inc., together with its subsidiaries, provides online and mobile employment and recruitment solutions worldwide. The company operates in three segments: Careers-North America, Careers-International, and Internet Advertising & Fees."
FDX,0.7051,FEDEX CORP,"FedEx Corporation provides transportation, e-commerce, and business services worldwide. Its FedEx Express segment offers shipping services for delivery of packages and freight."
TPR,0.7187,TAPESTRY INC,"Tapestry, Inc. provides luxury accessories and branded lifestyle products in the United States, Japan, China, Hong Kong, Macau, Taiwan, Europe, Canada, South Korea, Malaysia, Singapore, Australia, and New Zealand."
EL,0.7229,LAUDER (ESTEE) COS INC -CL A,"The Estee Lauder Companies Inc. manufactures and markets skin care, makeup, fragrance, and hair care products worldwide."
IPGP,0.7342,IPG PHOTONICS CORP,"IPG Photonics Corporation develops and manufactures a range of high-performance fiber lasers, fiber amplifiers, and diode lasers used in various applications primarily in materials processing worldwide."
MDP,0.7351,MEREDITH CORP,"Meredith Corporation operates as a diversified media company primarily in the United States. It operates in two segments, National Media and Local Media."
SSP,0.7414,EW SCRIPPS  -CL A,"The E.W. Scripps Company, together with its subsidiaries, operates as a media enterprise through a portfolio of local and national media brands. The company operates through Local Media, National Media, and Other segments."
SPGI,0.7485,S&P GLOBAL INC,"S&P Global Inc., together with its subsidiaries, provides ratings, benchmarks, analytics, and data to the capital and commodity markets worldwide."
ALB,0.7553,ALBEMARLE CORP,"Albemarle Corporation develops, manufactures, and markets engineered specialty chemicals worldwide. The company operates in three segments: Lithium, Bromine Specialties, and Catalysts."
BA,0.7584,BOEING CO,"The Boeing Company, together with its subsidiaries, designs, develops, manufactures, sales, services, and supports commercial jetliners, military aircraft, satellites, missile defense, human space flight and launch systems, and services worldwide."
PPG,0.7629,PPG INDUSTRIES INC,"PPG Industries, Inc. manufactures and distributes paints, coatings, and specialty materials worldwide."
CHRW,0.7809,C H ROBINSON WORLDWIDE INC,"C.H. Robinson Worldwide, Inc., a third party logistics company, provides freight transportation services and logistics solutions to companies in various industries worldwide. The company operates through North American Surface Transportation and Global Forwarding segments."
IRM,0.7823,IRON MOUNTAIN INC,"Iron Mountain Incorporated (NYSE: IRM), founded in 1951, is the global leader for storage and information management services."
AME,0.7892,AMETEK INC,"AMETEK, Inc. manufactures and sells electronic instruments and electromechanical devices worldwide. It operates through two segments, Electronic Instruments (EIG) and Electromechanical (EMG)."
AVP,0.7952,AVON PRODUCTS,"Avon Products, Inc. manufactures, markets, and sells beauty and related products in Europe, the Middle East, Africa, south Latin America, north Latin America, and the Asia Pacific."
AOS,0.798,SMITH (A.O.),"A. O. Smith Corporation manufactures and markets residential and commercial gas and electric water heaters, boilers, tanks, and water treatment products in North America, China, Europe, and India. It operates through two segments, North America and Rest of World."
RX,0.8142,IMS HEALTH HOLDINGS INC,"As of October 3, 2016, IMS Health Holdings, Inc. was acquired by Quintiles IMS Holdings, Inc. IMS Health Holdings, Inc. provides information and technology services to healthcare industry worldwide."
PTV,0.8175,PACTIV CORP,"Pactiv LLC manufactures and distributes food packaging and foodservice products. Its product lines include custom and stock foam, plastic, aluminum, pressed-paperboard, PE coated board, and molded-fiber packaging."
H,0.8219,HYATT HOTELS CORP,"Hyatt Hotels Corporation, a hospitality company, develops, owns, operates, manages, franchises, licenses, or provides services to hotels, resorts, and other properties."
ALGN,0.8831,ALIGN TECHNOLOGY INC,"Align Technology, Inc., a medical device company, designs, manufactures, and markets Invisalign clear aligners and iTero intraoral scanners and services for orthodontists and general practitioner dentists, and restorative and aesthetic dentistry."
PKI,0.9077,PERKINELMER INC,"PerkinElmer, Inc. provides products, services, and solutions to the diagnostics, life sciences, and applied services markets worldwide. The company operates in two segments, Discovery & Analytical Solutions and Diagnostics."
