,dist,conm,busdesc
TIN,0.0,TEMPLE-INLAND INC,"Temple-Inland LLC went out of business. Temple-Inland LLC, through its subsidiaries, manufactures and sells corrugated packaging and building products in the United States and Mexico."
GR,0.0613,GOODRICH CORP,"Goodrich Corporation supplies aerospace components, systems, and services for the commercial and general aviation airplane, and defense and space markets primarily in the United States, Europe, Canada, and the Asia Pacific."
UST,0.122,PROSHARES ULTRA 7-10 YR TRES,ProShares Trust - ProShares Ultra 7-10 Year Treasury is an exchange traded fund launched and managed by ProShare Advisors LLC. The fund invests in the fixed income markets of the United States.
JNJ,0.2477,JOHNSON & JOHNSON,"Johnson & Johnson researches and develops, manufactures, and sells various products in the health care field worldwide. It operates in three segments: Consumer, Pharmaceutical, and Medical Devices."
HSY,0.2544,HERSHEY CO,"The Hershey Company, together with its subsidiaries, manufactures and sells confectionery products. The company operates through two segments, North America; and International and Other."
KMB,0.3467,KIMBERLY-CLARK CORP,"Kimberly-Clark Corporation, together with its subsidiaries, manufactures and markets personal care and consumer tissue products worldwide. It operates through three segments: Personal Care, Consumer Tissue, and K-C Professional."
CAG,0.356,CONAGRA BRANDS INC,"Conagra Brands, Inc., together with its subsidiaries, operates as a consumer packaged goods food company in North America. The company operates through Grocery & Snacks, Refrigerated & Frozen, International, and Foodservice segments."
DG,0.3608,DOLLAR GENERAL CORP,"Dollar General Corporation, a discount retailer, provides various merchandise products in the southern, southwestern, Midwestern, and eastern United States."
HNZ,0.4142,KRAFT HEINZ CO,"The Kraft Heinz Company, together with its subsidiaries, manufactures and markets food and beverage products in the United States, Canada, the United Kingdom, and internationally."
EP,0.4163,EL PASO CORP,"El Paso LLC offers natural gas transmission, and exploration and production services primarily in the United States."
AWK,0.4367,AMERICAN WATER WORKS CO INC,"American Water Works Company, Inc., through its subsidiaries, provides water and wastewater services in the United States. It offers water and wastewater services to approximately 1,700 communities in 16 states serving approximately 3.4 million active customers."
CBOE,0.4417,CBOE GLOBAL MARKETS INC,"Cboe Global Markets, Inc., through its subsidiaries, operates as an options exchange in the United States. It operates in five segments: Options, U.S. Equities, Futures, European Equities, and Global FX. The Options segment trades in listed market indices. The U.S."
VZ,0.4522,VERIZON COMMUNICATIONS INC,"Verizon Communications Inc. offers communications, information, and entertainment products and services to consumers, businesses, and governmental entities worldwide."
GIS,0.4604,GENERAL MILLS INC,"General Mills, Inc. manufactures and markets branded consumer foods worldwide. The company operates in five segments: North America Retail; Convenience Stores & Foodservice; Europe & Australia; Asia & Latin America; and Pet."
AZO,0.4755,AUTOZONE INC,"AutoZone, Inc. retails and distributes automotive replacement parts and accessories. The company offers various products for cars, sport utility vehicles, vans, and light trucks, including new and remanufactured automotive hard parts, maintenance items, accessories, and non-automotive products."
SBUX,0.5084,STARBUCKS CORP,"Starbucks Corporation, together with its subsidiaries, operates as a roaster, marketer, and retailer of specialty coffee worldwide. The company operates through three segments: Americas, International, and Channel Development."
AMT,0.5305,AMERICAN TOWER CORP,"American Tower, one of the largest global REITs, is a leading independent owner, operator and developer of multitenant communications real estate with a portfolio of approximately 181,000 communications sites."
MDLZ,0.5317,MONDELEZ INTERNATIONAL INC,"Mondelez International, Inc., through its subsidiaries, manufactures, markets, and sells snack food and beverage products worldwide."
ABT,0.5396,ABBOTT LABORATORIES,"Abbott Laboratories discovers, develops, manufactures, and sells health care products worldwide."
SBAC,0.5432,SBA COMMUNICATIONS CORP,"SBA Communications Corporation is a first choice provider and leading owner and operator of wireless communications infrastructure in North, Central, and South America and South Africa."
AAP,0.5434,ADVANCE AUTO PARTS INC,"Advance Auto Parts, Inc. provides automotive replacement parts, accessories, batteries, and maintenance items for domestic and imported cars, vans, sport utility vehicles, and light and heavy duty trucks."
GPC,0.5476,GENUINE PARTS CO,"Genuine Parts Company distributes automotive replacement parts, industrial parts and materials, and business products in the United States, Canada, Mexico, Australasia, France, the United Kingdom, Germany, Poland, the Netherlands, and Belgium."
QCOM,0.553,QUALCOMM INC,"QUALCOMM Incorporated engages in the development and commercialization of foundational technologies and products are used in mobile devices and other wireless products, including network equipment, broadband gateway equipment, consumer electronic devices, and other connected devices worldwide."
KR,0.5898,KROGER CO,"The Kroger Co. operates as a retailer in the United States. The company operates supermarkets, multi-department stores, marketplace stores, and price impact warehouse stores."
AET,0.5908,AETNA INC,"Aetna Inc. operates as a health care benefits company in the United States. It operates through three segments: Health Care, Group Insurance, and Large Case Pensions."
FBHS,0.5999,FORTUNE BRANDS HOME & SECUR,"Fortune Brands Home & Security, Inc., together with its subsidiaries, provides home and security products for residential home repair, remodeling, new construction, and security applications. It operates in three segments: Cabinets, Plumbing, and Doors & Security."
BMY,0.6076,BRISTOL-MYERS SQUIBB CO,"Bristol-Myers Squibb Company discovers, develops, licenses, manufactures, and markets biopharmaceutical products worldwide. It offers products in hematology, oncology, cardiovascular, and immunology therapeutic classes."
SJM,0.6178,SMUCKER (JM) CO,"The J. M. Smucker Company manufactures and markets food and beverage products worldwide. It operates in four segments: U.S. Retail Pet Foods, U.S. Retail Coffee, U.S. Retail Consumer Foods, and International and Away From Home."
WLTW,0.622,WILLIS TOWERS WATSON PLC,"Willis Towers Watson Public Limited Company operates as an advisory, broking, and solutions company worldwide."
KMI,0.63,KINDER MORGAN INC,"Kinder Morgan, Inc. operates as an energy infrastructure company in North America. The company operates through Natural Gas Pipelines, Products Pipelines, Terminals, and CO2 segments."
SNPS,0.6352,SYNOPSYS INC,"Synopsys, Inc. provides electronic design automation software products used to design and test integrated circuits."
CPRT,0.6433,COPART INC,"Copart, Inc. provides online auctions and vehicle remarketing services in the United States, Canada, the United Kingdom, Brazil, the Republic of Ireland, Germany, Finland, the United Arab Emirates, Oman, Bahrain, and Spain."
LB,0.6496,L BRANDS INC,"L Brands, Inc. operates as a specialty retailer of women's intimate and other apparel, personal care, and beauty and home fragrance products. The company operates in three segments: Victoria's Secret, Bath & Body Works, and Victoria's Secret and Bath & Body Works International."
CCI,0.6608,CROWN CASTLE INTL CORP,"Crown Castle owns, operates and leases more than 40,000 cell towers and approximately 80,000 route miles of fiber supporting small cells and fiber solutions across every major U.S. market."
FRX,0.6959,FOREST LABORATORIES  -CL A,"Forest Laboratories, LLC develops, manufactures, and sells branded forms of ethical drug products in the United States and Europe."
PBCT,0.722,PEOPLE'S UNITED FINL INC,"People's United Financial, Inc. operates as the bank holding company for People's United Bank, National Association that provides commercial banking, retail banking, and wealth management services to individual, corporate, and municipal customers."
JWN,0.7318,NORDSTROM INC,"Nordstrom, Inc., a fashion retailer, provides apparels, shoes, cosmetics, and accessories for women, men, young adults, and children."
HAS,0.7643,HASBRO INC,"Hasbro, Inc., together with its subsidiaries, operates as a play and entertainment company. The company's U.S."
ZBH,0.7733,ZIMMER BIOMET HOLDINGS INC,"Zimmer Biomet Holdings, Inc., together with its subsidiaries, designs, manufactures, and markets musculoskeletal healthcare products and solutions in the Americas, Europe, the Middle East, Africa, and the Asia Pacific."
MSI,0.7751,MOTOROLA SOLUTIONS INC,"Motorola Solutions, Inc. provides mission-critical communication solutions the United States, the United Kingdom, Canada, and internationally. The company operates in two segments, Products and Systems Integration, and Services and Software."
BRYN,0.7757,RNETHEALTH INC,"BRYN Resources Inc. provides corporate, capital, and communication services for small businesses worldwide. The company operates VybeOffice, an online tool that allows you to manage company online from a single portal. It also offers stock issuance, transfer, custodial, and registrar services."
BLL,0.7797,BALL CORP,"Ball Corporation supplies aluminum packaging products to the beverage, personal care, automotive, paint, healthcare, and household products industries."
ICE,0.7826,INTERCONTINENTAL EXCHANGE,"Intercontinental Exchange, Inc. operates regulated exchanges, clearing houses, and listings venues for commodity, financial, fixed income, and equity markets in the United States, the United Kingdom, European Union, Singapore, Israel, and Canada."
NFLX,0.7943,NETFLIX INC,"Netflix, Inc. provides subscription streaming entertainment service. It offers TV series, documentaries, and feature films across various genres and languages."
DGX,0.8144,QUEST DIAGNOSTICS INC,"Quest Diagnostics Incorporated provides diagnostic testing, information, and services in the United States and internationally."
CFN,0.8303,CAREFUSION CORP,"CareFusion Corporation, a medical technology company, provides various healthcare products and services. It offers product lines in the areas of medication management, infection prevention, operating room effectiveness, and respiratory care."
ALL,0.8389,ALLSTATE CORP,"The Allstate Corporation, through its subsidiaries, provides property and casualty, and other insurance products in the United States and Canada. The company operates through Allstate Protection, Service Businesses, Allstate Life, and Allstate Benefits segments."
STJ,0.8782,ST JUDE MEDICAL INC,"St. Jude Medical, Inc. was acquired by St. Jude Medical, LLC. St."
HSIC,0.8795,HENRY SCHEIN INC,"Henry Schein, Inc., a solutions company for health care professionals, provides health care products and services to office-based dental practitioners and laboratories, physician practices, government, institutional health care clinics, and other alternate care clinics worldwide."
DISH,0.93,DISH NETWORK CORP,"DISH Network Corporation, together with its subsidiaries, provides pay-TV services in the United States. The company operates in two segments, Pay-TV and Wireless."
