,dist,conm,busdesc
XEL,0.0,XCEL ENERGY INC,"Xcel Energy Inc., through its subsidiaries, generates, purchases, transmits, distributes, and sells electricity. It operates through Regulated Electric Utility, Regulated Natural Gas Utility, and All Other segments."
CMS,0.0489,CMS ENERGY CORP,"CMS Energy Corporation operates as an energy company primarily in Michigan. The company operates in four segments: Electric Utility, Gas Utility, Enterprises, and EnerBank. The Electric Utility segment is involved in the generation, purchase, transmission, distribution, and sale of electricity."
WEC,0.0557,WEC ENERGY GROUP INC,"WEC Energy Group, Inc., through its subsidiaries, provides regulated natural gas and electricity, and nonregulated renewable energy services in the United States."
ED,0.0746,CONSOLIDATED EDISON INC,"Consolidated Edison, Inc., through its subsidiaries, engages in regulated electric, gas, and steam delivery businesses in the United States."
ES,0.0793,EVERSOURCE ENERGY,"Eversource Energy, a public utility holding company, engages in the energy delivery business. The company operates in four segments: Electric Distribution, Electric Transmission, Natural Gas Distribution, and Water Distribution."
AEP,0.081,AMERICAN ELECTRIC POWER CO,"American Electric Power Company, Inc., an electric public utility holding company, engages in the generation, transmission, and distribution of electricity for sale to retail and wholesale customers in the United States."
PNW,0.0842,PINNACLE WEST CAPITAL CORP,"Pinnacle West Capital Corporation, through its subsidiary, Arizona Public Service Company, provides retail and wholesale electric services primarily in the state of Arizona."
LNT,0.0848,ALLIANT ENERGY CORP,"Alliant Energy Corporation operates as a utility holding company that provides regulated electricity and natural gas services in the Midwest region of the United States. It operates through three segments: Utility Electric Operations, Utility Gas Operations, and Utility Other."
SCG,0.0853,SCANA CORP,"SCANA Corporation, through its subsidiaries, generates, transmits, distributes, and sells electricity to wholesale and retail customers. The company operates through Electric Operations, Gas Distribution, and Gas Marketing segments."
DTE,0.0872,DTE ENERGY CO,"DTE Energy Company engages in the utility operations. The company's Electric segment generates, purchases, distributes, and sells electricity to approximately 2.2 million residential, commercial, and industrial customers in southeastern Michigan."
DUK,0.0901,DUKE ENERGY CORP,"Duke Energy Corporation, together with its subsidiaries, operates as an energy company in the United States. It operates through three segments: Electric Utilities and Infrastructure, Gas Utilities and Infrastructure, and Commercial Renewables."
PCG,0.1083,PG&E CORP,"PG&E Corporation, through its subsidiary, Pacific Gas and Electric Company, engages in the sale and delivery of electricity and natural gas to customers in northern and central California, the United States."
AEE,0.1103,AMEREN CORP,"Ameren Corporation, together with its subsidiaries, operates as a public utility holding company in the United States. It operates through four segments: Ameren Missouri, Ameren Illinois Electric Distribution, Ameren Illinois Natural Gas, and Ameren Transmission."
SO,0.1124,SOUTHERN CO,"The Southern Company, through its subsidiaries, engages in the generation, transmission, and distribution of electricity. It operates in four segments: Gas Distribution Operations, Gas Pipeline Investments, Wholesale Gas Services, and Gas Marketing Services."
D,0.1338,DOMINION ENERGY INC,"Dominion Energy, Inc. produces and transports energy. The company's Dominion Energy Virginia segment engages in the regulated electric generation, transmission, and distribution operations that serve residential, commercial, industrial, and governmental customers in Virginia and North Carolina."
PEG,0.1593,PUBLIC SERVICE ENTRP GRP INC,"Public Service Enterprise Group Incorporated, through its subsidiaries, operates as an energy company primarily in the Northeastern and Mid-Atlantic United States. It operates through two segments, PSE&G and PSEG Power."
NEE,0.165,NEXTERA ENERGY INC,"NextEra Energy, Inc., through its subsidiaries, generates, transmits, and distributes electric power in North America. The company generates electricity through wind, solar, nuclear, coal, oil, and natural gas facilities."
ATO,0.166,ATMOS ENERGY CORP,"Atmos Energy Corporation, together with its subsidiaries, engages in the regulated natural gas distribution, and pipeline and storage businesses in the United States. It operates through Distribution, and Pipeline and Storage segments."
ETR,0.1795,ENTERGY CORP,"Entergy Corporation, together with its subsidiaries, engages in the production and distribution of electricity in the United States. The company generates electricity through gas/oil, nuclear, coal, hydro, and solar power sources."
NI,0.1918,NISOURCE INC,"NiSource Inc., an energy holding company, operates as a regulated natural gas and electric utility company in the United States. The company operates through two segments, Gas Distribution Operations and Electric Operations."
PPL,0.236,PPL CORP,"PPL Corporation, a utility holding company, delivers electricity and natural gas in the United States and the United Kingdom. The company operates through three segments: U.K. Regulated, Kentucky Regulated, and Pennsylvania Regulated."
SRE,0.2901,SEMPRA ENERGY,"Sempra Energy operates as an energy-services holding company in the United States and internationally. The company's San Diego Gas & Electric Company segment generates, transmits, and distributes electricity; and supplies natural gas."
MO,0.3015,ALTRIA GROUP INC,"Altria Group, Inc., through its subsidiaries, manufactures and sells cigarettes, smokeless products, and wine in the United States."
O,0.3379,REALTY INCOME CORP,"Realty Income, The Monthly Dividend Company<sup></sup>, is an S&P 500 company dedicated to providing stockholders with dependable monthly income."
EXC,0.3559,EXELON CORP,"Exelon Corporation, a utility services holding company, engages in the generation and marketing of energy in the United States and Canada. It owns nuclear, fossil, wind, hydroelectric, biomass, and solar generating facilities."
DPS,0.3572,DR PEPPER SNAPPLE GROUP INC,"As of 2018, Dr Pepper Snapple Group, Inc is acquired by Keurig Dr Pepper Inc. Dr Pepper Snapple Group, Inc. manufactures and distributes non-alcoholic beverages in the United States, Mexico and the Caribbean, and Canada."
CNP,0.3894,CENTERPOINT ENERGY INC,"CenterPoint Energy, Inc. operates as a public utility holding company in the United States. The company's Houston Electric T&D segment electric transmission and distribution services to electric utility."
FE,0.4014,FIRSTENERGY CORP,"FirstEnergy Corp., through its subsidiaries, generates, transmits, and distributes electricity in the United States. The company operates through Regulated Distribution and Regulated Transmission segments."
K,0.4154,KELLOGG CO,"Kellogg Company, together with its subsidiaries, manufactures and markets ready-to-eat cereal and convenience foods. The company operates through four segments: North America, Europe, Latin America, and Asia Middle East Africa."
VZ,0.4533,VERIZON COMMUNICATIONS INC,"Verizon Communications Inc. offers communications, information, and entertainment products and services to consumers, businesses, and governmental entities worldwide."
CPB,0.4585,CAMPBELL SOUP CO,"Campbell Soup Company, together with its subsidiaries, engages in the manufacture and market food and beverage products. It operates through Meals & Beverages and Snacks segments. The Meals & Beverages segment engages in the retail and foodservice businesses in the United States and Canada."
RSG,0.4586,REPUBLIC SERVICES INC,"Republic Services, Inc., together with its subsidiaries, provides non-hazardous solid waste collection, transfer, disposal, recycling, and environmental services in the United States. The company serves small-container, large-container, and municipal and residential customers."
WM,0.4655,WASTE MANAGEMENT INC,"Waste Management, Inc., through its subsidiaries, provides waste management environmental services to residential, commercial, industrial, and municipal customers in North America."
KMB,0.4759,KIMBERLY-CLARK CORP,"Kimberly-Clark Corporation, together with its subsidiaries, manufactures and markets personal care and consumer tissue products worldwide. It operates through three segments: Personal Care, Consumer Tissue, and K-C Professional."
KIM,0.4978,KIMCO REALTY CORP,"Kimco Realty Corp. (NYSE:KIM) is a real estate investment trust (REIT) headquartered in Jericho, N.Y. that is one of North America's largest publicly traded owners and operators of open-air, grocery-anchored shopping centers and mixed-use assets."
DTV,0.5089,DTE ENERGY CO,"DTE Energy Company engages in the utility operations. The company's Electric segment generates, purchases, distributes, and sells electricity to approximately 2.2 million residential, commercial, and industrial customers in southeastern Michigan."
RAI,0.5159,REYNOLDS AMERICAN INC,"Reynolds American Inc., through its subsidiaries, manufactures and sells cigarettes and other tobacco products in the United States. It operates through RJR Tobacco, Santa Fe, and American Snuff segments."
CHD,0.5682,CHURCH & DWIGHT INC,"Church & Dwight Co., Inc. develops, manufactures, and markets household, personal care, and specialty products in the United States and internationally. It operates in three segments: Consumer Domestic, Consumer International, and Specialty Products Division."
ARE,0.6,ALEXANDRIA R E EQUITIES INC,"Alexandria Real Estate Equities, Inc."
WMT,0.6278,WALMART INC,"Walmart Inc. engages in the retail and wholesale operations in various formats worldwide. The company operates in three segments: Walmart U.S., Walmart International, and Sam's Club."
STR,0.6664,QUESTAR CORP,Dominion Energy Questar Corporation operates as an integrated natural gas company in the United States.
FISV,0.7346,FISERV INC,"Fiserv, Inc., together with its subsidiaries, provides financial services technology worldwide."
EL,0.7366,LAUDER (ESTEE) COS INC -CL A,"The Estee Lauder Companies Inc. manufactures and markets skin care, makeup, fragrance, and hair care products worldwide."
CINF,0.7441,CINCINNATI FINANCIAL CORP,"Cincinnati Financial Corporation, together with its subsidiary, provides property casualty insurance products in the United States. The company operates in five segments: Commercial Lines Insurance, Personal Lines Insurance, Excess and Surplus Lines Insurance, Life Insurance, and Investments."
RTN,0.7627,RAYTHEON CO,"Raytheon Company develops technologically advanced and integrated products, services, and solutions for the defense and other government markets worldwide."
MMM,0.7739,3M CO,"3M Company develops, manufactures, and markets various products worldwide. It operates through four business segments: Safety and Industrial, Transportation and Electronics, Health Care, and Consumer."
WRB,0.7899,BERKLEY (W R) CORP,"W. R. Berkley Corporation, an insurance holding company, operates as a commercial lines writer in the United States and internationally. It operates through two segments, Insurance and Reinsurance & Monoline Excess."
CMCSA,0.8115,COMCAST CORP,"Comcast Corporation operates as a media and technology company worldwide. It operates through Cable Communications, Cable Networks, Broadcast Television, Filmed Entertainment, Theme Parks, and Sky segments."
SNDK,0.838,SANDISK CORP,"SanDisk LLC designs, develops, manufactures, and markets data storage solutions in the United States and internationally."
PAYX,0.8556,PAYCHEX INC,"Paychex, Inc. provides integrated human capital management solutions for human resources (HR), payroll, benefits, and insurance services for small- to medium-sized businesses in the United States and Europe."
FB,0.8975,FACEBOOK INC,"Facebook, Inc. develops products that enable people to connect and share with friends and family through mobile devices, personal computers, virtual reality headsets, and in-home devices worldwide."
LB,0.934,L BRANDS INC,"L Brands, Inc. operates as a specialty retailer of women's intimate and other apparel, personal care, and beauty and home fragrance products. The company operates in three segments: Victoria's Secret, Bath & Body Works, and Victoria's Secret and Bath & Body Works International."
NLSN,0.9392,NIELSEN HOLDINGS PLC,"Nielsen Holdings plc, together with its subsidiaries, operates as a measurement and data analytics company worldwide. It operates in two segments, Connect and Media."
