,dist,conm,busdesc
XL,0.0,XL FLEET CORP,"XL Hybrids, Inc. develops and manufactures hybrid electric solutions for the commercial vehicle market."
BAC,0.0121,BANK OF AMERICA CORP,"Bank of America Corporation, through its subsidiaries, provides banking and financial products and services for individual consumers, small- and middle-market businesses, institutional investors, large corporations, and governments worldwide."
HRL,0.0212,HORMEL FOODS CORP,"Hormel Foods Corporation produces and markets various meat and food products to retail, foodservice, deli, and commercial customers in the United States and internationally."
HUM,0.0274,HUMANA INC,"Humana Inc., together with its subsidiaries, operates as a health and well-being company in the United States. It operates through Retail, Group and Specialty, and Healthcare Services segments. The company offers medical and supplemental benefit plans to individuals."
MS,0.0367,MORGAN STANLEY,"Morgan Stanley, a financial holding company, provides various financial products and services to corporations, governments, financial institutions, and individuals in the Americas, Europe, the Middle East, Africa, and Asia."
JPM,0.0408,JPMORGAN CHASE & CO,"JPMorgan Chase & Co. operates as a financial services company worldwide. It operates in four segments: Consumer & Community Banking (CCB), Corporate & Investment Bank (CIB), Commercial Banking (CB), and Asset & Wealth Management (AWM)."
C,0.0419,CITIGROUP INC,"Citigroup Inc., a diversified financial services holding company, provides various financial products and services to consumers, corporations, governments, and institutions in North America, Latin America, Asia, Europe, the Middle East, and Africa."
WFC,0.0485,WELLS FARGO & CO,"Wells Fargo & Company, a diversified financial services company, provides banking, investment, mortgage, and consumer and commercial finance products and services to individuals, businesses, and institutions in the United States and internationally."
LUMN,0.0518,CENTURYLINK INC,"Lumen Technologies, Inc., a facilities-based communications company, provides various integrated services under 'CenturyLink' name to business and residential customers in the United States and internationally."
LNC,0.0565,LINCOLN NATIONAL CORP,"Lincoln National Corporation, through its subsidiaries, operates multiple insurance and retirement businesses in the United States. It operates through four segments: Annuities, Retirement Plan Services, Life Insurance, and Group Protection."
STT,0.0601,STATE STREET CORP,"State Street Corporation, through its subsidiaries, provides a range of financial products and services to institutional investors worldwide."
BHF,0.0624,BRIGHTHOUSE FINANL INC,"Brighthouse Financial, Inc. provides annuity and life insurance products in the United States. It operates through three segments: Annuities, Life, and Run-off."
AMG,0.0671,AFFILIATED MANAGERS GRP INC,"Affiliated Managers Group, Inc., through its affiliates, operates as an asset management company providing investment management services to mutual funds, institutional clients, and high net worth individuals in the United States. It provides advisory or subadvisory services to mutual funds."
CVS,0.0686,CVS HEALTH CORP,CVS Health Corporation provides health services and plans in the United States.
TSN,0.0708,TYSON FOODS INC  -CL A,"Tyson Foods, Inc., together with its subsidiaries, operates as a food company worldwide. It operates through four segments: Beef, Pork, Chicken, and Prepared Foods."
LDOS,0.0713,LEIDOS HOLDINGS INC,"Leidos Holdings, Inc. provides services and solutions in the defense, intelligence, civil, and health markets in the United States and internationally. It operates through three segments: Defense Solutions, Civil, and Health."
DISH,0.0713,DISH NETWORK CORP,"DISH Network Corporation, together with its subsidiaries, provides pay-TV services in the United States. The company operates in two segments, Pay-TV and Wireless."
SHLD,0.0791,VICTORYSHARES PR AMERICA ETF,Victory Portfolios II - VictoryShares Defend America ETF is an exchange traded fund launched and managed by Victory Capital Management Inc. It invests in public equity markets of the United States.
ZION,0.082,ZIONS BANCORPORATION NA,"Zions Bancorporation, National Association provides various banking and related services primarily in Arizona, California, Colorado, Idaho, Nevada, New Mexico, Oregon, Texas, Utah, Washington, and Wyoming."
CNP,0.0869,CENTERPOINT ENERGY INC,"CenterPoint Energy, Inc. operates as a public utility holding company in the United States. The company's Houston Electric T&D segment electric transmission and distribution services to electric utility."
CAG,0.089,CONAGRA BRANDS INC,"Conagra Brands, Inc., together with its subsidiaries, operates as a consumer packaged goods food company in North America. The company operates through Grocery & Snacks, Refrigerated & Frozen, International, and Foodservice segments."
GS,0.0933,GOLDMAN SACHS GROUP INC,"The Goldman Sachs Group, Inc. operates as an investment banking, securities, and investment management company worldwide. It operates in four segments: Investment Banking, Global Markets, Asset Management, and Consumer & Wealth Management."
FITB,0.0943,FIFTH THIRD BANCORP,Fifth Third Bancorp operates as a diversified financial services company in the United States.
AXP,0.0951,AMERICAN EXPRESS CO,"American Express Company, together with its subsidiaries, provides charge and credit payment card products, and travel-related services worldwide. The company operates through three segments: Global Consumer Services Group, Global Commercial Services, and Global Merchant and Network Services."
RF,0.0962,REGIONS FINANCIAL CORP,"Regions Financial Corporation, a financial holding company, provides banking and bank-related services to individual and corporate customers. It operates through three segments: Corporate Bank, Consumer Bank, and Wealth Management."
FOSL,0.0967,FOSSIL GROUP INC,"Fossil Group, Inc., together with its subsidiaries, designs, develops, markets, and distributes consumer fashion accessories in the United States, Europe, Asia, and internationally."
H,0.0973,HYATT HOTELS CORP,"Hyatt Hotels Corporation, a hospitality company, develops, owns, operates, manages, franchises, licenses, or provides services to hotels, resorts, and other properties."
L,0.1,LOEWS CORP,Loews Corporation provides commercial property and casualty insurance in the United States and internationally.
CMA,0.102,COMERICA INC,"Comerica Incorporated, through its subsidiaries, provides various financial products and services. It operates through three segments: Business Bank, Retail Bank, and Wealth Management."
LUV,0.1041,SOUTHWEST AIRLINES,Southwest Airlines Co. operates a passenger airline that provides scheduled air transportation services in the United States and near-international markets.
PFG,0.1062,PRINCIPAL FINANCIAL GRP INC,"Principal Financial Group, Inc. provides retirement, asset management, and insurance products and services to businesses, individuals, and institutional clients worldwide. The company operates through Retirement and Income Solutions, Principal Global Investors, Principal International, and U.S."
WYNN,0.1091,WYNN RESORTS LTD,"Wynn Resorts, Limited designs, develops, and operates integrated resorts."
VIAC,0.1112,VIACOMCBS INC,"ViacomCBS Inc. operates as a media and entertainment company worldwide. The company operates in four segments: TV Entertainment, Cable Networks, Filmed Entertainment, and Publishing."
NAVI,0.1121,NAVIENT CORP,"Navient Corporation provides education loan management and business processing solutions for education, healthcare, and government clients at the federal, state, and local levels in the United States."
USB,0.1158,U S BANCORP,"U.S. Bancorp, a financial services holding company, provides various financial services in the United States."
OMC,0.1231,OMNICOM GROUP,"Omnicom Group Inc., together with its subsidiaries, provides advertising, marketing, and corporate communications services. It provides a range of services in the areas of advertising, customer relationship management, public relations, and healthcare."
MTB,0.1232,M & T BANK CORP,"M&T Bank Corporation operates as the holding company for Manufacturers and Traders Trust Company; and Wilmington Trust, National Association that provide banking services."
PWR,0.1234,QUANTA SERVICES INC,"Quanta Services, Inc. provides specialty contracting services in the United States, Canada, Australia, Latin America, and internationally."
WBA,0.1251,WALGREENS BOOTS ALLIANCE INC,"Walgreens Boots Alliance, Inc. operates as a pharmacy-led health and beauty retail company. It operates through three segments: Retail Pharmacy USA, Retail Pharmacy International, and Pharmaceutical Wholesale."
LMT,0.1274,LOCKHEED MARTIN CORP,"Lockheed Martin Corporation, a security and aerospace company, engages in the research, design, development, manufacture, integration, and sustainment of technology systems, products, and services worldwide."
TAP,0.1292,MOLSON COORS BEVERAGE CO,"Molson Coors Beverage Company manufactures, markets, and sells beer and other malt beverage products in the United States, Canada, Europe, and internationally."
HBI,0.1298,HANESBRANDS INC,"Hanesbrands Inc., a consumer goods company, designs, manufactures, sources, and sells a range of basic apparel for men, women, and children in the United States. The company operates through three segments: Innerwear, Activewear, and International."
CFG,0.1304,CITIZENS FINANCIAL GROUP INC,"Citizens Financial Group, Inc. operates as the bank holding company for Citizens Bank, National Association that provides retail and commercial banking products and services in the United States. The company operates in two segments, Consumer Banking and Commercial Banking."
IPG,0.1317,INTERPUBLIC GROUP OF COS,"The Interpublic Group of Companies, Inc. provides advertising and marketing services worldwide. It operates through two segments, Integrated Agency Networks and Constituency Management Group."
GRMN,0.1322,GARMIN LTD,"Garmin Ltd. designs, develops, manufactures, markets, and distributes a range of navigation, communication, and information devices worldwide. It operates through five segments: Auto, Aviation, Marine, Outdoor, and Fitness."
SYF,0.1374,SYNCHRONY FINANCIAL,"Synchrony Financial operates as a consumer financial services company in the United States. It delivers a range of specialized financing programs and consumer banking products to digital, retail, home, auto, travel, health, and pet industries."
UNM,0.1382,UNUM GROUP,"Unum Group, together with its subsidiaries, provides financial protection benefit solutions in the United States, the United Kingdom, Poland, and internationally. It operates through Unum US, Unum International, Colonial Life, and Closed Block segments."
CIT,0.139,CIT GROUP INC,"CIT Group Inc. operates as the holding company for CIT Bank, N.A. that provides banking and related services to commercial and individual customers. The company operates through Commercial Banking and Consumer Banking segments."
NTRS,0.1391,NORTHERN TRUST CORP,"Northern Trust Corporation, a financial holding company, provides wealth management, asset servicing, asset management, and banking solutions for corporations, institutions, families, and individuals worldwide."
BK,0.1424,BANK OF NEW YORK MELLON CORP,"The Bank of New York Mellon Corporation provides a range of financial products and services to in the United States and internationally. The company operates through two segments, Investment Management and Investment Services."
FLIR,0.1432,FLIR SYSTEMS INC,"FLIR Systems, Inc. designs, develops, markets, and distributes thermal imaging systems, visible-light imaging systems, locater systems, measurement and diagnostic systems, and threat-detection solutions worldwide."
MET,0.1485,METLIFE INC,"MetLife, Inc. engages in the insurance, annuities, employee benefits, and asset management businesses worldwide. It operates through five segments: U.S.; Asia; Latin America; Europe, the Middle East and Africa; and MetLife Holdings."
GM,0.1502,GENERAL MOTORS CO,"General Motors Company designs, builds, and sells cars, trucks, crossovers, and automobile parts worldwide. The company operates through GM North America, GM International, Cruise, and GM Financial segments."
HWM,0.1505,HOWMET AEROSPACE INC,Howmet Aerospace Inc. provides advanced engineered solutions for the aerospace and transportation industries.
CHD,0.1511,CHURCH & DWIGHT INC,"Church & Dwight Co., Inc. develops, manufactures, and markets household, personal care, and specialty products in the United States and internationally. It operates in three segments: Consumer Domestic, Consumer International, and Specialty Products Division."
TRV,0.1535,TRAVELERS COS INC,"The Travelers Companies, Inc., through its subsidiaries, provides a range of commercial and personal property, and casualty insurance products and services to businesses, government units, associations, and individuals in the United states and internationally."
KEY,0.1549,KEYCORP,"KeyCorp operates as the holding company for KeyBank National Association that provides various retail and commercial banking services in the United States. It operates in two segments, Consumer Bank and Commercial Bank."
NBR,0.1599,NABORS INDUSTRIES LTD,"Nabors Industries Ltd. provides drilling and drilling-related services for land-based and offshore oil and natural gas wells. It operates through five segments: U.S. Drilling, Canada Drilling, International Drilling, Drilling Solutions, and Rig Technologies."
RHI,0.1607,ROBERT HALF INTL INC,"Robert Half International Inc. provides staffing and risk consulting services in North America, South America, Europe, Asia, and Australia."
JEF,0.1634,JEFFERIES FINANCIAL GRP INC,"Jefferies Financial Group Inc., a diversified financial services company, engages in investment banking and capital markets, asset management, and direct investing businesses in the Americas, Europe, the Middle East, Africa, and Asia."
DISCK,0.1643,DISCOVERY INC,"Discovery, Inc. operates as a media company in the United States and internationally. The company operates in two segments, U.S. Networks and International Networks."
TGT,0.1691,TARGET CORP,Target Corporation operates as a general merchandise retailer in the United States.
FHN,0.1717,FIRST HORIZON CORP,"First Horizon Corporation operates as the bank holding company for First Horizon Bank that provides various financial services. The company operates through four segments: Regional Banking, Fixed Income, Corporate, and Non-Strategic."
FRC,0.1722,FIRST REPUBLIC BANK,"First Republic Bank, together with its subsidiaries, provides private banking, private business banking, real estate lending, and wealth management services to clients in metropolitan areas in the United States. It operates through two segments, Commercial Banking and Wealth Management."
MTW,0.1731,MANITOWOC CO,"The Manitowoc Company, Inc. provides engineered lifting equipment for the construction industry in the Americas, Europe, Africa, the Middle East, and the Asia Pacific."
ANF,0.1732,ABERCROMBIE & FITCH  -CL A,"Abercrombie & Fitch Co., through its subsidiaries, operates as a specialty retailer. The company operates in two segments, Hollister and Abercrombie."
NOC,0.1756,NORTHROP GRUMMAN CORP,Northrop Grumman Corporation operates as a security company.
HLT,0.1775,HILTON WORLDWIDE HOLDINGS,"Hilton Worldwide Holdings Inc., a hospitality company, owns, leases, manages, develops, and franchises hotels and resorts. It operates through two segments, Management and Franchise, and Ownership. The company engages in the hotel management and licensing of its brands."
PRU,0.1792,PRUDENTIAL FINANCIAL INC,"Prudential Financial, Inc., through its subsidiaries, provides insurance, investment management, and other financial products and services."
KHC,0.1869,KRAFT HEINZ CO,"The Kraft Heinz Company, together with its subsidiaries, manufactures and markets food and beverage products in the United States, Canada, the United Kingdom, and internationally."
TDG,0.1877,TRANSDIGM GROUP INC,"TransDigm Group Incorporated designs, produces, and supplies aircraft components in the United States and internationally."
KSU,0.1889,KANSAS CITY SOUTHERN,"Kansas City Southern, a transportation holding company, provides domestic and international rail transportation services in North America."
HCA,0.1897,HCA HEALTHCARE INC,"HCA Healthcare, Inc., through its subsidiaries, operates as a health care services company in the United States."
F,0.1907,FORD MOTOR CO,"Ford Motor Company designs, manufactures, markets, and services a range of Ford cars, trucks, sport utility vehicles, electrified vehicles, and Lincoln luxury vehicles worldwide. It operates through three segments: Automotive, Mobility, and Ford Credit."
HOG,0.1956,HARLEY-DAVIDSON INC,"Harley-Davidson, Inc. manufactures and sells custom, cruiser, and touring motorcycles. The company operates in two segments, Motorcycles and Related Products and Financial Services."
HPE,0.1964,HEWLETT PACKARD ENTERPRISE,"Hewlett Packard Enterprise Company provides solutions that allow customers to capture, analyze, and act upon data from edge to cloud."
TEL,0.1984,TE CONNECTIVITY LTD,"TE Connectivity Ltd., together with its subsidiaries, manufactures and sells connectivity and sensor solutions in Europe, the Middle East, Africa, the Asia-Pacific, and the Americas."
QEP,0.2014,QEP RESOURCES INC,"QEP Resources, Inc. operates as a crude oil and natural gas exploration and production company in the United States. The company conducts exploration and production activities in the Permian Basin in Western Texas; and Williston Basin in North Dakota."
URBN,0.2069,URBAN OUTFITTERS INC,"Urban Outfitters, Inc. engages in the retail and wholesale of general consumer products. The company operates through three segments: Retail, wholesale, and Subscription."
T,0.2114,AT&T INC,"AT&T Inc. provides telecommunication, media, and technology services worldwide. The company operates through four segments: Communications, WarnerMedia, Latin America, and Xandr."
BLK,0.2115,BLACKROCK INC,"BlackRock, Inc. is a publicly owned investment manager."
STZ,0.2152,CONSTELLATION BRANDS,"Constellation Brands, Inc., together with its subsidiaries, produces, imports, and markets beer, wine, and spirits in the United States, Canada, Mexico, New Zealand, and Italy."
MPC,0.2153,MARATHON PETROLEUM CORP,"Marathon Petroleum Corporation, together with its subsidiaries, engages in refining, marketing, retailing, and transporting petroleum products primarily in the United States. It operates through three segments: Refining & Marketing, Retail, and Midstream."
DISCA,0.2199,DISCOVERY INC,"Discovery, Inc. operates as a media company in the United States and internationally. The company operates in two segments, U.S. Networks and International Networks."
ADM,0.2207,ARCHER-DANIELS-MIDLAND CO,"Archer-Daniels-Midland Company procures, transports, stores, processes, and merchandises agricultural commodities, products, and ingredients in the United States and internationally. The company operates through three segments: Ag Services and Oilseeds, Carbohydrate Solutions, and Nutrition."
TFC,0.2244,TRUIST FINANCIAL CORP,"Truist Financial Corporation, a holding company, provides banking and trust services for small and mid-size businesses, public agencies, local governments, corporations, and individuals in the Southeastern and Mid-Atlantic United States."
MO,0.2263,ALTRIA GROUP INC,"Altria Group, Inc., through its subsidiaries, manufactures and sells cigarettes, smokeless products, and wine in the United States."
UHS,0.2311,UNIVERSAL HEALTH SVCS INC,"Universal Health Services, Inc., through its subsidiaries, owns and operates acute care hospitals, outpatient facilities, and behavioral health care facilities. The company operates through Acute Care Hospital Services, Behavioral Health Care Services, and Other segments."
AYI,0.2338,ACUITY BRANDS INC,"Acuity Brands, Inc. provides lighting and building management solutions and services for commercial, institutional, industrial, infrastructure, and residential applications in North America and internationally."
FTI,0.2351,TECHNIPFMC PLC,"TechnipFMC plc engages in the oil and gas projects, technologies, and systems and services businesses. It operates through three segments: Subsea, Technip Energies, and Surface Technologies."
NLSN,0.2359,NIELSEN HOLDINGS PLC,"Nielsen Holdings plc, together with its subsidiaries, operates as a measurement and data analytics company worldwide. It operates in two segments, Connect and Media."
KR,0.2364,KROGER CO,"The Kroger Co. operates as a retailer in the United States. The company operates supermarkets, multi-department stores, marketplace stores, and price impact warehouse stores."
AMP,0.2389,AMERIPRISE FINANCIAL INC,"Ameriprise Financial, Inc., through its subsidiaries, provides various financial products and services to individual and institutional clients in the United States and internationally."
GT,0.2394,GOODYEAR TIRE & RUBBER CO,"The Goodyear Tire & Rubber Company, together with its subsidiaries, develops, manufactures, distributes, and sells tires and related products and services worldwide."
SNV,0.2411,SYNOVUS FINANCIAL CORP,"Synovus Financial Corp. operates as the bank holding company for Synovus Bank that provides various financial products and services. It operates through three segments: Community Banking, Wholesale Banking, and Financial Management Services."
MDP,0.2428,MEREDITH CORP,"Meredith Corporation operates as a diversified media company primarily in the United States. It operates in two segments, National Media and Local Media."
TXT,0.2437,TEXTRON INC,"Textron Inc. operates in the aircraft, defense, industrial, and finance businesses worldwide."
SWN,0.2448,SOUTHWESTERN ENERGY CO,"Southwestern Energy Company, an independent energy company, engages in the exploration, development, and production of natural gas, oil, and natural gas liquids (NGLs) in the United States. It operates through Exploration and Production, and Marketing segments."
PNC,0.2448,PNC FINANCIAL SVCS GROUP INC,"The PNC Financial Services Group, Inc. operates as a diversified financial services company in the United States."
NCLH,0.2479,NORWEGIAN CRUISE LINE HLDGS,"Norwegian Cruise Line Holdings Ltd., together with its subsidiaries, operates as a cruise company in the North America, Europe, the Asia-Pacific, and internationally. The company operates the Norwegian Cruise Line, Oceania Cruises, and Regent Seven Seas Cruises brands."
WRB,0.2503,BERKLEY (W R) CORP,"W. R. Berkley Corporation, an insurance holding company, operates as a commercial lines writer in the United States and internationally. It operates through two segments, Insurance and Reinsurance & Monoline Excess."
DAL,0.2509,DELTA AIR LINES INC,"Delta Air Lines, Inc. provides scheduled air transportation for passengers and cargo in the United States and internationally. The company operates through two segments, Airline and Refinery. Its domestic network centered on core hubs in Atlanta, Minneapolis-St."
NOV,0.2509,NATIONAL OILWELL VARCO INC,"National Oilwell Varco, Inc. designs, constructs, manufactures, and sells systems, components, and products for oil and gas drilling and production worldwide. It operates through three segments: Wellbore Technologies, Completion & Production Solutions, and Rig Technologies."
PFE,0.2517,PFIZER INC,"Pfizer Inc. develops, manufactures, and sells healthcare products worldwide."
AFL,0.2522,AFLAC INC,"Aflac Incorporated, through its subsidiaries, provides supplemental health and life insurance products. It operates through two segments, Aflac Japan and Aflac U.S."
ALTR,0.2544,ALTAIR ENGINEERING INC,"Altair Engineering Inc., together with its subsidiaries, provides software and cloud solutions worldwide. The company operates through two segments, Software and Client Engineering Services."
FLS,0.2574,FLOWSERVE CORP,"Flowserve Corporation designs, develops, manufactures, distributes, and services industrial flow management equipment in the United States, Europe, the Middle East, Africa, Asia, and internationally."
SIVB,0.2611,SVB FINANCIAL GROUP,"SVB Financial Group, a diversified financial services company, provides various banking and financial products and services. The company operates through four segments: Global Commercial Bank, SVB Private Bank, SVB Capital, and SVB Leerink."
ACT,0.2617,ADVISORSHARES VICE ETF,"AdvisorShares Trust - AdvisorShares Vice ETF is an exchange traded fund launched and managed by AdvisorShares Investments, LLC. It invests in public equity markets of the United States."
SEE,0.2636,SEALED AIR CORP,"Sealed Air Corporation provides food safety and security, and product protection solutions and equipment in North America, South America, Europe, the Middle East, Africa, and the Asia Pacific. It operates in two segments, Food Care and Product Care."
LIFE,0.265,ATYR PHARMA INC,"aTyr Pharma, Inc., a biotherapeutics company, engages in the discovery and development of medicines based on novel immunological pathways in the United States."
MBI,0.2659,MBIA INC,"MBIA Inc. provides financial guarantee insurance services to public finance markets. It operates through United States (U.S.) Public Finance Insurance, and International and Structured Finance Insurance segments."
ORCL,0.2671,ORACLE CORP,Oracle Corporation provides products and services that address enterprise information technology environments worldwide.
DYN,0.2694,DYNE THERAPEUTICS INC,"Dyne Therapeutics, Inc., a muscle disease company, operates as a biotechnology company that focuses on advancing therapeutics for genetically driven muscle diseases in the United States."
