,dist,conm,busdesc
MTD,0.6204,METTLER-TOLEDO INTL INC,"Mettler-Toledo International Inc. manufactures and supplies precision instruments and services worldwide. It operates in five segments: U.S. Operations, Swiss Operations, Western European Operations, Chinese Operations, and Other."
LLL,0.6237,L3 TECHNOLOGIES INC,"L3 Technologies, Inc. provides aircraft sustainment, simulation and training, night vision and image intensification equipment, and security and detection systems used on military, homeland security, and commercial platforms in the United States and internationally."
TRV,0.6293,TRAVELERS COS INC,"The Travelers Companies, Inc., through its subsidiaries, provides a range of commercial and personal property, and casualty insurance products and services to businesses, government units, associations, and individuals in the United states and internationally."
TPR,0.6391,TAPESTRY INC,"Tapestry, Inc. provides luxury accessories and branded lifestyle products in the United States, Japan, China, Hong Kong, Macau, Taiwan, Europe, Canada, South Korea, Malaysia, Singapore, Australia, and New Zealand."
EQT,0.6404,EQT CORP,"EQT Corporation operates as a natural gas production company in the United States. The company produces natural gas, natural gas liquids (NGLs), and crude oil."
FOSL,0.6463,FOSSIL GROUP INC,"Fossil Group, Inc., together with its subsidiaries, designs, develops, markets, and distributes consumer fashion accessories in the United States, Europe, Asia, and internationally."
VFC,0.6493,VF CORP,"V.F. Corporation engages in the design, production, procurement, marketing, and distribution of branded lifestyle apparel, footwear, and related products for men, women, and children in the Americas, Europe, and the Asia-Pacific. It operates through four segments: Outdoor, Active, and Work."
MXIM,0.6689,MAXIM INTEGRATED PRODUCTS,"Maxim Integrated Products, Inc. designs, develops, manufactures, and markets a range of linear and mixed-signal integrated circuits in the United States, China, rest of Asia, Europe, and internationally."
WEN,0.6857,WENDY'S CO,"The Wendy's Company, together with its subsidiaries, operates as a quick-service restaurant company. It operates through three segments: Wendy's U.S., Wendy's International, and Global Real Estate & Development."
CIEN,0.6985,CIENA CORP,"Ciena Corporation provides network hardware, software, and services that support the transport, routing, switching, aggregation, service delivery, and management of video, data, and voice traffic on communications networks worldwide."
JBL,0.7012,JABIL INC,"Jabil Inc. provides manufacturing services and solutions worldwide. The company operates in two segments, Electronics Manufacturing Services and Diversified Manufacturing Services. It offers electronics design, production, and product management services."
WYNN,0.7105,WYNN RESORTS LTD,"Wynn Resorts, Limited designs, develops, and operates integrated resorts."
JBHT,0.7212,HUNT (JB) TRANSPRT SVCS INC,"J.B. Hunt Transport Services, Inc., together with its subsidiaries, provides surface transportation and delivery services in the continental United States, Canada, and Mexico."
LOW,0.723,LOWE'S COS INC,"Lowe's Companies, Inc., together with its subsidiaries, operates as a home improvement retailer in the United States, Canada, and Mexico. The company offers a line of products for construction, maintenance, repair, remodeling, and decorating."
RMD,0.7242,RESMED INC,"ResMed Inc. develops, manufactures, distributes, and markets medical devices and cloud-based software applications that diagnose, treat, and manage respiratory disorders comprising sleep apnea, chronic obstructive pulmonary disease, neuromuscular disease, and other chronic diseases."
HAS,0.738,HASBRO INC,"Hasbro, Inc., together with its subsidiaries, operates as a play and entertainment company. The company's U.S."
UHS,0.748,UNIVERSAL HEALTH SVCS INC,"Universal Health Services, Inc., through its subsidiaries, owns and operates acute care hospitals, outpatient facilities, and behavioral health care facilities. The company operates through Acute Care Hospital Services, Behavioral Health Care Services, and Other segments."
HOG,0.7504,HARLEY-DAVIDSON INC,"Harley-Davidson, Inc. manufactures and sells custom, cruiser, and touring motorcycles. The company operates in two segments, Motorcycles and Related Products and Financial Services."
CB,0.7506,CHUBB LTD,"Chubb Limited, through its subsidiaries, provides insurance and reinsurance products worldwide."
TJX,0.766,TJX COS INC (THE),"The TJX Companies, Inc. operates as an off-price apparel and home fashions retailer. It operates through four segments: Marmaxx, HomeGoods, TJX Canada, and TJX International."
NVLS,0.7703,NIVALIS THERAPEUTICS INC,"As of July 24, 2017, Nivalis Therapeutics, Inc. was acquired by Alpine Immune Sciences Inc. in a reverse merger transaction."
CTAS,0.7729,CINTAS CORP,"Cintas Corporation provides corporate identity uniforms and related business services primarily in North America, Latin America, Europe, and Asia. It operates through Uniform Rental and Facility Services and First Aid and Safety Services segments."
WBA,0.7788,WALGREENS BOOTS ALLIANCE INC,"Walgreens Boots Alliance, Inc. operates as a pharmacy-led health and beauty retail company. It operates through three segments: Retail Pharmacy USA, Retail Pharmacy International, and Pharmaceutical Wholesale."
TEX,0.782,TEREX CORP,"Terex Corporation manufactures and sells aerial work platforms, materials processing machinery, and cranes worldwide. The company operates in two segments, Aerial Work Platforms (AWP) and Material Processing (MP)."
CPRT,0.7886,COPART INC,"Copart, Inc. provides online auctions and vehicle remarketing services in the United States, Canada, the United Kingdom, Brazil, the Republic of Ireland, Germany, Finland, the United Arab Emirates, Oman, Bahrain, and Spain."
LEN,0.7913,LENNAR CORP,"Lennar Corporation, together with its subsidiaries, operates as a homebuilder primarily under the Lennar brand in the United States. It operates through Homebuilding East, Homebuilding Central, Homebuilding Texas, Homebuilding West, Financial Services, Multifamily, and Lennar Other segments."
ROP,0.8057,ROPER TECHNOLOGIES INC,"Roper Technologies, Inc. designs and develops software, and engineered products and solutions worldwide."
UAA,0.8063,UNDER ARMOUR INC,"Under Armour, Inc., together with its subsidiaries, develops, markets, and distributes branded performance apparel, footwear, and accessories for men, women, and youth primarily in North America, Europe, the Middle East, Africa, the Asia-Pacific, and Latin America."
CSCO,0.8169,CISCO SYSTEMS INC,"Cisco Systems, Inc. designs, manufactures, and sells Internet Protocol based networking and other products related to the communications and information technology industry in the Americas, Europe, the Middle East, Africa, the Asia Pacific, Japan, and China."
DXC,0.8371,DXC TECHNOLOGY CO,"DXC Technology Company, together with its subsidiaries, provides information technology services and solutions primarily in North America, Europe, Asia, and Australia. It operates in two segments, Global Business Services (GBS) and Global Infrastructure Services (GIS)."
LUMN,0.8399,CENTURYLINK INC,"Lumen Technologies, Inc., a facilities-based communications company, provides various integrated services under 'CenturyLink' name to business and residential customers in the United States and internationally."
AJG,0.8498,ARTHUR J GALLAGHER & CO,"Arthur J. Gallagher & Co., together with its subsidiaries, provides insurance brokerage, consulting, and third party claims settlement and administration services in the United States, Australia, Bermuda, Canada, the Caribbean, New Zealand, and the United Kingdom."
POOL,0.8895,POOL CORP,"Pool Corporation distributes swimming pool supplies, equipment, and related leisure products in the United States and internationally."
HON,0.8932,HONEYWELL INTERNATIONAL INC,Honeywell International Inc. operates as a diversified technology and manufacturing company worldwide.
QLGC,0.9123,QLOGIC CORP,"QLogic Corporation and its subsidiaries design and supply high performance server and storage networking connectivity products that provide, enhance, and manage computer data communication."
