,dist,conm,busdesc
ADS,0.2694,ALLIANCE DATA SYSTEMS CORP,"Alliance Data Systems Corporation provides data-driven marketing and loyalty solutions in the United States, Canada, Europe, the Middle East, Africa, the Asia Pacific, and others. It operates through two segments, LoyaltyOne and Card Services."
GE,0.271,GENERAL ELECTRIC CO,"General Electric Company operates as a high-tech industrial company in the United States, Europe, Asia, the Americas, the Middle East, and Africa. It operates through Power, Renewable Energy, Aviation, Healthcare, and Capital segments."
HII,0.2711,HUNTINGTON INGALLS IND INC,"Huntington Ingalls Industries, Inc. engages in the designing, building, overhauling, and repairing military ships in the United States. It operates through three segments: Ingalls Shipbuilding, Newport News Shipbuilding, and Technical Solutions."
GD,0.2725,GENERAL DYNAMICS CORP,"General Dynamics Corporation operates as an aerospace and defense company worldwide. It operates through five segments: Aerospace, Combat Systems, Information Technology, Mission Systems, and Marine Systems."
GIS,0.2726,GENERAL MILLS INC,"General Mills, Inc. manufactures and markets branded consumer foods worldwide. The company operates in five segments: North America Retail; Convenience Stores & Foodservice; Europe & Australia; Asia & Latin America; and Pet."
HBAN,0.2771,HUNTINGTON BANCSHARES,"Huntington Bancshares Incorporated operates as a holding company for The Huntington National Bank that provides commercial, small business, consumer, and mortgage banking services."
LB,0.2786,L BRANDS INC,"L Brands, Inc. operates as a specialty retailer of women's intimate and other apparel, personal care, and beauty and home fragrance products. The company operates in three segments: Victoria's Secret, Bath & Body Works, and Victoria's Secret and Bath & Body Works International."
VLO,0.2789,VALERO ENERGY CORP,"Valero Energy Corporation manufactures and sells transportation fuels and petrochemical products in the United States, Canada, the United Kingdom, Ireland, and internationally. It operates through three segments: Refining, Ethanol, and Renewable Diesel."
PPL,0.2791,PPL CORP,"PPL Corporation, a utility holding company, delivers electricity and natural gas in the United States and the United Kingdom. The company operates through three segments: U.K. Regulated, Kentucky Regulated, and Pennsylvania Regulated."
IVZ,0.2795,INVESCO LTD,Invesco Ltd. is a publicly owned investment manager.
HRB,0.2796,BLOCK H & R INC,"H&R Block, Inc., through its subsidiaries, provides assisted income tax return preparation, do-it-yourself (DIY) tax, and virtual tax preparation services and products to the general public primarily in the United States, Canada, and Australia."
HP,0.2831,HELMERICH & PAYNE,"Helmerich & Payne, Inc., together with its subsidiaries, provides drilling services and solutions for exploration and production companies. The company operates through three segments: North America Solutions, Offshore Gulf of Mexico, and International Solutions."
JBL,0.287,JABIL INC,"Jabil Inc. provides manufacturing services and solutions worldwide. The company operates in two segments, Electronics Manufacturing Services and Diversified Manufacturing Services. It offers electronics design, production, and product management services."
LW,0.2873,LAMB WESTON HOLDINGS INC,"Lamb Weston Holdings, Inc. produces, distributes, and markets value-added frozen potato products worldwide. It operates through four segments: Global, Foodservice, Retail, and Other."
ROP,0.2879,ROPER TECHNOLOGIES INC,"Roper Technologies, Inc. designs and develops software, and engineered products and solutions worldwide."
GPS,0.2886,GAP INC,"The Gap, Inc. operates as an apparel retail company worldwide. The company offers apparel, accessories, and personal care products for men, women, and children under the Old Navy, Gap, Banana Republic, Athleta, Intermix, Janie and Jack, and Hill City brands."
AES,0.2905,AES CORP (THE),"The AES Corporation operates as a diversified power generation and utility company. It owns and/or operates power plants to generate and sell power to customers, such as utilities, industrial users, and other intermediaries."
EL,0.2948,LAUDER (ESTEE) COS INC -CL A,"The Estee Lauder Companies Inc. manufactures and markets skin care, makeup, fragrance, and hair care products worldwide."
HFC,0.2981,HOLLYFRONTIER CORP,"HollyFrontier Corporation operates as an independent petroleum refiner in the United States. The company operates through three segments: Refining, Lubricants and Specialty Products, and HEP."
NWL,0.2993,NEWELL BRANDS INC,"Newell Brands Inc. designs, manufactures, sources, and distributes consumer and commercial products worldwide. The company operates through four segments: Appliances and Cookware, Food and Commercial, Home and Outdoor Living, and Learning and Development."
DFS,0.3004,DISCOVER FINANCIAL SVCS,"Discover Financial Services, through its subsidiaries, operates as a direct banking and payment services company in the United States. It operates in two segments, Direct Banking and Payment Services."
BIIB,0.3026,BIOGEN INC,"Biogen Inc. discovers, develops, manufactures, and delivers therapies for treating neurological and neurodegenerative diseases worldwide."
AN,0.3026,AUTONATION INC,"AutoNation, Inc., through its subsidiaries, operates as an automotive retailer in the United States. The company operates through three segments: Domestic, Import, and Premium Luxury."
CCL,0.3042,CARNIVAL CORPORATION & PLC,"Carnival Corporation & Plc operates as a leisure travel company. The company's ships visit approximately 700 ports under the Carnival Cruise Line, Princess Cruises, Holland America Line, Seabourn, P&O Cruises (Australia), Costa Cruises, AIDA Cruises, P&O Cruises (UK), and Cunard brand names."
SCHW,0.3135,SCHWAB (CHARLES) CORP,"The Charles Schwab Corporation, through its subsidiaries, provides wealth management, securities brokerage, banking, asset management, custody, and financial advisory services. The company operates through two segments, Investor Services and Advisor Services."
MAR,0.3139,MARRIOTT INTL INC,"Marriott International, Inc. operates, franchises, and licenses hotel, residential, and timeshare properties worldwide. The company operates through North American Full-Service, North American Limited-Service, and Asia Pacific segments."
WRK,0.3145,WESTROCK CO,"WestRock Company manufactures and sells paper and packaging solutions in North America, South America, Europe, Asia, and Australia. The company operates through Corrugated Packaging and Consumer Packaging segments."
EMR,0.3148,EMERSON ELECTRIC CO,"Emerson Electric Co. designs and manufactures technology and engineering products for industrial, commercial, and consumer markets worldwide. It operates through Automation Solutions and Commercial & Residential Solutions segments."
HON,0.316,HONEYWELL INTERNATIONAL INC,Honeywell International Inc. operates as a diversified technology and manufacturing company worldwide.
AIG,0.3161,AMERICAN INTERNATIONAL GROUP,"American International Group, Inc. provides insurance products for commercial, institutional, and individual customers in North America and internationally."
FPL,0.3162,FIRST TR NEW OPP MLP &ENERGY,First Trust New Opportunities MLP & Energy Fund is a closed-ended balanced mutual fund launched and managed by First Trust Advisors L.P. It is co-managed by Energy Income Partners LLC. The fund invests in the public equity and fixed income markets of the United States.
CI,0.3164,CIGNA CORP,"Cigna Corporation provides insurance and related products and services. It operates through Health Services, Integrated Medical, International Markets, and Group Disability and Other segments."
KEYS,0.3189,KEYSIGHT TECHNOLOGIES INC,"Keysight Technologies, Inc. provides electronic design and test solutions to commercial communications, networking, aerospace, defense and government, automotive, energy, semiconductor, electronic, and education industries in the Americas, Europe, and the Asia Pacific."
FOXA,0.321,FOX CORP,"Fox Corporation operates as a news, sports, and entertainment company in the United States. The company operates through Cable Network Programming; Television; and Other, Corporate and Eliminations segments."
UIS,0.3269,UNISYS CORP,"Unisys Corporation operates as an information technology company worldwide. It operates in two segments, Services and Technology. The Services segment offers cloud and infrastructure services, application services, and business process outsourcing services."
PBCT,0.3271,PEOPLE'S UNITED FINL INC,"People's United Financial, Inc. operates as the bank holding company for People's United Bank, National Association that provides commercial banking, retail banking, and wealth management services to individual, corporate, and municipal customers."
SPOT,0.3327,SPOTIFY TECHNOLOGY SA,"Spotify Technology S.A., together with its subsidiaries, provides audio streaming services in the United States, the United Kingdom, Luxembourg, and internationally. It operates through two segments, Premium and Ad-Supported."
COTY,0.3351,COTY INC,"Coty Inc., together with its subsidiaries, manufactures, markets, distributes, and sells beauty products worldwide."
ANTM,0.339,ANTHEM INC,"Anthem, Inc., through its subsidiaries, operates as a health benefits company in the United States. It operates through three segments: Commercial & Specialty Business, Government Business, and Other."
NCR,0.3405,NCR CORP,"NCR Corporation provides software and services worldwide. The company operates through Banking, Retail, Hospitality, and Other segments."
PKG,0.3436,PACKAGING CORP OF AMERICA,Packaging Corporation of America manufactures and sells containerboard and corrugated packaging products in the United States. The company operates through Packaging and Paper segments.
APTV,0.3471,APTIV PLC,"Aptiv PLC designs, manufacturers, and sells vehicle components worldwide. The company provides electrical, electronic, and safety technology solutions to the automotive and commercial vehicle markets."
CVX,0.3495,CHEVRON CORP,"Chevron Corporation, through its subsidiaries, engages in integrated energy, chemicals, and petroleum operations worldwide. The company operates in two segments, Upstream and Downstream."
ATVI,0.3497,ACTIVISION BLIZZARD INC,"Activision Blizzard, Inc., together with its subsidiaries, develops and distributes content and services on video game consoles, personal computers (PC), and mobile devices in the Americas, Europe, the Middle East, Africa, and the Asia Pacific."
TDY,0.3502,TELEDYNE TECHNOLOGIES INC,"Teledyne Technologies Incorporated provides instrumentation, digital imaging, aerospace and defense electronics, and engineered systems in the United States, the United Kingdom, Canada, the Netherlands, and internationally."
ORLY,0.3517,O'REILLY AUTOMOTIVE INC,"O'Reilly Automotive, Inc., together with its subsidiaries, engages in the retail of automotive aftermarket parts, tools, supplies, equipment, and accessories in the United States."
EA,0.3547,ELECTRONIC ARTS INC,"Electronic Arts Inc. develops, markets, publishes, and distributes games, content, and services for game consoles, PCs, mobile phones, and tablets worldwide."
EQT,0.3566,EQT CORP,"EQT Corporation operates as a natural gas production company in the United States. The company produces natural gas, natural gas liquids (NGLs), and crude oil."
XOM,0.3568,EXXON MOBIL CORP,"Exxon Mobil Corporation explores for and produces crude oil and natural gas in the United States, Canada/other Americas, Europe, Africa, Asia, and Australia/Oceania. It operates through Upstream, Downstream, and Chemical segments."
MNST,0.3631,MONSTER BEVERAGE CORP,"Monster Beverage Corporation, through its subsidiaries, develops, markets, sells, and distributes energy drink beverages and concentrates in the United States and internationally. It operates through three segments: Monster Energy Drinks, Strategic Brands, and Other."
CINF,0.367,CINCINNATI FINANCIAL CORP,"Cincinnati Financial Corporation, together with its subsidiary, provides property casualty insurance products in the United States. The company operates in five segments: Commercial Lines Insurance, Personal Lines Insurance, Excess and Surplus Lines Insurance, Life Insurance, and Investments."
JWN,0.3673,NORDSTROM INC,"Nordstrom, Inc., a fashion retailer, provides apparels, shoes, cosmetics, and accessories for women, men, young adults, and children."
FOX,0.3678,FOX CORP,"Fox Corporation operates as a news, sports, and entertainment company in the United States. The company operates through Cable Network Programming; Television; and Other, Corporate and Eliminations segments."
RRC,0.3701,RANGE RESOURCES CORP,"Range Resources Corporation operates as an independent natural gas, natural gas liquids (NGLs), and oil company in the United States. The company engages in the exploration, development, and acquisition of natural gas and oil properties."
LHX,0.3703,L3HARRIS TECHNOLOGIES INC,"L3Harris Technologies, Inc., an aerospace and defense technology company, provides mission-critical solutions for government and commercial customers worldwide."
NSC,0.3739,NORFOLK SOUTHERN CORP,"Norfolk Southern Corporation, together with its subsidiaries, engages in the rail transportation of raw materials, intermediate products, and finished goods in the United States."
MGM,0.3755,MGM RESORTS INTERNATIONAL,"MGM Resorts International, through its subsidiaries, owns and operates integrated casino, hotel, and entertainment resorts in the United States and Macau. The company operates through three segments: Las Vegas Strip Resorts, Regional Operations, and MGM China."
GME,0.377,GAMESTOP CORP,"GameStop Corp. operates as a multichannel video game, consumer electronics, and collectibles retailer in the United States, Canada, Australia, and Europe."
TEX,0.3812,TEREX CORP,"Terex Corporation manufactures and sells aerial work platforms, materials processing machinery, and cranes worldwide. The company operates in two segments, Aerial Work Platforms (AWP) and Material Processing (MP)."
ALB,0.3856,ALBEMARLE CORP,"Albemarle Corporation develops, manufactures, and markets engineered specialty chemicals worldwide. The company operates in three segments: Lithium, Bromine Specialties, and Catalysts."
COG,0.3886,CABOT OIL & GAS CORP,"Cabot Oil & Gas Corporation, an independent oil and gas company, explores for, exploits, develops, produces, and markets oil and gas properties in the United States."
ATI,0.3886,ALLEGHENY TECHNOLOGIES INC,"Allegheny Technologies Incorporated manufactures and sells specialty materials and components worldwide. The company operates in two segments, High Performance Materials & Components and Advanced Alloys & Solutions."
SAIC,0.3912,SCIENCE APPLICATIONS INTL CP,"Science Applications International Corporation provides technical, engineering, and enterprise information technology (IT) services primarily in the United States."
FL,0.3958,FOOT LOCKER INC,"Foot Locker, Inc., through its subsidiaries, operates as an athletic footwear and apparel retailer."
GLW,0.4038,CORNING INC,"Corning Incorporated engages in display technologies, optical communications, environmental technologies, specialty materials, and life sciences businesses worldwide."
CAH,0.4164,CARDINAL HEALTH INC,"Cardinal Health, Inc. operates as an integrated healthcare services and products company in the United States and internationally. It provides customized solutions for hospitals, healthcare systems, pharmacies, ambulatory surgery centers, clinical laboratories, and physician offices."
CNX,0.4165,CNX RESOURCES CORPORATION,"CNX Resources Corporation, an independent oil and gas company, explores for, develops, and produces natural gas properties primarily in the Appalachian Basin. The company operates through two divisions, Exploration and Production (E&P), and Midstream."
RL,0.4211,RALPH LAUREN CORP,"Ralph Lauren Corporation designs, markets, and distributes lifestyle products in North America, Europe, Asia, and internationally."
UA,0.4236,UNDER ARMOUR INC,"Under Armour, Inc., together with its subsidiaries, develops, markets, and distributes branded performance apparel, footwear, and accessories for men, women, and youth primarily in North America, Europe, the Middle East, Africa, the Asia-Pacific, and Latin America."
TGNA,0.4239,TEGNA INC,TEGNA Inc. operates as a media company in the United States. The company operates television stations and radio stations that deliver television programming and digital content. It offers content and information to consumers across various platforms.
GL,0.4251,GLOBE LIFE INC,"Globe Life Inc., through its subsidiaries, provides various life and supplemental health insurance products, and annuities to lower middle to middle income households in the United States."
COO,0.4258,COOPER COS INC (THE),"The Cooper Companies, Inc. operates as a medical device company worldwide. It operates through CooperVision and CooperSurgical business units."
GPC,0.4305,GENUINE PARTS CO,"Genuine Parts Company distributes automotive replacement parts, industrial parts and materials, and business products in the United States, Canada, Mexico, Australasia, France, the United Kingdom, Germany, Poland, the Netherlands, and Belgium."
BIG,0.4507,BIG LOTS INC,"Big Lots, Inc., through its subsidiaries, operates as a retailer in the United States."
NYT,0.4522,NEW YORK TIMES CO  -CL A,"The New York Times Company, together with its subsidiaries, provides news and information for readers and viewers across various platforms worldwide."
AME,0.4558,AMETEK INC,"AMETEK, Inc. manufactures and sells electronic instruments and electromechanical devices worldwide. It operates through two segments, Electronic Instruments (EIG) and Electromechanical (EMG)."
ADCT,0.4623,ADC THERAPEUTICS SA,"ADC Therapeutics SA, a clinical-stage oncology-focused biotechnology company, develops antibody drug conjugates (ADC) for patients suffering from hematological malignancies and solid tumors."
BUD,0.4677,ANHEUSER-BUSCH INBEV,"Anheuser-Busch InBev SA/NV, a brewing company, engages in the production, distribution, and sale of beer, alcoholic beverages, and soft drinks worldwide."
MSI,0.4761,MOTOROLA SOLUTIONS INC,"Motorola Solutions, Inc. provides mission-critical communication solutions the United States, the United Kingdom, Canada, and internationally. The company operates in two segments, Products and Systems Integration, and Services and Software."
ABC,0.4772,AMERISOURCEBERGEN CORP,AmerisourceBergen Corporation sources and distributes pharmaceutical products in the United States and internationally.
R,0.4786,RYDER SYSTEM INC,"Ryder System, Inc. provides transportation and supply chain management solutions worldwide. The company operates through three segments: Fleet Management Solutions (FMS), Supply Chain Solutions (SCS), and Dedicated Transportation Solutions (DTS)."
KMB,0.4819,KIMBERLY-CLARK CORP,"Kimberly-Clark Corporation, together with its subsidiaries, manufactures and markets personal care and consumer tissue products worldwide. It operates through three segments: Personal Care, Consumer Tissue, and K-C Professional."
AKAM,0.4872,AKAMAI TECHNOLOGIES INC,"Akamai Technologies, Inc. provides cloud services for delivering, optimizing, and securing content and business applications over the Internet in the United States and internationally."
DELL,0.4881,DELL TECHNOLOGIES INC,"Dell Technologies Inc. designs, develops, manufactures, markets, sells, and support IT hardware, software, and services solutions worldwide. It operates through three segments: Infrastructure Solutions Group (ISG), Client Solutions Group (CSG), and VMware."
SJM,0.4882,SMUCKER (JM) CO,"The J. M. Smucker Company manufactures and markets food and beverage products worldwide. It operates in four segments: U.S. Retail Pet Foods, U.S. Retail Coffee, U.S. Retail Consumer Foods, and International and Away From Home."
CB,0.4942,CHUBB LTD,"Chubb Limited, through its subsidiaries, provides insurance and reinsurance products worldwide."
RE,0.4968,EVEREST RE GROUP LTD,"Everest Re Group, Ltd., through its subsidiaries, provides reinsurance and insurance products in the United States, Bermuda, and internationally. The company operates through four segments: U.S. Reinsurance, International, Bermuda, and Insurance. The U.S."
LH,0.5046,LABORATORY CP OF AMER HLDGS,"Laboratory Corporation of America Holdings operates as an independent clinical laboratory company worldwide. It operates in two segments, LabCorp Diagnostics (LCD) and Covance Drug Development."
FFIV,0.5049,F5 NETWORKS INC,"F5 Networks, Inc. provides multi-cloud application services for the security, performance, and availability of network applications, servers, and storage systems."
REGN,0.5067,REGENERON PHARMACEUTICALS,"Regeneron Pharmaceuticals, Inc., a biopharmaceutical company, discovers, invents, develops, manufactures, and commercializes medicines for treating various medical conditions worldwide."
SRCL,0.523,STERICYCLE INC,"Stericycle, Inc., together with its subsidiaries, provides regulated and compliance solutions to the healthcare, retail, and commercial businesses in the United States, Europe, and internationally."
NRG,0.5286,NRG ENERGY INC,"NRG Energy, Inc., together with its subsidiaries, operates as an energy company in the United States. It operates through Generation and Retail segments."
BWA,0.5297,BORGWARNER INC,"BorgWarner Inc. provides solutions for combustion, hybrid, and electric vehicles worldwide."
BEN,0.5301,FRANKLIN RESOURCES INC,"Franklin Resources, Inc. is a publicly owned asset management holding company. Through its subsidiaries, the firm provides its services to individuals, institutions, pension plans, trusts, and partnerships."
HOLX,0.5347,HOLOGIC INC,"Hologic, Inc. develops, manufactures, and supplies diagnostics products, medical imaging systems, and surgical products for women's health through early detection and treatment in the United States, Europe, the Asia-Pacific, and internationally."
FTV,0.5387,FORTIVE CORP,"Fortive Corporation designs, develops, manufactures, markets, and services professional and engineered products, software, and services worldwide."
SANM,0.5421,SANMINA CORP,"Sanmina Corporation provides integrated manufacturing solutions, components, products and repair, logistics, and after-market services worldwide. It operates in two segments, Integrated Manufacturing Solutions; and Components, Products and Services."
APD,0.5528,AIR PRODUCTS & CHEMICALS INC,"Air Products and Chemicals, Inc. provides atmospheric gases, process and specialty gases, equipment, and services worldwide."
WY,0.5532,WEYERHAEUSER CO,"Weyerhaeuser Company, one of the world's largest private owners of timberlands, began operations in 1900. We own or control approximately 11 million acres of timberlands in the U.S. and manage additional timberlands under long-term licenses in Canada."
HSY,0.5571,HERSHEY CO,"The Hershey Company, together with its subsidiaries, manufactures and sells confectionery products. The company operates through two segments, North America; and International and Other."
VNT,0.5605,VONTIER CORP,"Vontier Corporation engages in the research and development, manufacture, sale, and distribution of critical technical equipment, components, software, and services for manufacturing, repair and servicing in the mobility infrastructure industry worldwide."
ADT,0.5619,ADT INC,"ADT Inc. provides security and automation solutions for homes and businesses in the United States and Canada. It provides a range of fire detection, fire suppression, video surveillance, and access control systems to residential, commercial, and multi-site customers."
SUN,0.5805,SUNOCO LP,"Sunoco LP, together with its subsidiaries, engages in the distribution and retailing of motor fuels in the United States. It operates through two segments, Fuel Distribution and Marketing, and All Other."
HD,0.5806,HOME DEPOT INC,"The Home Depot, Inc. operates as a home improvement retailer."
JCI,0.5809,JOHNSON CONTROLS INTL PLC,"Johnson Controls International plc operates as a diversified technology and multi industrial company worldwide. It operates through Building Solutions North America, Building Solutions EMEA/LA, Building Solutions Asia Pacific, and Global Products segments."
J,0.5844,JACOBS ENGINEERING GROUP INC,"Jacobs Engineering Group Inc. provides consulting, technical, scientific, and project delivery services for the government and private sectors in the United States, Europe, Canada, India, rest of Asia, Australia, New Zealand, South America, Mexico, the Middle East, and Africa."
STE,0.5925,STERIS PLC,"STERIS plc provides infection prevention and other procedural products and services worldwide. It operates in four segments: Healthcare Products, Healthcare Specialty Services, Life Sciences, and Applied Sterilization Technologies."
AIZ,0.6004,ASSURANT INC,"Assurant, Inc., together with its subsidiaries, provides lifestyle and housing solutions that support, protect, and connect consumer purchases in North America, Latin America, Europe, and the Asia Pacific."
GNW,0.6026,GENWORTH FINANCIAL INC,"Genworth Financial, Inc. provides insurance products in the United States and internationally. It operates through four segments: U.S. Mortgage Insurance, Australia Mortgage Insurance, U.S. Life Insurance, and Runoff. The U.S."
SUNW,0.61,SUNWORKS INC,"Sunworks, Inc., through its subsidiaries, provides photovoltaic based power systems for the agricultural, commercial, industrial, public works, and residential markets in California, Massachusetts, Nevada, Oregon, New Jersey, and Washington."
