,dist,conm,busdesc
SNI,0.0,SCRIPPS NETWORKS INTERACTIVE,"Scripps Networks Interactive, Inc. develops lifestyle-oriented content in the United States, the United Kingdom and other European markets, the Middle East and Africa, the Asia-Pacific, and Latin America."
UST,0.2248,PROSHARES ULTRA 7-10 YR TRES,ProShares Trust - ProShares Ultra 7-10 Year Treasury is an exchange traded fund launched and managed by ProShare Advisors LLC. The fund invests in the fixed income markets of the United States.
MON,0.2578,MONSANTO CO,"Monsanto Company, together with its subsidiaries, provides agricultural products for farmers worldwide. It operates in two segments, Seeds and Genomics, and Agricultural Productivity."
COL,0.2691,ROCKWELL COLLINS,"Collins Aerospace designs, produces and supports communication and aviation systems worldwide."
AET,0.3083,AETNA INC,"Aetna Inc. operates as a health care benefits company in the United States. It operates through three segments: Health Care, Group Insurance, and Large Case Pensions."
TWX,0.3501,TIME WARNER INC,"Warner Media operates as a media and entertainment company worldwide. It operates in three segments: Turner, Home Box Office, and Warner Bros. The Turner segment creates and programs branded news, entertainment, sports, and kids multi-platform content for consumers."
CBH,0.3813,ALLIANZGI CON INCM 2024 TARG,AllianzGI Convertible & Income 2024 Target Term Fund is a closed ended balanced mutual fund launched and managed by Allianz Global Investors U.S. LLC. The fund invests in the public equity and fixed incomes markets of the United States.
AT,0.4368,ATLANTIC POWER CORP,Atlantic Power Corporation owns and operates a fleet of power generation assets in the United States and Canada.
SBUX,0.4894,STARBUCKS CORP,"Starbucks Corporation, together with its subsidiaries, operates as a roaster, marketer, and retailer of specialty coffee worldwide. The company operates through three segments: Americas, International, and Channel Development."
MKTX,0.4986,MARKETAXESS HOLDINGS INC,"MarketAxess Holdings Inc., together with its subsidiaries, operates an electronic trading platform that enables fixed-income market participants to trade corporate bonds and other types of fixed-income instruments worldwide."
CCU,0.5008,COMPANIA CERVECERIAS UNIDAS,"Compania Cervecerias Unidas S.A. operates as a beverage company principally in Chile, Argentina, Uruguay, Paraguay, Colombia, and Bolivia. The company operates through three segments: Chile, International Business, and Wine."
TSN,0.5625,TYSON FOODS INC  -CL A,"Tyson Foods, Inc., together with its subsidiaries, operates as a food company worldwide. It operates through four segments: Beef, Pork, Chicken, and Prepared Foods."
LIFE,0.5636,ATYR PHARMA INC,"aTyr Pharma, Inc., a biotherapeutics company, engages in the discovery and development of medicines based on novel immunological pathways in the United States."
GHC,0.5792,GRAHAM HOLDINGS CO,"Graham Holdings Company, through its subsidiaries, operates as a diversified education and media company worldwide."
ASH,0.5938,ASHLAND GLOBAL HOLDINGS INC,"Ashland Global Holdings Inc. provides specialty chemical solutions worldwide. The company's Specialty Ingredients segment offers products, technologies, and resources for solving formulation and product-performance challenges."
XRAY,0.6128,DENTSPLY SIRONA INC,"DENTSPLY SIRONA Inc. designs, develops, manufactures, and markets various dental products and technologies, and other consumable dental products and equipment primarily for the professional dental market worldwide. The company operates in two segments, Technologies & Equipment; and Consumables."
CDW,0.6138,CDW CORP,"CDW Corporation provides integrated information technology (IT) solutions to business, government, education, and healthcare customers in the United States, the United Kingdom, and Canada. It operates through three segments: Corporate, Small Business, and Public."
STE,0.614,STERIS PLC,"STERIS plc provides infection prevention and other procedural products and services worldwide. It operates in four segments: Healthcare Products, Healthcare Specialty Services, Life Sciences, and Applied Sterilization Technologies."
DXCM,0.6235,DEXCOM INC,"DexCom, Inc., a medical device company, focuses on the design, development, and commercialization of continuous glucose monitoring (CGM) systems in the United States and internationally. The company offers its systems for use by people with diabetes, as well as for use by healthcare providers."
HUM,0.625,HUMANA INC,"Humana Inc., together with its subsidiaries, operates as a health and well-being company in the United States. It operates through Retail, Group and Specialty, and Healthcare Services segments. The company offers medical and supplemental benefit plans to individuals."
FPL,0.6268,FIRST TR NEW OPP MLP &ENERGY,First Trust New Opportunities MLP & Energy Fund is a closed-ended balanced mutual fund launched and managed by First Trust Advisors L.P. It is co-managed by Energy Income Partners LLC. The fund invests in the public equity and fixed income markets of the United States.
DPS,0.6334,DR PEPPER SNAPPLE GROUP INC,"As of 2018, Dr Pepper Snapple Group, Inc is acquired by Keurig Dr Pepper Inc. Dr Pepper Snapple Group, Inc. manufactures and distributes non-alcoholic beverages in the United States, Mexico and the Caribbean, and Canada."
TSG,0.643,STARS GROUP INC,"The Stars Group Inc. engages in online gaming and betting businesses primarily in Europe, Australia, and the Americas."
STZ,0.6581,CONSTELLATION BRANDS,"Constellation Brands, Inc., together with its subsidiaries, produces, imports, and markets beer, wine, and spirits in the United States, Canada, Mexico, New Zealand, and Italy."
UHS,0.6608,UNIVERSAL HEALTH SVCS INC,"Universal Health Services, Inc., through its subsidiaries, owns and operates acute care hospitals, outpatient facilities, and behavioral health care facilities. The company operates through Acute Care Hospital Services, Behavioral Health Care Services, and Other segments."
DISCA,0.6616,DISCOVERY INC,"Discovery, Inc. operates as a media company in the United States and internationally. The company operates in two segments, U.S. Networks and International Networks."
CHRW,0.6633,C H ROBINSON WORLDWIDE INC,"C.H. Robinson Worldwide, Inc., a third party logistics company, provides freight transportation services and logistics solutions to companies in various industries worldwide. The company operates through North American Surface Transportation and Global Forwarding segments."
HCA,0.6673,HCA HEALTHCARE INC,"HCA Healthcare, Inc., through its subsidiaries, operates as a health care services company in the United States."
FLT,0.6721,FLEETCOR TECHNOLOGIES INC,"FLEETCOR Technologies, Inc. operates as a business payments company that simplifies the way businesses manage and pay expenses. The company's portfolio of brands help companies automate, secure, digitize, and control payments on behalf of employees and suppliers."
VIAB,0.6842,VIACOM INC,"As of December 4, 2019, Viacom Inc. was acquired by CBS Corporation. Viacom Inc. operates media brands that create entertainment content worldwide. It operates in two segments, Media Networks and Filmed Entertainment."
BKNG,0.6858,BOOKING HOLDINGS INC,Booking Holdings Inc. provides travel and restaurant online reservation and related services worldwide.
CAG,0.6877,CONAGRA BRANDS INC,"Conagra Brands, Inc., together with its subsidiaries, operates as a consumer packaged goods food company in North America. The company operates through Grocery & Snacks, Refrigerated & Frozen, International, and Foodservice segments."
BLL,0.6877,BALL CORP,"Ball Corporation supplies aluminum packaging products to the beverage, personal care, automotive, paint, healthcare, and household products industries."
DISCK,0.6878,DISCOVERY INC,"Discovery, Inc. operates as a media company in the United States and internationally. The company operates in two segments, U.S. Networks and International Networks."
BR,0.6891,BROADRIDGE FINANCIAL SOLUTNS,"Broadridge Financial Solutions, Inc. provides investor communications and technology-driven solutions for the financial services industry worldwide."
CVG,0.6906,CONVERGYS CORP,"Convergys Corporation provides customer management services to communications and media, technology, financial services, retail, healthcare, government, travel and hospitality, and other vertical markets worldwide."
MSI,0.6924,MOTOROLA SOLUTIONS INC,"Motorola Solutions, Inc. provides mission-critical communication solutions the United States, the United Kingdom, Canada, and internationally. The company operates in two segments, Products and Systems Integration, and Services and Software."
SII,0.693,SPROTT INC,"Sprott Inc. is a publicly owned asset management holding company. Through its subsidiaries, the firm provides asset management, portfolio management, wealth management, fund management, and administrative and consulting services to its clients."
H,0.6961,HYATT HOTELS CORP,"Hyatt Hotels Corporation, a hospitality company, develops, owns, operates, manages, franchises, licenses, or provides services to hotels, resorts, and other properties."
OMC,0.6977,OMNICOM GROUP,"Omnicom Group Inc., together with its subsidiaries, provides advertising, marketing, and corporate communications services. It provides a range of services in the areas of advertising, customer relationship management, public relations, and healthcare."
GCI,0.6996,GANNETT CO INC,"Gannett Co., Inc. operates as a media and marketing solutions company in the United States. It operates in Publishing and Marketing Solutions segments."
TWTR,0.7031,TWITTER INC,"Twitter, Inc. operates as a platform for public self-expression and conversation in real time United States and internationally."
ALK,0.706,ALASKA AIR GROUP INC,"Alaska Air Group, Inc., through its subsidiaries, provides passenger and cargo air transportation services. The company operates through three segments: Mainline, Regional, and Horizon."
NYT,0.7062,NEW YORK TIMES CO  -CL A,"The New York Times Company, together with its subsidiaries, provides news and information for readers and viewers across various platforms worldwide."
JBL,0.7244,JABIL INC,"Jabil Inc. provides manufacturing services and solutions worldwide. The company operates in two segments, Electronics Manufacturing Services and Diversified Manufacturing Services. It offers electronics design, production, and product management services."
VRSK,0.726,VERISK ANALYTICS INC,"Verisk Analytics, Inc. provides data analytics solutions in the United States and internationally."
WCG,0.7273,WELLCARE HEALTH PLANS INC,"WellCare Health Plans, Inc. provides government-sponsored managed care services. The company operates in three segments: Medicaid Health Plans, Medicare Health Plans, and Medicare Prescription Drug Plans (PDPs)."
NDAQ,0.7275,NASDAQ INC,"Nasdaq, Inc. operates as a technology company that serves capital markets and other industries worldwide."
ESRX,0.7306,EXPRESS SCRIPTS HOLDING CO,Express Scripts Holding Company operates as a pharmacy benefit management (PBM) company in the United States and Canada.
SUN,0.7316,SUNOCO LP,"Sunoco LP, together with its subsidiaries, engages in the distribution and retailing of motor fuels in the United States. It operates through two segments, Fuel Distribution and Marketing, and All Other."
CTSH,0.7322,COGNIZANT TECH SOLUTIONS,"Cognizant Technology Solutions Corporation, a professional services company, provides consulting and technology, and outsourcing services in North America, Europe, and internationally."
FISV,0.7347,FISERV INC,"Fiserv, Inc., together with its subsidiaries, provides financial services technology worldwide."
WST,0.7375,WEST PHARMACEUTICAL SVSC INC,"West Pharmaceutical Services, Inc. manufactures and sells containment and delivery systems for injectable drugs and healthcare products in the United States, Germany, Ireland, France, Other European countries, and internationally."
COTY,0.7557,COTY INC,"Coty Inc., together with its subsidiaries, manufactures, markets, distributes, and sells beauty products worldwide."
ADT,0.7561,ADT INC,"ADT Inc. provides security and automation solutions for homes and businesses in the United States and Canada. It provides a range of fire detection, fire suppression, video surveillance, and access control systems to residential, commercial, and multi-site customers."
CCL,0.7579,CARNIVAL CORPORATION & PLC,"Carnival Corporation & Plc operates as a leisure travel company. The company's ships visit approximately 700 ports under the Carnival Cruise Line, Princess Cruises, Holland America Line, Seabourn, P&O Cruises (Australia), Costa Cruises, AIDA Cruises, P&O Cruises (UK), and Cunard brand names."
SEE,0.7605,SEALED AIR CORP,"Sealed Air Corporation provides food safety and security, and product protection solutions and equipment in North America, South America, Europe, the Middle East, Africa, and the Asia Pacific. It operates in two segments, Food Care and Product Care."
TPR,0.7621,TAPESTRY INC,"Tapestry, Inc. provides luxury accessories and branded lifestyle products in the United States, Japan, China, Hong Kong, Macau, Taiwan, Europe, Canada, South Korea, Malaysia, Singapore, Australia, and New Zealand."
MMI,0.7635,MARCUS & MILLICHAP INC,"Marcus & Millichap, Inc., an investment brokerage company, provides real estate investment brokerage and financing services to sellers and buyers of commercial real estate in the United States and Canada."
LHX,0.7652,L3HARRIS TECHNOLOGIES INC,"L3Harris Technologies, Inc., an aerospace and defense technology company, provides mission-critical solutions for government and commercial customers worldwide."
LH,0.7665,LABORATORY CP OF AMER HLDGS,"Laboratory Corporation of America Holdings operates as an independent clinical laboratory company worldwide. It operates in two segments, LabCorp Diagnostics (LCD) and Covance Drug Development."
AA,0.7681,ALCOA CORP,"Alcoa Corporation, together with its subsidiaries, produces and sells bauxite, alumina, and aluminum products in the United States, Spain, Australia, Brazil, Canada, and internationally. The company operates through three segments: Bauxite, Alumina, and Aluminum."
SHW,0.7701,SHERWIN-WILLIAMS CO,"The Sherwin-Williams Company develops, manufactures, distributes, and sells paints, coatings, and related products to professional, industrial, commercial, and retail customers. It operates in three segments: The Americas Group, Consumer Brands Group, and Performance Coatings Group."
THC,0.7708,TENET HEALTHCARE CORP,"Tenet Healthcare Corporation operates as a diversified healthcare services company. The company operates through three segments: Hospital Operations and Other, Ambulatory Care, and Conifer."
ULTA,0.7711,ULTA BEAUTY INC,"Ulta Beauty, Inc. operates as a beauty retailer in the United States."
EL,0.7712,LAUDER (ESTEE) COS INC -CL A,"The Estee Lauder Companies Inc. manufactures and markets skin care, makeup, fragrance, and hair care products worldwide."
S,0.7758,SPRINT CORP,"Sprint Corporation provides a range of wireless and wireline communications products and services to consumers, businesses, government subscribers, and resellers in the United States, Puerto Rico, and the United States Virgin Islands. It operates in two segments, Wireless and Wireline."
TIF,0.778,TIFFANY & CO,"Tiffany & Co., through its subsidiaries, designs, manufactures, and retails jewelry and other items. The company offers jewelry collections, engagement rings, and wedding bands. It also sells watches, home and accessories products, and fragrances; and wholesales diamonds and earnings."
JBHT,0.7792,HUNT (JB) TRANSPRT SVCS INC,"J.B. Hunt Transport Services, Inc., together with its subsidiaries, provides surface transportation and delivery services in the continental United States, Canada, and Mexico."
SAIC,0.7817,SCIENCE APPLICATIONS INTL CP,"Science Applications International Corporation provides technical, engineering, and enterprise information technology (IT) services primarily in the United States."
COST,0.782,COSTCO WHOLESALE CORP,"Costco Wholesale Corporation, together with its subsidiaries, engages in the operation of membership warehouses in the United States, Puerto Rico, Canada, the United Kingdom, Mexico, Japan, Korea, Australia, Spain, France, Iceland, China, and Taiwan."
ZBH,0.7835,ZIMMER BIOMET HOLDINGS INC,"Zimmer Biomet Holdings, Inc., together with its subsidiaries, designs, manufactures, and markets musculoskeletal healthcare products and solutions in the Americas, Europe, the Middle East, Africa, and the Asia Pacific."
PCG,0.7877,PG&E CORP,"PG&E Corporation, through its subsidiary, Pacific Gas and Electric Company, engages in the sale and delivery of electricity and natural gas to customers in northern and central California, the United States."
UPS,0.7881,UNITED PARCEL SERVICE INC,"United Parcel Service, Inc. provides letter and package delivery, specialized transportation, logistics, and financial services. It operates through three segments: U.S. Domestic Package, International Package, and Supply Chain & Freight. The U.S."
LUV,0.7889,SOUTHWEST AIRLINES,Southwest Airlines Co. operates a passenger airline that provides scheduled air transportation services in the United States and near-international markets.
VFC,0.7936,VF CORP,"V.F. Corporation engages in the design, production, procurement, marketing, and distribution of branded lifestyle apparel, footwear, and related products for men, women, and children in the Americas, Europe, and the Asia-Pacific. It operates through four segments: Outdoor, Active, and Work."
HOLX,0.7981,HOLOGIC INC,"Hologic, Inc. develops, manufactures, and supplies diagnostics products, medical imaging systems, and surgical products for women's health through early detection and treatment in the United States, Europe, the Asia-Pacific, and internationally."
WBA,0.8018,WALGREENS BOOTS ALLIANCE INC,"Walgreens Boots Alliance, Inc. operates as a pharmacy-led health and beauty retail company. It operates through three segments: Retail Pharmacy USA, Retail Pharmacy International, and Pharmaceutical Wholesale."
EXPE,0.8037,EXPEDIA GROUP INC,"Expedia Group, Inc. operates as an online travel company worldwide. It operates through four segments: Core Online Travel Agencies, Trivago, Vrbo, and Egencia."
NCLH,0.8051,NORWEGIAN CRUISE LINE HLDGS,"Norwegian Cruise Line Holdings Ltd., together with its subsidiaries, operates as a cruise company in the North America, Europe, the Asia-Pacific, and internationally. The company operates the Norwegian Cruise Line, Oceania Cruises, and Regent Seven Seas Cruises brands."
VIAC,0.8077,VIACOMCBS INC,"ViacomCBS Inc. operates as a media and entertainment company worldwide. The company operates in four segments: TV Entertainment, Cable Networks, Filmed Entertainment, and Publishing."
BC,0.81,BRUNSWICK CORP,"Brunswick Corporation designs, manufactures, and markets recreation products worldwide."
MCK,0.8128,MCKESSON CORP,"McKesson Corporation provides pharmaceuticals and medical supplies in the United States and internationally. It operates through four segments: U.S. Pharmaceutical, Prescription Technology Solutions, International, and Medical-Surgical Solutions. The U.S."
CNC,0.8197,CENTENE CORP,Centene Corporation operates as a multi-national healthcare enterprise that provides programs and services to under-insured and uninsured individuals in the United States.
CIEN,0.8218,CIENA CORP,"Ciena Corporation provides network hardware, software, and services that support the transport, routing, switching, aggregation, service delivery, and management of video, data, and voice traffic on communications networks worldwide."
CAH,0.8225,CARDINAL HEALTH INC,"Cardinal Health, Inc. operates as an integrated healthcare services and products company in the United States and internationally. It provides customized solutions for hospitals, healthcare systems, pharmacies, ambulatory surgery centers, clinical laboratories, and physician offices."
FSLR,0.8236,FIRST SOLAR INC,"First Solar, Inc. provides photovoltaic (PV) solar energy solutions in the United States and internationally. It operates in two segments, Modules and Systems."
SANM,0.8275,SANMINA CORP,"Sanmina Corporation provides integrated manufacturing solutions, components, products and repair, logistics, and after-market services worldwide. It operates in two segments, Integrated Manufacturing Solutions; and Components, Products and Services."
NCR,0.828,NCR CORP,"NCR Corporation provides software and services worldwide. The company operates through Banking, Retail, Hospitality, and Other segments."
IQV,0.8364,IQVIA HOLDINGS INC,"IQVIA Holdings Inc. provides advanced analytics, technology solutions, and contract research services to the life sciences industry in the Americas, Europe, Africa, and the Asia-Pacific."
NUE,0.8392,NUCOR CORP,"Nucor Corporation manufactures and sells steel and steel products. It operates in three segments: Steel Mills, Steel Products, and Raw Materials."
INFO,0.8424,IHS MARKIT LTD,"IHS Markit Ltd. provides critical information, analytics, and solutions for various industries and markets worldwide. The company's information, analytics, and solutions enhance operational efficiency and offer deep insights for customers in business, finance, and government."
CMG,0.8428,CHIPOTLE MEXICAN GRILL INC,"Chipotle Mexican Grill, Inc., together with its subsidiaries, operates Chipotle Mexican Grill restaurants. As of September 30, 2020, it operated approximately 2,700 restaurants in the United States, Canada, the United Kingdom, France, and Germany."
SRCL,0.8454,STERICYCLE INC,"Stericycle, Inc., together with its subsidiaries, provides regulated and compliance solutions to the healthcare, retail, and commercial businesses in the United States, Europe, and internationally."
ABT,0.8459,ABBOTT LABORATORIES,"Abbott Laboratories discovers, develops, manufactures, and sells health care products worldwide."
CLF,0.8511,CLEVELAND-CLIFFS INC,"Cleveland-Cliffs Inc. operates as an independent iron ore mining company in the United States, Canada, and internationally. It operates in two segments, Mining and Pelletizing, and Metallics."
NLOK,0.8512,NORTONLIFELOCK INC,NortonLifeLock Inc. provides cyber safety solutions for consumers worldwide.
DVA,0.8522,DAVITA INC,DaVita Inc. provides kidney dialysis services for patients suffering from chronic kidney failure or end stage renal disease (ESRD). The company operates kidney dialysis centers and provides related lab services in outpatient dialysis centers.
CI,0.8526,CIGNA CORP,"Cigna Corporation provides insurance and related products and services. It operates through Health Services, Integrated Medical, International Markets, and Group Disability and Other segments."
FAST,0.8569,FASTENAL CO,"Fastenal Company, together with its subsidiaries, engages in the wholesale distribution of industrial and construction supplies in the United States, Canada, Mexico, North America, and internationally."
TGNA,0.8586,TEGNA INC,TEGNA Inc. operates as a media company in the United States. The company operates television stations and radio stations that deliver television programming and digital content. It offers content and information to consumers across various platforms.
CHTR,0.8673,CHARTER COMMUNICATIONS INC,"Charter Communications, Inc., through its subsidiaries, provides cable services to residential and commercial customers in the United States."
MHK,0.8673,MOHAWK INDUSTRIES INC,"Mohawk Industries, Inc. designs, manufactures, sources, distributes, and markets flooring products for remodeling and new constructions of residential and commercial spaces in the United States, Europe, Russia, and internationally."
CTLT,0.8756,CATALENT INC,"Catalent, Inc., together with its subsidiaries, provides delivery technologies and development solutions for drugs, biologics, and consumer and animal health products worldwide."
BIIB,0.886,BIOGEN INC,"Biogen Inc. discovers, develops, manufactures, and delivers therapies for treating neurological and neurodegenerative diseases worldwide."
BIO,0.8929,BIO-RAD LABORATORIES INC,"Bio-Rad Laboratories, Inc. develops, manufactures, and markets products and solutions for the life science research and clinical diagnostic markets in Europe, the United States, Canada, and Latin America."
BRYN,0.916,RNETHEALTH INC,"BRYN Resources Inc. provides corporate, capital, and communication services for small businesses worldwide. The company operates VybeOffice, an online tool that allows you to manage company online from a single portal. It also offers stock issuance, transfer, custodial, and registrar services."
NWSA,0.938,NEWS CORP,"News Corporation, a media and information services company, creates and distributes content for consumers and businesses worldwide. It operates in six segments: Digital Real Estate Services, Subscription Video Services, Dow Jones, Book Publishing, News Media, and Other."
