,dist,conm,busdesc
PMCS,0.0,PMC-SIERRA INC,"Microsemi Storage Solutions, Inc. designs, develops, markets, and supports semiconductor solutions for communications network infrastructure equipment worldwide. Its semiconductor devices enable networking equipment primarily in three markets, including storage, optical, and mobile networks."
EIX,0.0508,EDISON INTERNATIONAL,"Edison International, through its subsidiaries, engages in the generation, transmission, and distribution of electricity in the United States. The company generates electricity through hydroelectric, diesel/liquid petroleum gas, natural gas, nuclear, and photovoltaic sources."
GAS,0.0585,SOUTHERN CO GAS,"Southern Company Gas, an energy services holding company, distributes natural gas in Illinois, Georgia, Virginia, and Tennessee. It operates through four segments: Gas Distribution Operations, Gas Pipeline Investments, Wholesale Gas Services, and Gas Marketing Services."
POM,0.0586,PEPCO HOLDINGS INC,"Pepco Holdings LLC operates as a utility services holding company. The company operates through Pepco, DPL, and ACE segments."
RE,0.1017,EVEREST RE GROUP LTD,"Everest Re Group, Ltd., through its subsidiaries, provides reinsurance and insurance products in the United States, Bermuda, and internationally. The company operates through four segments: U.S. Reinsurance, International, Bermuda, and Insurance. The U.S."
ESS,0.1407,ESSEX PROPERTY TRUST,"Essex Property Trust, Inc., an S&P 500 company, is a fully integrated real estate investment trust (REIT) that acquires, develops, redevelops, and manages multifamily residential properties in selected West Coast markets."
AFL,0.143,AFLAC INC,"Aflac Incorporated, through its subsidiaries, provides supplemental health and life insurance products. It operates through two segments, Aflac Japan and Aflac U.S."
UDR,0.1543,UDR INC,"UDR, Inc."
PG,0.1566,PROCTER & GAMBLE CO,"The Procter & Gamble Company provides branded consumer packaged goods to consumers in North and Latin America, Europe, the Asia Pacific, Greater China, India, the Middle East, and Africa."
AWK,0.1685,AMERICAN WATER WORKS CO INC,"American Water Works Company, Inc., through its subsidiaries, provides water and wastewater services in the United States. It offers water and wastewater services to approximately 1,700 communities in 16 states serving approximately 3.4 million active customers."
MAA,0.1852,MID-AMERICA APT CMNTYS INC,"MAA, an S&P 500 company, is a real estate investment trust, or REIT, focused on delivering full-cycle and superior investment performance for shareholders through the ownership, management, acquisition, development and redevelopment of quality apartment communities throughout the United States."
BMS,0.2072,BEMIS CO INC,"Bemis Company, Inc. manufactures and sells packaging products in the United States, Brazil, other Americas, Europe, and the Asia-Pacific. It operates through three segments: U.S. Packaging, Latin America Packaging, and Rest of World Packaging."
DE,0.2089,DEERE & CO,"Deere & Company, together with its subsidiaries, manufactures and distributes various equipment worldwide. The company operates through three segments: Agriculture and Turf, Construction and Forestry, and Financial Services."
CBOE,0.2131,CBOE GLOBAL MARKETS INC,"Cboe Global Markets, Inc., through its subsidiaries, operates as an options exchange in the United States. It operates in five segments: Options, U.S. Equities, Futures, European Equities, and Global FX. The Options segment trades in listed market indices. The U.S."
KO,0.2131,COCA-COLA CO,"The Coca-Cola Company, a beverage company, manufactures, markets, and sells various nonalcoholic beverages worldwide. The company provides sparkling soft drinks; water, enhanced water, and sports drinks; juice, dairy, and plant-based beverages; tea and coffee; and energy drinks."
FRT,0.2141,FEDERAL REALTY INVESTMENT TR,"Federal Realty is a recognized leader in the ownership, operation and redevelopment of high-quality retail-based properties located primarily in major coastal markets from Washington, D.C. to Boston as well as San Francisco and Los Angeles."
CLX,0.2175,CLOROX CO/DE,"The Clorox Company manufactures and markets consumer and professional products worldwide. It operates through four segments: Health and Wellness, Household, Lifestyle, and International."
GIS,0.2188,GENERAL MILLS INC,"General Mills, Inc. manufactures and markets branded consumer foods worldwide. The company operates in five segments: North America Retail; Convenience Stores & Foodservice; Europe & Australia; Asia & Latin America; and Pet."
T,0.2246,AT&T INC,"AT&T Inc. provides telecommunication, media, and technology services worldwide. The company operates through four segments: Communications, WarnerMedia, Latin America, and Xandr."
MON,0.2349,MONSANTO CO,"Monsanto Company, together with its subsidiaries, provides agricultural products for farmers worldwide. It operates in two segments, Seeds and Genomics, and Agricultural Productivity."
SLM,0.2383,SLM CORP,"SLM Corporation, through its subsidiaries, originates and services private education loans to students and their families to finance the cost of their education in the United States."
LH,0.2431,LABORATORY CP OF AMER HLDGS,"Laboratory Corporation of America Holdings operates as an independent clinical laboratory company worldwide. It operates in two segments, LabCorp Diagnostics (LCD) and Covance Drug Development."
LSI,0.2502,LIFE STORAGE INC,"Life Storage, Inc. is a self-administered and self-managed equity REIT that is in the business of acquiring and managing self-storage facilities. Located in Buffalo, New York, the Company operates more than 900 storage facilities in 30 states and in the province of Ontario, Canada."
DGX,0.2553,QUEST DIAGNOSTICS INC,"Quest Diagnostics Incorporated provides diagnostic testing, information, and services in the United States and internationally."
FFIV,0.2603,F5 NETWORKS INC,"F5 Networks, Inc. provides multi-cloud application services for the security, performance, and availability of network applications, servers, and storage systems."
REG,0.278,REGENCY CENTERS CORP,"Regency Centers is the preeminent national owner, operator, and developer of shopping centers located in affluent and densely populated trade areas."
PM,0.2787,PHILIP MORRIS INTERNATIONAL,"Philip Morris International Inc., through its subsidiaries, manufactures and sells cigarettes, other nicotine-containing products, smoke-free products, and related electronic devices and accessories."
CVS,0.2868,CVS HEALTH CORP,CVS Health Corporation provides health services and plans in the United States.
IBM,0.2932,INTL BUSINESS MACHINES CORP,International Business Machines Corporation provides integrated solutions and services worldwide.
DRE,0.3071,DUKE REALTY CORP,Duke Realty Corporation owns and operates approximately 156 million rentable square feet of industrial assets in 20 major logistics markets. Duke Realty Corporation is publicly traded on the NYSE under the symbol DRE and is a member of the S&P 500 Index.
MKC,0.308,MCCORMICK & CO INC,"McCormick & Company, Incorporated manufactures, markets, and distributes spices, seasoning mixes, condiments, and other flavorful products to the food industry. The company operates in two segments, Consumer and Flavor Solutions."
GME,0.3104,GAMESTOP CORP,"GameStop Corp. operates as a multichannel video game, consumer electronics, and collectibles retailer in the United States, Canada, Australia, and Europe."
PEP,0.3122,PEPSICO INC,"PepsiCo, Inc. operates as a food and beverage company worldwide. The company operates through seven segments: FLNA, QFNA, PBNA, LatAm, Europe, AMESA, and APAC."
SLG,0.3242,SL GREEN REALTY CORP,"SL Green Realty Corp., an S&P 500 company and Manhattan's largest office landlord, is a fully integrated real estate investment trust, or REIT, that is focused primarily on acquiring, managing and maximizing value of Manhattan commercial properties."
PWR,0.3245,QUANTA SERVICES INC,"Quanta Services, Inc. provides specialty contracting services in the United States, Canada, Australia, Latin America, and internationally."
PVH,0.329,PVH CORP,PVH Corp. operates as an apparel company in the United States and internationally.
EQR,0.3352,EQUITY RESIDENTIAL,"Equity Residential is committed to creating communities where people thrive. The Company, a member of the S&P 500, is focused on the acquisition, development and management of residential properties located in and around dynamic cities that attract high quality long-term renters."
EVRG,0.3403,EVERGY INC,"Evergy, Inc., through its subsidiaries, engages in the generation, transmission, distribution, and sale of electricity in Kansas and Missouri."
ASH,0.3404,ASHLAND GLOBAL HOLDINGS INC,"Ashland Global Holdings Inc. provides specialty chemical solutions worldwide. The company's Specialty Ingredients segment offers products, technologies, and resources for solving formulation and product-performance challenges."
BBY,0.3568,BEST BUY CO INC,"Best Buy Co., Inc. retails technology products in the United States, Canada, and Mexico. The company operates in two segments, Domestic and International."
M,0.3579,MACY'S INC,"Macy's, Inc., an omnichannel retail organization, operates stores, websites, and mobile applications under the Macy's, Bloomingdale's, and bluemercury brands."
SJM,0.3618,SMUCKER (JM) CO,"The J. M. Smucker Company manufactures and markets food and beverage products worldwide. It operates in four segments: U.S. Retail Pet Foods, U.S. Retail Coffee, U.S. Retail Consumer Foods, and International and Away From Home."
BUD,0.3656,ANHEUSER-BUSCH INBEV,"Anheuser-Busch InBev SA/NV, a brewing company, engages in the production, distribution, and sale of beer, alcoholic beverages, and soft drinks worldwide."
WY,0.3711,WEYERHAEUSER CO,"Weyerhaeuser Company, one of the world's largest private owners of timberlands, began operations in 1900. We own or control approximately 11 million acres of timberlands in the U.S. and manage additional timberlands under long-term licenses in Canada."
GM,0.3717,GENERAL MOTORS CO,"General Motors Company designs, builds, and sells cars, trucks, crossovers, and automobile parts worldwide. The company operates through GM North America, GM International, Cruise, and GM Financial segments."
IP,0.3726,INTL PAPER CO,"International Paper Company operates as a paper and packaging company primarily in United States, the Middle East, Europe, Africa, Pacific Rim, Asia, and the Americas. It operates through three segments: Industrial Packaging, Global Cellulose Fibers, and Printing Papers."
AIV,0.3733,APARTMENT INVST & MGMT CO,Aimco is a real estate investment trust focused on the ownership and management of quality apartment communities located in select markets in the United States.
TSN,0.3754,TYSON FOODS INC  -CL A,"Tyson Foods, Inc., together with its subsidiaries, operates as a food company worldwide. It operates through four segments: Beef, Pork, Chicken, and Prepared Foods."
PGR,0.3772,PROGRESSIVE CORP-OHIO,"The Progressive Corporation, through its subsidiaries, provides personal and commercial auto insurance, residential property insurance, and other specialty property-casualty insurance and related services primarily in the United States."
FLS,0.379,FLOWSERVE CORP,"Flowserve Corporation designs, develops, manufactures, distributes, and services industrial flow management equipment in the United States, Europe, the Middle East, Africa, Asia, and internationally."
PCL,0.3796,PLUM CREEK TIMBER CO INC,"As on February 19, 2016, Plum Creek Timber Co. Inc. was acquired by Weyerhaeuser Co. Plum Creek Timber Company, Inc. is a privately owned real estate investment trust (REIT). The trust owns and manages timberlands in the United States."
APD,0.3826,AIR PRODUCTS & CHEMICALS INC,"Air Products and Chemicals, Inc. provides atmospheric gases, process and specialty gases, equipment, and services worldwide."
PPG,0.3853,PPG INDUSTRIES INC,"PPG Industries, Inc. manufactures and distributes paints, coatings, and specialty materials worldwide."
AVB,0.3992,AVALONBAY COMMUNITIES INC,"As of September 30, 2020, the Company owned or held a direct or indirect ownership interest in 294 apartment communities containing 86,676 apartment homes in 11 states and the District of Columbia, of which 19 communities were under development and one community was under redevelopment."
PH,0.4055,PARKER-HANNIFIN CORP,"Parker-Hannifin Corporation manufactures and sells motion and control technologies and systems for various mobile, industrial, and aerospace markets worldwide. The company operates through two segments, Diversified Industrial and Aerospace Systems."
DLR,0.4061,DIGITAL REALTY TRUST INC,"Digital Realty supports the world's leading enterprises and service providers by delivering the full spectrum of data center, colocation and interconnection solutions."
VNO,0.4098,VORNADO REALTY TRUST,Vornado's portfolio is concentrated in the nation's key market - New York City - along with the premier asset in both Chicago and San Francisco. Vornado is also the real estate industry leader in sustainability policy.
ALL,0.4131,ALLSTATE CORP,"The Allstate Corporation, through its subsidiaries, provides property and casualty, and other insurance products in the United States and Canada. The company operates through Allstate Protection, Service Businesses, Allstate Life, and Allstate Benefits segments."
ISRG,0.4144,INTUITIVE SURGICAL INC,"Intuitive Surgical, Inc., together with its subsidiaries, designs, manufactures, and markets da Vinci surgical systems, and related instruments and accessories in the United States and internationally."
CL,0.4165,COLGATE-PALMOLIVE CO,"Colgate-Palmolive Company, together with its subsidiaries, manufactures and sells consumer products worldwide. The company operates through two segments, Oral, Personal and Home Care; and Pet Nutrition."
ANSS,0.4168,ANSYS INC,"ANSYS, Inc. develops and markets engineering simulation software and services worldwide."
MSI,0.4182,MOTOROLA SOLUTIONS INC,"Motorola Solutions, Inc. provides mission-critical communication solutions the United States, the United Kingdom, Canada, and internationally. The company operates in two segments, Products and Systems Integration, and Services and Software."
TAP,0.4192,MOLSON COORS BEVERAGE CO,"Molson Coors Beverage Company manufactures, markets, and sells beer and other malt beverage products in the United States, Canada, Europe, and internationally."
AAP,0.4216,ADVANCE AUTO PARTS INC,"Advance Auto Parts, Inc. provides automotive replacement parts, accessories, batteries, and maintenance items for domestic and imported cars, vans, sport utility vehicles, and light and heavy duty trucks."
COO,0.4219,COOPER COS INC (THE),"The Cooper Companies, Inc. operates as a medical device company worldwide. It operates through CooperVision and CooperSurgical business units."
EXR,0.4254,EXTRA SPACE STORAGE INC,"Extra Space Storage Inc., headquartered in Salt Lake City, Utah, is a self-administered and self-managed REIT and a member of the S&P 500. As of September 30, 2020, the Company owned and/or operated 1,906 self-storage stores in 40 states, Washington, D.C. and Puerto Rico."
PSA,0.4314,PUBLIC STORAGE,"Public Storage, a member of the S&P 500 and FT Global 500, is a REIT that primarily acquires, develops, owns and operates self-storage facilities."
IFF,0.434,INTL FLAVORS & FRAGRANCES,"International Flavors & Fragrances Inc., together with its subsidiaries, manufactures flavors and fragrances for use in various consumer products. It operates through two segments, Taste and Scent."
IGT,0.4394,INTL GAME TECHNOLOGY PLC,"International Game Technology PLC operates and provides gaming technology products and services worldwide. The company operates through four segments: North America Gaming and Interactive, North America Lottery, International, and Italy."
ITW,0.4436,ILLINOIS TOOL WORKS,Illinois Tool Works Inc. manufactures and sells industrial products and equipment worldwide. It operates through seven segments: Automotive OEM; Food Equipment; Test & Measurement and Electronics; Welding; Polymers & Fluids; Construction Products; and Specialty Products.
KSS,0.4498,KOHL'S CORP,"Kohl's Corporation operates as a retail company in the United States. Its stores and Website offer apparel, footwear, accessories, beauty, and home products. The company provides its products primarily under the brand names of Apt."
PBI,0.4509,PITNEY BOWES INC,"Pitney Bowes Inc., a technology company, provides commerce solutions in the United States and internationally. The company operates through Global Ecommerce, Presort Services and SendTech Solutions segments."
TGT,0.4511,TARGET CORP,Target Corporation operates as a general merchandise retailer in the United States.
TYC,0.4579,TYCO INTERNATIONAL PLC,"As of September 2, 2016, Tyco International plc was acquired by Johnson Controls International plc. Tyco International plc provides security products and services, fire detection and suppression products and services, and life safety products worldwide."
PKG,0.4591,PACKAGING CORP OF AMERICA,Packaging Corporation of America manufactures and sells containerboard and corrugated packaging products in the United States. The company operates through Packaging and Paper segments.
JWN,0.4648,NORDSTROM INC,"Nordstrom, Inc., a fashion retailer, provides apparels, shoes, cosmetics, and accessories for women, men, young adults, and children."
EMC,0.4685,EMC CORP/MA,"Dell EMC develops, delivers, and supports information infrastructure and virtual infrastructure technologies, solutions, and services."
VAR,0.4689,VARIAN MEDICAL SYSTEMS INC,"Varian Medical Systems, Inc. designs, manufactures, sells, and services medical devices and software products for treating cancer and other medical conditions worldwide. It operates through Oncology Systems and Proton Solutions segments."
PHM,0.4691,PULTEGROUP INC,"PulteGroup, Inc., through its subsidiaries, primarily engages in the homebuilding business in the United States. The company acquires and develops land primarily for residential purposes; and constructs housing on such land."
ADBE,0.4693,ADOBE INC,"Adobe Inc. operates as a diversified software company worldwide. Its Digital Media segment provides tools and solutions that enable individuals, teams, and enterprises to create, publish, promote, and monetize their digital content."
COST,0.4777,COSTCO WHOLESALE CORP,"Costco Wholesale Corporation, together with its subsidiaries, engages in the operation of membership warehouses in the United States, Puerto Rico, Canada, the United Kingdom, Mexico, Japan, Korea, Australia, Spain, France, Iceland, China, and Taiwan."
CAM,0.4801,CAMERON INTERNATIONAL CORP,"Cameron International Corporation provides flow equipment products, systems, and services worldwide."
NKE,0.4814,NIKE INC  -CL B,"NIKE, Inc., together with its subsidiaries, designs, develops, markets, and sells athletic footwear, apparel, equipment, and accessories worldwide. The company offers NIKE brand products in six categories, including running, NIKE basketball, the Jordan brand, football, training, and sportswear."
CCU,0.4849,COMPANIA CERVECERIAS UNIDAS,"Compania Cervecerias Unidas S.A. operates as a beverage company principally in Chile, Argentina, Uruguay, Paraguay, Colombia, and Bolivia. The company operates through three segments: Chile, International Business, and Wine."
IRM,0.4863,IRON MOUNTAIN INC,"Iron Mountain Incorporated (NYSE: IRM), founded in 1951, is the global leader for storage and information management services."
ETN,0.4879,EATON CORP PLC,Eaton Corporation plc operates as a power management company worldwide.
INFO,0.4902,IHS MARKIT LTD,"IHS Markit Ltd. provides critical information, analytics, and solutions for various industries and markets worldwide. The company's information, analytics, and solutions enhance operational efficiency and offer deep insights for customers in business, finance, and government."
XYL,0.4971,XYLEM INC,"Xylem Inc. engages in the design, manufacture, and servicing of engineered products and solutions for the water and wastewater applications in the United States, Europe, the Asia Pacific, and internationally."
MTG,0.5059,MGIC INVESTMENT CORP/WI,"MGIC Investment Corporation, through its subsidiaries, provides private mortgage insurance, other mortgage credit risk management solutions, and ancillary services to lenders and government sponsored entities in the United States, Puerto Rico, and Guam."
ROK,0.5086,ROCKWELL AUTOMATION,"Rockwell Automation, Inc. provides industrial automation and digital transformation solutions. The company operates in two segments, Architecture & Software, and Control Products & Solutions."
TT,0.509,TRANE TECHNOLOGIES PLC,"Trane Technologies plc provides climate control solutions for buildings, homes, and transportation."
SPG,0.5105,SIMON PROPERTY GROUP INC,"Simon is a real estate investment trust engaged in the ownership of premier shopping, dining, entertainment and mixed-use destinations and an S&P 100 company (Simon Property Group, NYSE: SPG)."
IEX,0.5141,IDEX CORP,"IDEX Corporation, together with its subsidiaries, operates as an applied solutions company worldwide. The company operates through three segments: Fluid & Metering Technologies (FMT), Health & Science Technologies (HST), and Fire & Safety/Diversified Products (FSDP)."
PEAK,0.515,HEALTHPEAK PROPERTIES INC,"Healthpeak Properties, Inc. is a fully integrated real estate investment trust (REIT) and S&P 500 company."
MNST,0.516,MONSTER BEVERAGE CORP,"Monster Beverage Corporation, through its subsidiaries, develops, markets, sells, and distributes energy drink beverages and concentrates in the United States and internationally. It operates through three segments: Monster Energy Drinks, Strategic Brands, and Other."
BCR,0.5225,BARD (C.R.) INC,"C. R. Bard, Inc. designs, manufactures, packages, distributes, and sells medical, surgical, diagnostic, and patient care devices worldwide."
TIF,0.5262,TIFFANY & CO,"Tiffany & Co., through its subsidiaries, designs, manufactures, and retails jewelry and other items. The company offers jewelry collections, engagement rings, and wedding bands. It also sells watches, home and accessories products, and fragrances; and wholesales diamonds and earnings."
HSY,0.5281,HERSHEY CO,"The Hershey Company, together with its subsidiaries, manufactures and sells confectionery products. The company operates through two segments, North America; and International and Other."
GWW,0.5356,GRAINGER (W W) INC,"W.W. Grainger, Inc. distributes maintenance, repair, and operating (MRO) products and services in the United States, Canada, and internationally."
TSG,0.5356,STARS GROUP INC,"The Stars Group Inc. engages in online gaming and betting businesses primarily in Europe, Australia, and the Americas."
STZ,0.5472,CONSTELLATION BRANDS,"Constellation Brands, Inc., together with its subsidiaries, produces, imports, and markets beer, wine, and spirits in the United States, Canada, Mexico, New Zealand, and Italy."
HCA,0.5489,HCA HEALTHCARE INC,"HCA Healthcare, Inc., through its subsidiaries, operates as a health care services company in the United States."
BBBY,0.5499,BED BATH & BEYOND INC,"Bed Bath & Beyond Inc., together with its subsidiaries, operates a chain of retail stores."
TXT,0.5506,TEXTRON INC,"Textron Inc. operates in the aircraft, defense, industrial, and finance businesses worldwide."
AIZ,0.5514,ASSURANT INC,"Assurant, Inc., together with its subsidiaries, provides lifestyle and housing solutions that support, protect, and connect consumer purchases in North America, Latin America, Europe, and the Asia Pacific."
J,0.5586,JACOBS ENGINEERING GROUP INC,"Jacobs Engineering Group Inc. provides consulting, technical, scientific, and project delivery services for the government and private sectors in the United States, Europe, Canada, India, rest of Asia, Australia, New Zealand, South America, Mexico, the Middle East, and Africa."
HD,0.5705,HOME DEPOT INC,"The Home Depot, Inc. operates as a home improvement retailer."
MSCI,0.575,MSCI INC,"MSCI Inc., together with its subsidiaries, provides investment decision support tools for the clients to manage their investment processes worldwide. The company operates through four segments: Index, Analytics, ESG, and Real Estate."
MJN,0.5815,MEAD JOHNSON NUTRITION CO,"Mead Johnson Nutrition Company manufactures and sells infant formula, children's nutrition, and other nutritional products."
GD,0.5858,GENERAL DYNAMICS CORP,"General Dynamics Corporation operates as an aerospace and defense company worldwide. It operates through five segments: Aerospace, Combat Systems, Information Technology, Mission Systems, and Marine Systems."
NOC,0.5889,NORTHROP GRUMMAN CORP,Northrop Grumman Corporation operates as a security company.
CME,0.5964,CME GROUP INC,"CME Group Inc., through its subsidiaries, operates contract markets for the trading of futures and options on futures contracts worldwide."
L,0.599,LOEWS CORP,Loews Corporation provides commercial property and casualty insurance in the United States and internationally.
WFM,0.6047,WHOLE FOODS MARKET INC,"Whole Foods Market, Inc. operates natural and organic foods supermarkets. The company's stores offers produce, grocery, meat and poultry, seafood, bakery, prepared foods, coffee, tea, beer, wine, cheese, nutritional supplements, vitamins, body care, pet foods, and household goods."
MAC,0.6068,MACERICH CO,"Macerich is a fully integrated, self-managed and self-administered real estate investment trust, which focuses on the acquisition, leasing, management, development and redevelopment of regional malls throughout the United States."
FL,0.6097,FOOT LOCKER INC,"Foot Locker, Inc., through its subsidiaries, operates as an athletic footwear and apparel retailer."
