,dist,conm,busdesc
STX,0.0,SEAGATE TECHNOLOGY PLC,"Seagate Technology plc provides data storage technology and solutions in Singapore, the United States, the Netherlands, and internationally."
KMB,0.3722,KIMBERLY-CLARK CORP,"Kimberly-Clark Corporation, together with its subsidiaries, manufactures and markets personal care and consumer tissue products worldwide. It operates through three segments: Personal Care, Consumer Tissue, and K-C Professional."
MWV,0.4014,MEADWESTVACO CORP,"WestRock MWV, LLC provides packaging solutions to the healthcare, beauty and personal care, food, beverage, home and garden, tobacco, and agricultural industries worldwide."
ROK,0.4251,ROCKWELL AUTOMATION,"Rockwell Automation, Inc. provides industrial automation and digital transformation solutions. The company operates in two segments, Architecture & Software, and Control Products & Solutions."
ADM,0.4306,ARCHER-DANIELS-MIDLAND CO,"Archer-Daniels-Midland Company procures, transports, stores, processes, and merchandises agricultural commodities, products, and ingredients in the United States and internationally. The company operates through three segments: Ag Services and Oilseeds, Carbohydrate Solutions, and Nutrition."
UNP,0.4321,UNION PACIFIC CORP,"Union Pacific Corporation, through its subsidiary, Union Pacific Railroad Company, engages in the railroad business in the United States."
BEN,0.4402,FRANKLIN RESOURCES INC,"Franklin Resources, Inc. is a publicly owned asset management holding company. Through its subsidiaries, the firm provides its services to individuals, institutions, pension plans, trusts, and partnerships."
NSC,0.4781,NORFOLK SOUTHERN CORP,"Norfolk Southern Corporation, together with its subsidiaries, engages in the rail transportation of raw materials, intermediate products, and finished goods in the United States."
ODP,0.4781,ODP CORP,"The ODP Corporation provides business services and supplies, products, and technology solutions for small, medium, and enterprise businesses. The company operates in three divisions: Business Solutions, Retail, and CompuCom."
ENDP,0.4813,ENDO INTERNATIONAL PLC,Endo International plc manufactures and sells generic and branded pharmaceuticals in the United States and internationally.
WMB,0.4825,WILLIAMS COS INC,"The Williams Companies, Inc., together with its subsidiaries, operates as an energy infrastructure company primarily in the United States. It operates through Atlantic-Gulf, Northeast G&P, and West segments."
NFLX,0.484,NETFLIX INC,"Netflix, Inc. provides subscription streaming entertainment service. It offers TV series, documentaries, and feature films across various genres and languages."
ABT,0.5034,ABBOTT LABORATORIES,"Abbott Laboratories discovers, develops, manufactures, and sells health care products worldwide."
IRM,0.517,IRON MOUNTAIN INC,"Iron Mountain Incorporated (NYSE: IRM), founded in 1951, is the global leader for storage and information management services."
AGN,0.5171,ALLERGAN PLC,"Allergan plc, a pharmaceutical company, develops, manufactures, and commercializes branded pharmaceutical, device, biologic, surgical, and regenerative medicine products worldwide. The company operates in three segments: US Specialized Therapeutics, US General Medicine, and International."
MDP,0.5226,MEREDITH CORP,"Meredith Corporation operates as a diversified media company primarily in the United States. It operates in two segments, National Media and Local Media."
M,0.5328,MACY'S INC,"Macy's, Inc., an omnichannel retail organization, operates stores, websites, and mobile applications under the Macy's, Bloomingdale's, and bluemercury brands."
TXU,0.5399,ENERGY FUTURE HOLDINGS CORP,"Sempra Texas Holdings Corp., through its subsidiaries, engages in competitive and regulated energy businesses in Texas. The company operates in two segments, Competitive Electric and Regulated Delivery."
SOV,0.54,SANTANDER HOLDINGS USA INC,"Santander Holdings USA, Inc. operates as the holding company for Santander Bank, National Association that provides various banking products and services primarily in the Mid-Atlantic and Northeastern United States."
WMT,0.5415,WALMART INC,"Walmart Inc. engages in the retail and wholesale operations in various formats worldwide. The company operates in three segments: Walmart U.S., Walmart International, and Sam's Club."
ZBRA,0.5502,ZEBRA TECHNOLOGIES CP  -CL A,"Zebra Technologies Corporation, together with its subsidiaries, provides enterprise asset intelligence solutions in the automatic identification and data capture solutions industry worldwide."
KG,0.5563,KING PHARMACEUTICALS INC,"King Pharmaceuticals LLC develops, and markets prescription pharmaceutical products and animal health products worldwide."
DVA,0.5568,DAVITA INC,DaVita Inc. provides kidney dialysis services for patients suffering from chronic kidney failure or end stage renal disease (ESRD). The company operates kidney dialysis centers and provides related lab services in outpatient dialysis centers.
GT,0.5704,GOODYEAR TIRE & RUBBER CO,"The Goodyear Tire & Rubber Company, together with its subsidiaries, develops, manufactures, distributes, and sells tires and related products and services worldwide."
CSX,0.5706,CSX CORP,"CSX Corporation, together with its subsidiaries, provides rail-based freight transportation services."
MRK,0.5718,MERCK & CO,"Merck & Co., Inc. provides healthcare solutions worldwide."
BAX,0.586,BAXTER INTERNATIONAL INC,"Baxter International Inc., through its subsidiaries, develops and provides a portfolio of healthcare products. The company operates through North and South America; Europe, Middle East and Africa; and Asia-Pacific segments."
ORLY,0.591,O'REILLY AUTOMOTIVE INC,"O'Reilly Automotive, Inc., together with its subsidiaries, engages in the retail of automotive aftermarket parts, tools, supplies, equipment, and accessories in the United States."
ROST,0.5924,ROSS STORES INC,"Ross Stores, Inc., together with its subsidiaries, operates off-price retail apparel and home fashion stores under the Ross Dress for Less and dd's DISCOUNTS brands. Its stores primarily offers apparel, accessories, footwear, and home fashions."
OI,0.594,O-I GLASS INC,"O-I Glass, Inc., through its subsidiaries, manufactures and sells glass containers to food and beverage manufacturers primarily in the Americas, Europe, and the Asia Pacific. It produces glass containers for alcoholic beverages, including beer, flavored malt beverages, spirits, and wine."
BNI,0.596,BURLINGTON NORTHERN SANTA FE,"Burlington Northern Santa Fe, LLC, through its subsidiaries, provides freight rail transportation services in North America."
GPS,0.5967,GAP INC,"The Gap, Inc. operates as an apparel retail company worldwide. The company offers apparel, accessories, and personal care products for men, women, and children under the Old Navy, Gap, Banana Republic, Athleta, Intermix, Janie and Jack, and Hill City brands."
TSCO,0.6024,TRACTOR SUPPLY CO,Tractor Supply Company operates rural lifestyle retail stores in the United States.
JNY,0.6069,JONES GROUP INC,"Premier Brands Group Holdings LLC designs, markets, and wholesales apparel, footwear, jeanswear, jewelry, and handbags in the United States and internationally."
VFC,0.6084,VF CORP,"V.F. Corporation engages in the design, production, procurement, marketing, and distribution of branded lifestyle apparel, footwear, and related products for men, women, and children in the Americas, Europe, and the Asia-Pacific. It operates through four segments: Outdoor, Active, and Work."
CAH,0.6104,CARDINAL HEALTH INC,"Cardinal Health, Inc. operates as an integrated healthcare services and products company in the United States and internationally. It provides customized solutions for hospitals, healthcare systems, pharmacies, ambulatory surgery centers, clinical laboratories, and physician offices."
CVS,0.6163,CVS HEALTH CORP,CVS Health Corporation provides health services and plans in the United States.
CCL,0.6175,CARNIVAL CORPORATION & PLC,"Carnival Corporation & Plc operates as a leisure travel company. The company's ships visit approximately 700 ports under the Carnival Cruise Line, Princess Cruises, Holland America Line, Seabourn, P&O Cruises (Australia), Costa Cruises, AIDA Cruises, P&O Cruises (UK), and Cunard brand names."
LVLT,0.6179,LEVEL 3 COMMUNICATIONS INC,"Level 3 Parent, LLC provides various integrated communications services for enterprise, government, wholesale, and small and medium business customers in North America, Latin America, Europe, the Asia Pacific, the Middle East, and Africa."
FLIR,0.6277,FLIR SYSTEMS INC,"FLIR Systems, Inc. designs, develops, markets, and distributes thermal imaging systems, visible-light imaging systems, locater systems, measurement and diagnostic systems, and threat-detection solutions worldwide."
CB,0.6306,CHUBB LTD,"Chubb Limited, through its subsidiaries, provides insurance and reinsurance products worldwide."
URBN,0.6321,URBAN OUTFITTERS INC,"Urban Outfitters, Inc. engages in the retail and wholesale of general consumer products. The company operates through three segments: Retail, wholesale, and Subscription."
AYE,0.6393,ALLEGHENY ENERGY INC,"As of January 1, 2014, Allegheny Energy Inc. was acquired by FirstEnergy Corp. Allegheny Energy, Inc. owns & operates electric generation facilities & delivers electric services to customers in Pennsylvania, West Virginia, Maryland & Virginia."
BC,0.6517,BRUNSWICK CORP,"Brunswick Corporation designs, manufactures, and markets recreation products worldwide."
AKS,0.654,AK STEEL HOLDING CORP,"AK Steel Holding Corporation, through its subsidiary, AK Steel Corporation, produces flat-rolled carbon, and stainless and electrical steel products in the United States and internationally."
PRU,0.6691,PRUDENTIAL FINANCIAL INC,"Prudential Financial, Inc., through its subsidiaries, provides insurance, investment management, and other financial products and services."
PKG,0.6729,PACKAGING CORP OF AMERICA,Packaging Corporation of America manufactures and sells containerboard and corrugated packaging products in the United States. The company operates through Packaging and Paper segments.
EMR,0.6742,EMERSON ELECTRIC CO,"Emerson Electric Co. designs and manufactures technology and engineering products for industrial, commercial, and consumer markets worldwide. It operates through Automation Solutions and Commercial & Residential Solutions segments."
ANF,0.6822,ABERCROMBIE & FITCH  -CL A,"Abercrombie & Fitch Co., through its subsidiaries, operates as a specialty retailer. The company operates in two segments, Hollister and Abercrombie."
MAT,0.6837,MATTEL INC,"Mattel, Inc., a children's entertainment company, designs and produces toys and consumer products worldwide. The company operates through North America, International, and American Girl segments."
CNX,0.6907,CNX RESOURCES CORPORATION,"CNX Resources Corporation, an independent oil and gas company, explores for, develops, and produces natural gas properties primarily in the Appalachian Basin. The company operates through two divisions, Exploration and Production (E&P), and Midstream."
TYL,0.6939,TYLER TECHNOLOGIES INC,"Tyler Technologies, Inc. provides integrated information management solutions and services for the public sector in the United States and internationally. The company operates in two segments, Enterprise Software; and Appraisal and Tax."
SRCL,0.699,STERICYCLE INC,"Stericycle, Inc., together with its subsidiaries, provides regulated and compliance solutions to the healthcare, retail, and commercial businesses in the United States, Europe, and internationally."
DDS,0.7069,DILLARDS INC  -CL A,"Dillard's, Inc. operates retail department stores primarily in the Southeastern, Southwestern, and Midwestern areas of the United States."
WM,0.7107,WASTE MANAGEMENT INC,"Waste Management, Inc., through its subsidiaries, provides waste management environmental services to residential, commercial, industrial, and municipal customers in North America."
TRB,0.7109,TRIBUNE MEDIA CO,"Tribune Media Company, through its subsidiaries, operates as a diversified media and entertainment company in the United States."
AES,0.7121,AES CORP (THE),"The AES Corporation operates as a diversified power generation and utility company. It owns and/or operates power plants to generate and sell power to customers, such as utilities, industrial users, and other intermediaries."
STZ,0.7129,CONSTELLATION BRANDS,"Constellation Brands, Inc., together with its subsidiaries, produces, imports, and markets beer, wine, and spirits in the United States, Canada, Mexico, New Zealand, and Italy."
GS,0.7133,GOLDMAN SACHS GROUP INC,"The Goldman Sachs Group, Inc. operates as an investment banking, securities, and investment management company worldwide. It operates in four segments: Investment Banking, Global Markets, Asset Management, and Consumer & Wealth Management."
ILMN,0.7172,ILLUMINA INC,"Illumina, Inc. provides sequencing and array-based solutions for genetic and genomic analysis."
KR,0.7186,KROGER CO,"The Kroger Co. operates as a retailer in the United States. The company operates supermarkets, multi-department stores, marketplace stores, and price impact warehouse stores."
GLW,0.7234,CORNING INC,"Corning Incorporated engages in display technologies, optical communications, environmental technologies, specialty materials, and life sciences businesses worldwide."
AON,0.7267,AON PLC,"Aon plc, a professional services firm, provides advice and solutions to clients focused on risk, retirement, and health worldwide."
BBY,0.7308,BEST BUY CO INC,"Best Buy Co., Inc. retails technology products in the United States, Canada, and Mexico. The company operates in two segments, Domestic and International."
CVG,0.7311,CONVERGYS CORP,"Convergys Corporation provides customer management services to communications and media, technology, financial services, retail, healthcare, government, travel and hospitality, and other vertical markets worldwide."
GME,0.7448,GAMESTOP CORP,"GameStop Corp. operates as a multichannel video game, consumer electronics, and collectibles retailer in the United States, Canada, Australia, and Europe."
LOW,0.7558,LOWE'S COS INC,"Lowe's Companies, Inc., together with its subsidiaries, operates as a home improvement retailer in the United States, Canada, and Mexico. The company offers a line of products for construction, maintenance, repair, remodeling, and decorating."
KSS,0.7678,KOHL'S CORP,"Kohl's Corporation operates as a retail company in the United States. Its stores and Website offer apparel, footwear, accessories, beauty, and home products. The company provides its products primarily under the brand names of Apt."
TJX,0.768,TJX COS INC (THE),"The TJX Companies, Inc. operates as an off-price apparel and home fashions retailer. It operates through four segments: Marmaxx, HomeGoods, TJX Canada, and TJX International."
EP,0.7824,EL PASO CORP,"El Paso LLC offers natural gas transmission, and exploration and production services primarily in the United States."
LLY,0.7841,LILLY (ELI) & CO,"Eli Lilly and Company discovers, develops, manufactures, and markets pharmaceutical products worldwide. It offers endocrinology products for diabetes; osteoporosis in postmenopausal women and men; and human growth hormone deficiency and paediatric growth conditions."
MEE,0.79,MASSEY ENERGY CO,"Alpha Appalachia Holdings, Inc., through its subsidiaries, operates coal mines and processing facilities primarily in the United States."
BKNG,0.7922,BOOKING HOLDINGS INC,Booking Holdings Inc. provides travel and restaurant online reservation and related services worldwide.
ACN,0.7927,ACCENTURE PLC,"Accenture plc, a professional services company, provides strategy and consulting, interactive, and technology and operations services worldwide. The company also provides outsourcing services."
ALGN,0.8145,ALIGN TECHNOLOGY INC,"Align Technology, Inc., a medical device company, designs, manufactures, and markets Invisalign clear aligners and iTero intraoral scanners and services for orthodontists and general practitioner dentists, and restorative and aesthetic dentistry."
PETM,0.8298,PETSMART INC,"PetSmart, Inc., together with its subsidiaries, operates as a specialty retailer of products, services, and solutions for pets in the United States, Puerto Rico, and Canada."
BRYN,0.8337,RNETHEALTH INC,"BRYN Resources Inc. provides corporate, capital, and communication services for small businesses worldwide. The company operates VybeOffice, an online tool that allows you to manage company online from a single portal. It also offers stock issuance, transfer, custodial, and registrar services."
TGT,0.8338,TARGET CORP,Target Corporation operates as a general merchandise retailer in the United States.
WYE,0.8571,WYETH,"Wyeth LLC manufactures pharmaceuticals and healthcare products. The company offers pharmaceutical and biotechnology products, consumer health care products, and animal health care products."
THC,0.8571,TENET HEALTHCARE CORP,"Tenet Healthcare Corporation operates as a diversified healthcare services company. The company operates through three segments: Hospital Operations and Other, Ambulatory Care, and Conifer."
TYC,0.9358,TYCO INTERNATIONAL PLC,"As of September 2, 2016, Tyco International plc was acquired by Johnson Controls International plc. Tyco International plc provides security products and services, fire detection and suppression products and services, and life safety products worldwide."
