,dist,conm,busdesc
SSP,0.6233,EW SCRIPPS  -CL A,"The E.W. Scripps Company, together with its subsidiaries, operates as a media enterprise through a portfolio of local and national media brands. The company operates through Local Media, National Media, and Other segments."
AZO,0.6295,AUTOZONE INC,"AutoZone, Inc. retails and distributes automotive replacement parts and accessories. The company offers various products for cars, sport utility vehicles, vans, and light trucks, including new and remanufactured automotive hard parts, maintenance items, accessories, and non-automotive products."
AVY,0.6401,AVERY DENNISON CORP,Avery Dennison Corporation produces and sells pressure-sensitive materials worldwide.
WAT,0.6534,WATERS CORP,"Waters Corporation, a specialty measurement company, provides analytical workflow solutions in Asia, the Americas, and Europe. It operates through two segments, Waters and TA."
VAR,0.6639,VARIAN MEDICAL SYSTEMS INC,"Varian Medical Systems, Inc. designs, manufactures, sells, and services medical devices and software products for treating cancer and other medical conditions worldwide. It operates through Oncology Systems and Proton Solutions segments."
MAT,0.6667,MATTEL INC,"Mattel, Inc., a children's entertainment company, designs and produces toys and consumer products worldwide. The company operates through North America, International, and American Girl segments."
PD,0.6712,PAGERDUTY INC,"PagerDuty, Inc. operates a platform for real-time operations in the United States and internationally."
WHR,0.672,WHIRLPOOL CORP,"Whirlpool Corporation manufactures and markets home appliances and related products. It operates through four segments: North America; Europe, Middle East and Africa; Latin America; and Asia."
CIEN,0.684,CIENA CORP,"Ciena Corporation provides network hardware, software, and services that support the transport, routing, switching, aggregation, service delivery, and management of video, data, and voice traffic on communications networks worldwide."
AMGN,0.6948,AMGEN INC,"Amgen Inc. discovers, develops, manufactures, and delivers human therapeutics worldwide. It focuses on inflammation, oncology/hematology, bone health, cardiovascular disease, nephrology and neuroscience areas."
LIN,0.7005,LINDE PLC,"Linde plc operates as an industrial gas company in North and South America, Europe, the Middle East, Africa, and the Asia Pacific. The company offers oxygen, nitrogen, argon, rare gases, carbon monoxide, carbon dioxide, helium, hydrogen, electronic gases, specialty gases, and acetylene."
DNB,0.709,DUN & BRADSTREET HOLDNGS INC,"Dun & Bradstreet Holdings, Inc. provides business decisioning data and analytics in North America and internationally."
NTAP,0.7109,NETAPP INC,"NetApp, Inc. provides software, systems, and services to manage and share data on-premises, and private and public clouds worldwide."
IBM,0.7233,INTL BUSINESS MACHINES CORP,International Business Machines Corporation provides integrated solutions and services worldwide.
GWW,0.7363,GRAINGER (W W) INC,"W.W. Grainger, Inc. distributes maintenance, repair, and operating (MRO) products and services in the United States, Canada, and internationally."
PM,0.7473,PHILIP MORRIS INTERNATIONAL,"Philip Morris International Inc., through its subsidiaries, manufactures and sells cigarettes, other nicotine-containing products, smoke-free products, and related electronic devices and accessories."
A,0.7981,AGILENT TECHNOLOGIES INC,"Agilent Technologies, Inc. provides application focused solutions to the life sciences, diagnostics, and applied chemical markets worldwide."
IPGP,0.8308,IPG PHOTONICS CORP,"IPG Photonics Corporation develops and manufactures a range of high-performance fiber lasers, fiber amplifiers, and diode lasers used in various applications primarily in materials processing worldwide."
