,dist,conm,busdesc
MWV,0.0,MEADWESTVACO CORP,"WestRock MWV, LLC provides packaging solutions to the healthcare, beauty and personal care, food, beverage, home and garden, tobacco, and agricultural industries worldwide."
WRK,0.1552,WESTROCK CO,"WestRock Company manufactures and sells paper and packaging solutions in North America, South America, Europe, Asia, and Australia. The company operates through Corrugated Packaging and Consumer Packaging segments."
NVLS,0.3043,NIVALIS THERAPEUTICS INC,"As of July 24, 2017, Nivalis Therapeutics, Inc. was acquired by Alpine Immune Sciences Inc. in a reverse merger transaction."
CC,0.3873,CHEMOURS CO,"The Chemours Company provides performance chemicals in North America, the Asia Pacific, Europe, the Middle East, Africa, and Latin America. It operates through three segments: Fluoroproducts, Chemical Solutions, and Titanium Technologies."
IP,0.5616,INTL PAPER CO,"International Paper Company operates as a paper and packaging company primarily in United States, the Middle East, Europe, Africa, Pacific Rim, Asia, and the Americas. It operates through three segments: Industrial Packaging, Global Cellulose Fibers, and Printing Papers."
DXCM,0.6014,DEXCOM INC,"DexCom, Inc., a medical device company, focuses on the design, development, and commercialization of continuous glucose monitoring (CGM) systems in the United States and internationally. The company offers its systems for use by people with diabetes, as well as for use by healthcare providers."
PKG,0.6479,PACKAGING CORP OF AMERICA,Packaging Corporation of America manufactures and sells containerboard and corrugated packaging products in the United States. The company operates through Packaging and Paper segments.
WAB,0.7381,WABTEC CORP,"Wabtec Corporation provides technology-based equipment, systems, and services for the freight rail and passenger transit vehicle industries worldwide. It operates through two segments, Freight and Transit."
MLM,0.7434,MARTIN MARIETTA MATERIALS,"Martin Marietta Materials, Inc., a natural resource-based building materials company, supplies aggregates and heavy building materials to the construction industry in the United States and internationally."
DHI,0.7436,D R HORTON INC,"D.R. Horton, Inc. operates as a homebuilding company in East, Midwest, Southeast, South Central, Southwest, and West regions in the United States. It engages in the acquisition and development of land; and construction and sale of homes in 29 states and 88 markets under the names of D.R."
VMC,0.7446,VULCAN MATERIALS CO,"Vulcan Materials Company produces and supplies construction materials primarily in the United States. The company operates through four segments: Aggregates, Asphalt, Concrete, and Calcium."
LVS,0.7448,LAS VEGAS SANDS CORP,"Las Vegas Sands Corp., together with its subsidiaries, develops, owns, and operates integrated resorts in Asia and the United States."
PGR,0.7559,PROGRESSIVE CORP-OHIO,"The Progressive Corporation, through its subsidiaries, provides personal and commercial auto insurance, residential property insurance, and other specialty property-casualty insurance and related services primarily in the United States."
MGM,0.7653,MGM RESORTS INTERNATIONAL,"MGM Resorts International, through its subsidiaries, owns and operates integrated casino, hotel, and entertainment resorts in the United States and Macau. The company operates through three segments: Las Vegas Strip Resorts, Regional Operations, and MGM China."
WYNN,0.7714,WYNN RESORTS LTD,"Wynn Resorts, Limited designs, develops, and operates integrated resorts."
IPG,0.7809,INTERPUBLIC GROUP OF COS,"The Interpublic Group of Companies, Inc. provides advertising and marketing services worldwide. It operates through two segments, Integrated Agency Networks and Constituency Management Group."
LEN,0.7989,LENNAR CORP,"Lennar Corporation, together with its subsidiaries, operates as a homebuilder primarily under the Lennar brand in the United States. It operates through Homebuilding East, Homebuilding Central, Homebuilding Texas, Homebuilding West, Financial Services, Multifamily, and Lennar Other segments."
VTRS,0.8087,VIATRIS INC,"Viatris Inc., a healthcare company, manufactures and distributes various medicines for patients in the United States and internationally."
SEE,0.8215,SEALED AIR CORP,"Sealed Air Corporation provides food safety and security, and product protection solutions and equipment in North America, South America, Europe, the Middle East, Africa, and the Asia Pacific. It operates in two segments, Food Care and Product Care."
UAA,0.8295,UNDER ARMOUR INC,"Under Armour, Inc., together with its subsidiaries, develops, markets, and distributes branded performance apparel, footwear, and accessories for men, women, and youth primarily in North America, Europe, the Middle East, Africa, the Asia-Pacific, and Latin America."
GPN,0.8297,GLOBAL PAYMENTS INC,"Global Payments Inc. provides payment technology and software solutions for card, electronic, check, and digital-based payments in North America, Europe, the Asia-Pacific, and Latin America."
DDS,0.83,DILLARDS INC  -CL A,"Dillard's, Inc. operates retail department stores primarily in the Southeastern, Southwestern, and Midwestern areas of the United States."
SANM,0.8407,SANMINA CORP,"Sanmina Corporation provides integrated manufacturing solutions, components, products and repair, logistics, and after-market services worldwide. It operates in two segments, Integrated Manufacturing Solutions; and Components, Products and Services."
VLO,0.841,VALERO ENERGY CORP,"Valero Energy Corporation manufactures and sells transportation fuels and petrochemical products in the United States, Canada, the United Kingdom, Ireland, and internationally. It operates through three segments: Refining, Ethanol, and Renewable Diesel."
FBHS,0.8441,FORTUNE BRANDS HOME & SECUR,"Fortune Brands Home & Security, Inc., together with its subsidiaries, provides home and security products for residential home repair, remodeling, new construction, and security applications. It operates in three segments: Cabinets, Plumbing, and Doors & Security."
TDC,0.846,TERADATA CORP,"Teradata Corporation provides hybrid cloud analytics software. Its solutions and services comprise software, hardware, and related business consulting and support services to deliver analytics in company's analytical ecosystem."
EXPD,0.8484,EXPEDITORS INTL WASH INC,"Expeditors International of Washington, Inc. provides logistics services in the Americas, North Asia, South Asia, Europe, the Middle East, Africa, and India."
SNI,0.8513,SCRIPPS NETWORKS INTERACTIVE,"Scripps Networks Interactive, Inc. develops lifestyle-oriented content in the United States, the United Kingdom and other European markets, the Middle East and Africa, the Asia-Pacific, and Latin America."
CDNS,0.8538,CADENCE DESIGN SYSTEMS INC,"Cadence Design Systems, Inc. provides software, hardware, services, and reusable integrated circuit (IC) design blocks worldwide. The company offers functional verification services, including emulation and prototyping hardware."
LUV,0.8563,SOUTHWEST AIRLINES,Southwest Airlines Co. operates a passenger airline that provides scheduled air transportation services in the United States and near-international markets.
TSCO,0.8565,TRACTOR SUPPLY CO,Tractor Supply Company operates rural lifestyle retail stores in the United States.
NWL,0.859,NEWELL BRANDS INC,"Newell Brands Inc. designs, manufactures, sources, and distributes consumer and commercial products worldwide. The company operates through four segments: Appliances and Cookware, Food and Commercial, Home and Outdoor Living, and Learning and Development."
BBBY,0.8678,BED BATH & BEYOND INC,"Bed Bath & Beyond Inc., together with its subsidiaries, operates a chain of retail stores."
TWX,0.8693,TIME WARNER INC,"Warner Media operates as a media and entertainment company worldwide. It operates in three segments: Turner, Home Box Office, and Warner Bros. The Turner segment creates and programs branded news, entertainment, sports, and kids multi-platform content for consumers."
PHM,0.8726,PULTEGROUP INC,"PulteGroup, Inc., through its subsidiaries, primarily engages in the homebuilding business in the United States. The company acquires and develops land primarily for residential purposes; and constructs housing on such land."
CCU,0.8763,COMPANIA CERVECERIAS UNIDAS,"Compania Cervecerias Unidas S.A. operates as a beverage company principally in Chile, Argentina, Uruguay, Paraguay, Colombia, and Bolivia. The company operates through three segments: Chile, International Business, and Wine."
BBY,0.8779,BEST BUY CO INC,"Best Buy Co., Inc. retails technology products in the United States, Canada, and Mexico. The company operates in two segments, Domestic and International."
BC,0.8836,BRUNSWICK CORP,"Brunswick Corporation designs, manufactures, and markets recreation products worldwide."
GMCR,0.8913,KEURIG DR PEPPER INC,"Keurig Dr Pepper Inc. operates as a beverage company in the United States and internationally. It operates through four segments: Coffee Systems, Packaged Beverages, Beverage Concentrates, and Latin America Beverages."
HLT,0.894,HILTON WORLDWIDE HOLDINGS,"Hilton Worldwide Holdings Inc., a hospitality company, owns, leases, manages, develops, and franchises hotels and resorts. It operates through two segments, Management and Franchise, and Ownership. The company engages in the hotel management and licensing of its brands."
TTWO,0.8951,TAKE-TWO INTERACTIVE SFTWR,"Take-Two Interactive Software, Inc. develops, publishes, and markets interactive entertainment solutions for consumers worldwide. The company offers its products under the Rockstar Games and 2K labels, as well as under Private Division and Social Point labels."
ANDV,0.9133,ANDEAVOR,"Andeavor, through its subsidiaries, operates as an independent petroleum refining, logistics, and marketing company in the United States. The company operates in three segments: Marketing, Logistics, and Refining."
