,dist,conm,busdesc
MTW,0.0,MANITOWOC CO,"The Manitowoc Company, Inc. provides engineered lifting equipment for the construction industry in the Americas, Europe, Africa, the Middle East, and the Asia Pacific."
TEX,0.2783,TEREX CORP,"Terex Corporation manufactures and sells aerial work platforms, materials processing machinery, and cranes worldwide. The company operates in two segments, Aerial Work Platforms (AWP) and Material Processing (MP)."
CMI,0.5234,CUMMINS INC,"Cummins Inc. designs, manufactures, distributes, and services diesel and natural gas engines, products worldwide. It operates through five segments: Engine, Distribution, Components, Power Systems, and New Power."
URI,0.544,UNITED RENTALS INC,"United Rentals, Inc., through its subsidiaries, operates as an equipment rental company. It operates in two segments, General Rentals; and Trench, Power and Fluid Solutions."
JOY,0.558,JOY GLOBAL INC,"Komatsu Mining Corp. manufactures and services mining equipment for the extraction of coal, copper, iron ore, oil sands, gold, and other minerals worldwide. It operates in two segments, Underground Mining Machinery and Surface Mining Equipment."
X,0.5732,UNITED STATES STEEL CORP,"United States Steel Corporation produces and sells flat-rolled and tubular steel products primarily in North America and Europe. It operates through three segments: North American Flat-Rolled (Flat-Rolled), U. S. Steel Europe (USSE), and Tubular Products (Tubular)."
EMN,0.5767,EASTMAN CHEMICAL CO,Eastman Chemical Company operates as an advanced materials and specialty additives company worldwide.
MTD,0.5911,METTLER-TOLEDO INTL INC,"Mettler-Toledo International Inc. manufactures and supplies precision instruments and services worldwide. It operates in five segments: U.S. Operations, Swiss Operations, Western European Operations, Chinese Operations, and Other."
FLS,0.5926,FLOWSERVE CORP,"Flowserve Corporation designs, develops, manufactures, distributes, and services industrial flow management equipment in the United States, Europe, the Middle East, Africa, Asia, and internationally."
CAT,0.594,CATERPILLAR INC,"Caterpillar Inc. manufactures and sells construction and mining equipment, diesel and natural gas engines, and industrial gas turbines."
CAM,0.597,CAMERON INTERNATIONAL CORP,"Cameron International Corporation provides flow equipment products, systems, and services worldwide."
LYB,0.6273,LYONDELLBASELL INDUSTRIES NV,"LyondellBasell Industries N.V. operates as a chemical company in the United States, Germany, Mexico, Italy, France, Japan, China, the Netherlands, and internationally."
AMG,0.6278,AFFILIATED MANAGERS GRP INC,"Affiliated Managers Group, Inc., through its affiliates, operates as an asset management company providing investment management services to mutual funds, institutional clients, and high net worth individuals in the United States. It provides advisory or subadvisory services to mutual funds."
CF,0.6342,CF INDUSTRIES HOLDINGS INC,"CF Industries Holdings, Inc. manufactures and distributes nitrogen fertilizers and other nitrogen products worldwide. Its principal nitrogen fertilizer products include anhydrous ammonia, granular urea, urea ammonium nitrate solution, and ammonium nitrate."
ETN,0.6439,EATON CORP PLC,Eaton Corporation plc operates as a power management company worldwide.
J,0.645,JACOBS ENGINEERING GROUP INC,"Jacobs Engineering Group Inc. provides consulting, technical, scientific, and project delivery services for the government and private sectors in the United States, Europe, Canada, India, rest of Asia, Australia, New Zealand, South America, Mexico, the Middle East, and Africa."
BWA,0.652,BORGWARNER INC,"BorgWarner Inc. provides solutions for combustion, hybrid, and electric vehicles worldwide."
IPGP,0.6541,IPG PHOTONICS CORP,"IPG Photonics Corporation develops and manufactures a range of high-performance fiber lasers, fiber amplifiers, and diode lasers used in various applications primarily in materials processing worldwide."
PHM,0.6555,PULTEGROUP INC,"PulteGroup, Inc., through its subsidiaries, primarily engages in the homebuilding business in the United States. The company acquires and develops land primarily for residential purposes; and constructs housing on such land."
AKS,0.6835,AK STEEL HOLDING CORP,"AK Steel Holding Corporation, through its subsidiary, AK Steel Corporation, produces flat-rolled carbon, and stainless and electrical steel products in the United States and internationally."
HAR,0.6849,HARMAN INTERNATIONAL INDS,"Harman International Industries, Incorporated designs and engineers connected products and solutions for automakers, consumers, and enterprises worldwide. The company operates through four segments: Connected Car, Lifestyle Audio, Professional Solutions, and Connected Services."
COF,0.6934,CAPITAL ONE FINANCIAL CORP,"Capital One Financial Corporation operates as the financial services holding company for the Capital One Bank (USA), National Association; and Capital One, National Association, which provides various financial products and services in the United States, the United Kingdom, and Canada."
BC,0.7065,BRUNSWICK CORP,"Brunswick Corporation designs, manufactures, and markets recreation products worldwide."
MGM,0.7185,MGM RESORTS INTERNATIONAL,"MGM Resorts International, through its subsidiaries, owns and operates integrated casino, hotel, and entertainment resorts in the United States and Macau. The company operates through three segments: Las Vegas Strip Resorts, Regional Operations, and MGM China."
NUE,0.7201,NUCOR CORP,"Nucor Corporation manufactures and sells steel and steel products. It operates in three segments: Steel Mills, Steel Products, and Raw Materials."
LEN,0.7214,LENNAR CORP,"Lennar Corporation, together with its subsidiaries, operates as a homebuilder primarily under the Lennar brand in the United States. It operates through Homebuilding East, Homebuilding Central, Homebuilding Texas, Homebuilding West, Financial Services, Multifamily, and Lennar Other segments."
WHR,0.7239,WHIRLPOOL CORP,"Whirlpool Corporation manufactures and markets home appliances and related products. It operates through four segments: North America; Europe, Middle East and Africa; Latin America; and Asia."
DXC,0.7298,DXC TECHNOLOGY CO,"DXC Technology Company, together with its subsidiaries, provides information technology services and solutions primarily in North America, Europe, Asia, and Australia. It operates in two segments, Global Business Services (GBS) and Global Infrastructure Services (GIS)."
JBL,0.731,JABIL INC,"Jabil Inc. provides manufacturing services and solutions worldwide. The company operates in two segments, Electronics Manufacturing Services and Diversified Manufacturing Services. It offers electronics design, production, and product management services."
RCL,0.7329,ROYAL CARIBBEAN GROUP,"Royal Caribbean Group operates as a cruise company. The company operates cruises under the Royal Caribbean International, Celebrity Cruises, Azamara Club Cruises, and Silversea Cruises brands."
DE,0.7345,DEERE & CO,"Deere & Company, together with its subsidiaries, manufactures and distributes various equipment worldwide. The company operates through three segments: Agriculture and Turf, Construction and Forestry, and Financial Services."
WAB,0.7353,WABTEC CORP,"Wabtec Corporation provides technology-based equipment, systems, and services for the freight rail and passenger transit vehicle industries worldwide. It operates through two segments, Freight and Transit."
FMC,0.7366,FMC CORP,"FMC Corporation, an agricultural sciences company, provides crop protection, plant health, and professional pest and turf management products."
CIEN,0.7384,CIENA CORP,"Ciena Corporation provides network hardware, software, and services that support the transport, routing, switching, aggregation, service delivery, and management of video, data, and voice traffic on communications networks worldwide."
SANM,0.7395,SANMINA CORP,"Sanmina Corporation provides integrated manufacturing solutions, components, products and repair, logistics, and after-market services worldwide. It operates in two segments, Integrated Manufacturing Solutions; and Components, Products and Services."
TT,0.7423,TRANE TECHNOLOGIES PLC,"Trane Technologies plc provides climate control solutions for buildings, homes, and transportation."
SWK,0.7483,STANLEY BLACK & DECKER INC,"Stanley Black & Decker, Inc. engages in tools and storage, industrial, and security businesses worldwide."
MTG,0.7536,MGIC INVESTMENT CORP/WI,"MGIC Investment Corporation, through its subsidiaries, provides private mortgage insurance, other mortgage credit risk management solutions, and ancillary services to lenders and government sponsored entities in the United States, Puerto Rico, and Guam."
NCR,0.758,NCR CORP,"NCR Corporation provides software and services worldwide. The company operates through Banking, Retail, Hospitality, and Other segments."
MCO,0.7588,MOODY'S CORP,"Moody's Corporation provides credit ratings and assessment services; and credit, capital markets, and economic research, data, and analytical tools worldwide. It operates through two segments, Moody's Investors Service and Moody's Analytics."
NWL,0.7589,NEWELL BRANDS INC,"Newell Brands Inc. designs, manufactures, sources, and distributes consumer and commercial products worldwide. The company operates through four segments: Appliances and Cookware, Food and Commercial, Home and Outdoor Living, and Learning and Development."
SNA,0.7748,SNAP-ON INC,"Snap-on Incorporated manufactures and markets tools, equipment, diagnostics, and repair information and systems solutions for professional users worldwide."
R,0.779,RYDER SYSTEM INC,"Ryder System, Inc. provides transportation and supply chain management solutions worldwide. The company operates through three segments: Fleet Management Solutions (FMS), Supply Chain Solutions (SCS), and Dedicated Transportation Solutions (DTS)."
CBE,0.8072,COOPER INDUSTRIES PLC,"Cooper Industries plc manufactures and sells electrical components and tools in the United States and internationally. It operates in two segments, Energy and Safety Solutions, and Electrical Products Group."
VLO,0.8173,VALERO ENERGY CORP,"Valero Energy Corporation manufactures and sells transportation fuels and petrochemical products in the United States, Canada, the United Kingdom, Ireland, and internationally. It operates through three segments: Refining, Ethanol, and Renewable Diesel."
TMO,0.8183,THERMO FISHER SCIENTIFIC INC,"Thermo Fisher Scientific Inc. provides analytical and other instruments, laboratory equipment, software, consumables, reagents, instrument systems, chemicals, supplies, and services worldwide."
NYT,0.8247,NEW YORK TIMES CO  -CL A,"The New York Times Company, together with its subsidiaries, provides news and information for readers and viewers across various platforms worldwide."
ADBE,0.8362,ADOBE INC,"Adobe Inc. operates as a diversified software company worldwide. Its Digital Media segment provides tools and solutions that enable individuals, teams, and enterprises to create, publish, promote, and monetize their digital content."
ANF,0.8364,ABERCROMBIE & FITCH  -CL A,"Abercrombie & Fitch Co., through its subsidiaries, operates as a specialty retailer. The company operates in two segments, Hollister and Abercrombie."
THC,0.8447,TENET HEALTHCARE CORP,"Tenet Healthcare Corporation operates as a diversified healthcare services company. The company operates through three segments: Hospital Operations and Other, Ambulatory Care, and Conifer."
SSP,0.845,EW SCRIPPS  -CL A,"The E.W. Scripps Company, together with its subsidiaries, operates as a media enterprise through a portfolio of local and national media brands. The company operates through Local Media, National Media, and Other segments."
NDAQ,0.8513,NASDAQ INC,"Nasdaq, Inc. operates as a technology company that serves capital markets and other industries worldwide."
ITT,0.8614,ITT INC,"ITT Inc. manufactures and sells engineered critical components and customized technology solutions for the energy, transportation, and industrial markets worldwide. The company operates through three segments: Motion Technologies, Industrial Process, and Connect & Control Technologies."
MPC,0.8703,MARATHON PETROLEUM CORP,"Marathon Petroleum Corporation, together with its subsidiaries, engages in refining, marketing, retailing, and transporting petroleum products primarily in the United States. It operates through three segments: Refining & Marketing, Retail, and Midstream."
TGNA,0.8771,TEGNA INC,TEGNA Inc. operates as a media company in the United States. The company operates television stations and radio stations that deliver television programming and digital content. It offers content and information to consumers across various platforms.
XLNX,0.8852,XILINX INC,"Xilinx, Inc. designs and develops programmable devices and associated technologies worldwide."
WYNN,0.89,WYNN RESORTS LTD,"Wynn Resorts, Limited designs, develops, and operates integrated resorts."
FOSL,0.8935,FOSSIL GROUP INC,"Fossil Group, Inc., together with its subsidiaries, designs, develops, markets, and distributes consumer fashion accessories in the United States, Europe, Asia, and internationally."
M,0.9004,MACY'S INC,"Macy's, Inc., an omnichannel retail organization, operates stores, websites, and mobile applications under the Macy's, Bloomingdale's, and bluemercury brands."
GME,0.9036,GAMESTOP CORP,"GameStop Corp. operates as a multichannel video game, consumer electronics, and collectibles retailer in the United States, Canada, Australia, and Europe."
PSX,0.9491,PHILLIPS 66,"Phillips 66 operates as an energy manufacturing and logistics company. It operates through four segments: Midstream, Chemicals, Refining, and Marketing and Specialties (M&S)."
