,dist,conm,busdesc
ED,0.0,CONSOLIDATED EDISON INC,"Consolidated Edison, Inc., through its subsidiaries, engages in regulated electric, gas, and steam delivery businesses in the United States."
SO,0.1152,SOUTHERN CO,"The Southern Company, through its subsidiaries, engages in the generation, transmission, and distribution of electricity. It operates in four segments: Gas Distribution Operations, Gas Pipeline Investments, Wholesale Gas Services, and Gas Marketing Services."
XEL,0.1578,XCEL ENERGY INC,"Xcel Energy Inc., through its subsidiaries, generates, purchases, transmits, distributes, and sells electricity. It operates through Regulated Electric Utility, Regulated Natural Gas Utility, and All Other segments."
DUK,0.1746,DUKE ENERGY CORP,"Duke Energy Corporation, together with its subsidiaries, operates as an energy company in the United States. It operates through three segments: Electric Utilities and Infrastructure, Gas Utilities and Infrastructure, and Commercial Renewables."
D,0.1772,DOMINION ENERGY INC,"Dominion Energy, Inc. produces and transports energy. The company's Dominion Energy Virginia segment engages in the regulated electric generation, transmission, and distribution operations that serve residential, commercial, industrial, and governmental customers in Virginia and North Carolina."
WEC,0.2192,WEC ENERGY GROUP INC,"WEC Energy Group, Inc., through its subsidiaries, provides regulated natural gas and electricity, and nonregulated renewable energy services in the United States."
PNW,0.2362,PINNACLE WEST CAPITAL CORP,"Pinnacle West Capital Corporation, through its subsidiary, Arizona Public Service Company, provides retail and wholesale electric services primarily in the state of Arizona."
DTE,0.2452,DTE ENERGY CO,"DTE Energy Company engages in the utility operations. The company's Electric segment generates, purchases, distributes, and sells electricity to approximately 2.2 million residential, commercial, and industrial customers in southeastern Michigan."
SCG,0.2603,SCANA CORP,"SCANA Corporation, through its subsidiaries, generates, transmits, distributes, and sells electricity to wholesale and retail customers. The company operates through Electric Operations, Gas Distribution, and Gas Marketing segments."
PCG,0.2736,PG&E CORP,"PG&E Corporation, through its subsidiary, Pacific Gas and Electric Company, engages in the sale and delivery of electricity and natural gas to customers in northern and central California, the United States."
KMB,0.2754,KIMBERLY-CLARK CORP,"Kimberly-Clark Corporation, together with its subsidiaries, manufactures and markets personal care and consumer tissue products worldwide. It operates through three segments: Personal Care, Consumer Tissue, and K-C Professional."
POM,0.2802,PEPCO HOLDINGS INC,"Pepco Holdings LLC operates as a utility services holding company. The company operates through Pepco, DPL, and ACE segments."
EVRG,0.2868,EVERGY INC,"Evergy, Inc., through its subsidiaries, engages in the generation, transmission, distribution, and sale of electricity in Kansas and Missouri."
ES,0.2998,EVERSOURCE ENERGY,"Eversource Energy, a public utility holding company, engages in the energy delivery business. The company operates in four segments: Electric Distribution, Electric Transmission, Natural Gas Distribution, and Water Distribution."
CMS,0.3095,CMS ENERGY CORP,"CMS Energy Corporation operates as an energy company primarily in Michigan. The company operates in four segments: Electric Utility, Gas Utility, Enterprises, and EnerBank. The Electric Utility segment is involved in the generation, purchase, transmission, distribution, and sale of electricity."
NEE,0.3121,NEXTERA ENERGY INC,"NextEra Energy, Inc., through its subsidiaries, generates, transmits, and distributes electric power in North America. The company generates electricity through wind, solar, nuclear, coal, oil, and natural gas facilities."
PG,0.3132,PROCTER & GAMBLE CO,"The Procter & Gamble Company provides branded consumer packaged goods to consumers in North and Latin America, Europe, the Asia Pacific, Greater China, India, the Middle East, and Africa."
SRE,0.3233,SEMPRA ENERGY,"Sempra Energy operates as an energy-services holding company in the United States and internationally. The company's San Diego Gas & Electric Company segment generates, transmits, and distributes electricity; and supplies natural gas."
EXC,0.3372,EXELON CORP,"Exelon Corporation, a utility services holding company, engages in the generation and marketing of energy in the United States and Canada. It owns nuclear, fossil, wind, hydroelectric, biomass, and solar generating facilities."
ETR,0.3376,ENTERGY CORP,"Entergy Corporation, together with its subsidiaries, engages in the production and distribution of electricity in the United States. The company generates electricity through gas/oil, nuclear, coal, hydro, and solar power sources."
LNT,0.3511,ALLIANT ENERGY CORP,"Alliant Energy Corporation operates as a utility holding company that provides regulated electricity and natural gas services in the Midwest region of the United States. It operates through three segments: Utility Electric Operations, Utility Gas Operations, and Utility Other."
EIX,0.3516,EDISON INTERNATIONAL,"Edison International, through its subsidiaries, engages in the generation, transmission, and distribution of electricity in the United States. The company generates electricity through hydroelectric, diesel/liquid petroleum gas, natural gas, nuclear, and photovoltaic sources."
TEG,0.36,INTEGRYS HOLDING INC,"Integrys Holding, Inc. operates as an energy holding company in the United States. It operates through Wisconsin, Illinois, Other States, and Electric Transmission segments."
AEE,0.3712,AMEREN CORP,"Ameren Corporation, together with its subsidiaries, operates as a public utility holding company in the United States. It operates through four segments: Ameren Missouri, Ameren Illinois Electric Distribution, Ameren Illinois Natural Gas, and Ameren Transmission."
WMT,0.3771,WALMART INC,"Walmart Inc. engages in the retail and wholesale operations in various formats worldwide. The company operates in three segments: Walmart U.S., Walmart International, and Sam's Club."
PEG,0.387,PUBLIC SERVICE ENTRP GRP INC,"Public Service Enterprise Group Incorporated, through its subsidiaries, operates as an energy company primarily in the Northeastern and Mid-Atlantic United States. It operates through two segments, PSE&G and PSEG Power."
ABT,0.387,ABBOTT LABORATORIES,"Abbott Laboratories discovers, develops, manufactures, and sells health care products worldwide."
VZ,0.3975,VERIZON COMMUNICATIONS INC,"Verizon Communications Inc. offers communications, information, and entertainment products and services to consumers, businesses, and governmental entities worldwide."
MCD,0.3988,MCDONALD'S CORP,"McDonald's Corporation operates and franchises McDonald's restaurants in the United States and internationally. Its restaurants offer various food products and beverages, as well as breakfast menu. As of December 31, 2019, the company operated 38,695 restaurants."
KO,0.4052,COCA-COLA CO,"The Coca-Cola Company, a beverage company, manufactures, markets, and sells various nonalcoholic beverages worldwide. The company provides sparkling soft drinks; water, enhanced water, and sports drinks; juice, dairy, and plant-based beverages; tea and coffee; and energy drinks."
JNJ,0.4243,JOHNSON & JOHNSON,"Johnson & Johnson researches and develops, manufactures, and sells various products in the health care field worldwide. It operates in three segments: Consumer, Pharmaceutical, and Medical Devices."
NI,0.4249,NISOURCE INC,"NiSource Inc., an energy holding company, operates as a regulated natural gas and electric utility company in the United States. The company operates through two segments, Gas Distribution Operations and Electric Operations."
TE,0.4425,TECO ENERGY INC,"TECO Energy, Inc., an electric and gas utility holding company, engages in the regulated electric and gas utility operations."
CAG,0.4458,CONAGRA BRANDS INC,"Conagra Brands, Inc., together with its subsidiaries, operates as a consumer packaged goods food company in North America. The company operates through Grocery & Snacks, Refrigerated & Frozen, International, and Foodservice segments."
FE,0.4541,FIRSTENERGY CORP,"FirstEnergy Corp., through its subsidiaries, generates, transmits, and distributes electricity in the United States. The company operates through Regulated Distribution and Regulated Transmission segments."
AWK,0.4909,AMERICAN WATER WORKS CO INC,"American Water Works Company, Inc., through its subsidiaries, provides water and wastewater services in the United States. It offers water and wastewater services to approximately 1,700 communities in 16 states serving approximately 3.4 million active customers."
STR,0.5752,QUESTAR CORP,Dominion Energy Questar Corporation operates as an integrated natural gas company in the United States.
DPS,0.5916,DR PEPPER SNAPPLE GROUP INC,"As of 2018, Dr Pepper Snapple Group, Inc is acquired by Keurig Dr Pepper Inc. Dr Pepper Snapple Group, Inc. manufactures and distributes non-alcoholic beverages in the United States, Mexico and the Caribbean, and Canada."
CEPH,0.6358,CEPHALON INC,"Cephalon, Inc. engages in the discovery and development of medicines for central nervous system disorders, pain, and cancer."
WBA,0.6818,WALGREENS BOOTS ALLIANCE INC,"Walgreens Boots Alliance, Inc. operates as a pharmacy-led health and beauty retail company. It operates through three segments: Retail Pharmacy USA, Retail Pharmacy International, and Pharmaceutical Wholesale."
XYL,0.6927,XYLEM INC,"Xylem Inc. engages in the design, manufacture, and servicing of engineered products and solutions for the water and wastewater applications in the United States, Europe, the Asia Pacific, and internationally."
KMI,0.6965,KINDER MORGAN INC,"Kinder Morgan, Inc. operates as an energy infrastructure company in North America. The company operates through Natural Gas Pipelines, Products Pipelines, Terminals, and CO2 segments."
GRMN,0.6999,GARMIN LTD,"Garmin Ltd. designs, develops, manufactures, markets, and distributes a range of navigation, communication, and information devices worldwide. It operates through five segments: Auto, Aviation, Marine, Outdoor, and Fitness."
UPS,0.7001,UNITED PARCEL SERVICE INC,"United Parcel Service, Inc. provides letter and package delivery, specialized transportation, logistics, and financial services. It operates through three segments: U.S. Domestic Package, International Package, and Supply Chain & Freight. The U.S."
NVR,0.7514,NVR INC,"NVR, Inc. operates as a homebuilder in the United States. The company operates in two segments, Homebuilding and Mortgage Banking. It primarily constructs and sells single-family detached homes, townhomes, and condominium buildings under the Ryan Homes, NVHomes, and Heartland Homes names."
TWC,0.7791,TIME WARNER CABLE INC,"Spectrum Management Holding Company, LLC, together with its subsidiaries, provides video, high-speed data, and voice services in the United States. It operates in three segments: Residential Services, Business Services, and Other Operations."
ABC,0.7826,AMERISOURCEBERGEN CORP,AmerisourceBergen Corporation sources and distributes pharmaceutical products in the United States and internationally.
LOW,0.8048,LOWE'S COS INC,"Lowe's Companies, Inc., together with its subsidiaries, operates as a home improvement retailer in the United States, Canada, and Mexico. The company offers a line of products for construction, maintenance, repair, remodeling, and decorating."
FDO,0.8094,FAMILY DOLLAR STORES,"Family Dollar Stores, Inc. operates a chain of general merchandise retail discount stores primarily for low- and middle-income consumers in the United States."
GHC,0.821,GRAHAM HOLDINGS CO,"Graham Holdings Company, through its subsidiaries, operates as a diversified education and media company worldwide."
MAT,0.8419,MATTEL INC,"Mattel, Inc., a children's entertainment company, designs and produces toys and consumer products worldwide. The company operates through North America, International, and American Girl segments."
AMT,0.8424,AMERICAN TOWER CORP,"American Tower, one of the largest global REITs, is a leading independent owner, operator and developer of multitenant communications real estate with a portfolio of approximately 181,000 communications sites."
MCK,0.8426,MCKESSON CORP,"McKesson Corporation provides pharmaceuticals and medical supplies in the United States and internationally. It operates through four segments: U.S. Pharmaceutical, Prescription Technology Solutions, International, and Medical-Surgical Solutions. The U.S."
MNST,0.8695,MONSTER BEVERAGE CORP,"Monster Beverage Corporation, through its subsidiaries, develops, markets, sells, and distributes energy drink beverages and concentrates in the United States and internationally. It operates through three segments: Monster Energy Drinks, Strategic Brands, and Other."
FISV,0.8805,FISERV INC,"Fiserv, Inc., together with its subsidiaries, provides financial services technology worldwide."
AVP,0.8826,AVON PRODUCTS,"Avon Products, Inc. manufactures, markets, and sells beauty and related products in Europe, the Middle East, Africa, south Latin America, north Latin America, and the Asia Pacific."
CAH,0.8867,CARDINAL HEALTH INC,"Cardinal Health, Inc. operates as an integrated healthcare services and products company in the United States and internationally. It provides customized solutions for hospitals, healthcare systems, pharmacies, ambulatory surgery centers, clinical laboratories, and physician offices."
CMCSK,0.9744,COMCAST CORP,"Comcast Corporation operates as a media and technology company worldwide. It operates through Cable Communications, Cable Networks, Broadcast Television, Filmed Entertainment, Theme Parks, and Sky segments."
