,dist,conm,busdesc
KSS,0.0,KOHL'S CORP,"Kohl's Corporation operates as a retail company in the United States. Its stores and Website offer apparel, footwear, accessories, beauty, and home products. The company provides its products primarily under the brand names of Apt."
M,0.3038,MACY'S INC,"Macy's, Inc., an omnichannel retail organization, operates stores, websites, and mobile applications under the Macy's, Bloomingdale's, and bluemercury brands."
TGT,0.4057,TARGET CORP,Target Corporation operates as a general merchandise retailer in the United States.
JWN,0.4348,NORDSTROM INC,"Nordstrom, Inc., a fashion retailer, provides apparels, shoes, cosmetics, and accessories for women, men, young adults, and children."
DDS,0.4509,DILLARDS INC  -CL A,"Dillard's, Inc. operates retail department stores primarily in the Southeastern, Southwestern, and Midwestern areas of the United States."
ROST,0.5047,ROSS STORES INC,"Ross Stores, Inc., together with its subsidiaries, operates off-price retail apparel and home fashion stores under the Ross Dress for Less and dd's DISCOUNTS brands. Its stores primarily offers apparel, accessories, footwear, and home fashions."
URBN,0.5207,URBAN OUTFITTERS INC,"Urban Outfitters, Inc. engages in the retail and wholesale of general consumer products. The company operates through three segments: Retail, wholesale, and Subscription."
GPS,0.5327,GAP INC,"The Gap, Inc. operates as an apparel retail company worldwide. The company offers apparel, accessories, and personal care products for men, women, and children under the Old Navy, Gap, Banana Republic, Athleta, Intermix, Janie and Jack, and Hill City brands."
LB,0.562,L BRANDS INC,"L Brands, Inc. operates as a specialty retailer of women's intimate and other apparel, personal care, and beauty and home fragrance products. The company operates in three segments: Victoria's Secret, Bath & Body Works, and Victoria's Secret and Bath & Body Works International."
DG,0.588,DOLLAR GENERAL CORP,"Dollar General Corporation, a discount retailer, provides various merchandise products in the southern, southwestern, Midwestern, and eastern United States."
TJX,0.626,TJX COS INC (THE),"The TJX Companies, Inc. operates as an off-price apparel and home fashions retailer. It operates through four segments: Marmaxx, HomeGoods, TJX Canada, and TJX International."
ORLY,0.6537,O'REILLY AUTOMOTIVE INC,"O'Reilly Automotive, Inc., together with its subsidiaries, engages in the retail of automotive aftermarket parts, tools, supplies, equipment, and accessories in the United States."
RL,0.6645,RALPH LAUREN CORP,"Ralph Lauren Corporation designs, markets, and distributes lifestyle products in North America, Europe, Asia, and internationally."
HBI,0.6696,HANESBRANDS INC,"Hanesbrands Inc., a consumer goods company, designs, manufactures, sources, and sells a range of basic apparel for men, women, and children in the United States. The company operates through three segments: Innerwear, Activewear, and International."
HD,0.6808,HOME DEPOT INC,"The Home Depot, Inc. operates as a home improvement retailer."
BBBY,0.6989,BED BATH & BEYOND INC,"Bed Bath & Beyond Inc., together with its subsidiaries, operates a chain of retail stores."
AAP,0.7008,ADVANCE AUTO PARTS INC,"Advance Auto Parts, Inc. provides automotive replacement parts, accessories, batteries, and maintenance items for domestic and imported cars, vans, sport utility vehicles, and light and heavy duty trucks."
KR,0.702,KROGER CO,"The Kroger Co. operates as a retailer in the United States. The company operates supermarkets, multi-department stores, marketplace stores, and price impact warehouse stores."
TSCO,0.7051,TRACTOR SUPPLY CO,Tractor Supply Company operates rural lifestyle retail stores in the United States.
UAA,0.7126,UNDER ARMOUR INC,"Under Armour, Inc., together with its subsidiaries, develops, markets, and distributes branded performance apparel, footwear, and accessories for men, women, and youth primarily in North America, Europe, the Middle East, Africa, the Asia-Pacific, and Latin America."
UA,0.718,UNDER ARMOUR INC,"Under Armour, Inc., together with its subsidiaries, develops, markets, and distributes branded performance apparel, footwear, and accessories for men, women, and youth primarily in North America, Europe, the Middle East, Africa, the Asia-Pacific, and Latin America."
ANF,0.7194,ABERCROMBIE & FITCH  -CL A,"Abercrombie & Fitch Co., through its subsidiaries, operates as a specialty retailer. The company operates in two segments, Hollister and Abercrombie."
BIG,0.7294,BIG LOTS INC,"Big Lots, Inc., through its subsidiaries, operates as a retailer in the United States."
FL,0.7305,FOOT LOCKER INC,"Foot Locker, Inc., through its subsidiaries, operates as an athletic footwear and apparel retailer."
ODP,0.7339,ODP CORP,"The ODP Corporation provides business services and supplies, products, and technology solutions for small, medium, and enterprise businesses. The company operates in three divisions: Business Solutions, Retail, and CompuCom."
SIG,0.7385,SIGNET JEWELERS LTD,"Signet Jewelers Limited engages in the retail sale of diamond jewelry, watches, and other products. As of February 02, 2019, it operated 3,334 stores and kiosks. The company operates through three segments: North America, International, and Other."
GME,0.7455,GAMESTOP CORP,"GameStop Corp. operates as a multichannel video game, consumer electronics, and collectibles retailer in the United States, Canada, Australia, and Europe."
FOSL,0.7496,FOSSIL GROUP INC,"Fossil Group, Inc., together with its subsidiaries, designs, develops, markets, and distributes consumer fashion accessories in the United States, Europe, Asia, and internationally."
LOW,0.7511,LOWE'S COS INC,"Lowe's Companies, Inc., together with its subsidiaries, operates as a home improvement retailer in the United States, Canada, and Mexico. The company offers a line of products for construction, maintenance, repair, remodeling, and decorating."
CPRI,0.7535,CAPRI HOLDINGS LTD,"Capri Holdings Limited designs, markets, distributes, and retails branded women's and men's apparel, footwear, and accessories in the United States, Canada, Latin America, Europe, the Middle East, Africa, and Asia."
BBY,0.7548,BEST BUY CO INC,"Best Buy Co., Inc. retails technology products in the United States, Canada, and Mexico. The company operates in two segments, Domestic and International."
J,0.7909,JACOBS ENGINEERING GROUP INC,"Jacobs Engineering Group Inc. provides consulting, technical, scientific, and project delivery services for the government and private sectors in the United States, Europe, Canada, India, rest of Asia, Australia, New Zealand, South America, Mexico, the Middle East, and Africa."
DAL,0.821,DELTA AIR LINES INC,"Delta Air Lines, Inc. provides scheduled air transportation for passengers and cargo in the United States and internationally. The company operates through two segments, Airline and Refinery. Its domestic network centered on core hubs in Atlanta, Minneapolis-St."
LEN,0.8269,LENNAR CORP,"Lennar Corporation, together with its subsidiaries, operates as a homebuilder primarily under the Lennar brand in the United States. It operates through Homebuilding East, Homebuilding Central, Homebuilding Texas, Homebuilding West, Financial Services, Multifamily, and Lennar Other segments."
KBH,0.8278,KB HOME,"KB Home operates as a homebuilding company in the United States. It operates through four segments: West Coast, Southwest, Central, and Southeast."
PDCO,0.8486,PATTERSON COS INC,"Patterson Companies, Inc. distributes and sells dental and animal health products in the United States, the United Kingdom, and Canada. It operates through three segments; Dental, Animal Health, and Corporate segments."
DLTR,0.8632,DOLLAR TREE INC,"Dollar Tree, Inc. operates discount variety retail stores. It operates through two segments, Dollar Tree and Family Dollar. The Dollar Tree segment offers merchandise at the fixed price of $1.00."
BTU,0.8706,PEABODY ENERGY CORP,"Peabody Energy Corporation engages in coal mining business. The company operates through Seaborne Thermal Mining, Seaborne Metallurgical Mining, Powder River Basin Mining, Midwestern U.S. Mining, Western U.S. Mining, and Corporate and Other segments."
TSLA,0.8964,TESLA INC,"Tesla, Inc. designs, develops, manufactures, leases, and sells electric vehicles, and energy generation and storage systems in the United States, China, Netherlands, Norway, and internationally. The company operates in two segments, Automotive; and Energy Generation and Storage."
HOG,0.9009,HARLEY-DAVIDSON INC,"Harley-Davidson, Inc. manufactures and sells custom, cruiser, and touring motorcycles. The company operates in two segments, Motorcycles and Related Products and Financial Services."
NLSN,0.9163,NIELSEN HOLDINGS PLC,"Nielsen Holdings plc, together with its subsidiaries, operates as a measurement and data analytics company worldwide. It operates in two segments, Connect and Media."
ABC,0.9248,AMERISOURCEBERGEN CORP,AmerisourceBergen Corporation sources and distributes pharmaceutical products in the United States and internationally.
