,dist,conm,busdesc
AES,0.0,AES CORP (THE),"The AES Corporation operates as a diversified power generation and utility company. It owns and/or operates power plants to generate and sell power to customers, such as utilities, industrial users, and other intermediaries."
HBAN,0.0008,HUNTINGTON BANCSHARES,"Huntington Bancshares Incorporated operates as a holding company for The Huntington National Bank that provides commercial, small business, consumer, and mortgage banking services."
FRC,0.0017,FIRST REPUBLIC BANK,"First Republic Bank, together with its subsidiaries, provides private banking, private business banking, real estate lending, and wealth management services to clients in metropolitan areas in the United States. It operates through two segments, Commercial Banking and Wealth Management."
C,0.0017,CITIGROUP INC,"Citigroup Inc., a diversified financial services holding company, provides various financial products and services to consumers, corporations, governments, and institutions in North America, Latin America, Asia, Europe, the Middle East, and Africa."
KEY,0.0018,KEYCORP,"KeyCorp operates as the holding company for KeyBank National Association that provides various retail and commercial banking services in the United States. It operates in two segments, Consumer Bank and Commercial Bank."
ETFC,0.0022,E TRADE FINANCIAL CORP,"E*TRADE Financial Corporation, a financial services company, provides brokerage, and related products and services for traders, investors, registered investment advisors (RIAs), and stock plan administrators and participants."
AXP,0.0023,AMERICAN EXPRESS CO,"American Express Company, together with its subsidiaries, provides charge and credit payment card products, and travel-related services worldwide. The company operates through three segments: Global Consumer Services Group, Global Commercial Services, and Global Merchant and Network Services."
NTRS,0.0025,NORTHERN TRUST CORP,"Northern Trust Corporation, a financial holding company, provides wealth management, asset servicing, asset management, and banking solutions for corporations, institutions, families, and individuals worldwide."
FHN,0.0034,FIRST HORIZON CORP,"First Horizon Corporation operates as the bank holding company for First Horizon Bank that provides various financial services. The company operates through four segments: Regional Banking, Fixed Income, Corporate, and Non-Strategic."
HCBK,0.0035,HUDSON CITY BANCORP INC,"As of November 1, 2015, Hudson City Bancorp, Inc. was acquired by Wilmington Trust Corporation. Hudson City Bancorp, Inc. operates as the holding company of Hudson City Savings Bank that provides various banking products and services in the United States."
MET,0.0042,METLIFE INC,"MetLife, Inc. engages in the insurance, annuities, employee benefits, and asset management businesses worldwide. It operates through five segments: U.S.; Asia; Latin America; Europe, the Middle East and Africa; and MetLife Holdings."
WFC,0.0042,WELLS FARGO & CO,"Wells Fargo & Company, a diversified financial services company, provides banking, investment, mortgage, and consumer and commercial finance products and services to individuals, businesses, and institutions in the United States and internationally."
PFG,0.0045,PRINCIPAL FINANCIAL GRP INC,"Principal Financial Group, Inc. provides retirement, asset management, and insurance products and services to businesses, individuals, and institutional clients worldwide. The company operates through Retirement and Income Solutions, Principal Global Investors, Principal International, and U.S."
ZION,0.0046,ZIONS BANCORPORATION NA,"Zions Bancorporation, National Association provides various banking and related services primarily in Arizona, California, Colorado, Idaho, Nevada, New Mexico, Oregon, Texas, Utah, Washington, and Wyoming."
STT,0.0047,STATE STREET CORP,"State Street Corporation, through its subsidiaries, provides a range of financial products and services to institutional investors worldwide."
BAC,0.0049,BANK OF AMERICA CORP,"Bank of America Corporation, through its subsidiaries, provides banking and financial products and services for individual consumers, small- and middle-market businesses, institutional investors, large corporations, and governments worldwide."
CI,0.005,CIGNA CORP,"Cigna Corporation provides insurance and related products and services. It operates through Health Services, Integrated Medical, International Markets, and Group Disability and Other segments."
JPM,0.0051,JPMORGAN CHASE & CO,"JPMorgan Chase & Co. operates as a financial services company worldwide. It operates in four segments: Consumer & Community Banking (CCB), Corporate & Investment Bank (CIB), Commercial Banking (CB), and Asset & Wealth Management (AWM)."
NCC,0.0054,NATIONAL CITY CORP,"As of November 6, 2009, National City Corporation was acquired by PNC Bank, National Association."
SCHW,0.0057,SCHWAB (CHARLES) CORP,"The Charles Schwab Corporation, through its subsidiaries, provides wealth management, securities brokerage, banking, asset management, custody, and financial advisory services. The company operates through two segments, Investor Services and Advisor Services."
CNP,0.0061,CENTERPOINT ENERGY INC,"CenterPoint Energy, Inc. operates as a public utility holding company in the United States. The company's Houston Electric T&D segment electric transmission and distribution services to electric utility."
FITB,0.007,FIFTH THIRD BANCORP,Fifth Third Bancorp operates as a diversified financial services company in the United States.
GM,0.0072,GENERAL MOTORS CO,"General Motors Company designs, builds, and sells cars, trucks, crossovers, and automobile parts worldwide. The company operates through GM North America, GM International, Cruise, and GM Financial segments."
F,0.0072,FORD MOTOR CO,"Ford Motor Company designs, manufactures, markets, and services a range of Ford cars, trucks, sport utility vehicles, electrified vehicles, and Lincoln luxury vehicles worldwide. It operates through three segments: Automotive, Mobility, and Ford Credit."
PRU,0.0075,PRUDENTIAL FINANCIAL INC,"Prudential Financial, Inc., through its subsidiaries, provides insurance, investment management, and other financial products and services."
HIG,0.0078,HARTFORD FINANCIAL SERVICES,"The Hartford Financial Services Group, Inc. provides insurance and financial services to individual and business customers in the United States and internationally."
GT,0.0079,GOODYEAR TIRE & RUBBER CO,"The Goodyear Tire & Rubber Company, together with its subsidiaries, develops, manufactures, distributes, and sells tires and related products and services worldwide."
BK,0.0079,BANK OF NEW YORK MELLON CORP,"The Bank of New York Mellon Corporation provides a range of financial products and services to in the United States and internationally. The company operates through two segments, Investment Management and Investment Services."
CE,0.0081,CELANESE CORP,"Celanese Corporation, a technology and specialty materials company, manufactures and sells high performance engineered polymers in the United States and internationally. The company operates through Engineered Materials, Acetate Tow, and Acetyl Chain segments."
LNC,0.0082,LINCOLN NATIONAL CORP,"Lincoln National Corporation, through its subsidiaries, operates multiple insurance and retirement businesses in the United States. It operates through four segments: Annuities, Retirement Plan Services, Life Insurance, and Group Protection."
CMA,0.0083,COMERICA INC,"Comerica Incorporated, through its subsidiaries, provides various financial products and services. It operates through three segments: Business Bank, Retail Bank, and Wealth Management."
PNC,0.0086,PNC FINANCIAL SVCS GROUP INC,"The PNC Financial Services Group, Inc. operates as a diversified financial services company in the United States."
STI,0.0089,SUNTRUST BANKS INC,"As of December 6, 2019, SunTrust Banks, Inc. was acquired by BB&T Corporation. SunTrust Banks, Inc. operates as the holding company for SunTrust Bank that provides various financial services for consumers, businesses, corporations, institutions, and not-for-profit entities in the United States."
USB,0.0091,U S BANCORP,"U.S. Bancorp, a financial services holding company, provides various financial services in the United States."
GS,0.0094,GOLDMAN SACHS GROUP INC,"The Goldman Sachs Group, Inc. operates as an investment banking, securities, and investment management company worldwide. It operates in four segments: Investment Banking, Global Markets, Asset Management, and Consumer & Wealth Management."
AIG,0.0108,AMERICAN INTERNATIONAL GROUP,"American International Group, Inc. provides insurance products for commercial, institutional, and individual customers in North America and internationally."
AZO,0.0109,AUTOZONE INC,"AutoZone, Inc. retails and distributes automotive replacement parts and accessories. The company offers various products for cars, sport utility vehicles, vans, and light trucks, including new and remanufactured automotive hard parts, maintenance items, accessories, and non-automotive products."
MTB,0.012,M & T BANK CORP,"M&T Bank Corporation operates as the holding company for Manufacturers and Traders Trust Company; and Wilmington Trust, National Association that provide banking services."
TFC,0.0121,TRUIST FINANCIAL CORP,"Truist Financial Corporation, a holding company, provides banking and trust services for small and mid-size businesses, public agencies, local governments, corporations, and individuals in the Southeastern and Mid-Atlantic United States."
LYV,0.0125,LIVE NATION ENTERTAINMENT,"Live Nation Entertainment, Inc. operates as a live entertainment company. It operates through Concerts, Ticketing, and Sponsorship & Advertising segments."
HPC,0.0132,HERCULES INC,"Hercules Incorporated manufactures and markets chemical specialties used in making products for home, office, and industrial markets. It operates in two segments, Paper Technologies and Ventures (PTV), and Aqualon Group (Aqualon)."
MS,0.0133,MORGAN STANLEY,"Morgan Stanley, a financial holding company, provides various financial products and services to corporations, governments, financial institutions, and individuals in the Americas, Europe, the Middle East, Africa, and Asia."
PBCT,0.0134,PEOPLE'S UNITED FINL INC,"People's United Financial, Inc. operates as the bank holding company for People's United Bank, National Association that provides commercial banking, retail banking, and wealth management services to individual, corporate, and municipal customers."
AKS,0.0134,AK STEEL HOLDING CORP,"AK Steel Holding Corporation, through its subsidiary, AK Steel Corporation, produces flat-rolled carbon, and stainless and electrical steel products in the United States and internationally."
DJ,0.0136,DOW JONES & CO INC,"Dow Jones & Company, Inc. offers business and financial news and information globally to consumers and organizations worldwide. It provides solutions through newspapers, newswires, Websites, applications, newsletters, magazines, databases, and conferences."
CNX,0.0137,CNX RESOURCES CORPORATION,"CNX Resources Corporation, an independent oil and gas company, explores for, develops, and produces natural gas properties primarily in the Appalachian Basin. The company operates through two divisions, Exploration and Production (E&P), and Midstream."
SNV,0.0137,SYNOVUS FINANCIAL CORP,"Synovus Financial Corp. operates as the bank holding company for Synovus Bank that provides various financial products and services. It operates through three segments: Community Banking, Wholesale Banking, and Financial Management Services."
DNB,0.0138,DUN & BRADSTREET HOLDNGS INC,"Dun & Bradstreet Holdings, Inc. provides business decisioning data and analytics in North America and internationally."
NAVI,0.0139,NAVIENT CORP,"Navient Corporation provides education loan management and business processing solutions for education, healthcare, and government clients at the federal, state, and local levels in the United States."
SIVB,0.0167,SVB FINANCIAL GROUP,"SVB Financial Group, a diversified financial services company, provides various banking and financial products and services. The company operates through four segments: Global Commercial Bank, SVB Private Bank, SVB Capital, and SVB Leerink."
TIN,0.0167,TEMPLE-INLAND INC,"Temple-Inland LLC went out of business. Temple-Inland LLC, through its subsidiaries, manufactures and sells corrugated packaging and building products in the United States and Mexico."
CIT,0.017,CIT GROUP INC,"CIT Group Inc. operates as the holding company for CIT Bank, N.A. that provides banking and related services to commercial and individual customers. The company operates through Commercial Banking and Consumer Banking segments."
EP,0.0177,EL PASO CORP,"El Paso LLC offers natural gas transmission, and exploration and production services primarily in the United States."
GNW,0.0188,GENWORTH FINANCIAL INC,"Genworth Financial, Inc. provides insurance products in the United States and internationally. It operates through four segments: U.S. Mortgage Insurance, Australia Mortgage Insurance, U.S. Life Insurance, and Runoff. The U.S."
WLTW,0.0188,WILLIS TOWERS WATSON PLC,"Willis Towers Watson Public Limited Company operates as an advisory, broking, and solutions company worldwide."
AFL,0.0206,AFLAC INC,"Aflac Incorporated, through its subsidiaries, provides supplemental health and life insurance products. It operates through two segments, Aflac Japan and Aflac U.S."
RF,0.0207,REGIONS FINANCIAL CORP,"Regions Financial Corporation, a financial holding company, provides banking and bank-related services to individual and corporate customers. It operates through three segments: Corporate Bank, Consumer Bank, and Wealth Management."
VRTX,0.0207,VERTEX PHARMACEUTICALS INC,Vertex Pharmaceuticals Incorporated engages in developing and commercializing therapies for treating cystic fibrosis.
CPB,0.0221,CAMPBELL SOUP CO,"Campbell Soup Company, together with its subsidiaries, engages in the manufacture and market food and beverage products. It operates through Meals & Beverages and Snacks segments. The Meals & Beverages segment engages in the retail and foodservice businesses in the United States and Canada."
TE,0.0246,TECO ENERGY INC,"TECO Energy, Inc., an electric and gas utility holding company, engages in the regulated electric and gas utility operations."
AAL,0.0257,AMERICAN AIRLINES GROUP INC,"American Airlines Group Inc., through its subsidiaries, operates as a network air carrier. It provides scheduled air transportation services for passengers and cargo. As of December 31, 2019, the company operated a mainline fleet of 942 aircraft."
LVLT,0.0259,LEVEL 3 COMMUNICATIONS INC,"Level 3 Parent, LLC provides various integrated communications services for enterprise, government, wholesale, and small and medium business customers in North America, Latin America, Europe, the Asia Pacific, the Middle East, and Africa."
FTI,0.0272,TECHNIPFMC PLC,"TechnipFMC plc engages in the oil and gas projects, technologies, and systems and services businesses. It operates through three segments: Subsea, Technip Energies, and Surface Technologies."
UNM,0.0277,UNUM GROUP,"Unum Group, together with its subsidiaries, provides financial protection benefit solutions in the United States, the United Kingdom, Poland, and internationally. It operates through Unum US, Unum International, Colonial Life, and Closed Block segments."
RJF,0.0279,RAYMOND JAMES FINANCIAL CORP,"Raymond James Financial, Inc., through its subsidiaries, engages in the underwriting, distribution, trading, and brokerage of equity and debt securities in the United States, Canada, and Europe."
VTR,0.0282,VENTAS INC,"Ventas, an S&P 500 company, operates at the intersection of two powerful and dynamic industries - healthcare and real estate."
IPG,0.029,INTERPUBLIC GROUP OF COS,"The Interpublic Group of Companies, Inc. provides advertising and marketing services worldwide. It operates through two segments, Integrated Agency Networks and Constituency Management Group."
ALL,0.0295,ALLSTATE CORP,"The Allstate Corporation, through its subsidiaries, provides property and casualty, and other insurance products in the United States and Canada. The company operates through Allstate Protection, Service Businesses, Allstate Life, and Allstate Benefits segments."
AIZ,0.031,ASSURANT INC,"Assurant, Inc., together with its subsidiaries, provides lifestyle and housing solutions that support, protect, and connect consumer purchases in North America, Latin America, Europe, and the Asia Pacific."
IT,0.0323,GARTNER INC,"Gartner, Inc. operates as a research and advisory company. It operates through three segments: Research, Conferences, and Consulting."
AMZN,0.0328,AMAZON.COM INC,"Amazon.com, Inc. engages in the retail sale of consumer products and subscriptions in North America and internationally. The company operates through three segments: North America, International, and Amazon Web Services (AWS)."
SBAC,0.0357,SBA COMMUNICATIONS CORP,"SBA Communications Corporation is a first choice provider and leading owner and operator of wireless communications infrastructure in North, Central, and South America and South Africa."
LO,0.0408,LORILLARD INC,"Lorillard, LLC, through its subsidiaries, manufactures and sells cigarettes in the United States. It operates through two segments, Cigarettes and Electronic Cigarettes."
APTV,0.0417,APTIV PLC,"Aptiv PLC designs, manufacturers, and sells vehicle components worldwide. The company provides electrical, electronic, and safety technology solutions to the automotive and commercial vehicle markets."
CHTR,0.0419,CHARTER COMMUNICATIONS INC,"Charter Communications, Inc., through its subsidiaries, provides cable services to residential and commercial customers in the United States."
DAL,0.0431,DELTA AIR LINES INC,"Delta Air Lines, Inc. provides scheduled air transportation for passengers and cargo in the United States and internationally. The company operates through two segments, Airline and Refinery. Its domestic network centered on core hubs in Atlanta, Minneapolis-St."
DISH,0.0439,DISH NETWORK CORP,"DISH Network Corporation, together with its subsidiaries, provides pay-TV services in the United States. The company operates in two segments, Pay-TV and Wireless."
UAL,0.0442,UNITED AIRLINES HOLDINGS INC,"United Airlines Holdings, Inc., through its subsidiaries, provides air transportation services in North America, Asia, Europe, Africa, the Pacific, the Middle East, and Latin America. It transports people and cargo through its mainline and regional fleets."
AKAM,0.0443,AKAMAI TECHNOLOGIES INC,"Akamai Technologies, Inc. provides cloud services for delivering, optimizing, and securing content and business applications over the Internet in the United States and internationally."
DPZ,0.0444,DOMINO'S PIZZA INC,"Domino's Pizza, Inc., through its subsidiaries, operates as a pizza delivery company in the United States and internationally. It operates through three segments: U.S. Stores, International Franchise, and Supply Chain."
