,dist,conm,busdesc
NFLX,0.0,NETFLIX INC,"Netflix, Inc. provides subscription streaming entertainment service. It offers TV series, documentaries, and feature films across various genres and languages."
KMX,0.009,CARMAX INC,"CarMax, Inc., through its subsidiaries, operates as a retailer of used vehicles in the United States. The company operates in two segments, CarMax Sales Operations and CarMax Auto Finance."
GM,0.0252,GENERAL MOTORS CO,"General Motors Company designs, builds, and sells cars, trucks, crossovers, and automobile parts worldwide. The company operates through GM North America, GM International, Cruise, and GM Financial segments."
SAIC,0.0259,SCIENCE APPLICATIONS INTL CP,"Science Applications International Corporation provides technical, engineering, and enterprise information technology (IT) services primarily in the United States."
ADT,0.0289,ADT INC,"ADT Inc. provides security and automation solutions for homes and businesses in the United States and Canada. It provides a range of fire detection, fire suppression, video surveillance, and access control systems to residential, commercial, and multi-site customers."
LOW,0.0319,LOWE'S COS INC,"Lowe's Companies, Inc., together with its subsidiaries, operates as a home improvement retailer in the United States, Canada, and Mexico. The company offers a line of products for construction, maintenance, repair, remodeling, and decorating."
UAL,0.0333,UNITED AIRLINES HOLDINGS INC,"United Airlines Holdings, Inc., through its subsidiaries, provides air transportation services in North America, Asia, Europe, Africa, the Pacific, the Middle East, and Latin America. It transports people and cargo through its mainline and regional fleets."
GE,0.0356,GENERAL ELECTRIC CO,"General Electric Company operates as a high-tech industrial company in the United States, Europe, Asia, the Americas, the Middle East, and Africa. It operates through Power, Renewable Energy, Aviation, Healthcare, and Capital segments."
POOL,0.0367,POOL CORP,"Pool Corporation distributes swimming pool supplies, equipment, and related leisure products in the United States and internationally."
CDW,0.0377,CDW CORP,"CDW Corporation provides integrated information technology (IT) solutions to business, government, education, and healthcare customers in the United States, the United Kingdom, and Canada. It operates through three segments: Corporate, Small Business, and Public."
ZBRA,0.0381,ZEBRA TECHNOLOGIES CP  -CL A,"Zebra Technologies Corporation, together with its subsidiaries, provides enterprise asset intelligence solutions in the automatic identification and data capture solutions industry worldwide."
AVY,0.0395,AVERY DENNISON CORP,Avery Dennison Corporation produces and sells pressure-sensitive materials worldwide.
IP,0.0396,INTL PAPER CO,"International Paper Company operates as a paper and packaging company primarily in United States, the Middle East, Europe, Africa, Pacific Rim, Asia, and the Americas. It operates through three segments: Industrial Packaging, Global Cellulose Fibers, and Printing Papers."
ALL,0.0398,ALLSTATE CORP,"The Allstate Corporation, through its subsidiaries, provides property and casualty, and other insurance products in the United States and Canada. The company operates through Allstate Protection, Service Businesses, Allstate Life, and Allstate Benefits segments."
AIZ,0.0402,ASSURANT INC,"Assurant, Inc., together with its subsidiaries, provides lifestyle and housing solutions that support, protect, and connect consumer purchases in North America, Latin America, Europe, and the Asia Pacific."
F,0.0439,FORD MOTOR CO,"Ford Motor Company designs, manufactures, markets, and services a range of Ford cars, trucks, sport utility vehicles, electrified vehicles, and Lincoln luxury vehicles worldwide. It operates through three segments: Automotive, Mobility, and Ford Credit."
NCR,0.0448,NCR CORP,"NCR Corporation provides software and services worldwide. The company operates through Banking, Retail, Hospitality, and Other segments."
AMD,0.0453,ADVANCED MICRO DEVICES,"Advanced Micro Devices, Inc. operates as a semiconductor company worldwide. The company operates in two segments, Computing and Graphics; and Enterprise, Embedded and Semi-Custom."
BLL,0.0454,BALL CORP,"Ball Corporation supplies aluminum packaging products to the beverage, personal care, automotive, paint, healthcare, and household products industries."
DE,0.0458,DEERE & CO,"Deere & Company, together with its subsidiaries, manufactures and distributes various equipment worldwide. The company operates through three segments: Agriculture and Turf, Construction and Forestry, and Financial Services."
AIG,0.0462,AMERICAN INTERNATIONAL GROUP,"American International Group, Inc. provides insurance products for commercial, institutional, and individual customers in North America and internationally."
JBL,0.0467,JABIL INC,"Jabil Inc. provides manufacturing services and solutions worldwide. The company operates in two segments, Electronics Manufacturing Services and Diversified Manufacturing Services. It offers electronics design, production, and product management services."
IT,0.0472,GARTNER INC,"Gartner, Inc. operates as a research and advisory company. It operates through three segments: Research, Conferences, and Consulting."
KR,0.0483,KROGER CO,"The Kroger Co. operates as a retailer in the United States. The company operates supermarkets, multi-department stores, marketplace stores, and price impact warehouse stores."
SYY,0.0484,SYSCO CORP,"Sysco Corporation, through its subsidiaries, markets and distributes a range of food and related products primarily to the foodservice or food-away-from-home industry in the United States, Canada, the United Kingdom, France, and internationally. It operates through three segments: U.S."
R,0.0484,RYDER SYSTEM INC,"Ryder System, Inc. provides transportation and supply chain management solutions worldwide. The company operates through three segments: Fleet Management Solutions (FMS), Supply Chain Solutions (SCS), and Dedicated Transportation Solutions (DTS)."
CNP,0.0487,CENTERPOINT ENERGY INC,"CenterPoint Energy, Inc. operates as a public utility holding company in the United States. The company's Houston Electric T&D segment electric transmission and distribution services to electric utility."
JWN,0.0498,NORDSTROM INC,"Nordstrom, Inc., a fashion retailer, provides apparels, shoes, cosmetics, and accessories for women, men, young adults, and children."
AN,0.0504,AUTONATION INC,"AutoNation, Inc., through its subsidiaries, operates as an automotive retailer in the United States. The company operates through three segments: Domestic, Import, and Premium Luxury."
MAR,0.0511,MARRIOTT INTL INC,"Marriott International, Inc. operates, franchises, and licenses hotel, residential, and timeshare properties worldwide. The company operates through North American Full-Service, North American Limited-Service, and Asia Pacific segments."
AMZN,0.0525,AMAZON.COM INC,"Amazon.com, Inc. engages in the retail sale of consumer products and subscriptions in North America and internationally. The company operates through three segments: North America, International, and Amazon Web Services (AWS)."
TRV,0.0529,TRAVELERS COS INC,"The Travelers Companies, Inc., through its subsidiaries, provides a range of commercial and personal property, and casualty insurance products and services to businesses, government units, associations, and individuals in the United states and internationally."
CAH,0.0542,CARDINAL HEALTH INC,"Cardinal Health, Inc. operates as an integrated healthcare services and products company in the United States and internationally. It provides customized solutions for hospitals, healthcare systems, pharmacies, ambulatory surgery centers, clinical laboratories, and physician offices."
PGR,0.0552,PROGRESSIVE CORP-OHIO,"The Progressive Corporation, through its subsidiaries, provides personal and commercial auto insurance, residential property insurance, and other specialty property-casualty insurance and related services primarily in the United States."
WHR,0.0557,WHIRLPOOL CORP,"Whirlpool Corporation manufactures and markets home appliances and related products. It operates through four segments: North America; Europe, Middle East and Africa; Latin America; and Asia."
MCK,0.0558,MCKESSON CORP,"McKesson Corporation provides pharmaceuticals and medical supplies in the United States and internationally. It operates through four segments: U.S. Pharmaceutical, Prescription Technology Solutions, International, and Medical-Surgical Solutions. The U.S."
LYV,0.0568,LIVE NATION ENTERTAINMENT,"Live Nation Entertainment, Inc. operates as a live entertainment company. It operates through Concerts, Ticketing, and Sponsorship & Advertising segments."
WRB,0.0573,BERKLEY (W R) CORP,"W. R. Berkley Corporation, an insurance holding company, operates as a commercial lines writer in the United States and internationally. It operates through two segments, Insurance and Reinsurance & Monoline Excess."
STX,0.0586,SEAGATE TECHNOLOGY PLC,"Seagate Technology plc provides data storage technology and solutions in Singapore, the United States, the Netherlands, and internationally."
THC,0.0594,TENET HEALTHCARE CORP,"Tenet Healthcare Corporation operates as a diversified healthcare services company. The company operates through three segments: Hospital Operations and Other, Ambulatory Care, and Conifer."
FTNT,0.0601,FORTINET INC,"Fortinet, Inc. provides broad, integrated, and automated cybersecurity solutions worldwide."
IPG,0.0619,INTERPUBLIC GROUP OF COS,"The Interpublic Group of Companies, Inc. provides advertising and marketing services worldwide. It operates through two segments, Integrated Agency Networks and Constituency Management Group."
OI,0.0646,O-I GLASS INC,"O-I Glass, Inc., through its subsidiaries, manufactures and sells glass containers to food and beverage manufacturers primarily in the Americas, Europe, and the Asia Pacific. It produces glass containers for alcoholic beverages, including beer, flavored malt beverages, spirits, and wine."
TDC,0.0655,TERADATA CORP,"Teradata Corporation provides hybrid cloud analytics software. Its solutions and services comprise software, hardware, and related business consulting and support services to deliver analytics in company's analytical ecosystem."
GNW,0.0679,GENWORTH FINANCIAL INC,"Genworth Financial, Inc. provides insurance products in the United States and internationally. It operates through four segments: U.S. Mortgage Insurance, Australia Mortgage Insurance, U.S. Life Insurance, and Runoff. The U.S."
NOC,0.068,NORTHROP GRUMMAN CORP,Northrop Grumman Corporation operates as a security company.
HWM,0.0702,HOWMET AEROSPACE INC,Howmet Aerospace Inc. provides advanced engineered solutions for the aerospace and transportation industries.
MET,0.0724,METLIFE INC,"MetLife, Inc. engages in the insurance, annuities, employee benefits, and asset management businesses worldwide. It operates through five segments: U.S.; Asia; Latin America; Europe, the Middle East and Africa; and MetLife Holdings."
SVU,0.0759,SUPERVALU INC,"SUPERVALU INC., together with its subsidiaries, operates as a grocery wholesaler and retailer in the United States and internationally. It operates through two segments, Wholesale and Retail."
GPC,0.0762,GENUINE PARTS CO,"Genuine Parts Company distributes automotive replacement parts, industrial parts and materials, and business products in the United States, Canada, Mexico, Australasia, France, the United Kingdom, Germany, Poland, the Netherlands, and Belgium."
CTLT,0.0765,CATALENT INC,"Catalent, Inc., together with its subsidiaries, provides delivery technologies and development solutions for drugs, biologics, and consumer and animal health products worldwide."
SHW,0.077,SHERWIN-WILLIAMS CO,"The Sherwin-Williams Company develops, manufactures, distributes, and sells paints, coatings, and related products to professional, industrial, commercial, and retail customers. It operates in three segments: The Americas Group, Consumer Brands Group, and Performance Coatings Group."
BBY,0.0786,BEST BUY CO INC,"Best Buy Co., Inc. retails technology products in the United States, Canada, and Mexico. The company operates in two segments, Domestic and International."
IGT,0.0788,INTL GAME TECHNOLOGY PLC,"International Game Technology PLC operates and provides gaming technology products and services worldwide. The company operates through four segments: North America Gaming and Interactive, North America Lottery, International, and Italy."
SUN,0.0799,SUNOCO LP,"Sunoco LP, together with its subsidiaries, engages in the distribution and retailing of motor fuels in the United States. It operates through two segments, Fuel Distribution and Marketing, and All Other."
GT,0.0834,GOODYEAR TIRE & RUBBER CO,"The Goodyear Tire & Rubber Company, together with its subsidiaries, develops, manufactures, distributes, and sells tires and related products and services worldwide."
EXC,0.0855,EXELON CORP,"Exelon Corporation, a utility services holding company, engages in the generation and marketing of energy in the United States and Canada. It owns nuclear, fossil, wind, hydroelectric, biomass, and solar generating facilities."
HIG,0.0888,HARTFORD FINANCIAL SERVICES,"The Hartford Financial Services Group, Inc. provides insurance and financial services to individual and business customers in the United States and internationally."
HII,0.0888,HUNTINGTON INGALLS IND INC,"Huntington Ingalls Industries, Inc. engages in the designing, building, overhauling, and repairing military ships in the United States. It operates through three segments: Ingalls Shipbuilding, Newport News Shipbuilding, and Technical Solutions."
AAL,0.0895,AMERICAN AIRLINES GROUP INC,"American Airlines Group Inc., through its subsidiaries, operates as a network air carrier. It provides scheduled air transportation services for passengers and cargo. As of December 31, 2019, the company operated a mainline fleet of 942 aircraft."
MAT,0.0926,MATTEL INC,"Mattel, Inc., a children's entertainment company, designs and produces toys and consumer products worldwide. The company operates through North America, International, and American Girl segments."
DISH,0.0947,DISH NETWORK CORP,"DISH Network Corporation, together with its subsidiaries, provides pay-TV services in the United States. The company operates in two segments, Pay-TV and Wireless."
AKS,0.102,AK STEEL HOLDING CORP,"AK Steel Holding Corporation, through its subsidiary, AK Steel Corporation, produces flat-rolled carbon, and stainless and electrical steel products in the United States and internationally."
ABC,0.1021,AMERISOURCEBERGEN CORP,AmerisourceBergen Corporation sources and distributes pharmaceutical products in the United States and internationally.
NOW,0.103,SERVICENOW INC,"ServiceNow, Inc. provides enterprise cloud computing solutions that defines, structures, consolidates, manages, and automates services for enterprises worldwide."
DELL,0.1035,DELL TECHNOLOGIES INC,"Dell Technologies Inc. designs, develops, manufactures, markets, sells, and support IT hardware, software, and services solutions worldwide. It operates through three segments: Infrastructure Solutions Group (ISG), Client Solutions Group (CSG), and VMware."
ALTR,0.1284,ALTAIR ENGINEERING INC,"Altair Engineering Inc., together with its subsidiaries, provides software and cloud solutions worldwide. The company operates through two segments, Software and Client Engineering Services."
RRD,0.1344,DONNELLEY (R R) & SONS CO,"R.R. Donnelley & Sons Company, an integrated communications provider, enables organizations to create, manage, deliver, and optimize their multichannel marketing and business communications."
TSLA,0.1352,TESLA INC,"Tesla, Inc. designs, develops, manufactures, leases, and sells electric vehicles, and energy generation and storage systems in the United States, China, Netherlands, Norway, and internationally. The company operates in two segments, Automotive; and Energy Generation and Storage."
AVP,0.1355,AVON PRODUCTS,"Avon Products, Inc. manufactures, markets, and sells beauty and related products in Europe, the Middle East, Africa, south Latin America, north Latin America, and the Asia Pacific."
BHF,0.1372,BRIGHTHOUSE FINANL INC,"Brighthouse Financial, Inc. provides annuity and life insurance products in the United States. It operates through three segments: Annuities, Life, and Run-off."
NKTR,0.1383,NEKTAR THERAPEUTICS,"Nektar Therapeutics, a biopharmaceutical company, researches and develops drug candidates for cancer and auto-immune disease in the United States."
SPOT,0.1428,SPOTIFY TECHNOLOGY SA,"Spotify Technology S.A., together with its subsidiaries, provides audio streaming services in the United States, the United Kingdom, Luxembourg, and internationally. It operates through two segments, Premium and Ad-Supported."
HPQ,0.1452,HP INC,"HP Inc., together with its subsidiaries, provides personal computing and other access devices, imaging and printing products, and related technologies, solutions, and services in the United States and internationally."
MBI,0.1578,MBIA INC,"MBIA Inc. provides financial guarantee insurance services to public finance markets. It operates through United States (U.S.) Public Finance Insurance, and International and Structured Finance Insurance segments."
SE,0.1614,SEA LTD - ADR,"Sea Limited engages in the digital entertainment, e-commerce, and digital financial service businesses in Southeast Asia, Latin America, rest of Asia, and internationally."
UIS,0.1919,UNISYS CORP,"Unisys Corporation operates as an information technology company worldwide. It operates in two segments, Services and Technology. The Services segment offers cloud and infrastructure services, application services, and business process outsourcing services."
ADSK,0.1983,AUTODESK INC,"Autodesk, Inc. operates as a software design and services company worldwide."
