,dist,conm,busdesc
MKC,0.0,MCCORMICK & CO INC,"McCormick & Company, Incorporated manufactures, markets, and distributes spices, seasoning mixes, condiments, and other flavorful products to the food industry. The company operates in two segments, Consumer and Flavor Solutions."
CINF,0.012,CINCINNATI FINANCIAL CORP,"Cincinnati Financial Corporation, together with its subsidiary, provides property casualty insurance products in the United States. The company operates in five segments: Commercial Lines Insurance, Personal Lines Insurance, Excess and Surplus Lines Insurance, Life Insurance, and Investments."
PNR,0.0144,PENTAIR PLC,"Pentair plc provides various smart water solutions worldwide. It operates through three segments: Aquatic Systems, Filtration Solutions, and Flow Technologies."
MDP,0.0156,MEREDITH CORP,"Meredith Corporation operates as a diversified media company primarily in the United States. It operates in two segments, National Media and Local Media."
CDNS,0.0157,CADENCE DESIGN SYSTEMS INC,"Cadence Design Systems, Inc. provides software, hardware, services, and reusable integrated circuit (IC) design blocks worldwide. The company offers functional verification services, including emulation and prototyping hardware."
MGM,0.0166,MGM RESORTS INTERNATIONAL,"MGM Resorts International, through its subsidiaries, owns and operates integrated casino, hotel, and entertainment resorts in the United States and Macau. The company operates through three segments: Las Vegas Strip Resorts, Regional Operations, and MGM China."
NWL,0.0177,NEWELL BRANDS INC,"Newell Brands Inc. designs, manufactures, sources, and distributes consumer and commercial products worldwide. The company operates through four segments: Appliances and Cookware, Food and Commercial, Home and Outdoor Living, and Learning and Development."
TSS,0.0184,TOTAL SYSTEM SERVICES INC,"As of September 17, 2019, Total System Services, Inc. was acquired by Global Payments Inc. Total System Services, Inc. provides payment processing, merchant, and related payment services to financial and nonfinancial institutions worldwide."
CTAS,0.0196,CINTAS CORP,"Cintas Corporation provides corporate identity uniforms and related business services primarily in North America, Latin America, Europe, and Asia. It operates through Uniform Rental and Facility Services and First Aid and Safety Services segments."
XYL,0.0207,XYLEM INC,"Xylem Inc. engages in the design, manufacture, and servicing of engineered products and solutions for the water and wastewater applications in the United States, Europe, the Asia Pacific, and internationally."
HAS,0.0222,HASBRO INC,"Hasbro, Inc., together with its subsidiaries, operates as a play and entertainment company. The company's U.S."
CE,0.0225,CELANESE CORP,"Celanese Corporation, a technology and specialty materials company, manufactures and sells high performance engineered polymers in the United States and internationally. The company operates through Engineered Materials, Acetate Tow, and Acetyl Chain segments."
GD,0.0235,GENERAL DYNAMICS CORP,"General Dynamics Corporation operates as an aerospace and defense company worldwide. It operates through five segments: Aerospace, Combat Systems, Information Technology, Mission Systems, and Marine Systems."
ECL,0.0253,ECOLAB INC,"Ecolab Inc. provides water, hygiene, and energy technologies and services worldwide."
BR,0.026,BROADRIDGE FINANCIAL SOLUTNS,"Broadridge Financial Solutions, Inc. provides investor communications and technology-driven solutions for the financial services industry worldwide."
RTN,0.026,RAYTHEON CO,"Raytheon Company develops technologically advanced and integrated products, services, and solutions for the defense and other government markets worldwide."
RSG,0.0261,REPUBLIC SERVICES INC,"Republic Services, Inc., together with its subsidiaries, provides non-hazardous solid waste collection, transfer, disposal, recycling, and environmental services in the United States. The company serves small-container, large-container, and municipal and residential customers."
LEG,0.0279,LEGGETT & PLATT INC,"Leggett & Platt, Incorporated designs and produces various engineered components and products worldwide. It operates through three segments: Bedding Products; Furniture, Flooring & Textile Products; and Specialized Products."
RTX,0.0302,RAYTHEON TECHNOLOGIES CORP,"Raytheon Technologies Corporation, an aerospace and defense company, provides advanced systems and services for commercial, military, and government customers worldwide."
DD,0.031,DUPONT DE NEMOURS INC,"DuPont de Nemours, Inc. provides technology-based materials, ingredients, and solutions in the United States, Canada, the Asia Pacific, Latin America, Europe, the Middle East, and Africa."
LH,0.032,LABORATORY CP OF AMER HLDGS,"Laboratory Corporation of America Holdings operates as an independent clinical laboratory company worldwide. It operates in two segments, LabCorp Diagnostics (LCD) and Covance Drug Development."
FIS,0.0334,FIDELITY NATIONAL INFO SVCS,"Fidelity National Information Services, Inc. operates as a financial services technology company in the United States and internationally. It operates through three segments: Merchant Solutions, Banking Solutions, and Capital Market Solutions."
EL,0.0336,LAUDER (ESTEE) COS INC -CL A,"The Estee Lauder Companies Inc. manufactures and markets skin care, makeup, fragrance, and hair care products worldwide."
CHTR,0.0337,CHARTER COMMUNICATIONS INC,"Charter Communications, Inc., through its subsidiaries, provides cable services to residential and commercial customers in the United States."
SRE,0.0338,SEMPRA ENERGY,"Sempra Energy operates as an energy-services holding company in the United States and internationally. The company's San Diego Gas & Electric Company segment generates, transmits, and distributes electricity; and supplies natural gas."
FMC,0.0341,FMC CORP,"FMC Corporation, an agricultural sciences company, provides crop protection, plant health, and professional pest and turf management products."
BSX,0.0348,BOSTON SCIENTIFIC CORP,"Boston Scientific Corporation develops, manufactures, and markets medical devices for use in various interventional medical specialties worldwide. It operates through three segments: MedSurg, Rhythm and Neuro, and Cardiovascular."
DOW,0.0371,DOW INC,"Dow Inc. provides various materials science solutions for consumer care, infrastructure, and packaging markets in the United States, Canada, Europe, the Middle East, Africa, India, the Asia Pacific, and Latin America."
BWA,0.0375,BORGWARNER INC,"BorgWarner Inc. provides solutions for combustion, hybrid, and electric vehicles worldwide."
EQIX,0.0379,EQUINIX INC,"Equinix (Nasdaq: EQIX) is the world's digital infrastructure company, enabling digital leaders to harness a trusted platform to bring together and interconnect the foundational infrastructure that powers their success."
LLY,0.0387,LILLY (ELI) & CO,"Eli Lilly and Company discovers, develops, manufactures, and markets pharmaceutical products worldwide. It offers endocrinology products for diabetes; osteoporosis in postmenopausal women and men; and human growth hormone deficiency and paediatric growth conditions."
WLTW,0.0393,WILLIS TOWERS WATSON PLC,"Willis Towers Watson Public Limited Company operates as an advisory, broking, and solutions company worldwide."
PPG,0.0393,PPG INDUSTRIES INC,"PPG Industries, Inc. manufactures and distributes paints, coatings, and specialty materials worldwide."
GWW,0.0394,GRAINGER (W W) INC,"W.W. Grainger, Inc. distributes maintenance, repair, and operating (MRO) products and services in the United States, Canada, and internationally."
TJX,0.0398,TJX COS INC (THE),"The TJX Companies, Inc. operates as an off-price apparel and home fashions retailer. It operates through four segments: Marmaxx, HomeGoods, TJX Canada, and TJX International."
PCAR,0.0404,PACCAR INC,"PACCAR Inc designs, manufactures, and distributes light, medium, and heavy-duty commercial trucks in the United States, Europe, and internationally. The company operates in three segments: Truck, Parts, and Financial Services."
KEYS,0.0415,KEYSIGHT TECHNOLOGIES INC,"Keysight Technologies, Inc. provides electronic design and test solutions to commercial communications, networking, aerospace, defense and government, automotive, energy, semiconductor, electronic, and education industries in the Americas, Europe, and the Asia Pacific."
VTRS,0.0422,VIATRIS INC,"Viatris Inc., a healthcare company, manufactures and distributes various medicines for patients in the United States and internationally."
T,0.0429,AT&T INC,"AT&T Inc. provides telecommunication, media, and technology services worldwide. The company operates through four segments: Communications, WarnerMedia, Latin America, and Xandr."
LUV,0.0429,SOUTHWEST AIRLINES,Southwest Airlines Co. operates a passenger airline that provides scheduled air transportation services in the United States and near-international markets.
EMR,0.0429,EMERSON ELECTRIC CO,"Emerson Electric Co. designs and manufactures technology and engineering products for industrial, commercial, and consumer markets worldwide. It operates through Automation Solutions and Commercial & Residential Solutions segments."
ACN,0.043,ACCENTURE PLC,"Accenture plc, a professional services company, provides strategy and consulting, interactive, and technology and operations services worldwide. The company also provides outsourcing services."
HON,0.043,HONEYWELL INTERNATIONAL INC,Honeywell International Inc. operates as a diversified technology and manufacturing company worldwide.
ASH,0.045,ASHLAND GLOBAL HOLDINGS INC,"Ashland Global Holdings Inc. provides specialty chemical solutions worldwide. The company's Specialty Ingredients segment offers products, technologies, and resources for solving formulation and product-performance challenges."
ABT,0.0461,ABBOTT LABORATORIES,"Abbott Laboratories discovers, develops, manufactures, and sells health care products worldwide."
DOV,0.0463,DOVER CORP,"Dover Corporation provides equipment and components, consumable supplies, aftermarket parts, software and digital solutions, and support services worldwide."
SRCL,0.0468,STERICYCLE INC,"Stericycle, Inc., together with its subsidiaries, provides regulated and compliance solutions to the healthcare, retail, and commercial businesses in the United States, Europe, and internationally."
PKG,0.0469,PACKAGING CORP OF AMERICA,Packaging Corporation of America manufactures and sells containerboard and corrugated packaging products in the United States. The company operates through Packaging and Paper segments.
TT,0.0472,TRANE TECHNOLOGIES PLC,"Trane Technologies plc provides climate control solutions for buildings, homes, and transportation."
CAG,0.0474,CONAGRA BRANDS INC,"Conagra Brands, Inc., together with its subsidiaries, operates as a consumer packaged goods food company in North America. The company operates through Grocery & Snacks, Refrigerated & Frozen, International, and Foodservice segments."
NCLH,0.0479,NORWEGIAN CRUISE LINE HLDGS,"Norwegian Cruise Line Holdings Ltd., together with its subsidiaries, operates as a cruise company in the North America, Europe, the Asia-Pacific, and internationally. The company operates the Norwegian Cruise Line, Oceania Cruises, and Regent Seven Seas Cruises brands."
TDC,0.048,TERADATA CORP,"Teradata Corporation provides hybrid cloud analytics software. Its solutions and services comprise software, hardware, and related business consulting and support services to deliver analytics in company's analytical ecosystem."
DVA,0.0499,DAVITA INC,DaVita Inc. provides kidney dialysis services for patients suffering from chronic kidney failure or end stage renal disease (ESRD). The company operates kidney dialysis centers and provides related lab services in outpatient dialysis centers.
PH,0.0503,PARKER-HANNIFIN CORP,"Parker-Hannifin Corporation manufactures and sells motion and control technologies and systems for various mobile, industrial, and aerospace markets worldwide. The company operates through two segments, Diversified Industrial and Aerospace Systems."
JBHT,0.0504,HUNT (JB) TRANSPRT SVCS INC,"J.B. Hunt Transport Services, Inc., together with its subsidiaries, provides surface transportation and delivery services in the continental United States, Canada, and Mexico."
ITT,0.0505,ITT INC,"ITT Inc. manufactures and sells engineered critical components and customized technology solutions for the energy, transportation, and industrial markets worldwide. The company operates through three segments: Motion Technologies, Industrial Process, and Connect & Control Technologies."
MDLZ,0.0519,MONDELEZ INTERNATIONAL INC,"Mondelez International, Inc., through its subsidiaries, manufactures, markets, and sells snack food and beverage products worldwide."
BMS,0.0519,BEMIS CO INC,"Bemis Company, Inc. manufactures and sells packaging products in the United States, Brazil, other Americas, Europe, and the Asia-Pacific. It operates through three segments: U.S. Packaging, Latin America Packaging, and Rest of World Packaging."
EMN,0.0525,EASTMAN CHEMICAL CO,Eastman Chemical Company operates as an advanced materials and specialty additives company worldwide.
RE,0.0527,EVEREST RE GROUP LTD,"Everest Re Group, Ltd., through its subsidiaries, provides reinsurance and insurance products in the United States, Bermuda, and internationally. The company operates through four segments: U.S. Reinsurance, International, Bermuda, and Insurance. The U.S."
FLS,0.0536,FLOWSERVE CORP,"Flowserve Corporation designs, develops, manufactures, distributes, and services industrial flow management equipment in the United States, Europe, the Middle East, Africa, Asia, and internationally."
SWK,0.0545,STANLEY BLACK & DECKER INC,"Stanley Black & Decker, Inc. engages in tools and storage, industrial, and security businesses worldwide."
DTE,0.055,DTE ENERGY CO,"DTE Energy Company engages in the utility operations. The company's Electric segment generates, purchases, distributes, and sells electricity to approximately 2.2 million residential, commercial, and industrial customers in southeastern Michigan."
WDC,0.0561,WESTERN DIGITAL CORP,"Western Digital Corporation develops, manufactures, and sells data storage devices and solutions."
BDX,0.0566,BECTON DICKINSON & CO,"Becton, Dickinson and Company develops, manufactures, and sells medical supplies, devices, laboratory equipment, and diagnostic products worldwide."
CB,0.0576,CHUBB LTD,"Chubb Limited, through its subsidiaries, provides insurance and reinsurance products worldwide."
ATO,0.0576,ATMOS ENERGY CORP,"Atmos Energy Corporation, together with its subsidiaries, engages in the regulated natural gas distribution, and pipeline and storage businesses in the United States. It operates through Distribution, and Pipeline and Storage segments."
AJG,0.0581,ARTHUR J GALLAGHER & CO,"Arthur J. Gallagher & Co., together with its subsidiaries, provides insurance brokerage, consulting, and third party claims settlement and administration services in the United States, Australia, Bermuda, Canada, the Caribbean, New Zealand, and the United Kingdom."
RCL,0.0585,ROYAL CARIBBEAN GROUP,"Royal Caribbean Group operates as a cruise company. The company operates cruises under the Royal Caribbean International, Celebrity Cruises, Azamara Club Cruises, and Silversea Cruises brands."
NTAP,0.0618,NETAPP INC,"NetApp, Inc. provides software, systems, and services to manage and share data on-premises, and private and public clouds worldwide."
DLPH,0.0622,DELPHI TECHNOLOGIES PLC,"Delphi Technologies PLC engages in the design, development, and manufacture of integrated powertrain technologies worldwide. The company operates through four segments: Fuel Injection Systems, Powertrain Products, Electrification & Electronics, and Aftermarket."
LNT,0.0637,ALLIANT ENERGY CORP,"Alliant Energy Corporation operates as a utility holding company that provides regulated electricity and natural gas services in the Midwest region of the United States. It operates through three segments: Utility Electric Operations, Utility Gas Operations, and Utility Other."
SBUX,0.064,STARBUCKS CORP,"Starbucks Corporation, together with its subsidiaries, operates as a roaster, marketer, and retailer of specialty coffee worldwide. The company operates through three segments: Americas, International, and Channel Development."
L,0.0645,LOEWS CORP,Loews Corporation provides commercial property and casualty insurance in the United States and internationally.
MMC,0.0653,MARSH & MCLENNAN COS,"Marsh & McLennan Companies, Inc., a professional services company, provides advice and solutions to clients in the areas of risk, strategy, and people worldwide. It operates in two segments, Risk and Insurance Services, and Consulting."
FTV,0.0663,FORTIVE CORP,"Fortive Corporation designs, develops, manufactures, markets, and services professional and engineered products, software, and services worldwide."
MCHP,0.0714,MICROCHIP TECHNOLOGY INC,"Microchip Technology Incorporated develops, manufactures, and sells semiconductor products for various embedded control applications in the Americas, Europe, and Asia."
GT,0.0723,GOODYEAR TIRE & RUBBER CO,"The Goodyear Tire & Rubber Company, together with its subsidiaries, develops, manufactures, distributes, and sells tires and related products and services worldwide."
IFF,0.0746,INTL FLAVORS & FRAGRANCES,"International Flavors & Fragrances Inc., together with its subsidiaries, manufactures flavors and fragrances for use in various consumer products. It operates through two segments, Taste and Scent."
PRGO,0.0751,PERRIGO CO PLC,Perrigo Company plc provides over-the-counter (OTC) health and wellness solutions that enhance individual well-being by empowering consumers to prevent or treat conditions that can be self-managed.
AVGO,0.0767,BROADCOM INC,"Broadcom Inc. designs, develops, and supplies a range of semiconductor devices with a focus on complex digital and mixed signal complementary metal oxide semiconductor based devices and analog III-V based products worldwide."
SJM,0.0795,SMUCKER (JM) CO,"The J. M. Smucker Company manufactures and markets food and beverage products worldwide. It operates in four segments: U.S. Retail Pet Foods, U.S. Retail Coffee, U.S. Retail Consumer Foods, and International and Away From Home."
LVLT,0.0821,LEVEL 3 COMMUNICATIONS INC,"Level 3 Parent, LLC provides various integrated communications services for enterprise, government, wholesale, and small and medium business customers in North America, Latin America, Europe, the Asia Pacific, the Middle East, and Africa."
PYPL,0.0825,PAYPAL HOLDINGS INC,"PayPal Holdings, Inc. operates as a technology platform and digital payments company that enables digital and mobile payments on behalf of consumers and merchants worldwide. Its payment solutions include PayPal, PayPal Credit, Braintree, Venmo, Xoom, and iZettle products."
XRX,0.0847,XEROX HOLDINGS CORP,"Xerox Holdings Corporation designs, develops, and sells document management systems and solutions in the United States, Europe, Canada, and internationally."
UHS,0.0871,UNIVERSAL HEALTH SVCS INC,"Universal Health Services, Inc., through its subsidiaries, owns and operates acute care hospitals, outpatient facilities, and behavioral health care facilities. The company operates through Acute Care Hospital Services, Behavioral Health Care Services, and Other segments."
WAB,0.0926,WABTEC CORP,"Wabtec Corporation provides technology-based equipment, systems, and services for the freight rail and passenger transit vehicle industries worldwide. It operates through two segments, Freight and Transit."
APH,0.0946,AMPHENOL CORP,"Amphenol Corporation, together with its subsidiaries, primarily designs, manufactures, and markets electrical, electronic, and fiber optic connectors in the United States, China, and internationally."
