,dist,conm,busdesc
MDLZ,0.0,MONDELEZ INTERNATIONAL INC,"Mondelez International, Inc., through its subsidiaries, manufactures, markets, and sells snack food and beverage products worldwide."
PEP,0.0022,PEPSICO INC,"PepsiCo, Inc. operates as a food and beverage company worldwide. The company operates through seven segments: FLNA, QFNA, PBNA, LatAm, Europe, AMESA, and APAC."
DHR,0.0026,DANAHER CORP,"Danaher Corporation designs, manufactures, and markets professional, medical, industrial, and commercial products and services worldwide. The company operates through three segments; Life Sciences, Diagnostics, and Environmental & Applied Solutions."
WWY,0.0026,WRIGLEY (WM) JR CO,"Wm. Wrigley Jr. Company produces and distributes confectionary products. The company offers chewing gums, mints, hard and chewy candies, and lollipops. It markets its products in the United States and internationally."
BIO,0.0027,BIO-RAD LABORATORIES INC,"Bio-Rad Laboratories, Inc. develops, manufactures, and markets products and solutions for the life science research and clinical diagnostic markets in Europe, the United States, Canada, and Latin America."
MFE,0.0041,MCAFEE INC,"McAfee LLC develops and delivers security solutions and services that protect systems, networks, and mobile devices for business and personal use in the United States and internationally."
CLF,0.0044,CLEVELAND-CLIFFS INC,"Cleveland-Cliffs Inc. operates as an independent iron ore mining company in the United States, Canada, and internationally. It operates in two segments, Mining and Pelletizing, and Metallics."
COP,0.0047,CONOCOPHILLIPS,"ConocoPhillips explores for, produces, transports, and markets crude oil, bitumen, natural gas, liquefied natural gas (LNG), and natural gas liquids worldwide."
PH,0.0057,PARKER-HANNIFIN CORP,"Parker-Hannifin Corporation manufactures and sells motion and control technologies and systems for various mobile, industrial, and aerospace markets worldwide. The company operates through two segments, Diversified Industrial and Aerospace Systems."
AMT,0.006,AMERICAN TOWER CORP,"American Tower, one of the largest global REITs, is a leading independent owner, operator and developer of multitenant communications real estate with a portfolio of approximately 181,000 communications sites."
NOC,0.0067,NORTHROP GRUMMAN CORP,Northrop Grumman Corporation operates as a security company.
CVX,0.0071,CHEVRON CORP,"Chevron Corporation, through its subsidiaries, engages in integrated energy, chemicals, and petroleum operations worldwide. The company operates in two segments, Upstream and Downstream."
HSIC,0.0075,HENRY SCHEIN INC,"Henry Schein, Inc., a solutions company for health care professionals, provides health care products and services to office-based dental practitioners and laboratories, physician practices, government, institutional health care clinics, and other alternate care clinics worldwide."
CVH,0.0076,COVENTRY HEALTH CARE INC,"As of January 1, 2014, Coventry Health Care, Inc. was acquired by Aetna Inc. Coventry Health Care, Inc. operates as a managed healthcare company in the United States."
TGNA,0.0076,TEGNA INC,TEGNA Inc. operates as a media company in the United States. The company operates television stations and radio stations that deliver television programming and digital content. It offers content and information to consumers across various platforms.
TFX,0.0083,TELEFLEX INC,"Teleflex Incorporated designs, develops, manufactures, and supplies single-use medical devices for common diagnostic and therapeutic procedures in critical care and surgical applications worldwide."
TAP,0.0085,MOLSON COORS BEVERAGE CO,"Molson Coors Beverage Company manufactures, markets, and sells beer and other malt beverage products in the United States, Canada, Europe, and internationally."
SBUX,0.0085,STARBUCKS CORP,"Starbucks Corporation, together with its subsidiaries, operates as a roaster, marketer, and retailer of specialty coffee worldwide. The company operates through three segments: Americas, International, and Channel Development."
HAR,0.0086,HARMAN INTERNATIONAL INDS,"Harman International Industries, Incorporated designs and engineers connected products and solutions for automakers, consumers, and enterprises worldwide. The company operates through four segments: Connected Car, Lifestyle Audio, Professional Solutions, and Connected Services."
MHS,0.0111,MEDCO HEALTH SOLUTIONS INC,"Medco Health Solutions, Inc. is a healthcare company provides clinically-driven pharmacy services for private and public employers, health plans, labor unions and government agencies, and individuals. Medco Health Solutions, Inc. was formerly known as Merck-Medco Managed Care, L.L.C."
MLM,0.013,MARTIN MARIETTA MATERIALS,"Martin Marietta Materials, Inc., a natural resource-based building materials company, supplies aggregates and heavy building materials to the construction industry in the United States and internationally."
VAR,0.013,VARIAN MEDICAL SYSTEMS INC,"Varian Medical Systems, Inc. designs, manufactures, sells, and services medical devices and software products for treating cancer and other medical conditions worldwide. It operates through Oncology Systems and Proton Solutions segments."
FDX,0.0132,FEDEX CORP,"FedEx Corporation provides transportation, e-commerce, and business services worldwide. Its FedEx Express segment offers shipping services for delivery of packages and freight."
DOV,0.0135,DOVER CORP,"Dover Corporation provides equipment and components, consumable supplies, aftermarket parts, software and digital solutions, and support services worldwide."
LHX,0.0142,L3HARRIS TECHNOLOGIES INC,"L3Harris Technologies, Inc., an aerospace and defense technology company, provides mission-critical solutions for government and commercial customers worldwide."
J,0.0142,JACOBS ENGINEERING GROUP INC,"Jacobs Engineering Group Inc. provides consulting, technical, scientific, and project delivery services for the government and private sectors in the United States, Europe, Canada, India, rest of Asia, Australia, New Zealand, South America, Mexico, the Middle East, and Africa."
COST,0.0144,COSTCO WHOLESALE CORP,"Costco Wholesale Corporation, together with its subsidiaries, engages in the operation of membership warehouses in the United States, Puerto Rico, Canada, the United Kingdom, Mexico, Japan, Korea, Australia, Spain, France, Iceland, China, and Taiwan."
FLIR,0.0148,FLIR SYSTEMS INC,"FLIR Systems, Inc. designs, develops, markets, and distributes thermal imaging systems, visible-light imaging systems, locater systems, measurement and diagnostic systems, and threat-detection solutions worldwide."
PHM,0.0148,PULTEGROUP INC,"PulteGroup, Inc., through its subsidiaries, primarily engages in the homebuilding business in the United States. The company acquires and develops land primarily for residential purposes; and constructs housing on such land."
LLY,0.015,LILLY (ELI) & CO,"Eli Lilly and Company discovers, develops, manufactures, and markets pharmaceutical products worldwide. It offers endocrinology products for diabetes; osteoporosis in postmenopausal women and men; and human growth hormone deficiency and paediatric growth conditions."
COG,0.016,CABOT OIL & GAS CORP,"Cabot Oil & Gas Corporation, an independent oil and gas company, explores for, exploits, develops, produces, and markets oil and gas properties in the United States."
HAS,0.0167,HASBRO INC,"Hasbro, Inc., together with its subsidiaries, operates as a play and entertainment company. The company's U.S."
HOG,0.0168,HARLEY-DAVIDSON INC,"Harley-Davidson, Inc. manufactures and sells custom, cruiser, and touring motorcycles. The company operates in two segments, Motorcycles and Related Products and Financial Services."
A,0.0169,AGILENT TECHNOLOGIES INC,"Agilent Technologies, Inc. provides application focused solutions to the life sciences, diagnostics, and applied chemical markets worldwide."
ROP,0.017,ROPER TECHNOLOGIES INC,"Roper Technologies, Inc. designs and develops software, and engineered products and solutions worldwide."
PNR,0.0172,PENTAIR PLC,"Pentair plc provides various smart water solutions worldwide. It operates through three segments: Aquatic Systems, Filtration Solutions, and Flow Technologies."
MCD,0.018,MCDONALD'S CORP,"McDonald's Corporation operates and franchises McDonald's restaurants in the United States and internationally. Its restaurants offer various food products and beverages, as well as breakfast menu. As of December 31, 2019, the company operated 38,695 restaurants."
DGX,0.0182,QUEST DIAGNOSTICS INC,"Quest Diagnostics Incorporated provides diagnostic testing, information, and services in the United States and internationally."
LH,0.0191,LABORATORY CP OF AMER HLDGS,"Laboratory Corporation of America Holdings operates as an independent clinical laboratory company worldwide. It operates in two segments, LabCorp Diagnostics (LCD) and Covance Drug Development."
CDNS,0.0194,CADENCE DESIGN SYSTEMS INC,"Cadence Design Systems, Inc. provides software, hardware, services, and reusable integrated circuit (IC) design blocks worldwide. The company offers functional verification services, including emulation and prototyping hardware."
BMS,0.0194,BEMIS CO INC,"Bemis Company, Inc. manufactures and sells packaging products in the United States, Brazil, other Americas, Europe, and the Asia-Pacific. It operates through three segments: U.S. Packaging, Latin America Packaging, and Rest of World Packaging."
ORCL,0.0194,ORACLE CORP,Oracle Corporation provides products and services that address enterprise information technology environments worldwide.
VLO,0.0207,VALERO ENERGY CORP,"Valero Energy Corporation manufactures and sells transportation fuels and petrochemical products in the United States, Canada, the United Kingdom, Ireland, and internationally. It operates through three segments: Refining, Ethanol, and Renewable Diesel."
BSX,0.0213,BOSTON SCIENTIFIC CORP,"Boston Scientific Corporation develops, manufactures, and markets medical devices for use in various interventional medical specialties worldwide. It operates through three segments: MedSurg, Rhythm and Neuro, and Cardiovascular."
XOM,0.0217,EXXON MOBIL CORP,"Exxon Mobil Corporation explores for and produces crude oil and natural gas in the United States, Canada/other Americas, Europe, Africa, Asia, and Australia/Oceania. It operates through Upstream, Downstream, and Chemical segments."
MAT,0.0221,MATTEL INC,"Mattel, Inc., a children's entertainment company, designs and produces toys and consumer products worldwide. The company operates through North America, International, and American Girl segments."
MRO,0.0224,MARATHON OIL CORP,Marathon Oil Corporation operates as an independent exploration and production company in the United States and Equatorial Guinea.
MJN,0.0227,MEAD JOHNSON NUTRITION CO,"Mead Johnson Nutrition Company manufactures and sells infant formula, children's nutrition, and other nutritional products."
LSI,0.0228,LIFE STORAGE INC,"Life Storage, Inc. is a self-administered and self-managed equity REIT that is in the business of acquiring and managing self-storage facilities. Located in Buffalo, New York, the Company operates more than 900 storage facilities in 30 states and in the province of Ontario, Canada."
SGP,0.023,SCHERING-PLOUGH,"As of November 3, 2009, Schering-Plough Corporation was acquired by Merck & Co. Inc. Schering-Plough Corporation discovers, develops, manufactures, and sells pharmaceuticals worldwide. It operates in three segments: Prescription Pharmaceuticals, Animal Health, and Consumer Health Care."
PCP,0.0237,PRECISION CASTPARTS CORP,"Precision Castparts Corp. manufactures and sells metal components and products to the aerospace, power, and general industrial and other markets worldwide. The company operates through three segments: Investment Cast Products, Forged Products, and Airframe Products."
TWX,0.0237,TIME WARNER INC,"Warner Media operates as a media and entertainment company worldwide. It operates in three segments: Turner, Home Box Office, and Warner Bros. The Turner segment creates and programs branded news, entertainment, sports, and kids multi-platform content for consumers."
DVN,0.0241,DEVON ENERGY CORP,"Devon Energy Corporation, an independent energy company, primarily engages in the exploration, development, and production of oil, natural gas, and natural gas liquids in the United States. It operates approximately 3,955 gross wells."
REG,0.0244,REGENCY CENTERS CORP,"Regency Centers is the preeminent national owner, operator, and developer of shopping centers located in affluent and densely populated trade areas."
VIAC,0.0249,VIACOMCBS INC,"ViacomCBS Inc. operates as a media and entertainment company worldwide. The company operates in four segments: TV Entertainment, Cable Networks, Filmed Entertainment, and Publishing."
IR,0.0258,INGERSOLL RAND INC,"Ingersoll Rand Inc. provides mission-critical flow control and compression equipment; and associated aftermarket parts, consumables, and services in the United States, Europe, the Middle East, Africa, and the Asia Pacific. It operates through three segments: Industrials, Energy, and Medical."
PETM,0.026,PETSMART INC,"PetSmart, Inc., together with its subsidiaries, operates as a specialty retailer of products, services, and solutions for pets in the United States, Puerto Rico, and Canada."
NTAP,0.0278,NETAPP INC,"NetApp, Inc. provides software, systems, and services to manage and share data on-premises, and private and public clouds worldwide."
STX,0.0299,SEAGATE TECHNOLOGY PLC,"Seagate Technology plc provides data storage technology and solutions in Singapore, the United States, the Netherlands, and internationally."
FCX,0.0304,FREEPORT-MCMORAN INC,"Freeport-McMoRan Inc. engages in the mining of mineral properties in North America, South America, and Indonesia. The company primarily explores for copper, gold, molybdenum, silver, and other metals, as well as oil and gas."
S,0.0308,SPRINT CORP,"Sprint Corporation provides a range of wireless and wireline communications products and services to consumers, businesses, government subscribers, and resellers in the United States, Puerto Rico, and the United States Virgin Islands. It operates in two segments, Wireless and Wireline."
RDC,0.031,ROWAN COMPANIES LTD,"Rowan Companies Limited provides offshore contract drilling services to the oil and gas industry. It operates through three segments: Deepwater, Jack-ups, and ARO. The Deepwater segment operates 4 ultra-deepwater drillships. The Jack-ups segment operates 15 self-elevating jack-up rigs."
MUR,0.0313,MURPHY OIL CORP,"Murphy Oil Corporation operates as an oil and natural gas exploration and production company in the United States, Canada, and internationally. It explores for and produces crude oil, natural gas, and natural gas liquids."
SLG,0.0327,SL GREEN REALTY CORP,"SL Green Realty Corp., an S&P 500 company and Manhattan's largest office landlord, is a fully integrated real estate investment trust, or REIT, that is focused primarily on acquiring, managing and maximizing value of Manhattan commercial properties."
SNI,0.0334,SCRIPPS NETWORKS INTERACTIVE,"Scripps Networks Interactive, Inc. develops lifestyle-oriented content in the United States, the United Kingdom and other European markets, the Middle East and Africa, the Asia-Pacific, and Latin America."
PM,0.0337,PHILIP MORRIS INTERNATIONAL,"Philip Morris International Inc., through its subsidiaries, manufactures and sells cigarettes, other nicotine-containing products, smoke-free products, and related electronic devices and accessories."
LEG,0.0345,LEGGETT & PLATT INC,"Leggett & Platt, Incorporated designs and produces various engineered components and products worldwide. It operates through three segments: Bedding Products; Furniture, Flooring & Textile Products; and Specialized Products."
APA,0.0349,APACHE CORP,"Apache Corporation, an independent energy company, explores for, develops, and produces natural gas, crude oil, and natural gas liquids (NGLs)."
ALGN,0.0387,ALIGN TECHNOLOGY INC,"Align Technology, Inc., a medical device company, designs, manufactures, and markets Invisalign clear aligners and iTero intraoral scanners and services for orthodontists and general practitioner dentists, and restorative and aesthetic dentistry."
ACAS,0.0395,AMERICAN CAPITAL LTD,"American Capital, Ltd. is a business development company specializing in management and employee buyouts, subordinated debt, leveraged finance, mezzanine, acquisition, recapitalization, middle market, early venture, mature, industry consolidation, and growth capital investments."
VRTX,0.0859,VERTEX PHARMACEUTICALS INC,Vertex Pharmaceuticals Incorporated engages in developing and commercializing therapies for treating cystic fibrosis.
