,dist,conm,busdesc
MDLZ,0.0,MONDELEZ INTERNATIONAL INC,"Mondelez International, Inc., through its subsidiaries, manufactures, markets, and sells snack food and beverage products worldwide."
DIS,0.0006,DISNEY (WALT) CO,"The Walt Disney Company, together with its subsidiaries, operates as an entertainment company worldwide."
NBR,0.0007,NABORS INDUSTRIES LTD,"Nabors Industries Ltd. provides drilling and drilling-related services for land-based and offshore oil and natural gas wells. It operates through five segments: U.S. Drilling, Canada Drilling, International Drilling, Drilling Solutions, and Rig Technologies."
LLL,0.0011,L3 TECHNOLOGIES INC,"L3 Technologies, Inc. provides aircraft sustainment, simulation and training, night vision and image intensification equipment, and security and detection systems used on military, homeland security, and commercial platforms in the United States and internationally."
ABT,0.0014,ABBOTT LABORATORIES,"Abbott Laboratories discovers, develops, manufactures, and sells health care products worldwide."
NOV,0.0014,NATIONAL OILWELL VARCO INC,"National Oilwell Varco, Inc. designs, constructs, manufactures, and sells systems, components, and products for oil and gas drilling and production worldwide. It operates through three segments: Wellbore Technologies, Completion & Production Solutions, and Rig Technologies."
NOC,0.0019,NORTHROP GRUMMAN CORP,Northrop Grumman Corporation operates as a security company.
MAT,0.0025,MATTEL INC,"Mattel, Inc., a children's entertainment company, designs and produces toys and consumer products worldwide. The company operates through North America, International, and American Girl segments."
ANF,0.0025,ABERCROMBIE & FITCH  -CL A,"Abercrombie & Fitch Co., through its subsidiaries, operates as a specialty retailer. The company operates in two segments, Hollister and Abercrombie."
UPS,0.0031,UNITED PARCEL SERVICE INC,"United Parcel Service, Inc. provides letter and package delivery, specialized transportation, logistics, and financial services. It operates through three segments: U.S. Domestic Package, International Package, and Supply Chain & Freight. The U.S."
TT,0.0033,TRANE TECHNOLOGIES PLC,"Trane Technologies plc provides climate control solutions for buildings, homes, and transportation."
SNA,0.0046,SNAP-ON INC,"Snap-on Incorporated manufactures and markets tools, equipment, diagnostics, and repair information and systems solutions for professional users worldwide."
REG,0.0057,REGENCY CENTERS CORP,"Regency Centers is the preeminent national owner, operator, and developer of shopping centers located in affluent and densely populated trade areas."
PEAK,0.006,HEALTHPEAK PROPERTIES INC,"Healthpeak Properties, Inc. is a fully integrated real estate investment trust (REIT) and S&P 500 company."
LXK,0.006,LEXMARK INTL INC  -CL A,"Lexmark International, Inc., together with its subsidiaries, operates as a developer, manufacturer, and supplier of printing, imaging, device management, and document workflow solutions."
HPQ,0.006,HP INC,"HP Inc., together with its subsidiaries, provides personal computing and other access devices, imaging and printing products, and related technologies, solutions, and services in the United States and internationally."
FLIR,0.0066,FLIR SYSTEMS INC,"FLIR Systems, Inc. designs, develops, markets, and distributes thermal imaging systems, visible-light imaging systems, locater systems, measurement and diagnostic systems, and threat-detection solutions worldwide."
BSX,0.0069,BOSTON SCIENTIFIC CORP,"Boston Scientific Corporation develops, manufactures, and markets medical devices for use in various interventional medical specialties worldwide. It operates through three segments: MedSurg, Rhythm and Neuro, and Cardiovascular."
HAS,0.007,HASBRO INC,"Hasbro, Inc., together with its subsidiaries, operates as a play and entertainment company. The company's U.S."
HFC,0.0073,HOLLYFRONTIER CORP,"HollyFrontier Corporation operates as an independent petroleum refiner in the United States. The company operates through three segments: Refining, Lubricants and Specialty Products, and HEP."
KIM,0.0078,KIMCO REALTY CORP,"Kimco Realty Corp. (NYSE:KIM) is a real estate investment trust (REIT) headquartered in Jericho, N.Y. that is one of North America's largest publicly traded owners and operators of open-air, grocery-anchored shopping centers and mixed-use assets."
ASN,0.0078,,
PCP,0.0081,PRECISION CASTPARTS CORP,"Precision Castparts Corp. manufactures and sells metal components and products to the aerospace, power, and general industrial and other markets worldwide. The company operates through three segments: Investment Cast Products, Forged Products, and Airframe Products."
GPS,0.0081,GAP INC,"The Gap, Inc. operates as an apparel retail company worldwide. The company offers apparel, accessories, and personal care products for men, women, and children under the Old Navy, Gap, Banana Republic, Athleta, Intermix, Janie and Jack, and Hill City brands."
VFC,0.0084,VF CORP,"V.F. Corporation engages in the design, production, procurement, marketing, and distribution of branded lifestyle apparel, footwear, and related products for men, women, and children in the Americas, Europe, and the Asia-Pacific. It operates through four segments: Outdoor, Active, and Work."
AMD,0.0085,ADVANCED MICRO DEVICES,"Advanced Micro Devices, Inc. operates as a semiconductor company worldwide. The company operates in two segments, Computing and Graphics; and Enterprise, Embedded and Semi-Custom."
AN,0.0094,AUTONATION INC,"AutoNation, Inc., through its subsidiaries, operates as an automotive retailer in the United States. The company operates through three segments: Domestic, Import, and Premium Luxury."
EOG,0.0095,EOG RESOURCES INC,"EOG Resources, Inc., together with its subsidiaries, explores for, develops, produces, and markets crude oil, and natural gas and natural gas liquids."
ANTM,0.0097,ANTHEM INC,"Anthem, Inc., through its subsidiaries, operates as a health benefits company in the United States. It operates through three segments: Commercial & Specialty Business, Government Business, and Other."
MLM,0.0097,MARTIN MARIETTA MATERIALS,"Martin Marietta Materials, Inc., a natural resource-based building materials company, supplies aggregates and heavy building materials to the construction industry in the United States and internationally."
KO,0.0098,COCA-COLA CO,"The Coca-Cola Company, a beverage company, manufactures, markets, and sells various nonalcoholic beverages worldwide. The company provides sparkling soft drinks; water, enhanced water, and sports drinks; juice, dairy, and plant-based beverages; tea and coffee; and energy drinks."
MWW,0.0099,MONSTER WORLDWIDE INC,"Monster Worldwide, Inc., together with its subsidiaries, provides online and mobile employment and recruitment solutions worldwide. The company operates in three segments: Careers-North America, Careers-International, and Internet Advertising & Fees."
OXY,0.0099,OCCIDENTAL PETROLEUM CORP,"Occidental Petroleum Corporation, together with its subsidiaries, engages in the acquisition, exploration, and development of oil and gas properties in the United States, the Middle East, and Latin America."
SPGI,0.0101,S&P GLOBAL INC,"S&P Global Inc., together with its subsidiaries, provides ratings, benchmarks, analytics, and data to the capital and commodity markets worldwide."
COST,0.0103,COSTCO WHOLESALE CORP,"Costco Wholesale Corporation, together with its subsidiaries, engages in the operation of membership warehouses in the United States, Puerto Rico, Canada, the United Kingdom, Mexico, Japan, Korea, Australia, Spain, France, Iceland, China, and Taiwan."
A,0.0108,AGILENT TECHNOLOGIES INC,"Agilent Technologies, Inc. provides application focused solutions to the life sciences, diagnostics, and applied chemical markets worldwide."
MCD,0.0112,MCDONALD'S CORP,"McDonald's Corporation operates and franchises McDonald's restaurants in the United States and internationally. Its restaurants offer various food products and beverages, as well as breakfast menu. As of December 31, 2019, the company operated 38,695 restaurants."
J,0.0115,JACOBS ENGINEERING GROUP INC,"Jacobs Engineering Group Inc. provides consulting, technical, scientific, and project delivery services for the government and private sectors in the United States, Europe, Canada, India, rest of Asia, Australia, New Zealand, South America, Mexico, the Middle East, and Africa."
LUV,0.0122,SOUTHWEST AIRLINES,Southwest Airlines Co. operates a passenger airline that provides scheduled air transportation services in the United States and near-international markets.
CVX,0.0123,CHEVRON CORP,"Chevron Corporation, through its subsidiaries, engages in integrated energy, chemicals, and petroleum operations worldwide. The company operates in two segments, Upstream and Downstream."
MTD,0.0123,METTLER-TOLEDO INTL INC,"Mettler-Toledo International Inc. manufactures and supplies precision instruments and services worldwide. It operates in five segments: U.S. Operations, Swiss Operations, Western European Operations, Chinese Operations, and Other."
PCL,0.0128,PLUM CREEK TIMBER CO INC,"As on February 19, 2016, Plum Creek Timber Co. Inc. was acquired by Weyerhaeuser Co. Plum Creek Timber Company, Inc. is a privately owned real estate investment trust (REIT). The trust owns and manages timberlands in the United States."
DRE,0.0136,DUKE REALTY CORP,Duke Realty Corporation owns and operates approximately 156 million rentable square feet of industrial assets in 20 major logistics markets. Duke Realty Corporation is publicly traded on the NYSE under the symbol DRE and is a member of the S&P 500 Index.
MUR,0.0141,MURPHY OIL CORP,"Murphy Oil Corporation operates as an oil and natural gas exploration and production company in the United States, Canada, and internationally. It explores for and produces crude oil, natural gas, and natural gas liquids."
MMM,0.0144,3M CO,"3M Company develops, manufactures, and markets various products worldwide. It operates through four business segments: Safety and Industrial, Transportation and Electronics, Health Care, and Consumer."
CNC,0.015,CENTENE CORP,Centene Corporation operates as a multi-national healthcare enterprise that provides programs and services to under-insured and uninsured individuals in the United States.
DXC,0.0152,DXC TECHNOLOGY CO,"DXC Technology Company, together with its subsidiaries, provides information technology services and solutions primarily in North America, Europe, Asia, and Australia. It operates in two segments, Global Business Services (GBS) and Global Infrastructure Services (GIS)."
VNO,0.0162,VORNADO REALTY TRUST,Vornado's portfolio is concentrated in the nation's key market - New York City - along with the premier asset in both Chicago and San Francisco. Vornado is also the real estate industry leader in sustainability policy.
PEP,0.0163,PEPSICO INC,"PepsiCo, Inc. operates as a food and beverage company worldwide. The company operates through seven segments: FLNA, QFNA, PBNA, LatAm, Europe, AMESA, and APAC."
XRAY,0.0173,DENTSPLY SIRONA INC,"DENTSPLY SIRONA Inc. designs, develops, manufactures, and markets various dental products and technologies, and other consumable dental products and equipment primarily for the professional dental market worldwide. The company operates in two segments, Technologies & Equipment; and Consumables."
NLSN,0.0176,NIELSEN HOLDINGS PLC,"Nielsen Holdings plc, together with its subsidiaries, operates as a measurement and data analytics company worldwide. It operates in two segments, Connect and Media."
CF,0.0182,CF INDUSTRIES HOLDINGS INC,"CF Industries Holdings, Inc. manufactures and distributes nitrogen fertilizers and other nitrogen products worldwide. Its principal nitrogen fertilizer products include anhydrous ammonia, granular urea, urea ammonium nitrate solution, and ammonium nitrate."
SLG,0.0184,SL GREEN REALTY CORP,"SL Green Realty Corp., an S&P 500 company and Manhattan's largest office landlord, is a fully integrated real estate investment trust, or REIT, that is focused primarily on acquiring, managing and maximizing value of Manhattan commercial properties."
CVH,0.019,COVENTRY HEALTH CARE INC,"As of January 1, 2014, Coventry Health Care, Inc. was acquired by Aetna Inc. Coventry Health Care, Inc. operates as a managed healthcare company in the United States."
CVS,0.0193,CVS HEALTH CORP,CVS Health Corporation provides health services and plans in the United States.
CCI,0.0201,CROWN CASTLE INTL CORP,"Crown Castle owns, operates and leases more than 40,000 cell towers and approximately 80,000 route miles of fiber supporting small cells and fiber solutions across every major U.S. market."
CAM,0.0223,CAMERON INTERNATIONAL CORP,"Cameron International Corporation provides flow equipment products, systems, and services worldwide."
IVZ,0.0226,INVESCO LTD,Invesco Ltd. is a publicly owned investment manager.
TYC,0.0229,TYCO INTERNATIONAL PLC,"As of September 2, 2016, Tyco International plc was acquired by Johnson Controls International plc. Tyco International plc provides security products and services, fire detection and suppression products and services, and life safety products worldwide."
PH,0.0231,PARKER-HANNIFIN CORP,"Parker-Hannifin Corporation manufactures and sells motion and control technologies and systems for various mobile, industrial, and aerospace markets worldwide. The company operates through two segments, Diversified Industrial and Aerospace Systems."
CRM,0.0234,SALESFORCE.COM INC,"salesforce.com, inc. develops enterprise cloud computing solutions with a focus on customer relationship management worldwide."
ODP,0.0235,ODP CORP,"The ODP Corporation provides business services and supplies, products, and technology solutions for small, medium, and enterprise businesses. The company operates in three divisions: Business Solutions, Retail, and CompuCom."
SGP,0.025,SCHERING-PLOUGH,"As of November 3, 2009, Schering-Plough Corporation was acquired by Merck & Co. Inc. Schering-Plough Corporation discovers, develops, manufactures, and sells pharmaceuticals worldwide. It operates in three segments: Prescription Pharmaceuticals, Animal Health, and Consumer Health Care."
AVB,0.025,AVALONBAY COMMUNITIES INC,"As of September 30, 2020, the Company owned or held a direct or indirect ownership interest in 294 apartment communities containing 86,676 apartment homes in 11 states and the District of Columbia, of which 19 communities were under development and one community was under redevelopment."
WELL,0.0254,WELLTOWER INC,"Welltower Inc. (NYSE:WELL), an S&P 500 company headquartered in Toledo, Ohio, is driving the transformation of health care infrastructure."
VAR,0.0254,VARIAN MEDICAL SYSTEMS INC,"Varian Medical Systems, Inc. designs, manufactures, sells, and services medical devices and software products for treating cancer and other medical conditions worldwide. It operates through Oncology Systems and Proton Solutions segments."
JEF,0.0255,JEFFERIES FINANCIAL GRP INC,"Jefferies Financial Group Inc., a diversified financial services company, engages in investment banking and capital markets, asset management, and direct investing businesses in the Americas, Europe, the Middle East, Africa, and Asia."
MAR,0.0277,MARRIOTT INTL INC,"Marriott International, Inc. operates, franchises, and licenses hotel, residential, and timeshare properties worldwide. The company operates through North American Full-Service, North American Limited-Service, and Asia Pacific segments."
COP,0.0279,CONOCOPHILLIPS,"ConocoPhillips explores for, produces, transports, and markets crude oil, bitumen, natural gas, liquefied natural gas (LNG), and natural gas liquids worldwide."
BMS,0.0281,BEMIS CO INC,"Bemis Company, Inc. manufactures and sells packaging products in the United States, Brazil, other Americas, Europe, and the Asia-Pacific. It operates through three segments: U.S. Packaging, Latin America Packaging, and Rest of World Packaging."
EL,0.0282,LAUDER (ESTEE) COS INC -CL A,"The Estee Lauder Companies Inc. manufactures and markets skin care, makeup, fragrance, and hair care products worldwide."
ROP,0.0291,ROPER TECHNOLOGIES INC,"Roper Technologies, Inc. designs and develops software, and engineered products and solutions worldwide."
STX,0.0294,SEAGATE TECHNOLOGY PLC,"Seagate Technology plc provides data storage technology and solutions in Singapore, the United States, the Netherlands, and internationally."
FDX,0.0301,FEDEX CORP,"FedEx Corporation provides transportation, e-commerce, and business services worldwide. Its FedEx Express segment offers shipping services for delivery of packages and freight."
APA,0.0305,APACHE CORP,"Apache Corporation, an independent energy company, explores for, develops, and produces natural gas, crude oil, and natural gas liquids (NGLs)."
