,dist,conm,busdesc
GLW,0.0,CORNING INC,"Corning Incorporated engages in display technologies, optical communications, environmental technologies, specialty materials, and life sciences businesses worldwide."
GRMN,0.0155,GARMIN LTD,"Garmin Ltd. designs, develops, manufactures, markets, and distributes a range of navigation, communication, and information devices worldwide. It operates through five segments: Auto, Aviation, Marine, Outdoor, and Fitness."
EW,0.0245,EDWARDS LIFESCIENCES CORP,"Edwards Lifesciences Corporation provides products and technologies for structural heart disease, and critical care and surgical monitoring in the United States and internationally."
RMD,0.0254,RESMED INC,"ResMed Inc. develops, manufactures, distributes, and markets medical devices and cloud-based software applications that diagnose, treat, and manage respiratory disorders comprising sleep apnea, chronic obstructive pulmonary disease, neuromuscular disease, and other chronic diseases."
ALGN,0.0259,ALIGN TECHNOLOGY INC,"Align Technology, Inc., a medical device company, designs, manufactures, and markets Invisalign clear aligners and iTero intraoral scanners and services for orthodontists and general practitioner dentists, and restorative and aesthetic dentistry."
LRCX,0.0293,LAM RESEARCH CORP,"Lam Research Corporation designs, manufactures, markets, refurbishes, and services semiconductor processing equipment used in the fabrication of integrated circuits worldwide."
QLGC,0.0294,QLOGIC CORP,"QLogic Corporation and its subsidiaries design and supply high performance server and storage networking connectivity products that provide, enhance, and manage computer data communication."
JNPR,0.0331,JUNIPER NETWORKS INC,"Juniper Networks, Inc. designs, develops, and sells network products and services worldwide."
CERN,0.0339,CERNER CORP,"Cerner Corporation, together with its subsidiaries, provides health care information technology solutions and tech-enabled services in the United States and internationally."
PCP,0.0353,PRECISION CASTPARTS CORP,"Precision Castparts Corp. manufactures and sells metal components and products to the aerospace, power, and general industrial and other markets worldwide. The company operates through three segments: Investment Cast Products, Forged Products, and Airframe Products."
FFIV,0.0357,F5 NETWORKS INC,"F5 Networks, Inc. provides multi-cloud application services for the security, performance, and availability of network applications, servers, and storage systems."
AVGO,0.0367,BROADCOM INC,"Broadcom Inc. designs, develops, and supplies a range of semiconductor devices with a focus on complex digital and mixed signal complementary metal oxide semiconductor based devices and analog III-V based products worldwide."
CTSH,0.0369,COGNIZANT TECH SOLUTIONS,"Cognizant Technology Solutions Corporation, a professional services company, provides consulting and technology, and outsourcing services in North America, Europe, and internationally."
EBAY,0.0385,EBAY INC,eBay Inc. operates the marketplace and classifieds platforms that connect buyers and sellers worldwide.
ATVI,0.0394,ACTIVISION BLIZZARD INC,"Activision Blizzard, Inc., together with its subsidiaries, develops and distributes content and services on video game consoles, personal computers (PC), and mobile devices in the Americas, Europe, the Middle East, Africa, and the Asia Pacific."
MNST,0.0403,MONSTER BEVERAGE CORP,"Monster Beverage Corporation, through its subsidiaries, develops, markets, sells, and distributes energy drink beverages and concentrates in the United States and internationally. It operates through three segments: Monster Energy Drinks, Strategic Brands, and Other."
FOSL,0.0408,FOSSIL GROUP INC,"Fossil Group, Inc., together with its subsidiaries, designs, develops, markets, and distributes consumer fashion accessories in the United States, Europe, Asia, and internationally."
IPGP,0.041,IPG PHOTONICS CORP,"IPG Photonics Corporation develops and manufactures a range of high-performance fiber lasers, fiber amplifiers, and diode lasers used in various applications primarily in materials processing worldwide."
MOS,0.0413,MOSAIC CO,"The Mosaic Company, through its subsidiaries, produces and markets concentrated phosphate and potash crop nutrients in North America and internationally. The company operates through three segments: Phosphates, Potash, and Mosaic Fertilizantes."
TSS,0.0422,TOTAL SYSTEM SERVICES INC,"As of September 17, 2019, Total System Services, Inc. was acquired by Global Payments Inc. Total System Services, Inc. provides payment processing, merchant, and related payment services to financial and nonfinancial institutions worldwide."
URBN,0.0427,URBAN OUTFITTERS INC,"Urban Outfitters, Inc. engages in the retail and wholesale of general consumer products. The company operates through three segments: Retail, wholesale, and Subscription."
NOV,0.0472,NATIONAL OILWELL VARCO INC,"National Oilwell Varco, Inc. designs, constructs, manufactures, and sells systems, components, and products for oil and gas drilling and production worldwide. It operates through three segments: Wellbore Technologies, Completion & Production Solutions, and Rig Technologies."
BRCM,0.05,BROADCOM CORP,"Broadcom Corporation provides semiconductor solutions for wired and wireless communications. Its products offer voice, video, data, and multimedia connectivity in the home, office, and mobile environments."
MXIM,0.0536,MAXIM INTEGRATED PRODUCTS,"Maxim Integrated Products, Inc. designs, develops, manufactures, and markets a range of linear and mixed-signal integrated circuits in the United States, China, rest of Asia, Europe, and internationally."
KRFT,0.055,KRAFT FOODS GROUP INC,"As of July 2, 2015, Kraft Foods Group, Inc was acquired by The Kraft Heinz Company. Kraft Foods Group, Inc. operates as a consumer packaged food and beverage company. It operates through six segments: Cheese, Refrigerated Meals, Beverages, Meals & Desserts, Enhancers & Snack Nuts, and Canada."
CMG,0.06,CHIPOTLE MEXICAN GRILL INC,"Chipotle Mexican Grill, Inc., together with its subsidiaries, operates Chipotle Mexican Grill restaurants. As of September 30, 2020, it operated approximately 2,700 restaurants in the United States, Canada, the United Kingdom, France, and Germany."
FLIR,0.0601,FLIR SYSTEMS INC,"FLIR Systems, Inc. designs, develops, markets, and distributes thermal imaging systems, visible-light imaging systems, locater systems, measurement and diagnostic systems, and threat-detection solutions worldwide."
CTXS,0.0611,CITRIX SYSTEMS INC,"Citrix Systems, Inc. provides workspace, networking, and professional services worldwide."
MU,0.0631,MICRON TECHNOLOGY INC,"Micron Technology, Inc. designs, manufactures, and sells memory and storage products worldwide. The company operates through four segments: Compute and Networking Business Unit, Mobile Business Unit, Storage Business Unit, and Embedded Business Unit."
ZBH,0.0636,ZIMMER BIOMET HOLDINGS INC,"Zimmer Biomet Holdings, Inc., together with its subsidiaries, designs, manufactures, and markets musculoskeletal healthcare products and solutions in the Americas, Europe, the Middle East, Africa, and the Asia Pacific."
AMAT,0.0638,APPLIED MATERIALS INC,"Applied Materials, Inc. provides manufacturing equipment, services, and software to the semiconductor, display, and related industries. It operates through three segments: Semiconductor Systems, Applied Global Services, and Display and Adjacent Markets."
SWKS,0.0655,SKYWORKS SOLUTIONS INC,"Skyworks Solutions, Inc., together with its subsidiaries, designs, develops, manufactures, and markets proprietary semiconductor products, including intellectual property in the United States, China, South Korea, Taiwan, Europe, the Middle East, Africa, and rest of Asia-Pacific."
HP,0.0666,HELMERICH & PAYNE,"Helmerich & Payne, Inc., together with its subsidiaries, provides drilling services and solutions for exploration and production companies. The company operates through three segments: North America Solutions, Offshore Gulf of Mexico, and International Solutions."
PMCS,0.0669,PMC-SIERRA INC,"Microsemi Storage Solutions, Inc. designs, develops, markets, and supports semiconductor solutions for communications network infrastructure equipment worldwide. Its semiconductor devices enable networking equipment primarily in three markets, including storage, optical, and mobile networks."
FSLR,0.0686,FIRST SOLAR INC,"First Solar, Inc. provides photovoltaic (PV) solar energy solutions in the United States and internationally. It operates in two segments, Modules and Systems."
ILMN,0.0703,ILLUMINA INC,"Illumina, Inc. provides sequencing and array-based solutions for genetic and genomic analysis."
SYK,0.0704,STRYKER CORP,"Stryker Corporation operates as a medical technology company. The company operates through three segments: Orthopaedics, MedSurg, and Neurotechnology and Spine. The Orthopaedics segment provides implants for use in hip and knee joint replacements, and trauma and extremities surgeries."
SIAL,0.0735,SIGMA-ALDRICH CORP,"Sigma-Aldrich Corporation, a life science and high technology company, develops, manufactures, purchases, and distributes various chemicals, biochemicals, and equipment products worldwide."
COO,0.0752,COOPER COS INC (THE),"The Cooper Companies, Inc. operates as a medical device company worldwide. It operates through CooperVision and CooperSurgical business units."
BBBY,0.0785,BED BATH & BEYOND INC,"Bed Bath & Beyond Inc., together with its subsidiaries, operates a chain of retail stores."
ALXN,0.079,ALEXION PHARMACEUTICALS INC,"Alexion Pharmaceuticals, Inc. develops and commercializes various therapeutic products."
ZBRA,0.0801,ZEBRA TECHNOLOGIES CP  -CL A,"Zebra Technologies Corporation, together with its subsidiaries, provides enterprise asset intelligence solutions in the automatic identification and data capture solutions industry worldwide."
TXN,0.0807,TEXAS INSTRUMENTS INC,"Texas Instruments Incorporated designs, manufactures, and sells semiconductors to electronics designers and manufacturers worldwide. It operates in two segments, Analog and Embedded Processing."
FAST,0.0809,FASTENAL CO,"Fastenal Company, together with its subsidiaries, engages in the wholesale distribution of industrial and construction supplies in the United States, Canada, Mexico, North America, and internationally."
QCOM,0.0813,QUALCOMM INC,"QUALCOMM Incorporated engages in the development and commercialization of foundational technologies and products are used in mobile devices and other wireless products, including network equipment, broadband gateway equipment, consumer electronic devices, and other connected devices worldwide."
LM,0.0828,LEGG MASON INC,"Legg Mason, Inc. is a publicly owned asset management holding company."
BKNG,0.0842,BOOKING HOLDINGS INC,Booking Holdings Inc. provides travel and restaurant online reservation and related services worldwide.
ADBE,0.0897,ADOBE INC,"Adobe Inc. operates as a diversified software company worldwide. Its Digital Media segment provides tools and solutions that enable individuals, teams, and enterprises to create, publish, promote, and monetize their digital content."
XYL,0.09,XYLEM INC,"Xylem Inc. engages in the design, manufacture, and servicing of engineered products and solutions for the water and wastewater applications in the United States, Europe, the Asia Pacific, and internationally."
ADI,0.0916,ANALOG DEVICES,"Analog Devices, Inc. designs, manufactures, tests, and markets integrated circuits (ICs), software, and subsystems that leverage analog, mixed-signal, and digital signal processing technologies."
TMO,0.0923,THERMO FISHER SCIENTIFIC INC,"Thermo Fisher Scientific Inc. provides analytical and other instruments, laboratory equipment, software, consumables, reagents, instrument systems, chemicals, supplies, and services worldwide."
BEN,0.0949,FRANKLIN RESOURCES INC,"Franklin Resources, Inc. is a publicly owned asset management holding company. Through its subsidiaries, the firm provides its services to individuals, institutions, pension plans, trusts, and partnerships."
TLAB,0.0957,TELLABS INC,"Tellabs Inc. designs, develops, and supports telecommunication networking products for communication service providers in the United States and internationally. The company operates through four segments: Optical, Data, Access, and Services."
NVR,0.106,NVR INC,"NVR, Inc. operates as a homebuilder in the United States. The company operates in two segments, Homebuilding and Mortgage Banking. It primarily constructs and sells single-family detached homes, townhomes, and condominium buildings under the Ryan Homes, NVHomes, and Heartland Homes names."
AKAM,0.1079,AKAMAI TECHNOLOGIES INC,"Akamai Technologies, Inc. provides cloud services for delivering, optimizing, and securing content and business applications over the Internet in the United States and internationally."
GOOGL,0.1112,ALPHABET INC,"Alphabet Inc. provides online advertising services in the United States, Europe, the Middle East, Africa, the Asia-Pacific, Canada, and Latin America. It offers performance and brand advertising services. The company operates through Google and Other Bets segments."
INTC,0.1172,INTEL CORP,"Intel Corporation designs, manufactures, and sells essential technologies for the cloud, smart, and connected devices worldwide. The company operates through DCG, IOTG, Mobileye, NSG, PSG, CCG, and All Other segments."
MKTX,0.1312,MARKETAXESS HOLDINGS INC,"MarketAxess Holdings Inc., together with its subsidiaries, operates an electronic trading platform that enables fixed-income market participants to trade corporate bonds and other types of fixed-income instruments worldwide."
JEF,0.1321,JEFFERIES FINANCIAL GRP INC,"Jefferies Financial Group Inc., a diversified financial services company, engages in investment banking and capital markets, asset management, and direct investing businesses in the Americas, Europe, the Middle East, Africa, and Asia."
ISRG,0.1462,INTUITIVE SURGICAL INC,"Intuitive Surgical, Inc., together with its subsidiaries, designs, manufactures, and markets da Vinci surgical systems, and related instruments and accessories in the United States and internationally."
TROW,0.1825,PRICE (T. ROWE) GROUP,"T. Rowe Price Group, Inc. is a publicly owned investment manager. The firm provides its services to individuals, institutional investors, retirement plans, financial intermediaries, and institutions. It launches and manages equity and fixed income mutual funds."
PSA,0.1929,PUBLIC STORAGE,"Public Storage, a member of the S&P 500 and FT Global 500, is a REIT that primarily acquires, develops, owns and operates self-storage facilities."
