,dist,conm,busdesc
SANM,0.0,SANMINA CORP,"Sanmina Corporation provides integrated manufacturing solutions, components, products and repair, logistics, and after-market services worldwide. It operates in two segments, Integrated Manufacturing Solutions; and Components, Products and Services."
NCR,0.0102,NCR CORP,"NCR Corporation provides software and services worldwide. The company operates through Banking, Retail, Hospitality, and Other segments."
TXT,0.0153,TEXTRON INC,"Textron Inc. operates in the aircraft, defense, industrial, and finance businesses worldwide."
ABC,0.0163,AMERISOURCEBERGEN CORP,AmerisourceBergen Corporation sources and distributes pharmaceutical products in the United States and internationally.
KR,0.0191,KROGER CO,"The Kroger Co. operates as a retailer in the United States. The company operates supermarkets, multi-department stores, marketplace stores, and price impact warehouse stores."
MAS,0.0192,MASCO CORP,"Masco Corporation designs, manufactures, and distributes home improvement and building products in North America, Europe, and internationally. The company operates through two segments, Plumbing Products and Decorative Architectural Products."
R,0.0193,RYDER SYSTEM INC,"Ryder System, Inc. provides transportation and supply chain management solutions worldwide. The company operates through three segments: Fleet Management Solutions (FMS), Supply Chain Solutions (SCS), and Dedicated Transportation Solutions (DTS)."
DELL,0.0231,DELL TECHNOLOGIES INC,"Dell Technologies Inc. designs, develops, manufactures, markets, sells, and support IT hardware, software, and services solutions worldwide. It operates through three segments: Infrastructure Solutions Group (ISG), Client Solutions Group (CSG), and VMware."
MHS,0.0243,MEDCO HEALTH SOLUTIONS INC,"Medco Health Solutions, Inc. is a healthcare company provides clinically-driven pharmacy services for private and public employers, health plans, labor unions and government agencies, and individuals. Medco Health Solutions, Inc. was formerly known as Merck-Medco Managed Care, L.L.C."
TIN,0.0259,TEMPLE-INLAND INC,"Temple-Inland LLC went out of business. Temple-Inland LLC, through its subsidiaries, manufactures and sells corrugated packaging and building products in the United States and Mexico."
MCK,0.0274,MCKESSON CORP,"McKesson Corporation provides pharmaceuticals and medical supplies in the United States and internationally. It operates through four segments: U.S. Pharmaceutical, Prescription Technology Solutions, International, and Medical-Surgical Solutions. The U.S."
MGM,0.0275,MGM RESORTS INTERNATIONAL,"MGM Resorts International, through its subsidiaries, owns and operates integrated casino, hotel, and entertainment resorts in the United States and Macau. The company operates through three segments: Las Vegas Strip Resorts, Regional Operations, and MGM China."
OMX,0.0291,OFFICEMAX INC,"OfficeMax Incorporated, together with its subsidiaries, distributes business-to-business and retail office products."
KBH,0.0318,KB HOME,"KB Home operates as a homebuilding company in the United States. It operates through four segments: West Coast, Southwest, Central, and Southeast."
ODP,0.0325,ODP CORP,"The ODP Corporation provides business services and supplies, products, and technology solutions for small, medium, and enterprise businesses. The company operates in three divisions: Business Solutions, Retail, and CompuCom."
THC,0.0327,TENET HEALTHCARE CORP,"Tenet Healthcare Corporation operates as a diversified healthcare services company. The company operates through three segments: Hospital Operations and Other, Ambulatory Care, and Conifer."
MAR,0.0328,MARRIOTT INTL INC,"Marriott International, Inc. operates, franchises, and licenses hotel, residential, and timeshare properties worldwide. The company operates through North American Full-Service, North American Limited-Service, and Asia Pacific segments."
CDNS,0.0336,CADENCE DESIGN SYSTEMS INC,"Cadence Design Systems, Inc. provides software, hardware, services, and reusable integrated circuit (IC) design blocks worldwide. The company offers functional verification services, including emulation and prototyping hardware."
AMD,0.0353,ADVANCED MICRO DEVICES,"Advanced Micro Devices, Inc. operates as a semiconductor company worldwide. The company operates in two segments, Computing and Graphics; and Enterprise, Embedded and Semi-Custom."
ALL,0.0359,ALLSTATE CORP,"The Allstate Corporation, through its subsidiaries, provides property and casualty, and other insurance products in the United States and Canada. The company operates through Allstate Protection, Service Businesses, Allstate Life, and Allstate Benefits segments."
JBL,0.0379,JABIL INC,"Jabil Inc. provides manufacturing services and solutions worldwide. The company operates in two segments, Electronics Manufacturing Services and Diversified Manufacturing Services. It offers electronics design, production, and product management services."
GNW,0.0446,GENWORTH FINANCIAL INC,"Genworth Financial, Inc. provides insurance products in the United States and internationally. It operates through four segments: U.S. Mortgage Insurance, Australia Mortgage Insurance, U.S. Life Insurance, and Runoff. The U.S."
IPG,0.0456,INTERPUBLIC GROUP OF COS,"The Interpublic Group of Companies, Inc. provides advertising and marketing services worldwide. It operates through two segments, Integrated Agency Networks and Constituency Management Group."
AKS,0.0457,AK STEEL HOLDING CORP,"AK Steel Holding Corporation, through its subsidiary, AK Steel Corporation, produces flat-rolled carbon, and stainless and electrical steel products in the United States and internationally."
RRD,0.0478,DONNELLEY (R R) & SONS CO,"R.R. Donnelley & Sons Company, an integrated communications provider, enables organizations to create, manage, deliver, and optimize their multichannel marketing and business communications."
CBRE,0.0483,CBRE GROUP INC,"CBRE Group, Inc. operates as a commercial real estate services and investment company worldwide. It operates through Advisory Services, Global Workplace Solutions, and Real Estate Investments segments."
X,0.0505,UNITED STATES STEEL CORP,"United States Steel Corporation produces and sells flat-rolled and tubular steel products primarily in North America and Europe. It operates through three segments: North American Flat-Rolled (Flat-Rolled), U. S. Steel Europe (USSE), and Tubular Products (Tubular)."
CAH,0.0514,CARDINAL HEALTH INC,"Cardinal Health, Inc. operates as an integrated healthcare services and products company in the United States and internationally. It provides customized solutions for hospitals, healthcare systems, pharmacies, ambulatory surgery centers, clinical laboratories, and physician offices."
GM,0.0525,GENERAL MOTORS CO,"General Motors Company designs, builds, and sells cars, trucks, crossovers, and automobile parts worldwide. The company operates through GM North America, GM International, Cruise, and GM Financial segments."
MTW,0.0562,MANITOWOC CO,"The Manitowoc Company, Inc. provides engineered lifting equipment for the construction industry in the Americas, Europe, Africa, the Middle East, and the Asia Pacific."
FDC,0.0572,FIRST DATA CORP,"First Data Corporation provides commerce enabled technology and solutions for merchants, financial institutions, and card issuers in the United States, Canada, Europe, the Middle East, Africa, Latin America, and the Asia Pacific."
HII,0.0573,HUNTINGTON INGALLS IND INC,"Huntington Ingalls Industries, Inc. engages in the designing, building, overhauling, and repairing military ships in the United States. It operates through three segments: Ingalls Shipbuilding, Newport News Shipbuilding, and Technical Solutions."
GT,0.0597,GOODYEAR TIRE & RUBBER CO,"The Goodyear Tire & Rubber Company, together with its subsidiaries, develops, manufactures, distributes, and sells tires and related products and services worldwide."
SVU,0.0597,SUPERVALU INC,"SUPERVALU INC., together with its subsidiaries, operates as a grocery wholesaler and retailer in the United States and internationally. It operates through two segments, Wholesale and Retail."
BLL,0.0626,BALL CORP,"Ball Corporation supplies aluminum packaging products to the beverage, personal care, automotive, paint, healthcare, and household products industries."
WHR,0.0627,WHIRLPOOL CORP,"Whirlpool Corporation manufactures and markets home appliances and related products. It operates through four segments: North America; Europe, Middle East and Africa; Latin America; and Asia."
AET,0.0632,AETNA INC,"Aetna Inc. operates as a health care benefits company in the United States. It operates through three segments: Health Care, Group Insurance, and Large Case Pensions."
M,0.0634,MACY'S INC,"Macy's, Inc., an omnichannel retail organization, operates stores, websites, and mobile applications under the Macy's, Bloomingdale's, and bluemercury brands."
IP,0.0694,INTL PAPER CO,"International Paper Company operates as a paper and packaging company primarily in United States, the Middle East, Europe, Africa, Pacific Rim, Asia, and the Americas. It operates through three segments: Industrial Packaging, Global Cellulose Fibers, and Printing Papers."
ZION,0.07,ZIONS BANCORPORATION NA,"Zions Bancorporation, National Association provides various banking and related services primarily in Arizona, California, Colorado, Idaho, Nevada, New Mexico, Oregon, Texas, Utah, Washington, and Wyoming."
HOT,0.0725,STARWOOD HOTELS&RESORTS WRLD,"Starwood Hotels & Resorts Worldwide, Inc., together with its subsidiaries, operates as a hotel and leisure company worldwide."
S,0.0756,SPRINT CORP,"Sprint Corporation provides a range of wireless and wireline communications products and services to consumers, businesses, government subscribers, and resellers in the United States, Puerto Rico, and the United States Virgin Islands. It operates in two segments, Wireless and Wireline."
AE,0.0825,ADAMS RESOURCES & ENERGY INC,"Adams Resources & Energy, Inc., through its subsidiaries, primarily engages in the marketing, transportation, and storage of crude oil in the United States."
BC,0.0862,BRUNSWICK CORP,"Brunswick Corporation designs, manufactures, and markets recreation products worldwide."
NKTR,0.0917,NEKTAR THERAPEUTICS,"Nektar Therapeutics, a biopharmaceutical company, researches and develops drug candidates for cancer and auto-immune disease in the United States."
LYV,0.0938,LIVE NATION ENTERTAINMENT,"Live Nation Entertainment, Inc. operates as a live entertainment company. It operates through Concerts, Ticketing, and Sponsorship & Advertising segments."
CDW,0.095,CDW CORP,"CDW Corporation provides integrated information technology (IT) solutions to business, government, education, and healthcare customers in the United States, the United Kingdom, and Canada. It operates through three segments: Corporate, Small Business, and Public."
LVLT,0.107,LEVEL 3 COMMUNICATIONS INC,"Level 3 Parent, LLC provides various integrated communications services for enterprise, government, wholesale, and small and medium business customers in North America, Latin America, Europe, the Asia Pacific, the Middle East, and Africa."
PHM,0.1118,PULTEGROUP INC,"PulteGroup, Inc., through its subsidiaries, primarily engages in the homebuilding business in the United States. The company acquires and develops land primarily for residential purposes; and constructs housing on such land."
AAL,0.1179,AMERICAN AIRLINES GROUP INC,"American Airlines Group Inc., through its subsidiaries, operates as a network air carrier. It provides scheduled air transportation services for passengers and cargo. As of December 31, 2019, the company operated a mainline fleet of 942 aircraft."
MTG,0.1239,MGIC INVESTMENT CORP/WI,"MGIC Investment Corporation, through its subsidiaries, provides private mortgage insurance, other mortgage credit risk management solutions, and ancillary services to lenders and government sponsored entities in the United States, Puerto Rico, and Guam."
CIEN,0.1328,CIENA CORP,"Ciena Corporation provides network hardware, software, and services that support the transport, routing, switching, aggregation, service delivery, and management of video, data, and voice traffic on communications networks worldwide."
SNV,0.1539,SYNOVUS FINANCIAL CORP,"Synovus Financial Corp. operates as the bank holding company for Synovus Bank that provides various financial products and services. It operates through three segments: Community Banking, Wholesale Banking, and Financial Management Services."
MBI,0.1834,MBIA INC,"MBIA Inc. provides financial guarantee insurance services to public finance markets. It operates through United States (U.S.) Public Finance Insurance, and International and Structured Finance Insurance segments."
VRTX,0.1891,VERTEX PHARMACEUTICALS INC,Vertex Pharmaceuticals Incorporated engages in developing and commercializing therapies for treating cystic fibrosis.
NOW,0.2051,SERVICENOW INC,"ServiceNow, Inc. provides enterprise cloud computing solutions that defines, structures, consolidates, manages, and automates services for enterprises worldwide."
