,dist,conm,busdesc
MWV,0.0,MEADWESTVACO CORP,"WestRock MWV, LLC provides packaging solutions to the healthcare, beauty and personal care, food, beverage, home and garden, tobacco, and agricultural industries worldwide."
APD,0.0001,AIR PRODUCTS & CHEMICALS INC,"Air Products and Chemicals, Inc. provides atmospheric gases, process and specialty gases, equipment, and services worldwide."
PKG,0.0016,PACKAGING CORP OF AMERICA,Packaging Corporation of America manufactures and sells containerboard and corrugated packaging products in the United States. The company operates through Packaging and Paper segments.
NYT,0.0017,NEW YORK TIMES CO  -CL A,"The New York Times Company, together with its subsidiaries, provides news and information for readers and viewers across various platforms worldwide."
PPG,0.0017,PPG INDUSTRIES INC,"PPG Industries, Inc. manufactures and distributes paints, coatings, and specialty materials worldwide."
SPGI,0.0024,S&P GLOBAL INC,"S&P Global Inc., together with its subsidiaries, provides ratings, benchmarks, analytics, and data to the capital and commodity markets worldwide."
SYK,0.0037,STRYKER CORP,"Stryker Corporation operates as a medical technology company. The company operates through three segments: Orthopaedics, MedSurg, and Neurotechnology and Spine. The Orthopaedics segment provides implants for use in hip and knee joint replacements, and trauma and extremities surgeries."
AEE,0.0042,AMEREN CORP,"Ameren Corporation, together with its subsidiaries, operates as a public utility holding company in the United States. It operates through four segments: Ameren Missouri, Ameren Illinois Electric Distribution, Ameren Illinois Natural Gas, and Ameren Transmission."
PG,0.0044,PROCTER & GAMBLE CO,"The Procter & Gamble Company provides branded consumer packaged goods to consumers in North and Latin America, Europe, the Asia Pacific, Greater China, India, the Middle East, and Africa."
SO,0.0045,SOUTHERN CO,"The Southern Company, through its subsidiaries, engages in the generation, transmission, and distribution of electricity. It operates in four segments: Gas Distribution Operations, Gas Pipeline Investments, Wholesale Gas Services, and Gas Marketing Services."
PCP,0.0046,PRECISION CASTPARTS CORP,"Precision Castparts Corp. manufactures and sells metal components and products to the aerospace, power, and general industrial and other markets worldwide. The company operates through three segments: Investment Cast Products, Forged Products, and Airframe Products."
VLO,0.0047,VALERO ENERGY CORP,"Valero Energy Corporation manufactures and sells transportation fuels and petrochemical products in the United States, Canada, the United Kingdom, Ireland, and internationally. It operates through three segments: Refining, Ethanol, and Renewable Diesel."
PTV,0.0047,PACTIV CORP,"Pactiv LLC manufactures and distributes food packaging and foodservice products. Its product lines include custom and stock foam, plastic, aluminum, pressed-paperboard, PE coated board, and molded-fiber packaging."
DGX,0.0057,QUEST DIAGNOSTICS INC,"Quest Diagnostics Incorporated provides diagnostic testing, information, and services in the United States and internationally."
NCR,0.0071,NCR CORP,"NCR Corporation provides software and services worldwide. The company operates through Banking, Retail, Hospitality, and Other segments."
DHI,0.0073,D R HORTON INC,"D.R. Horton, Inc. operates as a homebuilding company in East, Midwest, Southeast, South Central, Southwest, and West regions in the United States. It engages in the acquisition and development of land; and construction and sale of homes in 29 states and 88 markets under the names of D.R."
OXY,0.008,OCCIDENTAL PETROLEUM CORP,"Occidental Petroleum Corporation, together with its subsidiaries, engages in the acquisition, exploration, and development of oil and gas properties in the United States, the Middle East, and Latin America."
J,0.0083,JACOBS ENGINEERING GROUP INC,"Jacobs Engineering Group Inc. provides consulting, technical, scientific, and project delivery services for the government and private sectors in the United States, Europe, Canada, India, rest of Asia, Australia, New Zealand, South America, Mexico, the Middle East, and Africa."
IRM,0.0089,IRON MOUNTAIN INC,"Iron Mountain Incorporated (NYSE: IRM), founded in 1951, is the global leader for storage and information management services."
MTW,0.0089,MANITOWOC CO,"The Manitowoc Company, Inc. provides engineered lifting equipment for the construction industry in the Americas, Europe, Africa, the Middle East, and the Asia Pacific."
JBHT,0.0092,HUNT (JB) TRANSPRT SVCS INC,"J.B. Hunt Transport Services, Inc., together with its subsidiaries, provides surface transportation and delivery services in the continental United States, Canada, and Mexico."
PETM,0.0096,PETSMART INC,"PetSmart, Inc., together with its subsidiaries, operates as a specialty retailer of products, services, and solutions for pets in the United States, Puerto Rico, and Canada."
HAS,0.0099,HASBRO INC,"Hasbro, Inc., together with its subsidiaries, operates as a play and entertainment company. The company's U.S."
DD,0.0105,DUPONT DE NEMOURS INC,"DuPont de Nemours, Inc. provides technology-based materials, ingredients, and solutions in the United States, Canada, the Asia Pacific, Latin America, Europe, the Middle East, and Africa."
JNPR,0.0106,JUNIPER NETWORKS INC,"Juniper Networks, Inc. designs, develops, and sells network products and services worldwide."
DDS,0.0112,DILLARDS INC  -CL A,"Dillard's, Inc. operates retail department stores primarily in the Southeastern, Southwestern, and Midwestern areas of the United States."
SYY,0.0119,SYSCO CORP,"Sysco Corporation, through its subsidiaries, markets and distributes a range of food and related products primarily to the foodservice or food-away-from-home industry in the United States, Canada, the United Kingdom, France, and internationally. It operates through three segments: U.S."
SLR,0.0122,SOLECTRON CORP,Flextronics Corporation engages in electronics manufacturing and supply chain management services to original equipment manufacturers in the electronics products and technology markets worldwide.
TT,0.0125,TRANE TECHNOLOGIES PLC,"Trane Technologies plc provides climate control solutions for buildings, homes, and transportation."
VZ,0.0129,VERIZON COMMUNICATIONS INC,"Verizon Communications Inc. offers communications, information, and entertainment products and services to consumers, businesses, and governmental entities worldwide."
M,0.0131,MACY'S INC,"Macy's, Inc., an omnichannel retail organization, operates stores, websites, and mobile applications under the Macy's, Bloomingdale's, and bluemercury brands."
ED,0.0137,CONSOLIDATED EDISON INC,"Consolidated Edison, Inc., through its subsidiaries, engages in regulated electric, gas, and steam delivery businesses in the United States."
HSY,0.0141,HERSHEY CO,"The Hershey Company, together with its subsidiaries, manufactures and sells confectionery products. The company operates through two segments, North America; and International and Other."
WST,0.0146,WEST PHARMACEUTICAL SVSC INC,"West Pharmaceutical Services, Inc. manufactures and sells containment and delivery systems for injectable drugs and healthcare products in the United States, Germany, Ireland, France, Other European countries, and internationally."
JWN,0.0148,NORDSTROM INC,"Nordstrom, Inc., a fashion retailer, provides apparels, shoes, cosmetics, and accessories for women, men, young adults, and children."
RTX,0.0162,RAYTHEON TECHNOLOGIES CORP,"Raytheon Technologies Corporation, an aerospace and defense company, provides advanced systems and services for commercial, military, and government customers worldwide."
PVH,0.0165,PVH CORP,PVH Corp. operates as an apparel company in the United States and internationally.
NVR,0.0166,NVR INC,"NVR, Inc. operates as a homebuilder in the United States. The company operates in two segments, Homebuilding and Mortgage Banking. It primarily constructs and sells single-family detached homes, townhomes, and condominium buildings under the Ryan Homes, NVHomes, and Heartland Homes names."
NWL,0.0174,NEWELL BRANDS INC,"Newell Brands Inc. designs, manufactures, sources, and distributes consumer and commercial products worldwide. The company operates through four segments: Appliances and Cookware, Food and Commercial, Home and Outdoor Living, and Learning and Development."
SWY,0.0176,SAFEWAY INC,Safeway Inc. operates as a food and drug retailer in the United States.
MAA,0.019,MID-AMERICA APT CMNTYS INC,"MAA, an S&P 500 company, is a real estate investment trust, or REIT, focused on delivering full-cycle and superior investment performance for shareholders through the ownership, management, acquisition, development and redevelopment of quality apartment communities throughout the United States."
ANTM,0.0191,ANTHEM INC,"Anthem, Inc., through its subsidiaries, operates as a health benefits company in the United States. It operates through three segments: Commercial & Specialty Business, Government Business, and Other."
MFE,0.0194,MCAFEE INC,"McAfee LLC develops and delivers security solutions and services that protect systems, networks, and mobile devices for business and personal use in the United States and internationally."
ATI,0.0196,ALLEGHENY TECHNOLOGIES INC,"Allegheny Technologies Incorporated manufactures and sells specialty materials and components worldwide. The company operates in two segments, High Performance Materials & Components and Advanced Alloys & Solutions."
OMX,0.0199,OFFICEMAX INC,"OfficeMax Incorporated, together with its subsidiaries, distributes business-to-business and retail office products."
LXK,0.02,LEXMARK INTL INC  -CL A,"Lexmark International, Inc., together with its subsidiaries, operates as a developer, manufacturer, and supplier of printing, imaging, device management, and document workflow solutions."
CHTR,0.0201,CHARTER COMMUNICATIONS INC,"Charter Communications, Inc., through its subsidiaries, provides cable services to residential and commercial customers in the United States."
AMCR,0.0202,AMCOR PLC,"Amcor plc develops, manufactures, and sells various packaging products for food, beverage, medical and pharmaceutical, fresh produce, snack food, personal care, and other industries worldwide. It operates through two segments, Flexibles and Rigid Packaging."
TGT,0.0206,TARGET CORP,Target Corporation operates as a general merchandise retailer in the United States.
WY,0.0208,WEYERHAEUSER CO,"Weyerhaeuser Company, one of the world's largest private owners of timberlands, began operations in 1900. We own or control approximately 11 million acres of timberlands in the U.S. and manage additional timberlands under long-term licenses in Canada."
PNW,0.0215,PINNACLE WEST CAPITAL CORP,"Pinnacle West Capital Corporation, through its subsidiary, Arizona Public Service Company, provides retail and wholesale electric services primarily in the state of Arizona."
UNH,0.0215,UNITEDHEALTH GROUP INC,"UnitedHealth Group Incorporated operates as a diversified health care company in the United States. It operates through four segments: UnitedHealthcare, OptumHealth, OptumInsight, and OptumRx."
WRK,0.0221,WESTROCK CO,"WestRock Company manufactures and sells paper and packaging solutions in North America, South America, Europe, Asia, and Australia. The company operates through Corrugated Packaging and Consumer Packaging segments."
BBY,0.0222,BEST BUY CO INC,"Best Buy Co., Inc. retails technology products in the United States, Canada, and Mexico. The company operates in two segments, Domestic and International."
DG,0.023,DOLLAR GENERAL CORP,"Dollar General Corporation, a discount retailer, provides various merchandise products in the southern, southwestern, Midwestern, and eastern United States."
HES,0.0232,HESS CORP,"Hess Corporation, an exploration and production company, explores, develops, produces, purchases, transports, and sells crude oil, natural gas liquids (NGLs), and natural gas. It operates through two segments, Exploration and Production, and Midstream."
LUMN,0.0237,CENTURYLINK INC,"Lumen Technologies, Inc., a facilities-based communications company, provides various integrated services under 'CenturyLink' name to business and residential customers in the United States and internationally."
KSU,0.0239,KANSAS CITY SOUTHERN,"Kansas City Southern, a transportation holding company, provides domestic and international rail transportation services in North America."
BIO,0.024,BIO-RAD LABORATORIES INC,"Bio-Rad Laboratories, Inc. develops, manufactures, and markets products and solutions for the life science research and clinical diagnostic markets in Europe, the United States, Canada, and Latin America."
UDR,0.025,UDR INC,"UDR, Inc."
COG,0.0251,CABOT OIL & GAS CORP,"Cabot Oil & Gas Corporation, an independent oil and gas company, explores for, exploits, develops, produces, and markets oil and gas properties in the United States."
MMC,0.0251,MARSH & MCLENNAN COS,"Marsh & McLennan Companies, Inc., a professional services company, provides advice and solutions to clients in the areas of risk, strategy, and people worldwide. It operates in two segments, Risk and Insurance Services, and Consulting."
NEE,0.0257,NEXTERA ENERGY INC,"NextEra Energy, Inc., through its subsidiaries, generates, transmits, and distributes electric power in North America. The company generates electricity through wind, solar, nuclear, coal, oil, and natural gas facilities."
ODP,0.0274,ODP CORP,"The ODP Corporation provides business services and supplies, products, and technology solutions for small, medium, and enterprise businesses. The company operates in three divisions: Business Solutions, Retail, and CompuCom."
ALK,0.0275,ALASKA AIR GROUP INC,"Alaska Air Group, Inc., through its subsidiaries, provides passenger and cargo air transportation services. The company operates through three segments: Mainline, Regional, and Horizon."
AME,0.0276,AMETEK INC,"AMETEK, Inc. manufactures and sells electronic instruments and electromechanical devices worldwide. It operates through two segments, Electronic Instruments (EIG) and Electromechanical (EMG)."
PNR,0.0277,PENTAIR PLC,"Pentair plc provides various smart water solutions worldwide. It operates through three segments: Aquatic Systems, Filtration Solutions, and Flow Technologies."
UIS,0.0279,UNISYS CORP,"Unisys Corporation operates as an information technology company worldwide. It operates in two segments, Services and Technology. The Services segment offers cloud and infrastructure services, application services, and business process outsourcing services."
ROH,0.0283,ROHM AND HAAS CO,Rohm and Haas Company manufactures and markets chemicals.
HUM,0.0288,HUMANA INC,"Humana Inc., together with its subsidiaries, operates as a health and well-being company in the United States. It operates through Retail, Group and Specialty, and Healthcare Services segments. The company offers medical and supplemental benefit plans to individuals."
MAT,0.0292,MATTEL INC,"Mattel, Inc., a children's entertainment company, designs and produces toys and consumer products worldwide. The company operates through North America, International, and American Girl segments."
LEN,0.0294,LENNAR CORP,"Lennar Corporation, together with its subsidiaries, operates as a homebuilder primarily under the Lennar brand in the United States. It operates through Homebuilding East, Homebuilding Central, Homebuilding Texas, Homebuilding West, Financial Services, Multifamily, and Lennar Other segments."
LIN,0.0304,LINDE PLC,"Linde plc operates as an industrial gas company in North and South America, Europe, the Middle East, Africa, and the Asia Pacific. The company offers oxygen, nitrogen, argon, rare gases, carbon monoxide, carbon dioxide, helium, hydrogen, electronic gases, specialty gases, and acetylene."
HON,0.0311,HONEYWELL INTERNATIONAL INC,Honeywell International Inc. operates as a diversified technology and manufacturing company worldwide.
AIV,0.0323,APARTMENT INVST & MGMT CO,Aimco is a real estate investment trust focused on the ownership and management of quality apartment communities located in select markets in the United States.
