,dist,conm,busdesc
MAS,0.0,MASCO CORP,"Masco Corporation designs, manufactures, and distributes home improvement and building products in North America, Europe, and internationally. The company operates through two segments, Plumbing Products and Decorative Architectural Products."
CHTR,0.0044,CHARTER COMMUNICATIONS INC,"Charter Communications, Inc., through its subsidiaries, provides cable services to residential and commercial customers in the United States."
PFG,0.0198,PRINCIPAL FINANCIAL GRP INC,"Principal Financial Group, Inc. provides retirement, asset management, and insurance products and services to businesses, individuals, and institutional clients worldwide. The company operates through Retirement and Income Solutions, Principal Global Investors, Principal International, and U.S."
LNC,0.0205,LINCOLN NATIONAL CORP,"Lincoln National Corporation, through its subsidiaries, operates multiple insurance and retirement businesses in the United States. It operates through four segments: Annuities, Retirement Plan Services, Life Insurance, and Group Protection."
WYNN,0.0216,WYNN RESORTS LTD,"Wynn Resorts, Limited designs, develops, and operates integrated resorts."
OI,0.0228,O-I GLASS INC,"O-I Glass, Inc., through its subsidiaries, manufactures and sells glass containers to food and beverage manufacturers primarily in the Americas, Europe, and the Asia Pacific. It produces glass containers for alcoholic beverages, including beer, flavored malt beverages, spirits, and wine."
UPS,0.0248,UNITED PARCEL SERVICE INC,"United Parcel Service, Inc. provides letter and package delivery, specialized transportation, logistics, and financial services. It operates through three segments: U.S. Domestic Package, International Package, and Supply Chain & Freight. The U.S."
LMT,0.0258,LOCKHEED MARTIN CORP,"Lockheed Martin Corporation, a security and aerospace company, engages in the research, design, development, manufacture, integration, and sustainment of technology systems, products, and services worldwide."
IT,0.026,GARTNER INC,"Gartner, Inc. operates as a research and advisory company. It operates through three segments: Research, Conferences, and Consulting."
SEE,0.028,SEALED AIR CORP,"Sealed Air Corporation provides food safety and security, and product protection solutions and equipment in North America, South America, Europe, the Middle East, Africa, and the Asia Pacific. It operates in two segments, Food Care and Product Care."
PRU,0.0291,PRUDENTIAL FINANCIAL INC,"Prudential Financial, Inc., through its subsidiaries, provides insurance, investment management, and other financial products and services."
KMB,0.031,KIMBERLY-CLARK CORP,"Kimberly-Clark Corporation, together with its subsidiaries, manufactures and markets personal care and consumer tissue products worldwide. It operates through three segments: Personal Care, Consumer Tissue, and K-C Professional."
IQV,0.0312,IQVIA HOLDINGS INC,"IQVIA Holdings Inc. provides advanced analytics, technology solutions, and contract research services to the life sciences industry in the Americas, Europe, Africa, and the Asia-Pacific."
MET,0.0317,METLIFE INC,"MetLife, Inc. engages in the insurance, annuities, employee benefits, and asset management businesses worldwide. It operates through five segments: U.S.; Asia; Latin America; Europe, the Middle East and Africa; and MetLife Holdings."
HIG,0.0323,HARTFORD FINANCIAL SERVICES,"The Hartford Financial Services Group, Inc. provides insurance and financial services to individual and business customers in the United States and internationally."
CLX,0.0324,CLOROX CO/DE,"The Clorox Company manufactures and markets consumer and professional products worldwide. It operates through four segments: Health and Wellness, Household, Lifestyle, and International."
LB,0.0369,L BRANDS INC,"L Brands, Inc. operates as a specialty retailer of women's intimate and other apparel, personal care, and beauty and home fragrance products. The company operates in three segments: Victoria's Secret, Bath & Body Works, and Victoria's Secret and Bath & Body Works International."
CSRA,0.0388,CSRA INC,"CSRA Inc. delivers a range of information technology solutions and professional services to its U.S. government customers to modernize legacy systems, protect networks and assets, and enhance the mission-critical functions for war fighters and citizens."
IR,0.0406,INGERSOLL RAND INC,"Ingersoll Rand Inc. provides mission-critical flow control and compression equipment; and associated aftermarket parts, consumables, and services in the United States, Europe, the Middle East, Africa, and the Asia Pacific. It operates through three segments: Industrials, Energy, and Medical."
MSI,0.0408,MOTOROLA SOLUTIONS INC,"Motorola Solutions, Inc. provides mission-critical communication solutions the United States, the United Kingdom, Canada, and internationally. The company operates in two segments, Products and Systems Integration, and Services and Software."
ALLE,0.0412,ALLEGION PLC,Allegion plc manufactures and sells mechanical and electronic security products and solutions worldwide.
BHF,0.0446,BRIGHTHOUSE FINANL INC,"Brighthouse Financial, Inc. provides annuity and life insurance products in the United States. It operates through three segments: Annuities, Life, and Run-off."
BA,0.0448,BOEING CO,"The Boeing Company, together with its subsidiaries, designs, develops, manufactures, sales, services, and supports commercial jetliners, military aircraft, satellites, missile defense, human space flight and launch systems, and services worldwide."
PBI,0.046,PITNEY BOWES INC,"Pitney Bowes Inc., a technology company, provides commerce solutions in the United States and internationally. The company operates through Global Ecommerce, Presort Services and SendTech Solutions segments."
IDXX,0.0476,IDEXX LABS INC,"IDEXX Laboratories, Inc., together with its subsidiaries, develops, manufactures, and distributes products and services primarily for the companion animal veterinary, livestock and poultry, dairy, and water testing markets worldwide."
HCA,0.0517,HCA HEALTHCARE INC,"HCA Healthcare, Inc., through its subsidiaries, operates as a health care services company in the United States."
HRB,0.0525,BLOCK H & R INC,"H&R Block, Inc., through its subsidiaries, provides assisted income tax return preparation, do-it-yourself (DIY) tax, and virtual tax preparation services and products to the general public primarily in the United States, Canada, and Australia."
IRM,0.0552,IRON MOUNTAIN INC,"Iron Mountain Incorporated (NYSE: IRM), founded in 1951, is the global leader for storage and information management services."
AMP,0.0559,AMERIPRISE FINANCIAL INC,"Ameriprise Financial, Inc., through its subsidiaries, provides various financial products and services to individual and institutional clients in the United States and internationally."
CC,0.0579,CHEMOURS CO,"The Chemours Company provides performance chemicals in North America, the Asia Pacific, Europe, the Middle East, Africa, and Latin America. It operates through three segments: Fluoroproducts, Chemical Solutions, and Titanium Technologies."
RRD,0.0591,DONNELLEY (R R) & SONS CO,"R.R. Donnelley & Sons Company, an integrated communications provider, enables organizations to create, manage, deliver, and optimize their multichannel marketing and business communications."
ADS,0.0661,ALLIANCE DATA SYSTEMS CORP,"Alliance Data Systems Corporation provides data-driven marketing and loyalty solutions in the United States, Canada, Europe, the Middle East, Africa, the Asia Pacific, and others. It operates through two segments, LoyaltyOne and Card Services."
AZO,0.0677,AUTOZONE INC,"AutoZone, Inc. retails and distributes automotive replacement parts and accessories. The company offers various products for cars, sport utility vehicles, vans, and light trucks, including new and remanufactured automotive hard parts, maintenance items, accessories, and non-automotive products."
ALTR,0.073,ALTAIR ENGINEERING INC,"Altair Engineering Inc., together with its subsidiaries, provides software and cloud solutions worldwide. The company operates through two segments, Software and Client Engineering Services."
SVU,0.0753,SUPERVALU INC,"SUPERVALU INC., together with its subsidiaries, operates as a grocery wholesaler and retailer in the United States and internationally. It operates through two segments, Wholesale and Retail."
AVP,0.0783,AVON PRODUCTS,"Avon Products, Inc. manufactures, markets, and sells beauty and related products in Europe, the Middle East, Africa, south Latin America, north Latin America, and the Asia Pacific."
CL,0.0787,COLGATE-PALMOLIVE CO,"Colgate-Palmolive Company, together with its subsidiaries, manufactures and sells consumer products worldwide. The company operates through two segments, Oral, Personal and Home Care; and Pet Nutrition."
ABC,0.0789,AMERISOURCEBERGEN CORP,AmerisourceBergen Corporation sources and distributes pharmaceutical products in the United States and internationally.
VZ,0.0852,VERIZON COMMUNICATIONS INC,"Verizon Communications Inc. offers communications, information, and entertainment products and services to consumers, businesses, and governmental entities worldwide."
AKS,0.0857,AK STEEL HOLDING CORP,"AK Steel Holding Corporation, through its subsidiary, AK Steel Corporation, produces flat-rolled carbon, and stainless and electrical steel products in the United States and internationally."
KLAC,0.087,KLA CORP,"KLA Corporation designs, manufactures, and markets process control and yield management solutions for the semiconductor and related nanoelectronics industries worldwide."
MJN,0.088,MEAD JOHNSON NUTRITION CO,"Mead Johnson Nutrition Company manufactures and sells infant formula, children's nutrition, and other nutritional products."
MAR,0.0945,MARRIOTT INTL INC,"Marriott International, Inc. operates, franchises, and licenses hotel, residential, and timeshare properties worldwide. The company operates through North American Full-Service, North American Limited-Service, and Asia Pacific segments."
SBAC,0.1005,SBA COMMUNICATIONS CORP,"SBA Communications Corporation is a first choice provider and leading owner and operator of wireless communications infrastructure in North, Central, and South America and South Africa."
DNB,0.1116,DUN & BRADSTREET HOLDNGS INC,"Dun & Bradstreet Holdings, Inc. provides business decisioning data and analytics in North America and internationally."
CLF,0.1177,CLEVELAND-CLIFFS INC,"Cleveland-Cliffs Inc. operates as an independent iron ore mining company in the United States, Canada, and internationally. It operates in two segments, Mining and Pelletizing, and Metallics."
UIS,0.1194,UNISYS CORP,"Unisys Corporation operates as an information technology company worldwide. It operates in two segments, Services and Technology. The Services segment offers cloud and infrastructure services, application services, and business process outsourcing services."
AMD,0.1376,ADVANCED MICRO DEVICES,"Advanced Micro Devices, Inc. operates as a semiconductor company worldwide. The company operates in two segments, Computing and Graphics; and Enterprise, Embedded and Semi-Custom."
DPZ,0.1443,DOMINO'S PIZZA INC,"Domino's Pizza, Inc., through its subsidiaries, operates as a pizza delivery company in the United States and internationally. It operates through three segments: U.S. Stores, International Franchise, and Supply Chain."
NKTR,0.1497,NEKTAR THERAPEUTICS,"Nektar Therapeutics, a biopharmaceutical company, researches and develops drug candidates for cancer and auto-immune disease in the United States."
