,dist,conm,busdesc
FLR,0.0,FLUOR CORP,"Fluor Corporation, through its subsidiaries, provides engineering, procurement, construction, fabrication and modularization, operation, maintenance and asset integrity, and project management services worldwide."
FCX,0.0058,FREEPORT-MCMORAN INC,"Freeport-McMoRan Inc. engages in the mining of mineral properties in North America, South America, and Indonesia. The company primarily explores for copper, gold, molybdenum, silver, and other metals, as well as oil and gas."
DRI,0.0088,DARDEN RESTAURANTS INC,"Darden Restaurants, Inc., through its subsidiaries, owns and operates full-service restaurants in the United States and Canada."
ANTM,0.0131,ANTHEM INC,"Anthem, Inc., through its subsidiaries, operates as a health benefits company in the United States. It operates through three segments: Commercial & Specialty Business, Government Business, and Other."
FDX,0.0135,FEDEX CORP,"FedEx Corporation provides transportation, e-commerce, and business services worldwide. Its FedEx Express segment offers shipping services for delivery of packages and freight."
COG,0.0171,CABOT OIL & GAS CORP,"Cabot Oil & Gas Corporation, an independent oil and gas company, explores for, exploits, develops, produces, and markets oil and gas properties in the United States."
HUM,0.0196,HUMANA INC,"Humana Inc., together with its subsidiaries, operates as a health and well-being company in the United States. It operates through Retail, Group and Specialty, and Healthcare Services segments. The company offers medical and supplemental benefit plans to individuals."
GPC,0.0202,GENUINE PARTS CO,"Genuine Parts Company distributes automotive replacement parts, industrial parts and materials, and business products in the United States, Canada, Mexico, Australasia, France, the United Kingdom, Germany, Poland, the Netherlands, and Belgium."
SYY,0.0205,SYSCO CORP,"Sysco Corporation, through its subsidiaries, markets and distributes a range of food and related products primarily to the foodservice or food-away-from-home industry in the United States, Canada, the United Kingdom, France, and internationally. It operates through three segments: U.S."
ESRX,0.0232,EXPRESS SCRIPTS HOLDING CO,Express Scripts Holding Company operates as a pharmacy benefit management (PBM) company in the United States and Canada.
UNH,0.0247,UNITEDHEALTH GROUP INC,"UnitedHealth Group Incorporated operates as a diversified health care company in the United States. It operates through four segments: UnitedHealthcare, OptumHealth, OptumInsight, and OptumRx."
MPC,0.025,MARATHON PETROLEUM CORP,"Marathon Petroleum Corporation, together with its subsidiaries, engages in refining, marketing, retailing, and transporting petroleum products primarily in the United States. It operates through three segments: Refining & Marketing, Retail, and Midstream."
TSN,0.0264,TYSON FOODS INC  -CL A,"Tyson Foods, Inc., together with its subsidiaries, operates as a food company worldwide. It operates through four segments: Beef, Pork, Chicken, and Prepared Foods."
SANM,0.0283,SANMINA CORP,"Sanmina Corporation provides integrated manufacturing solutions, components, products and repair, logistics, and after-market services worldwide. It operates in two segments, Integrated Manufacturing Solutions; and Components, Products and Services."
WMT,0.0291,WALMART INC,"Walmart Inc. engages in the retail and wholesale operations in various formats worldwide. The company operates in three segments: Walmart U.S., Walmart International, and Sam's Club."
COST,0.031,COSTCO WHOLESALE CORP,"Costco Wholesale Corporation, together with its subsidiaries, engages in the operation of membership warehouses in the United States, Puerto Rico, Canada, the United Kingdom, Mexico, Japan, Korea, Australia, Spain, France, Iceland, China, and Taiwan."
ANDV,0.0317,ANDEAVOR,"Andeavor, through its subsidiaries, operates as an independent petroleum refining, logistics, and marketing company in the United States. The company operates in three segments: Marketing, Logistics, and Refining."
MWW,0.0331,MONSTER WORLDWIDE INC,"Monster Worldwide, Inc., together with its subsidiaries, provides online and mobile employment and recruitment solutions worldwide. The company operates in three segments: Careers-North America, Careers-International, and Internet Advertising & Fees."
JCI,0.0356,JOHNSON CONTROLS INTL PLC,"Johnson Controls International plc operates as a diversified technology and multi industrial company worldwide. It operates through Building Solutions North America, Building Solutions EMEA/LA, Building Solutions Asia Pacific, and Global Products segments."
XRX,0.0365,XEROX HOLDINGS CORP,"Xerox Holdings Corporation designs, develops, and sells document management systems and solutions in the United States, Europe, Canada, and internationally."
ATI,0.0365,ALLEGHENY TECHNOLOGIES INC,"Allegheny Technologies Incorporated manufactures and sells specialty materials and components worldwide. The company operates in two segments, High Performance Materials & Components and Advanced Alloys & Solutions."
LLL,0.0378,L3 TECHNOLOGIES INC,"L3 Technologies, Inc. provides aircraft sustainment, simulation and training, night vision and image intensification equipment, and security and detection systems used on military, homeland security, and commercial platforms in the United States and internationally."
FDO,0.0395,FAMILY DOLLAR STORES,"Family Dollar Stores, Inc. operates a chain of general merchandise retail discount stores primarily for low- and middle-income consumers in the United States."
BMS,0.0401,BEMIS CO INC,"Bemis Company, Inc. manufactures and sells packaging products in the United States, Brazil, other Americas, Europe, and the Asia-Pacific. It operates through three segments: U.S. Packaging, Latin America Packaging, and Rest of World Packaging."
NBR,0.0407,NABORS INDUSTRIES LTD,"Nabors Industries Ltd. provides drilling and drilling-related services for land-based and offshore oil and natural gas wells. It operates through five segments: U.S. Drilling, Canada Drilling, International Drilling, Drilling Solutions, and Rig Technologies."
LEG,0.0411,LEGGETT & PLATT INC,"Leggett & Platt, Incorporated designs and produces various engineered components and products worldwide. It operates through three segments: Bedding Products; Furniture, Flooring & Textile Products; and Specialized Products."
PVH,0.0425,PVH CORP,PVH Corp. operates as an apparel company in the United States and internationally.
KSS,0.0426,KOHL'S CORP,"Kohl's Corporation operates as a retail company in the United States. Its stores and Website offer apparel, footwear, accessories, beauty, and home products. The company provides its products primarily under the brand names of Apt."
WRK,0.0456,WESTROCK CO,"WestRock Company manufactures and sells paper and packaging solutions in North America, South America, Europe, Asia, and Australia. The company operates through Corrugated Packaging and Consumer Packaging segments."
LXK,0.0464,LEXMARK INTL INC  -CL A,"Lexmark International, Inc., together with its subsidiaries, operates as a developer, manufacturer, and supplier of printing, imaging, device management, and document workflow solutions."
BC,0.0471,BRUNSWICK CORP,"Brunswick Corporation designs, manufactures, and markets recreation products worldwide."
TEX,0.0503,TEREX CORP,"Terex Corporation manufactures and sells aerial work platforms, materials processing machinery, and cranes worldwide. The company operates in two segments, Aerial Work Platforms (AWP) and Material Processing (MP)."
HAR,0.0504,HARMAN INTERNATIONAL INDS,"Harman International Industries, Incorporated designs and engineers connected products and solutions for automakers, consumers, and enterprises worldwide. The company operates through four segments: Connected Car, Lifestyle Audio, Professional Solutions, and Connected Services."
WCG,0.0527,WELLCARE HEALTH PLANS INC,"WellCare Health Plans, Inc. provides government-sponsored managed care services. The company operates in three segments: Medicaid Health Plans, Medicare Health Plans, and Medicare Prescription Drug Plans (PDPs)."
SIG,0.0542,SIGNET JEWELERS LTD,"Signet Jewelers Limited engages in the retail sale of diamond jewelry, watches, and other products. As of February 02, 2019, it operated 3,334 stores and kiosks. The company operates through three segments: North America, International, and Other."
ADM,0.0566,ARCHER-DANIELS-MIDLAND CO,"Archer-Daniels-Midland Company procures, transports, stores, processes, and merchandises agricultural commodities, products, and ingredients in the United States and internationally. The company operates through three segments: Ag Services and Oilseeds, Carbohydrate Solutions, and Nutrition."
TGT,0.0567,TARGET CORP,Target Corporation operates as a general merchandise retailer in the United States.
CXO,0.0582,CONCHO RESOURCES INC,"Concho Resources Inc., an independent oil and natural gas company, engages in the acquisition, development, and exploration of oil and natural gas properties in the United States. The company's principal operating areas are located in the Permian Basin of West Texas and southeast New Mexico."
KBH,0.0587,KB HOME,"KB Home operates as a homebuilding company in the United States. It operates through four segments: West Coast, Southwest, Central, and Southeast."
ADSK,0.0592,AUTODESK INC,"Autodesk, Inc. operates as a software design and services company worldwide."
JBHT,0.0652,HUNT (JB) TRANSPRT SVCS INC,"J.B. Hunt Transport Services, Inc., together with its subsidiaries, provides surface transportation and delivery services in the continental United States, Canada, and Mexico."
PSX,0.0676,PHILLIPS 66,"Phillips 66 operates as an energy manufacturing and logistics company. It operates through four segments: Midstream, Chemicals, Refining, and Marketing and Specialties (M&S)."
MWV,0.0679,MEADWESTVACO CORP,"WestRock MWV, LLC provides packaging solutions to the healthcare, beauty and personal care, food, beverage, home and garden, tobacco, and agricultural industries worldwide."
CNX,0.069,CNX RESOURCES CORPORATION,"CNX Resources Corporation, an independent oil and gas company, explores for, develops, and produces natural gas properties primarily in the Appalachian Basin. The company operates through two divisions, Exploration and Production (E&P), and Midstream."
BBY,0.0692,BEST BUY CO INC,"Best Buy Co., Inc. retails technology products in the United States, Canada, and Mexico. The company operates in two segments, Domestic and International."
DD,0.0693,DUPONT DE NEMOURS INC,"DuPont de Nemours, Inc. provides technology-based materials, ingredients, and solutions in the United States, Canada, the Asia Pacific, Latin America, Europe, the Middle East, and Africa."
ASH,0.07,ASHLAND GLOBAL HOLDINGS INC,"Ashland Global Holdings Inc. provides specialty chemical solutions worldwide. The company's Specialty Ingredients segment offers products, technologies, and resources for solving formulation and product-performance challenges."
CRM,0.0731,SALESFORCE.COM INC,"salesforce.com, inc. develops enterprise cloud computing solutions with a focus on customer relationship management worldwide."
VLO,0.0742,VALERO ENERGY CORP,"Valero Energy Corporation manufactures and sells transportation fuels and petrochemical products in the United States, Canada, the United Kingdom, Ireland, and internationally. It operates through three segments: Refining, Ethanol, and Renewable Diesel."
CNC,0.0753,CENTENE CORP,Centene Corporation operates as a multi-national healthcare enterprise that provides programs and services to under-insured and uninsured individuals in the United States.
TT,0.0769,TRANE TECHNOLOGIES PLC,"Trane Technologies plc provides climate control solutions for buildings, homes, and transportation."
CE,0.0778,CELANESE CORP,"Celanese Corporation, a technology and specialty materials company, manufactures and sells high performance engineered polymers in the United States and internationally. The company operates through Engineered Materials, Acetate Tow, and Acetyl Chain segments."
FTNT,0.0842,FORTINET INC,"Fortinet, Inc. provides broad, integrated, and automated cybersecurity solutions worldwide."
AE,0.0852,ADAMS RESOURCES & ENERGY INC,"Adams Resources & Energy, Inc., through its subsidiaries, primarily engages in the marketing, transportation, and storage of crude oil in the United States."
BIG,0.09,BIG LOTS INC,"Big Lots, Inc., through its subsidiaries, operates as a retailer in the United States."
GME,0.094,GAMESTOP CORP,"GameStop Corp. operates as a multichannel video game, consumer electronics, and collectibles retailer in the United States, Canada, Australia, and Europe."
DDS,0.0955,DILLARDS INC  -CL A,"Dillard's, Inc. operates retail department stores primarily in the Southeastern, Southwestern, and Midwestern areas of the United States."
SSP,0.1093,EW SCRIPPS  -CL A,"The E.W. Scripps Company, together with its subsidiaries, operates as a media enterprise through a portfolio of local and national media brands. The company operates through Local Media, National Media, and Other segments."
SUN,0.1281,SUNOCO LP,"Sunoco LP, together with its subsidiaries, engages in the distribution and retailing of motor fuels in the United States. It operates through two segments, Fuel Distribution and Marketing, and All Other."
QEP,0.1303,QEP RESOURCES INC,"QEP Resources, Inc. operates as a crude oil and natural gas exploration and production company in the United States. The company conducts exploration and production activities in the Permian Basin in Western Texas; and Williston Basin in North Dakota."
APA,0.1308,APACHE CORP,"Apache Corporation, an independent energy company, explores for, develops, and produces natural gas, crude oil, and natural gas liquids (NGLs)."
VRTX,0.1482,VERTEX PHARMACEUTICALS INC,Vertex Pharmaceuticals Incorporated engages in developing and commercializing therapies for treating cystic fibrosis.
NOW,0.1539,SERVICENOW INC,"ServiceNow, Inc. provides enterprise cloud computing solutions that defines, structures, consolidates, manages, and automates services for enterprises worldwide."
