,dist,conm,busdesc
HLT,0.0,HILTON WORLDWIDE HOLDINGS,"Hilton Worldwide Holdings Inc., a hospitality company, owns, leases, manages, develops, and franchises hotels and resorts. It operates through two segments, Management and Franchise, and Ownership. The company engages in the hotel management and licensing of its brands."
DAL,0.0142,DELTA AIR LINES INC,"Delta Air Lines, Inc. provides scheduled air transportation for passengers and cargo in the United States and internationally. The company operates through two segments, Airline and Refinery. Its domestic network centered on core hubs in Atlanta, Minneapolis-St."
IRM,0.0146,IRON MOUNTAIN INC,"Iron Mountain Incorporated (NYSE: IRM), founded in 1951, is the global leader for storage and information management services."
AON,0.0177,AON PLC,"Aon plc, a professional services firm, provides advice and solutions to clients focused on risk, retirement, and health worldwide."
NI,0.0199,NISOURCE INC,"NiSource Inc., an energy holding company, operates as a regulated natural gas and electric utility company in the United States. The company operates through two segments, Gas Distribution Operations and Electric Operations."
TRV,0.0226,TRAVELERS COS INC,"The Travelers Companies, Inc., through its subsidiaries, provides a range of commercial and personal property, and casualty insurance products and services to businesses, government units, associations, and individuals in the United states and internationally."
ORLY,0.0272,O'REILLY AUTOMOTIVE INC,"O'Reilly Automotive, Inc., together with its subsidiaries, engages in the retail of automotive aftermarket parts, tools, supplies, equipment, and accessories in the United States."
WM,0.0278,WASTE MANAGEMENT INC,"Waste Management, Inc., through its subsidiaries, provides waste management environmental services to residential, commercial, industrial, and municipal customers in North America."
GIS,0.0304,GENERAL MILLS INC,"General Mills, Inc. manufactures and markets branded consumer foods worldwide. The company operates in five segments: North America Retail; Convenience Stores & Foodservice; Europe & Australia; Asia & Latin America; and Pet."
ENDP,0.0306,ENDO INTERNATIONAL PLC,Endo International plc manufactures and sells generic and branded pharmaceuticals in the United States and internationally.
LHX,0.0309,L3HARRIS TECHNOLOGIES INC,"L3Harris Technologies, Inc., an aerospace and defense technology company, provides mission-critical solutions for government and commercial customers worldwide."
LYB,0.0312,LYONDELLBASELL INDUSTRIES NV,"LyondellBasell Industries N.V. operates as a chemical company in the United States, Germany, Mexico, Italy, France, Japan, China, the Netherlands, and internationally."
ETR,0.0362,ENTERGY CORP,"Entergy Corporation, together with its subsidiaries, engages in the production and distribution of electricity in the United States. The company generates electricity through gas/oil, nuclear, coal, hydro, and solar power sources."
AES,0.0371,AES CORP (THE),"The AES Corporation operates as a diversified power generation and utility company. It owns and/or operates power plants to generate and sell power to customers, such as utilities, industrial users, and other intermediaries."
OKE,0.0376,ONEOK INC,"ONEOK, Inc., together with its subsidiaries, engages in gathering, processing, storage, and transportation of natural gas in the United States. It operates through Natural Gas Gathering and Processing, Natural Gas Liquids, and Natural Gas Pipelines segments."
PCG,0.0384,PG&E CORP,"PG&E Corporation, through its subsidiary, Pacific Gas and Electric Company, engages in the sale and delivery of electricity and natural gas to customers in northern and central California, the United States."
CMS,0.0386,CMS ENERGY CORP,"CMS Energy Corporation operates as an energy company primarily in Michigan. The company operates in four segments: Electric Utility, Gas Utility, Enterprises, and EnerBank. The Electric Utility segment is involved in the generation, purchase, transmission, distribution, and sale of electricity."
INCY,0.0416,INCYTE CORP,"Incyte Corporation, a biopharmaceutical company, focuses on the discovery, development, and commercialization of various therapeutics in the United States."
HOG,0.0416,HARLEY-DAVIDSON INC,"Harley-Davidson, Inc. manufactures and sells custom, cruiser, and touring motorcycles. The company operates in two segments, Motorcycles and Related Products and Financial Services."
CPB,0.0417,CAMPBELL SOUP CO,"Campbell Soup Company, together with its subsidiaries, engages in the manufacture and market food and beverage products. It operates through Meals & Beverages and Snacks segments. The Meals & Beverages segment engages in the retail and foodservice businesses in the United States and Canada."
IGT,0.0418,INTL GAME TECHNOLOGY PLC,"International Game Technology PLC operates and provides gaming technology products and services worldwide. The company operates through four segments: North America Gaming and Interactive, North America Lottery, International, and Italy."
UAL,0.045,UNITED AIRLINES HOLDINGS INC,"United Airlines Holdings, Inc., through its subsidiaries, provides air transportation services in North America, Asia, Europe, Africa, the Pacific, the Middle East, and Latin America. It transports people and cargo through its mainline and regional fleets."
HBI,0.0456,HANESBRANDS INC,"Hanesbrands Inc., a consumer goods company, designs, manufactures, sources, and sells a range of basic apparel for men, women, and children in the United States. The company operates through three segments: Innerwear, Activewear, and International."
CTLT,0.0457,CATALENT INC,"Catalent, Inc., together with its subsidiaries, provides delivery technologies and development solutions for drugs, biologics, and consumer and animal health products worldwide."
EIX,0.047,EDISON INTERNATIONAL,"Edison International, through its subsidiaries, engages in the generation, transmission, and distribution of electricity in the United States. The company generates electricity through hydroelectric, diesel/liquid petroleum gas, natural gas, nuclear, and photovoltaic sources."
COL,0.0476,ROCKWELL COLLINS,"Collins Aerospace designs, produces and supports communication and aviation systems worldwide."
RJF,0.0485,RAYMOND JAMES FINANCIAL CORP,"Raymond James Financial, Inc., through its subsidiaries, engages in the underwriting, distribution, trading, and brokerage of equity and debt securities in the United States, Canada, and Europe."
XEL,0.0485,XCEL ENERGY INC,"Xcel Energy Inc., through its subsidiaries, generates, purchases, transmits, distributes, and sells electricity. It operates through Regulated Electric Utility, Regulated Natural Gas Utility, and All Other segments."
DISH,0.0496,DISH NETWORK CORP,"DISH Network Corporation, together with its subsidiaries, provides pay-TV services in the United States. The company operates in two segments, Pay-TV and Wireless."
GL,0.0501,GLOBE LIFE INC,"Globe Life Inc., through its subsidiaries, provides various life and supplemental health insurance products, and annuities to lower middle to middle income households in the United States."
ROK,0.0504,ROCKWELL AUTOMATION,"Rockwell Automation, Inc. provides industrial automation and digital transformation solutions. The company operates in two segments, Architecture & Software, and Control Products & Solutions."
NLSN,0.0514,NIELSEN HOLDINGS PLC,"Nielsen Holdings plc, together with its subsidiaries, operates as a measurement and data analytics company worldwide. It operates in two segments, Connect and Media."
APTV,0.0519,APTIV PLC,"Aptiv PLC designs, manufacturers, and sells vehicle components worldwide. The company provides electrical, electronic, and safety technology solutions to the automotive and commercial vehicle markets."
EXC,0.0525,EXELON CORP,"Exelon Corporation, a utility services holding company, engages in the generation and marketing of energy in the United States and Canada. It owns nuclear, fossil, wind, hydroelectric, biomass, and solar generating facilities."
MTD,0.0534,METTLER-TOLEDO INTL INC,"Mettler-Toledo International Inc. manufactures and supplies precision instruments and services worldwide. It operates in five segments: U.S. Operations, Swiss Operations, Western European Operations, Chinese Operations, and Other."
NOC,0.0535,NORTHROP GRUMMAN CORP,Northrop Grumman Corporation operates as a security company.
VIAB,0.0538,VIACOM INC,"As of December 4, 2019, Viacom Inc. was acquired by CBS Corporation. Viacom Inc. operates media brands that create entertainment content worldwide. It operates in two segments, Media Networks and Filmed Entertainment."
SHW,0.0541,SHERWIN-WILLIAMS CO,"The Sherwin-Williams Company develops, manufactures, distributes, and sells paints, coatings, and related products to professional, industrial, commercial, and retail customers. It operates in three segments: The Americas Group, Consumer Brands Group, and Performance Coatings Group."
AFL,0.0555,AFLAC INC,"Aflac Incorporated, through its subsidiaries, provides supplemental health and life insurance products. It operates through two segments, Aflac Japan and Aflac U.S."
MON,0.0557,MONSANTO CO,"Monsanto Company, together with its subsidiaries, provides agricultural products for farmers worldwide. It operates in two segments, Seeds and Genomics, and Agricultural Productivity."
DPS,0.0565,DR PEPPER SNAPPLE GROUP INC,"As of 2018, Dr Pepper Snapple Group, Inc is acquired by Keurig Dr Pepper Inc. Dr Pepper Snapple Group, Inc. manufactures and distributes non-alcoholic beverages in the United States, Mexico and the Caribbean, and Canada."
HSY,0.0576,HERSHEY CO,"The Hershey Company, together with its subsidiaries, manufactures and sells confectionery products. The company operates through two segments, North America; and International and Other."
PEP,0.0578,PEPSICO INC,"PepsiCo, Inc. operates as a food and beverage company worldwide. The company operates through seven segments: FLNA, QFNA, PBNA, LatAm, Europe, AMESA, and APAC."
IBM,0.0597,INTL BUSINESS MACHINES CORP,International Business Machines Corporation provides integrated solutions and services worldwide.
WRB,0.0605,BERKLEY (W R) CORP,"W. R. Berkley Corporation, an insurance holding company, operates as a commercial lines writer in the United States and internationally. It operates through two segments, Insurance and Reinsurance & Monoline Excess."
FE,0.0615,FIRSTENERGY CORP,"FirstEnergy Corp., through its subsidiaries, generates, transmits, and distributes electricity in the United States. The company operates through Regulated Distribution and Regulated Transmission segments."
RHT,0.0618,RED HAT INC,"Red Hat, Inc. provides open source software solutions to develop and offer operating system, virtualization, management, middleware, cloud, and storage technologies to various enterprises worldwide."
AEP,0.0626,AMERICAN ELECTRIC POWER CO,"American Electric Power Company, Inc., an electric public utility holding company, engages in the generation, transmission, and distribution of electricity for sale to retail and wholesale customers in the United States."
LUMN,0.063,CENTURYLINK INC,"Lumen Technologies, Inc., a facilities-based communications company, provides various integrated services under 'CenturyLink' name to business and residential customers in the United States and internationally."
HOLX,0.0684,HOLOGIC INC,"Hologic, Inc. develops, manufactures, and supplies diagnostics products, medical imaging systems, and surgical products for women's health through early detection and treatment in the United States, Europe, the Asia-Pacific, and internationally."
HII,0.0726,HUNTINGTON INGALLS IND INC,"Huntington Ingalls Industries, Inc. engages in the designing, building, overhauling, and repairing military ships in the United States. It operates through three segments: Ingalls Shipbuilding, Newport News Shipbuilding, and Technical Solutions."
ED,0.0739,CONSOLIDATED EDISON INC,"Consolidated Edison, Inc., through its subsidiaries, engages in regulated electric, gas, and steam delivery businesses in the United States."
VIAC,0.0744,VIACOMCBS INC,"ViacomCBS Inc. operates as a media and entertainment company worldwide. The company operates in four segments: TV Entertainment, Cable Networks, Filmed Entertainment, and Publishing."
CNP,0.075,CENTERPOINT ENERGY INC,"CenterPoint Energy, Inc. operates as a public utility holding company in the United States. The company's Houston Electric T&D segment electric transmission and distribution services to electric utility."
WEN,0.0836,WENDY'S CO,"The Wendy's Company, together with its subsidiaries, operates as a quick-service restaurant company. It operates through three segments: Wendy's U.S., Wendy's International, and Global Real Estate & Development."
COF,0.0965,CAPITAL ONE FINANCIAL CORP,"Capital One Financial Corporation operates as the financial services holding company for the Capital One Bank (USA), National Association; and Capital One, National Association, which provides various financial products and services in the United States, the United Kingdom, and Canada."
AXP,0.1023,AMERICAN EXPRESS CO,"American Express Company, together with its subsidiaries, provides charge and credit payment card products, and travel-related services worldwide. The company operates through three segments: Global Consumer Services Group, Global Commercial Services, and Global Merchant and Network Services."
URI,0.1108,UNITED RENTALS INC,"United Rentals, Inc., through its subsidiaries, operates as an equipment rental company. It operates in two segments, General Rentals; and Trench, Power and Fluid Solutions."
SYF,0.1176,SYNCHRONY FINANCIAL,"Synchrony Financial operates as a consumer financial services company in the United States. It delivers a range of specialized financing programs and consumer banking products to digital, retail, home, auto, travel, health, and pet industries."
