,dist,conm,busdesc
XRX,0.0,XEROX HOLDINGS CORP,"Xerox Holdings Corporation designs, develops, and sells document management systems and solutions in the United States, Europe, Canada, and internationally."
TIN,0.0046,TEMPLE-INLAND INC,"Temple-Inland LLC went out of business. Temple-Inland LLC, through its subsidiaries, manufactures and sells corrugated packaging and building products in the United States and Mexico."
YUM,0.0056,YUM BRANDS INC,"YUM! Brands, Inc., together with its subsidiaries, develops, operates, and franchises quick service restaurants worldwide. It operates in three segments: the KFC Division, the Pizza Hut Division, and the Taco Bell Division."
SCHW,0.0072,SCHWAB (CHARLES) CORP,"The Charles Schwab Corporation, through its subsidiaries, provides wealth management, securities brokerage, banking, asset management, custody, and financial advisory services. The company operates through two segments, Investor Services and Advisor Services."
AXP,0.0079,AMERICAN EXPRESS CO,"American Express Company, together with its subsidiaries, provides charge and credit payment card products, and travel-related services worldwide. The company operates through three segments: Global Consumer Services Group, Global Commercial Services, and Global Merchant and Network Services."
ETFC,0.0113,E TRADE FINANCIAL CORP,"E*TRADE Financial Corporation, a financial services company, provides brokerage, and related products and services for traders, investors, registered investment advisors (RIAs), and stock plan administrators and participants."
PCG,0.0115,PG&E CORP,"PG&E Corporation, through its subsidiary, Pacific Gas and Electric Company, engages in the sale and delivery of electricity and natural gas to customers in northern and central California, the United States."
PFG,0.0115,PRINCIPAL FINANCIAL GRP INC,"Principal Financial Group, Inc. provides retirement, asset management, and insurance products and services to businesses, individuals, and institutional clients worldwide. The company operates through Retirement and Income Solutions, Principal Global Investors, Principal International, and U.S."
AIG,0.0119,AMERICAN INTERNATIONAL GROUP,"American International Group, Inc. provides insurance products for commercial, institutional, and individual customers in North America and internationally."
K,0.012,KELLOGG CO,"Kellogg Company, together with its subsidiaries, manufactures and markets ready-to-eat cereal and convenience foods. The company operates through four segments: North America, Europe, Latin America, and Asia Middle East Africa."
BLL,0.012,BALL CORP,"Ball Corporation supplies aluminum packaging products to the beverage, personal care, automotive, paint, healthcare, and household products industries."
AIZ,0.0124,ASSURANT INC,"Assurant, Inc., together with its subsidiaries, provides lifestyle and housing solutions that support, protect, and connect consumer purchases in North America, Latin America, Europe, and the Asia Pacific."
CNP,0.0129,CENTERPOINT ENERGY INC,"CenterPoint Energy, Inc. operates as a public utility holding company in the United States. The company's Houston Electric T&D segment electric transmission and distribution services to electric utility."
WHR,0.0131,WHIRLPOOL CORP,"Whirlpool Corporation manufactures and markets home appliances and related products. It operates through four segments: North America; Europe, Middle East and Africa; Latin America; and Asia."
HIG,0.015,HARTFORD FINANCIAL SERVICES,"The Hartford Financial Services Group, Inc. provides insurance and financial services to individual and business customers in the United States and internationally."
MET,0.015,METLIFE INC,"MetLife, Inc. engages in the insurance, annuities, employee benefits, and asset management businesses worldwide. It operates through five segments: U.S.; Asia; Latin America; Europe, the Middle East and Africa; and MetLife Holdings."
GT,0.0163,GOODYEAR TIRE & RUBBER CO,"The Goodyear Tire & Rubber Company, together with its subsidiaries, develops, manufactures, distributes, and sells tires and related products and services worldwide."
DE,0.0172,DEERE & CO,"Deere & Company, together with its subsidiaries, manufactures and distributes various equipment worldwide. The company operates through three segments: Agriculture and Turf, Construction and Forestry, and Financial Services."
APTV,0.0181,APTIV PLC,"Aptiv PLC designs, manufacturers, and sells vehicle components worldwide. The company provides electrical, electronic, and safety technology solutions to the automotive and commercial vehicle markets."
CMS,0.0185,CMS ENERGY CORP,"CMS Energy Corporation operates as an energy company primarily in Michigan. The company operates in four segments: Electric Utility, Gas Utility, Enterprises, and EnerBank. The Electric Utility segment is involved in the generation, purchase, transmission, distribution, and sale of electricity."
CL,0.0187,COLGATE-PALMOLIVE CO,"Colgate-Palmolive Company, together with its subsidiaries, manufactures and sells consumer products worldwide. The company operates through two segments, Oral, Personal and Home Care; and Pet Nutrition."
PRU,0.0193,PRUDENTIAL FINANCIAL INC,"Prudential Financial, Inc., through its subsidiaries, provides insurance, investment management, and other financial products and services."
RJF,0.0194,RAYMOND JAMES FINANCIAL CORP,"Raymond James Financial, Inc., through its subsidiaries, engages in the underwriting, distribution, trading, and brokerage of equity and debt securities in the United States, Canada, and Europe."
GE,0.02,GENERAL ELECTRIC CO,"General Electric Company operates as a high-tech industrial company in the United States, Europe, Asia, the Americas, the Middle East, and Africa. It operates through Power, Renewable Energy, Aviation, Healthcare, and Capital segments."
WLTW,0.0205,WILLIS TOWERS WATSON PLC,"Willis Towers Watson Public Limited Company operates as an advisory, broking, and solutions company worldwide."
CI,0.0206,CIGNA CORP,"Cigna Corporation provides insurance and related products and services. It operates through Health Services, Integrated Medical, International Markets, and Group Disability and Other segments."
AFL,0.0208,AFLAC INC,"Aflac Incorporated, through its subsidiaries, provides supplemental health and life insurance products. It operates through two segments, Aflac Japan and Aflac U.S."
LNC,0.0217,LINCOLN NATIONAL CORP,"Lincoln National Corporation, through its subsidiaries, operates multiple insurance and retirement businesses in the United States. It operates through four segments: Annuities, Retirement Plan Services, Life Insurance, and Group Protection."
DVA,0.0224,DAVITA INC,DaVita Inc. provides kidney dialysis services for patients suffering from chronic kidney failure or end stage renal disease (ESRD). The company operates kidney dialysis centers and provides related lab services in outpatient dialysis centers.
COF,0.0225,CAPITAL ONE FINANCIAL CORP,"Capital One Financial Corporation operates as the financial services holding company for the Capital One Bank (USA), National Association; and Capital One, National Association, which provides various financial products and services in the United States, the United Kingdom, and Canada."
BA,0.0246,BOEING CO,"The Boeing Company, together with its subsidiaries, designs, develops, manufactures, sales, services, and supports commercial jetliners, military aircraft, satellites, missile defense, human space flight and launch systems, and services worldwide."
PBI,0.0253,PITNEY BOWES INC,"Pitney Bowes Inc., a technology company, provides commerce solutions in the United States and internationally. The company operates through Global Ecommerce, Presort Services and SendTech Solutions segments."
DJ,0.0253,DOW JONES & CO INC,"Dow Jones & Company, Inc. offers business and financial news and information globally to consumers and organizations worldwide. It provides solutions through newspapers, newswires, Websites, applications, newsletters, magazines, databases, and conferences."
ALL,0.0257,ALLSTATE CORP,"The Allstate Corporation, through its subsidiaries, provides property and casualty, and other insurance products in the United States and Canada. The company operates through Allstate Protection, Service Businesses, Allstate Life, and Allstate Benefits segments."
UNM,0.0264,UNUM GROUP,"Unum Group, together with its subsidiaries, provides financial protection benefit solutions in the United States, the United Kingdom, Poland, and internationally. It operates through Unum US, Unum International, Colonial Life, and Closed Block segments."
LVS,0.0272,LAS VEGAS SANDS CORP,"Las Vegas Sands Corp., together with its subsidiaries, develops, owns, and operates integrated resorts in Asia and the United States."
F,0.0274,FORD MOTOR CO,"Ford Motor Company designs, manufactures, markets, and services a range of Ford cars, trucks, sport utility vehicles, electrified vehicles, and Lincoln luxury vehicles worldwide. It operates through three segments: Automotive, Mobility, and Ford Credit."
GR,0.0282,GOODRICH CORP,"Goodrich Corporation supplies aerospace components, systems, and services for the commercial and general aviation airplane, and defense and space markets primarily in the United States, Europe, Canada, and the Asia Pacific."
GM,0.0282,GENERAL MOTORS CO,"General Motors Company designs, builds, and sells cars, trucks, crossovers, and automobile parts worldwide. The company operates through GM North America, GM International, Cruise, and GM Financial segments."
AON,0.0283,AON PLC,"Aon plc, a professional services firm, provides advice and solutions to clients focused on risk, retirement, and health worldwide."
CNX,0.0286,CNX RESOURCES CORPORATION,"CNX Resources Corporation, an independent oil and gas company, explores for, develops, and produces natural gas properties primarily in the Appalachian Basin. The company operates through two divisions, Exploration and Production (E&P), and Midstream."
APH,0.0288,AMPHENOL CORP,"Amphenol Corporation, together with its subsidiaries, primarily designs, manufactures, and markets electrical, electronic, and fiber optic connectors in the United States, China, and internationally."
FMC,0.029,FMC CORP,"FMC Corporation, an agricultural sciences company, provides crop protection, plant health, and professional pest and turf management products."
IT,0.0311,GARTNER INC,"Gartner, Inc. operates as a research and advisory company. It operates through three segments: Research, Conferences, and Consulting."
WMB,0.0315,WILLIAMS COS INC,"The Williams Companies, Inc., together with its subsidiaries, operates as an energy infrastructure company primarily in the United States. It operates through Atlantic-Gulf, Northeast G&P, and West segments."
EIX,0.0315,EDISON INTERNATIONAL,"Edison International, through its subsidiaries, engages in the generation, transmission, and distribution of electricity in the United States. The company generates electricity through hydroelectric, diesel/liquid petroleum gas, natural gas, nuclear, and photovoltaic sources."
PPL,0.0317,PPL CORP,"PPL Corporation, a utility holding company, delivers electricity and natural gas in the United States and the United Kingdom. The company operates through three segments: U.K. Regulated, Kentucky Regulated, and Pennsylvania Regulated."
CB,0.0318,CHUBB LTD,"Chubb Limited, through its subsidiaries, provides insurance and reinsurance products worldwide."
AES,0.0335,AES CORP (THE),"The AES Corporation operates as a diversified power generation and utility company. It owns and/or operates power plants to generate and sell power to customers, such as utilities, industrial users, and other intermediaries."
WDC,0.0352,WESTERN DIGITAL CORP,"Western Digital Corporation develops, manufactures, and sells data storage devices and solutions."
CPB,0.0353,CAMPBELL SOUP CO,"Campbell Soup Company, together with its subsidiaries, engages in the manufacture and market food and beverage products. It operates through Meals & Beverages and Snacks segments. The Meals & Beverages segment engages in the retail and foodservice businesses in the United States and Canada."
AVP,0.0356,AVON PRODUCTS,"Avon Products, Inc. manufactures, markets, and sells beauty and related products in Europe, the Middle East, Africa, south Latin America, north Latin America, and the Asia Pacific."
DAL,0.0362,DELTA AIR LINES INC,"Delta Air Lines, Inc. provides scheduled air transportation for passengers and cargo in the United States and internationally. The company operates through two segments, Airline and Refinery. Its domestic network centered on core hubs in Atlanta, Minneapolis-St."
TRV,0.0363,TRAVELERS COS INC,"The Travelers Companies, Inc., through its subsidiaries, provides a range of commercial and personal property, and casualty insurance products and services to businesses, government units, associations, and individuals in the United states and internationally."
DNB,0.0373,DUN & BRADSTREET HOLDNGS INC,"Dun & Bradstreet Holdings, Inc. provides business decisioning data and analytics in North America and internationally."
HPC,0.0388,HERCULES INC,"Hercules Incorporated manufactures and markets chemical specialties used in making products for home, office, and industrial markets. It operates in two segments, Paper Technologies and Ventures (PTV), and Aqualon Group (Aqualon)."
FDC,0.0391,FIRST DATA CORP,"First Data Corporation provides commerce enabled technology and solutions for merchants, financial institutions, and card issuers in the United States, Canada, Europe, the Middle East, Africa, Latin America, and the Asia Pacific."
NRG,0.0409,NRG ENERGY INC,"NRG Energy, Inc., together with its subsidiaries, operates as an energy company in the United States. It operates through Generation and Retail segments."
C,0.0411,CITIGROUP INC,"Citigroup Inc., a diversified financial services holding company, provides various financial products and services to consumers, corporations, governments, and institutions in North America, Latin America, Asia, Europe, the Middle East, and Africa."
EFX,0.0412,EQUIFAX INC,"Equifax Inc. provides information solutions and human resources business process outsourcing services for businesses, governments, and consumers. The company operates through four segments: U.S. Information Solutions (USIS), Workforce Solutions, International, and Global Consumer Solutions."
CLF,0.0412,CLEVELAND-CLIFFS INC,"Cleveland-Cliffs Inc. operates as an independent iron ore mining company in the United States, Canada, and internationally. It operates in two segments, Mining and Pelletizing, and Metallics."
SBAC,0.0419,SBA COMMUNICATIONS CORP,"SBA Communications Corporation is a first choice provider and leading owner and operator of wireless communications infrastructure in North, Central, and South America and South Africa."
CME,0.0427,CME GROUP INC,"CME Group Inc., through its subsidiaries, operates contract markets for the trading of futures and options on futures contracts worldwide."
AKS,0.0482,AK STEEL HOLDING CORP,"AK Steel Holding Corporation, through its subsidiary, AK Steel Corporation, produces flat-rolled carbon, and stainless and electrical steel products in the United States and internationally."
AAL,0.0508,AMERICAN AIRLINES GROUP INC,"American Airlines Group Inc., through its subsidiaries, operates as a network air carrier. It provides scheduled air transportation services for passengers and cargo. As of December 31, 2019, the company operated a mainline fleet of 942 aircraft."
EVRG,0.0518,EVERGY INC,"Evergy, Inc., through its subsidiaries, engages in the generation, transmission, distribution, and sale of electricity in Kansas and Missouri."
DISH,0.0531,DISH NETWORK CORP,"DISH Network Corporation, together with its subsidiaries, provides pay-TV services in the United States. The company operates in two segments, Pay-TV and Wireless."
CIT,0.0542,CIT GROUP INC,"CIT Group Inc. operates as the holding company for CIT Bank, N.A. that provides banking and related services to commercial and individual customers. The company operates through Commercial Banking and Consumer Banking segments."
CRM,0.0589,SALESFORCE.COM INC,"salesforce.com, inc. develops enterprise cloud computing solutions with a focus on customer relationship management worldwide."
LVLT,0.0644,LEVEL 3 COMMUNICATIONS INC,"Level 3 Parent, LLC provides various integrated communications services for enterprise, government, wholesale, and small and medium business customers in North America, Latin America, Europe, the Asia Pacific, the Middle East, and Africa."
UAL,0.0693,UNITED AIRLINES HOLDINGS INC,"United Airlines Holdings, Inc., through its subsidiaries, provides air transportation services in North America, Asia, Europe, Africa, the Pacific, the Middle East, and Latin America. It transports people and cargo through its mainline and regional fleets."
MS,0.0704,MORGAN STANLEY,"Morgan Stanley, a financial holding company, provides various financial products and services to corporations, governments, financial institutions, and individuals in the Americas, Europe, the Middle East, Africa, and Asia."
GS,0.071,GOLDMAN SACHS GROUP INC,"The Goldman Sachs Group, Inc. operates as an investment banking, securities, and investment management company worldwide. It operates in four segments: Investment Banking, Global Markets, Asset Management, and Consumer & Wealth Management."
LO,0.0741,LORILLARD INC,"Lorillard, LLC, through its subsidiaries, manufactures and sells cigarettes in the United States. It operates through two segments, Cigarettes and Electronic Cigarettes."
AMZN,0.0774,AMAZON.COM INC,"Amazon.com, Inc. engages in the retail sale of consumer products and subscriptions in North America and internationally. The company operates through three segments: North America, International, and Amazon Web Services (AWS)."
MCO,0.0968,MOODY'S CORP,"Moody's Corporation provides credit ratings and assessment services; and credit, capital markets, and economic research, data, and analytical tools worldwide. It operates through two segments, Moody's Investors Service and Moody's Analytics."
VTR,0.1055,VENTAS INC,"Ventas, an S&P 500 company, operates at the intersection of two powerful and dynamic industries - healthcare and real estate."
NAVI,0.1075,NAVIENT CORP,"Navient Corporation provides education loan management and business processing solutions for education, healthcare, and government clients at the federal, state, and local levels in the United States."
AKAM,0.1851,AKAMAI TECHNOLOGIES INC,"Akamai Technologies, Inc. provides cloud services for delivering, optimizing, and securing content and business applications over the Internet in the United States and internationally."
