,dist,conm,busdesc
BIO,0.0,BIO-RAD LABORATORIES INC,"Bio-Rad Laboratories, Inc. develops, manufactures, and markets products and solutions for the life science research and clinical diagnostic markets in Europe, the United States, Canada, and Latin America."
DGX,0.0017,QUEST DIAGNOSTICS INC,"Quest Diagnostics Incorporated provides diagnostic testing, information, and services in the United States and internationally."
EW,0.0031,EDWARDS LIFESCIENCES CORP,"Edwards Lifesciences Corporation provides products and technologies for structural heart disease, and critical care and surgical monitoring in the United States and internationally."
SYK,0.0058,STRYKER CORP,"Stryker Corporation operates as a medical technology company. The company operates through three segments: Orthopaedics, MedSurg, and Neurotechnology and Spine. The Orthopaedics segment provides implants for use in hip and knee joint replacements, and trauma and extremities surgeries."
BHI,0.0075,BAKER HUGHES INC,"Baker Hughes Holdings LLC operates as an energy technology company. The company operates through four segments: Oilfield Services, Oilfield Equipment, Turbomachinery & Process Solutions, and Digital Solutions."
EL,0.0099,LAUDER (ESTEE) COS INC -CL A,"The Estee Lauder Companies Inc. manufactures and markets skin care, makeup, fragrance, and hair care products worldwide."
VAR,0.0109,VARIAN MEDICAL SYSTEMS INC,"Varian Medical Systems, Inc. designs, manufactures, sells, and services medical devices and software products for treating cancer and other medical conditions worldwide. It operates through Oncology Systems and Proton Solutions segments."
IEX,0.0115,IDEX CORP,"IDEX Corporation, together with its subsidiaries, operates as an applied solutions company worldwide. The company operates through three segments: Fluid & Metering Technologies (FMT), Health & Science Technologies (HST), and Fire & Safety/Diversified Products (FSDP)."
SSP,0.0118,EW SCRIPPS  -CL A,"The E.W. Scripps Company, together with its subsidiaries, operates as a media enterprise through a portfolio of local and national media brands. The company operates through Local Media, National Media, and Other segments."
GHC,0.0137,GRAHAM HOLDINGS CO,"Graham Holdings Company, through its subsidiaries, operates as a diversified education and media company worldwide."
VMC,0.0139,VULCAN MATERIALS CO,"Vulcan Materials Company produces and supplies construction materials primarily in the United States. The company operates through four segments: Aggregates, Asphalt, Concrete, and Calcium."
DOV,0.0142,DOVER CORP,"Dover Corporation provides equipment and components, consumable supplies, aftermarket parts, software and digital solutions, and support services worldwide."
CTXS,0.0148,CITRIX SYSTEMS INC,"Citrix Systems, Inc. provides workspace, networking, and professional services worldwide."
GPC,0.0152,GENUINE PARTS CO,"Genuine Parts Company distributes automotive replacement parts, industrial parts and materials, and business products in the United States, Canada, Mexico, Australasia, France, the United Kingdom, Germany, Poland, the Netherlands, and Belgium."
CAM,0.016,CAMERON INTERNATIONAL CORP,"Cameron International Corporation provides flow equipment products, systems, and services worldwide."
COO,0.0162,COOPER COS INC (THE),"The Cooper Companies, Inc. operates as a medical device company worldwide. It operates through CooperVision and CooperSurgical business units."
S,0.0172,SPRINT CORP,"Sprint Corporation provides a range of wireless and wireline communications products and services to consumers, businesses, government subscribers, and resellers in the United States, Puerto Rico, and the United States Virgin Islands. It operates in two segments, Wireless and Wireline."
ODFL,0.0173,OLD DOMINION FREIGHT,"Old Dominion Freight Line, Inc. operates as a less-than-truckload (LTL) motor carrier in the United States and North America. It provides regional, inter-regional, and national LTL services, including expedited transportation."
IVZ,0.0174,INVESCO LTD,Invesco Ltd. is a publicly owned investment manager.
LOW,0.0175,LOWE'S COS INC,"Lowe's Companies, Inc., together with its subsidiaries, operates as a home improvement retailer in the United States, Canada, and Mexico. The company offers a line of products for construction, maintenance, repair, remodeling, and decorating."
MHK,0.0181,MOHAWK INDUSTRIES INC,"Mohawk Industries, Inc. designs, manufactures, sources, distributes, and markets flooring products for remodeling and new constructions of residential and commercial spaces in the United States, Europe, Russia, and internationally."
NLOK,0.0186,NORTONLIFELOCK INC,NortonLifeLock Inc. provides cyber safety solutions for consumers worldwide.
CVS,0.0189,CVS HEALTH CORP,CVS Health Corporation provides health services and plans in the United States.
KSS,0.0216,KOHL'S CORP,"Kohl's Corporation operates as a retail company in the United States. Its stores and Website offer apparel, footwear, accessories, beauty, and home products. The company provides its products primarily under the brand names of Apt."
BSX,0.0219,BOSTON SCIENTIFIC CORP,"Boston Scientific Corporation develops, manufactures, and markets medical devices for use in various interventional medical specialties worldwide. It operates through three segments: MedSurg, Rhythm and Neuro, and Cardiovascular."
DG,0.0225,DOLLAR GENERAL CORP,"Dollar General Corporation, a discount retailer, provides various merchandise products in the southern, southwestern, Midwestern, and eastern United States."
CHRW,0.0228,C H ROBINSON WORLDWIDE INC,"C.H. Robinson Worldwide, Inc., a third party logistics company, provides freight transportation services and logistics solutions to companies in various industries worldwide. The company operates through North American Surface Transportation and Global Forwarding segments."
TMO,0.0236,THERMO FISHER SCIENTIFIC INC,"Thermo Fisher Scientific Inc. provides analytical and other instruments, laboratory equipment, software, consumables, reagents, instrument systems, chemicals, supplies, and services worldwide."
XOM,0.0252,EXXON MOBIL CORP,"Exxon Mobil Corporation explores for and produces crude oil and natural gas in the United States, Canada/other Americas, Europe, Africa, Asia, and Australia/Oceania. It operates through Upstream, Downstream, and Chemical segments."
HPQ,0.0253,HP INC,"HP Inc., together with its subsidiaries, provides personal computing and other access devices, imaging and printing products, and related technologies, solutions, and services in the United States and internationally."
RMD,0.0257,RESMED INC,"ResMed Inc. develops, manufactures, distributes, and markets medical devices and cloud-based software applications that diagnose, treat, and manage respiratory disorders comprising sleep apnea, chronic obstructive pulmonary disease, neuromuscular disease, and other chronic diseases."
HSIC,0.026,HENRY SCHEIN INC,"Henry Schein, Inc., a solutions company for health care professionals, provides health care products and services to office-based dental practitioners and laboratories, physician practices, government, institutional health care clinics, and other alternate care clinics worldwide."
SNPS,0.0262,SYNOPSYS INC,"Synopsys, Inc. provides electronic design automation software products used to design and test integrated circuits."
SEE,0.0265,SEALED AIR CORP,"Sealed Air Corporation provides food safety and security, and product protection solutions and equipment in North America, South America, Europe, the Middle East, Africa, and the Asia Pacific. It operates in two segments, Food Care and Product Care."
PCL,0.0271,PLUM CREEK TIMBER CO INC,"As on February 19, 2016, Plum Creek Timber Co. Inc. was acquired by Weyerhaeuser Co. Plum Creek Timber Company, Inc. is a privately owned real estate investment trust (REIT). The trust owns and manages timberlands in the United States."
TWX,0.0274,TIME WARNER INC,"Warner Media operates as a media and entertainment company worldwide. It operates in three segments: Turner, Home Box Office, and Warner Bros. The Turner segment creates and programs branded news, entertainment, sports, and kids multi-platform content for consumers."
TFX,0.0279,TELEFLEX INC,"Teleflex Incorporated designs, develops, manufactures, and supplies single-use medical devices for common diagnostic and therapeutic procedures in critical care and surgical applications worldwide."
AMCR,0.029,AMCOR PLC,"Amcor plc develops, manufactures, and sells various packaging products for food, beverage, medical and pharmaceutical, fresh produce, snack food, personal care, and other industries worldwide. It operates through two segments, Flexibles and Rigid Packaging."
HRL,0.0293,HORMEL FOODS CORP,"Hormel Foods Corporation produces and markets various meat and food products to retail, foodservice, deli, and commercial customers in the United States and internationally."
DHR,0.0293,DANAHER CORP,"Danaher Corporation designs, manufactures, and markets professional, medical, industrial, and commercial products and services worldwide. The company operates through three segments; Life Sciences, Diagnostics, and Environmental & Applied Solutions."
LEG,0.0293,LEGGETT & PLATT INC,"Leggett & Platt, Incorporated designs and produces various engineered components and products worldwide. It operates through three segments: Bedding Products; Furniture, Flooring & Textile Products; and Specialized Products."
EXPE,0.0294,EXPEDIA GROUP INC,"Expedia Group, Inc. operates as an online travel company worldwide. It operates through four segments: Core Online Travel Agencies, Trivago, Vrbo, and Egencia."
CERN,0.0295,CERNER CORP,"Cerner Corporation, together with its subsidiaries, provides health care information technology solutions and tech-enabled services in the United States and internationally."
JNJ,0.0305,JOHNSON & JOHNSON,"Johnson & Johnson researches and develops, manufactures, and sells various products in the health care field worldwide. It operates in three segments: Consumer, Pharmaceutical, and Medical Devices."
RIG,0.0305,TRANSOCEAN LTD,"Transocean Ltd., together with its subsidiaries, provides offshore contract drilling services for oil and gas wells worldwide. The company primarily offers drilling rigs, related equipment, and work crews; and ultra-deepwater and harsh environment drilling services."
NEM,0.0313,NEWMONT CORP,"Newmont Corporation engages in the production and exploration of gold, copper, silver, zinc, and lead. The company has operations and/or assets in the United States, Canada, Mexico, Dominican Republic, Peru, Suriname, Argentina, Chile, Australia, and Ghana."
RDC,0.0342,ROWAN COMPANIES LTD,"Rowan Companies Limited provides offshore contract drilling services to the oil and gas industry. It operates through three segments: Deepwater, Jack-ups, and ARO. The Deepwater segment operates 4 ultra-deepwater drillships. The Jack-ups segment operates 15 self-elevating jack-up rigs."
MWW,0.0345,MONSTER WORLDWIDE INC,"Monster Worldwide, Inc., together with its subsidiaries, provides online and mobile employment and recruitment solutions worldwide. The company operates in three segments: Careers-North America, Careers-International, and Internet Advertising & Fees."
BDX,0.0347,BECTON DICKINSON & CO,"Becton, Dickinson and Company develops, manufactures, and sells medical supplies, devices, laboratory equipment, and diagnostic products worldwide."
SIG,0.0351,SIGNET JEWELERS LTD,"Signet Jewelers Limited engages in the retail sale of diamond jewelry, watches, and other products. As of February 02, 2019, it operated 3,334 stores and kiosks. The company operates through three segments: North America, International, and Other."
COST,0.0353,COSTCO WHOLESALE CORP,"Costco Wholesale Corporation, together with its subsidiaries, engages in the operation of membership warehouses in the United States, Puerto Rico, Canada, the United Kingdom, Mexico, Japan, Korea, Australia, Spain, France, Iceland, China, and Taiwan."
TSCO,0.0354,TRACTOR SUPPLY CO,Tractor Supply Company operates rural lifestyle retail stores in the United States.
JNPR,0.0355,JUNIPER NETWORKS INC,"Juniper Networks, Inc. designs, develops, and sells network products and services worldwide."
TGNA,0.0355,TEGNA INC,TEGNA Inc. operates as a media company in the United States. The company operates television stations and radio stations that deliver television programming and digital content. It offers content and information to consumers across various platforms.
PWR,0.0363,QUANTA SERVICES INC,"Quanta Services, Inc. provides specialty contracting services in the United States, Canada, Australia, Latin America, and internationally."
LUV,0.0372,SOUTHWEST AIRLINES,Southwest Airlines Co. operates a passenger airline that provides scheduled air transportation services in the United States and near-international markets.
HOG,0.0395,HARLEY-DAVIDSON INC,"Harley-Davidson, Inc. manufactures and sells custom, cruiser, and touring motorcycles. The company operates in two segments, Motorcycles and Related Products and Financial Services."
SGP,0.0397,SCHERING-PLOUGH,"As of November 3, 2009, Schering-Plough Corporation was acquired by Merck & Co. Inc. Schering-Plough Corporation discovers, develops, manufactures, and sells pharmaceuticals worldwide. It operates in three segments: Prescription Pharmaceuticals, Animal Health, and Consumer Health Care."
NVDA,0.0401,NVIDIA CORP,"NVIDIA Corporation operates as a visual computing company worldwide. It operates in two segments, GPU and Tegra Processor."
CNC,0.0406,CENTENE CORP,Centene Corporation operates as a multi-national healthcare enterprise that provides programs and services to under-insured and uninsured individuals in the United States.
MRK,0.0418,MERCK & CO,"Merck & Co., Inc. provides healthcare solutions worldwide."
SLG,0.0457,SL GREEN REALTY CORP,"SL Green Realty Corp., an S&P 500 company and Manhattan's largest office landlord, is a fully integrated real estate investment trust, or REIT, that is focused primarily on acquiring, managing and maximizing value of Manhattan commercial properties."
ORCL,0.0483,ORACLE CORP,Oracle Corporation provides products and services that address enterprise information technology environments worldwide.
EQR,0.0486,EQUITY RESIDENTIAL,"Equity Residential is committed to creating communities where people thrive. The Company, a member of the S&P 500, is focused on the acquisition, development and management of residential properties located in and around dynamic cities that attract high quality long-term renters."
VNO,0.0486,VORNADO REALTY TRUST,Vornado's portfolio is concentrated in the nation's key market - New York City - along with the premier asset in both Chicago and San Francisco. Vornado is also the real estate industry leader in sustainability policy.
DRE,0.0498,DUKE REALTY CORP,Duke Realty Corporation owns and operates approximately 156 million rentable square feet of industrial assets in 20 major logistics markets. Duke Realty Corporation is publicly traded on the NYSE under the symbol DRE and is a member of the S&P 500 Index.
APA,0.051,APACHE CORP,"Apache Corporation, an independent energy company, explores for, develops, and produces natural gas, crude oil, and natural gas liquids (NGLs)."
LSI,0.0562,LIFE STORAGE INC,"Life Storage, Inc. is a self-administered and self-managed equity REIT that is in the business of acquiring and managing self-storage facilities. Located in Buffalo, New York, the Company operates more than 900 storage facilities in 30 states and in the province of Ontario, Canada."
ASN,0.0589,,
AMG,0.0605,AFFILIATED MANAGERS GRP INC,"Affiliated Managers Group, Inc., through its affiliates, operates as an asset management company providing investment management services to mutual funds, institutional clients, and high net worth individuals in the United States. It provides advisory or subadvisory services to mutual funds."
REG,0.0609,REGENCY CENTERS CORP,"Regency Centers is the preeminent national owner, operator, and developer of shopping centers located in affluent and densely populated trade areas."
BIIB,0.0629,BIOGEN INC,"Biogen Inc. discovers, develops, manufactures, and delivers therapies for treating neurological and neurodegenerative diseases worldwide."
A,0.0645,AGILENT TECHNOLOGIES INC,"Agilent Technologies, Inc. provides application focused solutions to the life sciences, diagnostics, and applied chemical markets worldwide."
TER,0.0719,TERADYNE INC,"Teradyne, Inc. designs, develops, manufactures, sells, and supports automatic test equipment worldwide. The company operates through Semiconductor Test, System Test, Industrial Automation, and Wireless Test segments."
KIM,0.0722,KIMCO REALTY CORP,"Kimco Realty Corp. (NYSE:KIM) is a real estate investment trust (REIT) headquartered in Jericho, N.Y. that is one of North America's largest publicly traded owners and operators of open-air, grocery-anchored shopping centers and mixed-use assets."
PEAK,0.0852,HEALTHPEAK PROPERTIES INC,"Healthpeak Properties, Inc. is a fully integrated real estate investment trust (REIT) and S&P 500 company."
PLD,0.0866,PROLOGIS INC,"Prologis, Inc. is the global leader in logistics real estate with a focus on high-barrier, high-growth markets."
WELL,0.0901,WELLTOWER INC,"Welltower Inc. (NYSE:WELL), an S&P 500 company headquartered in Toledo, Ohio, is driving the transformation of health care infrastructure."
ACAS,0.1038,AMERICAN CAPITAL LTD,"American Capital, Ltd. is a business development company specializing in management and employee buyouts, subordinated debt, leveraged finance, mezzanine, acquisition, recapitalization, middle market, early venture, mature, industry consolidation, and growth capital investments."
