,dist,conm,busdesc
NI,0.0,NISOURCE INC,"NiSource Inc., an energy holding company, operates as a regulated natural gas and electric utility company in the United States. The company operates through two segments, Gas Distribution Operations and Electric Operations."
FLS,0.003,FLOWSERVE CORP,"Flowserve Corporation designs, develops, manufactures, distributes, and services industrial flow management equipment in the United States, Europe, the Middle East, Africa, Asia, and internationally."
SRE,0.0099,SEMPRA ENERGY,"Sempra Energy operates as an energy-services holding company in the United States and internationally. The company's San Diego Gas & Electric Company segment generates, transmits, and distributes electricity; and supplies natural gas."
ES,0.0115,EVERSOURCE ENERGY,"Eversource Energy, a public utility holding company, engages in the energy delivery business. The company operates in four segments: Electric Distribution, Electric Transmission, Natural Gas Distribution, and Water Distribution."
OMC,0.0134,OMNICOM GROUP,"Omnicom Group Inc., together with its subsidiaries, provides advertising, marketing, and corporate communications services. It provides a range of services in the areas of advertising, customer relationship management, public relations, and healthcare."
RE,0.0134,EVEREST RE GROUP LTD,"Everest Re Group, Ltd., through its subsidiaries, provides reinsurance and insurance products in the United States, Bermuda, and internationally. The company operates through four segments: U.S. Reinsurance, International, Bermuda, and Insurance. The U.S."
CAT,0.014,CATERPILLAR INC,"Caterpillar Inc. manufactures and sells construction and mining equipment, diesel and natural gas engines, and industrial gas turbines."
TRV,0.014,TRAVELERS COS INC,"The Travelers Companies, Inc., through its subsidiaries, provides a range of commercial and personal property, and casualty insurance products and services to businesses, government units, associations, and individuals in the United states and internationally."
BTU,0.0143,PEABODY ENERGY CORP,"Peabody Energy Corporation engages in coal mining business. The company operates through Seaborne Thermal Mining, Seaborne Metallurgical Mining, Powder River Basin Mining, Midwestern U.S. Mining, Western U.S. Mining, and Corporate and Other segments."
HST,0.0143,HOST HOTELS & RESORTS INC,"Host Hotels & Resorts, Inc. is an S&P 500 company and is the largest lodging real estate investment trust and one of the largest owners of luxury and upper-upscale hotels."
BA,0.0148,BOEING CO,"The Boeing Company, together with its subsidiaries, designs, develops, manufactures, sales, services, and supports commercial jetliners, military aircraft, satellites, missile defense, human space flight and launch systems, and services worldwide."
BLL,0.0155,BALL CORP,"Ball Corporation supplies aluminum packaging products to the beverage, personal care, automotive, paint, healthcare, and household products industries."
KHC,0.0159,KRAFT HEINZ CO,"The Kraft Heinz Company, together with its subsidiaries, manufactures and markets food and beverage products in the United States, Canada, the United Kingdom, and internationally."
IPG,0.0161,INTERPUBLIC GROUP OF COS,"The Interpublic Group of Companies, Inc. provides advertising and marketing services worldwide. It operates through two segments, Integrated Agency Networks and Constituency Management Group."
OKE,0.017,ONEOK INC,"ONEOK, Inc., together with its subsidiaries, engages in gathering, processing, storage, and transportation of natural gas in the United States. It operates through Natural Gas Gathering and Processing, Natural Gas Liquids, and Natural Gas Pipelines segments."
WHR,0.0174,WHIRLPOOL CORP,"Whirlpool Corporation manufactures and markets home appliances and related products. It operates through four segments: North America; Europe, Middle East and Africa; Latin America; and Asia."
AEP,0.0181,AMERICAN ELECTRIC POWER CO,"American Electric Power Company, Inc., an electric public utility holding company, engages in the generation, transmission, and distribution of electricity for sale to retail and wholesale customers in the United States."
KR,0.019,KROGER CO,"The Kroger Co. operates as a retailer in the United States. The company operates supermarkets, multi-department stores, marketplace stores, and price impact warehouse stores."
FTI,0.0192,TECHNIPFMC PLC,"TechnipFMC plc engages in the oil and gas projects, technologies, and systems and services businesses. It operates through three segments: Subsea, Technip Energies, and Surface Technologies."
EMN,0.0192,EASTMAN CHEMICAL CO,Eastman Chemical Company operates as an advanced materials and specialty additives company worldwide.
GIS,0.0194,GENERAL MILLS INC,"General Mills, Inc. manufactures and markets branded consumer foods worldwide. The company operates in five segments: North America Retail; Convenience Stores & Foodservice; Europe & Australia; Asia & Latin America; and Pet."
OI,0.0197,O-I GLASS INC,"O-I Glass, Inc., through its subsidiaries, manufactures and sells glass containers to food and beverage manufacturers primarily in the Americas, Europe, and the Asia Pacific. It produces glass containers for alcoholic beverages, including beer, flavored malt beverages, spirits, and wine."
DE,0.0203,DEERE & CO,"Deere & Company, together with its subsidiaries, manufactures and distributes various equipment worldwide. The company operates through three segments: Agriculture and Turf, Construction and Forestry, and Financial Services."
IFF,0.0221,INTL FLAVORS & FRAGRANCES,"International Flavors & Fragrances Inc., together with its subsidiaries, manufactures flavors and fragrances for use in various consumer products. It operates through two segments, Taste and Scent."
LMT,0.0226,LOCKHEED MARTIN CORP,"Lockheed Martin Corporation, a security and aerospace company, engages in the research, design, development, manufacture, integration, and sustainment of technology systems, products, and services worldwide."
BDK,0.0233,BLACK & DECKER CORP,"The Black & Decker Corporation designs and manufactures power tools, outdoor yard care equipment, and home products."
NRG,0.0243,NRG ENERGY INC,"NRG Energy, Inc., together with its subsidiaries, operates as an energy company in the United States. It operates through Generation and Retail segments."
HLT,0.0244,HILTON WORLDWIDE HOLDINGS,"Hilton Worldwide Holdings Inc., a hospitality company, owns, leases, manages, develops, and franchises hotels and resorts. It operates through two segments, Management and Franchise, and Ownership. The company engages in the hotel management and licensing of its brands."
DTE,0.0248,DTE ENERGY CO,"DTE Energy Company engages in the utility operations. The company's Electric segment generates, purchases, distributes, and sells electricity to approximately 2.2 million residential, commercial, and industrial customers in southeastern Michigan."
FE,0.0257,FIRSTENERGY CORP,"FirstEnergy Corp., through its subsidiaries, generates, transmits, and distributes electricity in the United States. The company operates through Regulated Distribution and Regulated Transmission segments."
XEL,0.0271,XCEL ENERGY INC,"Xcel Energy Inc., through its subsidiaries, generates, purchases, transmits, distributes, and sells electricity. It operates through Regulated Electric Utility, Regulated Natural Gas Utility, and All Other segments."
MTW,0.0286,MANITOWOC CO,"The Manitowoc Company, Inc. provides engineered lifting equipment for the construction industry in the Americas, Europe, Africa, the Middle East, and the Asia Pacific."
AON,0.0287,AON PLC,"Aon plc, a professional services firm, provides advice and solutions to clients focused on risk, retirement, and health worldwide."
MGM,0.0288,MGM RESORTS INTERNATIONAL,"MGM Resorts International, through its subsidiaries, owns and operates integrated casino, hotel, and entertainment resorts in the United States and Macau. The company operates through three segments: Las Vegas Strip Resorts, Regional Operations, and MGM China."
PBG,0.0296,PEPSI BOTTLING GROUP INC,"As of February 26, 2010, The Pepsi Bottling Group, Inc. was acquired by Pepsi-Cola Metropolitan Bottling Company, Inc. The Pepsi Bottling Group, Inc. (PBG) operates in the carbonated soft drinks and other ready-to-drink beverages industry."
TXT,0.0303,TEXTRON INC,"Textron Inc. operates in the aircraft, defense, industrial, and finance businesses worldwide."
PPL,0.0306,PPL CORP,"PPL Corporation, a utility holding company, delivers electricity and natural gas in the United States and the United Kingdom. The company operates through three segments: U.K. Regulated, Kentucky Regulated, and Pennsylvania Regulated."
AKS,0.0306,AK STEEL HOLDING CORP,"AK Steel Holding Corporation, through its subsidiary, AK Steel Corporation, produces flat-rolled carbon, and stainless and electrical steel products in the United States and internationally."
ALL,0.0308,ALLSTATE CORP,"The Allstate Corporation, through its subsidiaries, provides property and casualty, and other insurance products in the United States and Canada. The company operates through Allstate Protection, Service Businesses, Allstate Life, and Allstate Benefits segments."
DVN,0.0312,DEVON ENERGY CORP,"Devon Energy Corporation, an independent energy company, primarily engages in the exploration, development, and production of oil, natural gas, and natural gas liquids in the United States. It operates approximately 3,955 gross wells."
AET,0.0315,AETNA INC,"Aetna Inc. operates as a health care benefits company in the United States. It operates through three segments: Health Care, Group Insurance, and Large Case Pensions."
PEG,0.0317,PUBLIC SERVICE ENTRP GRP INC,"Public Service Enterprise Group Incorporated, through its subsidiaries, operates as an energy company primarily in the Northeastern and Mid-Atlantic United States. It operates through two segments, PSE&G and PSEG Power."
AES,0.0318,AES CORP (THE),"The AES Corporation operates as a diversified power generation and utility company. It owns and/or operates power plants to generate and sell power to customers, such as utilities, industrial users, and other intermediaries."
GL,0.032,GLOBE LIFE INC,"Globe Life Inc., through its subsidiaries, provides various life and supplemental health insurance products, and annuities to lower middle to middle income households in the United States."
CB,0.033,CHUBB LTD,"Chubb Limited, through its subsidiaries, provides insurance and reinsurance products worldwide."
WMB,0.0333,WILLIAMS COS INC,"The Williams Companies, Inc., together with its subsidiaries, operates as an energy infrastructure company primarily in the United States. It operates through Atlantic-Gulf, Northeast G&P, and West segments."
AE,0.0334,ADAMS RESOURCES & ENERGY INC,"Adams Resources & Energy, Inc., through its subsidiaries, primarily engages in the marketing, transportation, and storage of crude oil in the United States."
LM,0.0354,LEGG MASON INC,"Legg Mason, Inc. is a publicly owned asset management holding company."
EXC,0.0365,EXELON CORP,"Exelon Corporation, a utility services holding company, engages in the generation and marketing of energy in the United States and Canada. It owns nuclear, fossil, wind, hydroelectric, biomass, and solar generating facilities."
FDC,0.0379,FIRST DATA CORP,"First Data Corporation provides commerce enabled technology and solutions for merchants, financial institutions, and card issuers in the United States, Canada, Europe, the Middle East, Africa, Latin America, and the Asia Pacific."
WYE,0.0411,WYETH,"Wyeth LLC manufactures pharmaceuticals and healthcare products. The company offers pharmaceutical and biotechnology products, consumer health care products, and animal health care products."
L,0.0419,LOEWS CORP,Loews Corporation provides commercial property and casualty insurance in the United States and internationally.
WRB,0.0445,BERKLEY (W R) CORP,"W. R. Berkley Corporation, an insurance holding company, operates as a commercial lines writer in the United States and internationally. It operates through two segments, Insurance and Reinsurance & Monoline Excess."
EFX,0.0458,EQUIFAX INC,"Equifax Inc. provides information solutions and human resources business process outsourcing services for businesses, governments, and consumers. The company operates through four segments: U.S. Information Solutions (USIS), Workforce Solutions, International, and Global Consumer Solutions."
STX,0.0499,SEAGATE TECHNOLOGY PLC,"Seagate Technology plc provides data storage technology and solutions in Singapore, the United States, the Netherlands, and internationally."
DAL,0.0503,DELTA AIR LINES INC,"Delta Air Lines, Inc. provides scheduled air transportation for passengers and cargo in the United States and internationally. The company operates through two segments, Airline and Refinery. Its domestic network centered on core hubs in Atlanta, Minneapolis-St."
AAL,0.0558,AMERICAN AIRLINES GROUP INC,"American Airlines Group Inc., through its subsidiaries, operates as a network air carrier. It provides scheduled air transportation services for passengers and cargo. As of December 31, 2019, the company operated a mainline fleet of 942 aircraft."
CIT,0.0989,CIT GROUP INC,"CIT Group Inc. operates as the holding company for CIT Bank, N.A. that provides banking and related services to commercial and individual customers. The company operates through Commercial Banking and Consumer Banking segments."
