,dist,conm,busdesc
MAC,0.0,MACERICH CO,"Macerich is a fully integrated, self-managed and self-administered real estate investment trust, which focuses on the acquisition, leasing, management, development and redevelopment of regional malls throughout the United States."
SRCL,0.0091,STERICYCLE INC,"Stericycle, Inc., together with its subsidiaries, provides regulated and compliance solutions to the healthcare, retail, and commercial businesses in the United States, Europe, and internationally."
KO,0.011,COCA-COLA CO,"The Coca-Cola Company, a beverage company, manufactures, markets, and sells various nonalcoholic beverages worldwide. The company provides sparkling soft drinks; water, enhanced water, and sports drinks; juice, dairy, and plant-based beverages; tea and coffee; and energy drinks."
CHK,0.0147,,
UNP,0.0208,UNION PACIFIC CORP,"Union Pacific Corporation, through its subsidiary, Union Pacific Railroad Company, engages in the railroad business in the United States."
LLY,0.0252,LILLY (ELI) & CO,"Eli Lilly and Company discovers, develops, manufactures, and markets pharmaceutical products worldwide. It offers endocrinology products for diabetes; osteoporosis in postmenopausal women and men; and human growth hormone deficiency and paediatric growth conditions."
REG,0.0275,REGENCY CENTERS CORP,"Regency Centers is the preeminent national owner, operator, and developer of shopping centers located in affluent and densely populated trade areas."
AVB,0.0308,AVALONBAY COMMUNITIES INC,"As of September 30, 2020, the Company owned or held a direct or indirect ownership interest in 294 apartment communities containing 86,676 apartment homes in 11 states and the District of Columbia, of which 19 communities were under development and one community was under redevelopment."
VIAB,0.0317,VIACOM INC,"As of December 4, 2019, Viacom Inc. was acquired by CBS Corporation. Viacom Inc. operates media brands that create entertainment content worldwide. It operates in two segments, Media Networks and Filmed Entertainment."
APOL,0.0332,APOLLO EDUCATION GROUP INC,"Apollo Education Group, Inc. provides private education services in the United States and internationally. The company offers online and on-campus undergraduate, graduate, certificate, and non-degree educational programs and services to unemployed and employed learners."
PFE,0.0343,PFIZER INC,"Pfizer Inc. develops, manufactures, and sells healthcare products worldwide."
CA,0.0356,CA INC,"CA, Inc., doing business as CA technologies, develops, markets, delivers, and licenses software products and services in the United States and internationally."
LUMN,0.0362,CENTURYLINK INC,"Lumen Technologies, Inc., a facilities-based communications company, provides various integrated services under 'CenturyLink' name to business and residential customers in the United States and internationally."
FISV,0.0376,FISERV INC,"Fiserv, Inc., together with its subsidiaries, provides financial services technology worldwide."
RAI,0.0402,REYNOLDS AMERICAN INC,"Reynolds American Inc., through its subsidiaries, manufactures and sells cigarettes and other tobacco products in the United States. It operates through RJR Tobacco, Santa Fe, and American Snuff segments."
WAT,0.0406,WATERS CORP,"Waters Corporation, a specialty measurement company, provides analytical workflow solutions in Asia, the Americas, and Europe. It operates through two segments, Waters and TA."
NSC,0.0406,NORFOLK SOUTHERN CORP,"Norfolk Southern Corporation, together with its subsidiaries, engages in the rail transportation of raw materials, intermediate products, and finished goods in the United States."
QEP,0.0411,QEP RESOURCES INC,"QEP Resources, Inc. operates as a crude oil and natural gas exploration and production company in the United States. The company conducts exploration and production activities in the Permian Basin in Western Texas; and Williston Basin in North Dakota."
ENDP,0.043,ENDO INTERNATIONAL PLC,Endo International plc manufactures and sells generic and branded pharmaceuticals in the United States and internationally.
EXPE,0.0433,EXPEDIA GROUP INC,"Expedia Group, Inc. operates as an online travel company worldwide. It operates through four segments: Core Online Travel Agencies, Trivago, Vrbo, and Egencia."
BAX,0.0451,BAXTER INTERNATIONAL INC,"Baxter International Inc., through its subsidiaries, develops and provides a portfolio of healthcare products. The company operates through North and South America; Europe, Middle East and Africa; and Asia-Pacific segments."
JNS,0.0465,JANUS CAPITAL GROUP INC,"Janus Capital Group, Inc. is a privately owned asset manager. It also provides retirement planning, investment planning, tax planning, investment for college, and tax planning services to its clients."
MCD,0.0465,MCDONALD'S CORP,"McDonald's Corporation operates and franchises McDonald's restaurants in the United States and internationally. Its restaurants offer various food products and beverages, as well as breakfast menu. As of December 31, 2019, the company operated 38,695 restaurants."
BMC,0.0478,BMC SOFTWARE INC,"BMC Software, Inc. develops software that provides system and service management solutions for enterprises in the United States and internationally. It operates in two business units, Enterprise Service Management (ESM) and Mainframe Service Management (MSM)."
DUK,0.0479,DUKE ENERGY CORP,"Duke Energy Corporation, together with its subsidiaries, operates as an energy company in the United States. It operates through three segments: Electric Utilities and Infrastructure, Gas Utilities and Infrastructure, and Commercial Renewables."
AT,0.0513,ATLANTIC POWER CORP,Atlantic Power Corporation owns and operates a fleet of power generation assets in the United States and Canada.
COV,0.0532,COVIDIEN PLC,"As of January 26, 2015, Covidien plc was acquired by Medtronic plc. Covidien plc develops, manufactures, and sells healthcare products for use in clinical and home settings worldwide. The company operates through Medical Devices and U.S. Medical Supplies segments."
LIN,0.0538,LINDE PLC,"Linde plc operates as an industrial gas company in North and South America, Europe, the Middle East, Africa, and the Asia Pacific. The company offers oxygen, nitrogen, argon, rare gases, carbon monoxide, carbon dioxide, helium, hydrogen, electronic gases, specialty gases, and acetylene."
ABT,0.0553,ABBOTT LABORATORIES,"Abbott Laboratories discovers, develops, manufactures, and sells health care products worldwide."
NFX,0.0574,NEWFIELD EXPLORATION CO,"Ovintiv Exploration Inc. engages in the exploration, development, and production of crude oil, natural gas, and natural gas liquids in the United States. Ovintiv Exploration Inc. was formerly known as Newfield Exploration Company and changed its name to Ovintiv Exploration Inc. in 2020."
IVZ,0.0615,INVESCO LTD,Invesco Ltd. is a publicly owned investment manager.
KSU,0.0619,KANSAS CITY SOUTHERN,"Kansas City Southern, a transportation holding company, provides domestic and international rail transportation services in North America."
LH,0.0632,LABORATORY CP OF AMER HLDGS,"Laboratory Corporation of America Holdings operates as an independent clinical laboratory company worldwide. It operates in two segments, LabCorp Diagnostics (LCD) and Covance Drug Development."
ESS,0.0632,ESSEX PROPERTY TRUST,"Essex Property Trust, Inc., an S&P 500 company, is a fully integrated real estate investment trust (REIT) that acquires, develops, redevelops, and manages multifamily residential properties in selected West Coast markets."
CMCSA,0.0659,COMCAST CORP,"Comcast Corporation operates as a media and technology company worldwide. It operates through Cable Communications, Cable Networks, Broadcast Television, Filmed Entertainment, Theme Parks, and Sky segments."
EXR,0.0659,EXTRA SPACE STORAGE INC,"Extra Space Storage Inc., headquartered in Salt Lake City, Utah, is a self-administered and self-managed REIT and a member of the S&P 500. As of September 30, 2020, the Company owned and/or operated 1,906 self-storage stores in 40 states, Washington, D.C. and Puerto Rico."
EQT,0.066,EQT CORP,"EQT Corporation operates as a natural gas production company in the United States. The company produces natural gas, natural gas liquids (NGLs), and crude oil."
JOY,0.0672,JOY GLOBAL INC,"Komatsu Mining Corp. manufactures and services mining equipment for the extraction of coal, copper, iron ore, oil sands, gold, and other minerals worldwide. It operates in two segments, Underground Mining Machinery and Surface Mining Equipment."
RSG,0.0677,REPUBLIC SERVICES INC,"Republic Services, Inc., together with its subsidiaries, provides non-hazardous solid waste collection, transfer, disposal, recycling, and environmental services in the United States. The company serves small-container, large-container, and municipal and residential customers."
COG,0.0724,CABOT OIL & GAS CORP,"Cabot Oil & Gas Corporation, an independent oil and gas company, explores for, exploits, develops, produces, and markets oil and gas properties in the United States."
VNO,0.0736,VORNADO REALTY TRUST,Vornado's portfolio is concentrated in the nation's key market - New York City - along with the premier asset in both Chicago and San Francisco. Vornado is also the real estate industry leader in sustainability policy.
BTU,0.0741,PEABODY ENERGY CORP,"Peabody Energy Corporation engages in coal mining business. The company operates through Seaborne Thermal Mining, Seaborne Metallurgical Mining, Powder River Basin Mining, Midwestern U.S. Mining, Western U.S. Mining, and Corporate and Other segments."
JKHY,0.0743,HENRY (JACK) & ASSOCIATES,"Jack Henry & Associates, Inc. provides technology solutions and payment processing services primarily for financial services organizations in the United States."
CLF,0.0745,CLEVELAND-CLIFFS INC,"Cleveland-Cliffs Inc. operates as an independent iron ore mining company in the United States, Canada, and internationally. It operates in two segments, Mining and Pelletizing, and Metallics."
GPN,0.0786,GLOBAL PAYMENTS INC,"Global Payments Inc. provides payment technology and software solutions for card, electronic, check, and digital-based payments in North America, Europe, the Asia-Pacific, and Latin America."
BUD,0.0793,ANHEUSER-BUSCH INBEV,"Anheuser-Busch InBev SA/NV, a brewing company, engages in the production, distribution, and sale of beer, alcoholic beverages, and soft drinks worldwide."
AME,0.0824,AMETEK INC,"AMETEK, Inc. manufactures and sells electronic instruments and electromechanical devices worldwide. It operates through two segments, Electronic Instruments (EIG) and Electromechanical (EMG)."
FIS,0.0855,FIDELITY NATIONAL INFO SVCS,"Fidelity National Information Services, Inc. operates as a financial services technology company in the United States and internationally. It operates through three segments: Merchant Solutions, Banking Solutions, and Capital Market Solutions."
CF,0.0859,CF INDUSTRIES HOLDINGS INC,"CF Industries Holdings, Inc. manufactures and distributes nitrogen fertilizers and other nitrogen products worldwide. Its principal nitrogen fertilizer products include anhydrous ammonia, granular urea, urea ammonium nitrate solution, and ammonium nitrate."
MSCI,0.0886,MSCI INC,"MSCI Inc., together with its subsidiaries, provides investment decision support tools for the clients to manage their investment processes worldwide. The company operates through four segments: Index, Analytics, ESG, and Real Estate."
STJ,0.0899,ST JUDE MEDICAL INC,"St. Jude Medical, Inc. was acquired by St. Jude Medical, LLC. St."
BXP,0.1049,BOSTON PROPERTIES INC,"Boston Properties (NYSE: BXP) is the largest publicly-held developer and owner of Class A office properties in the United States, concentrated in five markets - Boston, Los Angeles, New York, San Francisco and Washington, DC."
CSX,0.1072,CSX CORP,"CSX Corporation, together with its subsidiaries, provides rail-based freight transportation services."
VTR,0.1082,VENTAS INC,"Ventas, an S&P 500 company, operates at the intersection of two powerful and dynamic industries - healthcare and real estate."
STR,0.1133,QUESTAR CORP,Dominion Energy Questar Corporation operates as an integrated natural gas company in the United States.
FRT,0.1154,FEDERAL REALTY INVESTMENT TR,"Federal Realty is a recognized leader in the ownership, operation and redevelopment of high-quality retail-based properties located primarily in major coastal markets from Washington, D.C. to Boston as well as San Francisco and Los Angeles."
FLT,0.118,FLEETCOR TECHNOLOGIES INC,"FLEETCOR Technologies, Inc. operates as a business payments company that simplifies the way businesses manage and pay expenses. The company's portfolio of brands help companies automate, secure, digitize, and control payments on behalf of employees and suppliers."
AMT,0.1194,AMERICAN TOWER CORP,"American Tower, one of the largest global REITs, is a leading independent owner, operator and developer of multitenant communications real estate with a portfolio of approximately 181,000 communications sites."
