,dist,conm,busdesc
JNPR,0.0,JUNIPER NETWORKS INC,"Juniper Networks, Inc. designs, develops, and sells network products and services worldwide."
CIEN,0.5243,CIENA CORP,"Ciena Corporation provides network hardware, software, and services that support the transport, routing, switching, aggregation, service delivery, and management of video, data, and voice traffic on communications networks worldwide."
FFIV,0.669,F5 NETWORKS INC,"F5 Networks, Inc. provides multi-cloud application services for the security, performance, and availability of network applications, servers, and storage systems."
UIS,0.6935,UNISYS CORP,"Unisys Corporation operates as an information technology company worldwide. It operates in two segments, Services and Technology. The Services segment offers cloud and infrastructure services, application services, and business process outsourcing services."
RHI,0.699,ROBERT HALF INTL INC,"Robert Half International Inc. provides staffing and risk consulting services in North America, South America, Europe, Asia, and Australia."
CSCO,0.7094,CISCO SYSTEMS INC,"Cisco Systems, Inc. designs, manufactures, and sells Internet Protocol based networking and other products related to the communications and information technology industry in the Americas, Europe, the Middle East, Africa, the Asia Pacific, Japan, and China."
