,dist,conm,busdesc
FL,0.1888,FOOT LOCKER INC,"Foot Locker, Inc., through its subsidiaries, operates as an athletic footwear and apparel retailer."
LDOS,0.1928,LEIDOS HOLDINGS INC,"Leidos Holdings, Inc. provides services and solutions in the defense, intelligence, civil, and health markets in the United States and internationally. It operates through three segments: Defense Solutions, Civil, and Health."
KRFT,0.1939,KRAFT FOODS GROUP INC,"As of July 2, 2015, Kraft Foods Group, Inc was acquired by The Kraft Heinz Company. Kraft Foods Group, Inc. operates as a consumer packaged food and beverage company. It operates through six segments: Cheese, Refrigerated Meals, Beverages, Meals & Desserts, Enhancers & Snack Nuts, and Canada."
CNX,0.1946,CNX RESOURCES CORPORATION,"CNX Resources Corporation, an independent oil and gas company, explores for, develops, and produces natural gas properties primarily in the Appalachian Basin. The company operates through two divisions, Exploration and Production (E&P), and Midstream."
GL,0.1953,GLOBE LIFE INC,"Globe Life Inc., through its subsidiaries, provides various life and supplemental health insurance products, and annuities to lower middle to middle income households in the United States."
CINF,0.2097,CINCINNATI FINANCIAL CORP,"Cincinnati Financial Corporation, together with its subsidiary, provides property casualty insurance products in the United States. The company operates in five segments: Commercial Lines Insurance, Personal Lines Insurance, Excess and Surplus Lines Insurance, Life Insurance, and Investments."
YUM,0.2202,YUM BRANDS INC,"YUM! Brands, Inc., together with its subsidiaries, develops, operates, and franchises quick service restaurants worldwide. It operates in three segments: the KFC Division, the Pizza Hut Division, and the Taco Bell Division."
CLX,0.2243,CLOROX CO/DE,"The Clorox Company manufactures and markets consumer and professional products worldwide. It operates through four segments: Health and Wellness, Household, Lifestyle, and International."
SPG,0.2253,SIMON PROPERTY GROUP INC,"Simon is a real estate investment trust engaged in the ownership of premier shopping, dining, entertainment and mixed-use destinations and an S&P 100 company (Simon Property Group, NYSE: SPG)."
NLSN,0.2257,NIELSEN HOLDINGS PLC,"Nielsen Holdings plc, together with its subsidiaries, operates as a measurement and data analytics company worldwide. It operates in two segments, Connect and Media."
NBL,0.2258,NOBLE ENERGY INC,"Noble Energy, Inc., an independent energy company, engages in the acquisition, exploration, development, and production of crude oil and natural gas worldwide. The company also owns, operates, develops, and acquires domestic midstream infrastructure assets in the DJ and Delaware Basins."
DE,0.2316,DEERE & CO,"Deere & Company, together with its subsidiaries, manufactures and distributes various equipment worldwide. The company operates through three segments: Agriculture and Turf, Construction and Forestry, and Financial Services."
FRX,0.2351,FOREST LABORATORIES  -CL A,"Forest Laboratories, LLC develops, manufactures, and sells branded forms of ethical drug products in the United States and Europe."
CHRW,0.2359,C H ROBINSON WORLDWIDE INC,"C.H. Robinson Worldwide, Inc., a third party logistics company, provides freight transportation services and logistics solutions to companies in various industries worldwide. The company operates through North American Surface Transportation and Global Forwarding segments."
FRT,0.236,FEDERAL REALTY INVESTMENT TR,"Federal Realty is a recognized leader in the ownership, operation and redevelopment of high-quality retail-based properties located primarily in major coastal markets from Washington, D.C. to Boston as well as San Francisco and Los Angeles."
WRB,0.2413,BERKLEY (W R) CORP,"W. R. Berkley Corporation, an insurance holding company, operates as a commercial lines writer in the United States and internationally. It operates through two segments, Insurance and Reinsurance & Monoline Excess."
PETM,0.2417,PETSMART INC,"PetSmart, Inc., together with its subsidiaries, operates as a specialty retailer of products, services, and solutions for pets in the United States, Puerto Rico, and Canada."
HST,0.2449,HOST HOTELS & RESORTS INC,"Host Hotels & Resorts, Inc. is an S&P 500 company and is the largest lodging real estate investment trust and one of the largest owners of luxury and upper-upscale hotels."
HBI,0.2462,HANESBRANDS INC,"Hanesbrands Inc., a consumer goods company, designs, manufactures, sources, and sells a range of basic apparel for men, women, and children in the United States. The company operates through three segments: Innerwear, Activewear, and International."
TMO,0.2472,THERMO FISHER SCIENTIFIC INC,"Thermo Fisher Scientific Inc. provides analytical and other instruments, laboratory equipment, software, consumables, reagents, instrument systems, chemicals, supplies, and services worldwide."
EXC,0.2555,EXELON CORP,"Exelon Corporation, a utility services holding company, engages in the generation and marketing of energy in the United States and Canada. It owns nuclear, fossil, wind, hydroelectric, biomass, and solar generating facilities."
V,0.2611,VISA INC,"Visa Inc. operates as a payments technology company worldwide. The company facilitates digital payments among consumers, merchants, financial institutions, businesses, strategic partners, and government entities."
COL,0.2715,ROCKWELL COLLINS,"Collins Aerospace designs, produces and supports communication and aviation systems worldwide."
M,0.276,MACY'S INC,"Macy's, Inc., an omnichannel retail organization, operates stores, websites, and mobile applications under the Macy's, Bloomingdale's, and bluemercury brands."
IP,0.2803,INTL PAPER CO,"International Paper Company operates as a paper and packaging company primarily in United States, the Middle East, Europe, Africa, Pacific Rim, Asia, and the Americas. It operates through three segments: Industrial Packaging, Global Cellulose Fibers, and Printing Papers."
MRK,0.281,MERCK & CO,"Merck & Co., Inc. provides healthcare solutions worldwide."
ISRG,0.2811,INTUITIVE SURGICAL INC,"Intuitive Surgical, Inc., together with its subsidiaries, designs, manufactures, and markets da Vinci surgical systems, and related instruments and accessories in the United States and internationally."
LUV,0.2865,SOUTHWEST AIRLINES,Southwest Airlines Co. operates a passenger airline that provides scheduled air transportation services in the United States and near-international markets.
TXT,0.3063,TEXTRON INC,"Textron Inc. operates in the aircraft, defense, industrial, and finance businesses worldwide."
OXY,0.3073,OCCIDENTAL PETROLEUM CORP,"Occidental Petroleum Corporation, together with its subsidiaries, engages in the acquisition, exploration, and development of oil and gas properties in the United States, the Middle East, and Latin America."
CBOE,0.312,CBOE GLOBAL MARKETS INC,"Cboe Global Markets, Inc., through its subsidiaries, operates as an options exchange in the United States. It operates in five segments: Options, U.S. Equities, Futures, European Equities, and Global FX. The Options segment trades in listed market indices. The U.S."
NAVI,0.3129,NAVIENT CORP,"Navient Corporation provides education loan management and business processing solutions for education, healthcare, and government clients at the federal, state, and local levels in the United States."
JWN,0.315,NORDSTROM INC,"Nordstrom, Inc., a fashion retailer, provides apparels, shoes, cosmetics, and accessories for women, men, young adults, and children."
HII,0.3153,HUNTINGTON INGALLS IND INC,"Huntington Ingalls Industries, Inc. engages in the designing, building, overhauling, and repairing military ships in the United States. It operates through three segments: Ingalls Shipbuilding, Newport News Shipbuilding, and Technical Solutions."
JBL,0.3159,JABIL INC,"Jabil Inc. provides manufacturing services and solutions worldwide. The company operates in two segments, Electronics Manufacturing Services and Diversified Manufacturing Services. It offers electronics design, production, and product management services."
SBUX,0.3165,STARBUCKS CORP,"Starbucks Corporation, together with its subsidiaries, operates as a roaster, marketer, and retailer of specialty coffee worldwide. The company operates through three segments: Americas, International, and Channel Development."
PRGO,0.3265,PERRIGO CO PLC,Perrigo Company plc provides over-the-counter (OTC) health and wellness solutions that enhance individual well-being by empowering consumers to prevent or treat conditions that can be self-managed.
INCY,0.3313,INCYTE CORP,"Incyte Corporation, a biopharmaceutical company, focuses on the discovery, development, and commercialization of various therapeutics in the United States."
GILD,0.3333,GILEAD SCIENCES INC,"Gilead Sciences, Inc., a research-based biopharmaceutical company, discovers, develops, and commercializes medicines in the areas of unmet medical needs in the United States, Europe, and internationally."
GM,0.3334,GENERAL MOTORS CO,"General Motors Company designs, builds, and sells cars, trucks, crossovers, and automobile parts worldwide. The company operates through GM North America, GM International, Cruise, and GM Financial segments."
GHC,0.3363,GRAHAM HOLDINGS CO,"Graham Holdings Company, through its subsidiaries, operates as a diversified education and media company worldwide."
EW,0.337,EDWARDS LIFESCIENCES CORP,"Edwards Lifesciences Corporation provides products and technologies for structural heart disease, and critical care and surgical monitoring in the United States and internationally."
WRK,0.3371,WESTROCK CO,"WestRock Company manufactures and sells paper and packaging solutions in North America, South America, Europe, Asia, and Australia. The company operates through Corrugated Packaging and Consumer Packaging segments."
XRAY,0.3386,DENTSPLY SIRONA INC,"DENTSPLY SIRONA Inc. designs, develops, manufactures, and markets various dental products and technologies, and other consumable dental products and equipment primarily for the professional dental market worldwide. The company operates in two segments, Technologies & Equipment; and Consumables."
CNC,0.3474,CENTENE CORP,Centene Corporation operates as a multi-national healthcare enterprise that provides programs and services to under-insured and uninsured individuals in the United States.
WMT,0.3488,WALMART INC,"Walmart Inc. engages in the retail and wholesale operations in various formats worldwide. The company operates in three segments: Walmart U.S., Walmart International, and Sam's Club."
VRTX,0.3506,VERTEX PHARMACEUTICALS INC,Vertex Pharmaceuticals Incorporated engages in developing and commercializing therapies for treating cystic fibrosis.
KMX,0.3543,CARMAX INC,"CarMax, Inc., through its subsidiaries, operates as a retailer of used vehicles in the United States. The company operates in two segments, CarMax Sales Operations and CarMax Auto Finance."
AET,0.3546,AETNA INC,"Aetna Inc. operates as a health care benefits company in the United States. It operates through three segments: Health Care, Group Insurance, and Large Case Pensions."
CXO,0.3547,CONCHO RESOURCES INC,"Concho Resources Inc., an independent oil and natural gas company, engages in the acquisition, development, and exploration of oil and natural gas properties in the United States. The company's principal operating areas are located in the Permian Basin of West Texas and southeast New Mexico."
UAA,0.3596,UNDER ARMOUR INC,"Under Armour, Inc., together with its subsidiaries, develops, markets, and distributes branded performance apparel, footwear, and accessories for men, women, and youth primarily in North America, Europe, the Middle East, Africa, the Asia-Pacific, and Latin America."
K,0.3609,KELLOGG CO,"Kellogg Company, together with its subsidiaries, manufactures and markets ready-to-eat cereal and convenience foods. The company operates through four segments: North America, Europe, Latin America, and Asia Middle East Africa."
DD,0.3679,DUPONT DE NEMOURS INC,"DuPont de Nemours, Inc. provides technology-based materials, ingredients, and solutions in the United States, Canada, the Asia Pacific, Latin America, Europe, the Middle East, and Africa."
FANG,0.3696,DIAMONDBACK ENERGY INC,"Diamondback Energy, Inc., an independent oil and natural gas company, focuses on the acquisition, development, exploration, and exploitation of unconventional and onshore oil and natural gas reserves in the Permian Basin in West Texas."
O,0.3749,REALTY INCOME CORP,"Realty Income, The Monthly Dividend Company<sup></sup>, is an S&P 500 company dedicated to providing stockholders with dependable monthly income."
FMC,0.3868,FMC CORP,"FMC Corporation, an agricultural sciences company, provides crop protection, plant health, and professional pest and turf management products."
LLY,0.3919,LILLY (ELI) & CO,"Eli Lilly and Company discovers, develops, manufactures, and markets pharmaceutical products worldwide. It offers endocrinology products for diabetes; osteoporosis in postmenopausal women and men; and human growth hormone deficiency and paediatric growth conditions."
HON,0.3924,HONEYWELL INTERNATIONAL INC,Honeywell International Inc. operates as a diversified technology and manufacturing company worldwide.
AN,0.4004,AUTONATION INC,"AutoNation, Inc., through its subsidiaries, operates as an automotive retailer in the United States. The company operates through three segments: Domestic, Import, and Premium Luxury."
NYX,0.4155,NYSE EURONEXT,"NYSE Holdings LLC, through its subsidiaries, operates securities exchanges. It operates various stock exchanges, including the New York Stock Exchange (NYSE), NYSE Arca, Inc., and NYSE MKT LLC in the United States; and European based exchanges comprising Euronext N.V."
AZO,0.4161,AUTOZONE INC,"AutoZone, Inc. retails and distributes automotive replacement parts and accessories. The company offers various products for cars, sport utility vehicles, vans, and light trucks, including new and remanufactured automotive hard parts, maintenance items, accessories, and non-automotive products."
EVHC,0.4197,ENVISION HEALTHCARE CORP,"Envision Healthcare Corporation, through its subsidiaries, provides various healthcare services in the United States. The company operates through two segments, Physician Services and Ambulatory Services."
H,0.4245,HYATT HOTELS CORP,"Hyatt Hotels Corporation, a hospitality company, develops, owns, operates, manages, franchises, licenses, or provides services to hotels, resorts, and other properties."
EFX,0.4263,EQUIFAX INC,"Equifax Inc. provides information solutions and human resources business process outsourcing services for businesses, governments, and consumers. The company operates through four segments: U.S. Information Solutions (USIS), Workforce Solutions, International, and Global Consumer Solutions."
JEF,0.4301,JEFFERIES FINANCIAL GRP INC,"Jefferies Financial Group Inc., a diversified financial services company, engages in investment banking and capital markets, asset management, and direct investing businesses in the Americas, Europe, the Middle East, Africa, and Asia."
ADS,0.4309,ALLIANCE DATA SYSTEMS CORP,"Alliance Data Systems Corporation provides data-driven marketing and loyalty solutions in the United States, Canada, Europe, the Middle East, Africa, the Asia Pacific, and others. It operates through two segments, LoyaltyOne and Card Services."
RIG,0.4408,TRANSOCEAN LTD,"Transocean Ltd., together with its subsidiaries, provides offshore contract drilling services for oil and gas wells worldwide. The company primarily offers drilling rigs, related equipment, and work crews; and ultra-deepwater and harsh environment drilling services."
MDP,0.441,MEREDITH CORP,"Meredith Corporation operates as a diversified media company primarily in the United States. It operates in two segments, National Media and Local Media."
JNY,0.4474,JONES GROUP INC,"Premier Brands Group Holdings LLC designs, markets, and wholesales apparel, footwear, jeanswear, jewelry, and handbags in the United States and internationally."
AMZN,0.4562,AMAZON.COM INC,"Amazon.com, Inc. engages in the retail sale of consumer products and subscriptions in North America and internationally. The company operates through three segments: North America, International, and Amazon Web Services (AWS)."
SLG,0.4621,SL GREEN REALTY CORP,"SL Green Realty Corp., an S&P 500 company and Manhattan's largest office landlord, is a fully integrated real estate investment trust, or REIT, that is focused primarily on acquiring, managing and maximizing value of Manhattan commercial properties."
AYI,0.465,ACUITY BRANDS INC,"Acuity Brands, Inc. provides lighting and building management solutions and services for commercial, institutional, industrial, infrastructure, and residential applications in North America and internationally."
NKTR,0.4682,NEKTAR THERAPEUTICS,"Nektar Therapeutics, a biopharmaceutical company, researches and develops drug candidates for cancer and auto-immune disease in the United States."
WLTW,0.4729,WILLIS TOWERS WATSON PLC,"Willis Towers Watson Public Limited Company operates as an advisory, broking, and solutions company worldwide."
GIS,0.474,GENERAL MILLS INC,"General Mills, Inc. manufactures and markets branded consumer foods worldwide. The company operates in five segments: North America Retail; Convenience Stores & Foodservice; Europe & Australia; Asia & Latin America; and Pet."
BKNG,0.4771,BOOKING HOLDINGS INC,Booking Holdings Inc. provides travel and restaurant online reservation and related services worldwide.
MWV,0.4784,MEADWESTVACO CORP,"WestRock MWV, LLC provides packaging solutions to the healthcare, beauty and personal care, food, beverage, home and garden, tobacco, and agricultural industries worldwide."
FRC,0.4839,FIRST REPUBLIC BANK,"First Republic Bank, together with its subsidiaries, provides private banking, private business banking, real estate lending, and wealth management services to clients in metropolitan areas in the United States. It operates through two segments, Commercial Banking and Wealth Management."
SNPS,0.4878,SYNOPSYS INC,"Synopsys, Inc. provides electronic design automation software products used to design and test integrated circuits."
ROST,0.4881,ROSS STORES INC,"Ross Stores, Inc., together with its subsidiaries, operates off-price retail apparel and home fashion stores under the Ross Dress for Less and dd's DISCOUNTS brands. Its stores primarily offers apparel, accessories, footwear, and home fashions."
FOSL,0.4887,FOSSIL GROUP INC,"Fossil Group, Inc., together with its subsidiaries, designs, develops, markets, and distributes consumer fashion accessories in the United States, Europe, Asia, and internationally."
CLF,0.49,CLEVELAND-CLIFFS INC,"Cleveland-Cliffs Inc. operates as an independent iron ore mining company in the United States, Canada, and internationally. It operates in two segments, Mining and Pelletizing, and Metallics."
HAR,0.4919,HARMAN INTERNATIONAL INDS,"Harman International Industries, Incorporated designs and engineers connected products and solutions for automakers, consumers, and enterprises worldwide. The company operates through four segments: Connected Car, Lifestyle Audio, Professional Solutions, and Connected Services."
TJX,0.4961,TJX COS INC (THE),"The TJX Companies, Inc. operates as an off-price apparel and home fashions retailer. It operates through four segments: Marmaxx, HomeGoods, TJX Canada, and TJX International."
XYL,0.4973,XYLEM INC,"Xylem Inc. engages in the design, manufacture, and servicing of engineered products and solutions for the water and wastewater applications in the United States, Europe, the Asia Pacific, and internationally."
DG,0.5052,DOLLAR GENERAL CORP,"Dollar General Corporation, a discount retailer, provides various merchandise products in the southern, southwestern, Midwestern, and eastern United States."
VZ,0.5098,VERIZON COMMUNICATIONS INC,"Verizon Communications Inc. offers communications, information, and entertainment products and services to consumers, businesses, and governmental entities worldwide."
UHS,0.5109,UNIVERSAL HEALTH SVCS INC,"Universal Health Services, Inc., through its subsidiaries, owns and operates acute care hospitals, outpatient facilities, and behavioral health care facilities. The company operates through Acute Care Hospital Services, Behavioral Health Care Services, and Other segments."
VFC,0.5117,VF CORP,"V.F. Corporation engages in the design, production, procurement, marketing, and distribution of branded lifestyle apparel, footwear, and related products for men, women, and children in the Americas, Europe, and the Asia-Pacific. It operates through four segments: Outdoor, Active, and Work."
VTRS,0.5226,VIATRIS INC,"Viatris Inc., a healthcare company, manufactures and distributes various medicines for patients in the United States and internationally."
WAB,0.5227,WABTEC CORP,"Wabtec Corporation provides technology-based equipment, systems, and services for the freight rail and passenger transit vehicle industries worldwide. It operates through two segments, Freight and Transit."
TRV,0.5268,TRAVELERS COS INC,"The Travelers Companies, Inc., through its subsidiaries, provides a range of commercial and personal property, and casualty insurance products and services to businesses, government units, associations, and individuals in the United states and internationally."
RE,0.5288,EVEREST RE GROUP LTD,"Everest Re Group, Ltd., through its subsidiaries, provides reinsurance and insurance products in the United States, Bermuda, and internationally. The company operates through four segments: U.S. Reinsurance, International, Bermuda, and Insurance. The U.S."
TIF,0.543,TIFFANY & CO,"Tiffany & Co., through its subsidiaries, designs, manufactures, and retails jewelry and other items. The company offers jewelry collections, engagement rings, and wedding bands. It also sells watches, home and accessories products, and fragrances; and wholesales diamonds and earnings."
CVG,0.5446,CONVERGYS CORP,"Convergys Corporation provides customer management services to communications and media, technology, financial services, retail, healthcare, government, travel and hospitality, and other vertical markets worldwide."
HSIC,0.5497,HENRY SCHEIN INC,"Henry Schein, Inc., a solutions company for health care professionals, provides health care products and services to office-based dental practitioners and laboratories, physician practices, government, institutional health care clinics, and other alternate care clinics worldwide."
CTAS,0.5588,CINTAS CORP,"Cintas Corporation provides corporate identity uniforms and related business services primarily in North America, Latin America, Europe, and Asia. It operates through Uniform Rental and Facility Services and First Aid and Safety Services segments."
CELG,0.5626,CELGENE CORP,"Celgene Corporation, a biopharmaceutical company, discovers, develops, and commercializes therapies for the treatment of cancer and inflammatory diseases worldwide."
F,0.5626,FORD MOTOR CO,"Ford Motor Company designs, manufactures, markets, and services a range of Ford cars, trucks, sport utility vehicles, electrified vehicles, and Lincoln luxury vehicles worldwide. It operates through three segments: Automotive, Mobility, and Ford Credit."
SPGI,0.5666,S&P GLOBAL INC,"S&P Global Inc., together with its subsidiaries, provides ratings, benchmarks, analytics, and data to the capital and commodity markets worldwide."
ENDP,0.5673,ENDO INTERNATIONAL PLC,Endo International plc manufactures and sells generic and branded pharmaceuticals in the United States and internationally.
HRL,0.5694,HORMEL FOODS CORP,"Hormel Foods Corporation produces and markets various meat and food products to retail, foodservice, deli, and commercial customers in the United States and internationally."
POOL,0.5722,POOL CORP,"Pool Corporation distributes swimming pool supplies, equipment, and related leisure products in the United States and internationally."
DAL,0.5749,DELTA AIR LINES INC,"Delta Air Lines, Inc. provides scheduled air transportation for passengers and cargo in the United States and internationally. The company operates through two segments, Airline and Refinery. Its domestic network centered on core hubs in Atlanta, Minneapolis-St."
MTD,0.5833,METTLER-TOLEDO INTL INC,"Mettler-Toledo International Inc. manufactures and supplies precision instruments and services worldwide. It operates in five segments: U.S. Operations, Swiss Operations, Western European Operations, Chinese Operations, and Other."
CIT,0.5888,CIT GROUP INC,"CIT Group Inc. operates as the holding company for CIT Bank, N.A. that provides banking and related services to commercial and individual customers. The company operates through Commercial Banking and Consumer Banking segments."
RTX,0.5898,RAYTHEON TECHNOLOGIES CORP,"Raytheon Technologies Corporation, an aerospace and defense company, provides advanced systems and services for commercial, military, and government customers worldwide."
PKI,0.5909,PERKINELMER INC,"PerkinElmer, Inc. provides products, services, and solutions to the diagnostics, life sciences, and applied services markets worldwide. The company operates in two segments, Discovery & Analytical Solutions and Diagnostics."
CVX,0.6024,CHEVRON CORP,"Chevron Corporation, through its subsidiaries, engages in integrated energy, chemicals, and petroleum operations worldwide. The company operates in two segments, Upstream and Downstream."
THC,0.6065,TENET HEALTHCARE CORP,"Tenet Healthcare Corporation operates as a diversified healthcare services company. The company operates through three segments: Hospital Operations and Other, Ambulatory Care, and Conifer."
