,dist,conm,busdesc
CMA,0.0,COMERICA INC,"Comerica Incorporated, through its subsidiaries, provides various financial products and services. It operates through three segments: Business Bank, Retail Bank, and Wealth Management."
TFC,0.2695,TRUIST FINANCIAL CORP,"Truist Financial Corporation, a holding company, provides banking and trust services for small and mid-size businesses, public agencies, local governments, corporations, and individuals in the Southeastern and Mid-Atlantic United States."
RF,0.2909,REGIONS FINANCIAL CORP,"Regions Financial Corporation, a financial holding company, provides banking and bank-related services to individual and corporate customers. It operates through three segments: Corporate Bank, Consumer Bank, and Wealth Management."
MTB,0.3237,M & T BANK CORP,"M&T Bank Corporation operates as the holding company for Manufacturers and Traders Trust Company; and Wilmington Trust, National Association that provide banking services."
SNV,0.3333,SYNOVUS FINANCIAL CORP,"Synovus Financial Corp. operates as the bank holding company for Synovus Bank that provides various financial products and services. It operates through three segments: Community Banking, Wholesale Banking, and Financial Management Services."
NCC,0.348,NATIONAL CITY CORP,"As of November 6, 2009, National City Corporation was acquired by PNC Bank, National Association."
HBAN,0.3551,HUNTINGTON BANCSHARES,"Huntington Bancshares Incorporated operates as a holding company for The Huntington National Bank that provides commercial, small business, consumer, and mortgage banking services."
WFC,0.3566,WELLS FARGO & CO,"Wells Fargo & Company, a diversified financial services company, provides banking, investment, mortgage, and consumer and commercial finance products and services to individuals, businesses, and institutions in the United States and internationally."
KEY,0.3672,KEYCORP,"KeyCorp operates as the holding company for KeyBank National Association that provides various retail and commercial banking services in the United States. It operates in two segments, Consumer Bank and Commercial Bank."
STI,0.4014,SUNTRUST BANKS INC,"As of December 6, 2019, SunTrust Banks, Inc. was acquired by BB&T Corporation. SunTrust Banks, Inc. operates as the holding company for SunTrust Bank that provides various financial services for consumers, businesses, corporations, institutions, and not-for-profit entities in the United States."
PNC,0.408,PNC FINANCIAL SVCS GROUP INC,"The PNC Financial Services Group, Inc. operates as a diversified financial services company in the United States."
ZION,0.4109,ZIONS BANCORPORATION NA,"Zions Bancorporation, National Association provides various banking and related services primarily in Arizona, California, Colorado, Idaho, Nevada, New Mexico, Oregon, Texas, Utah, Washington, and Wyoming."
FITB,0.4292,FIFTH THIRD BANCORP,Fifth Third Bancorp operates as a diversified financial services company in the United States.
USB,0.4486,U S BANCORP,"U.S. Bancorp, a financial services holding company, provides various financial services in the United States."
FHN,0.4559,FIRST HORIZON CORP,"First Horizon Corporation operates as the bank holding company for First Horizon Bank that provides various financial services. The company operates through four segments: Regional Banking, Fixed Income, Corporate, and Non-Strategic."
BAC,0.4626,BANK OF AMERICA CORP,"Bank of America Corporation, through its subsidiaries, provides banking and financial products and services for individual consumers, small- and middle-market businesses, institutional investors, large corporations, and governments worldwide."
C,0.491,CITIGROUP INC,"Citigroup Inc., a diversified financial services holding company, provides various financial products and services to consumers, corporations, governments, and institutions in North America, Latin America, Asia, Europe, the Middle East, and Africa."
COF,0.5052,CAPITAL ONE FINANCIAL CORP,"Capital One Financial Corporation operates as the financial services holding company for the Capital One Bank (USA), National Association; and Capital One, National Association, which provides various financial products and services in the United States, the United Kingdom, and Canada."
SOV,0.5215,SANTANDER HOLDINGS USA INC,"Santander Holdings USA, Inc. operates as the holding company for Santander Bank, National Association that provides various banking products and services primarily in the Mid-Atlantic and Northeastern United States."
NTRS,0.5605,NORTHERN TRUST CORP,"Northern Trust Corporation, a financial holding company, provides wealth management, asset servicing, asset management, and banking solutions for corporations, institutions, families, and individuals worldwide."
AXP,0.6066,AMERICAN EXPRESS CO,"American Express Company, together with its subsidiaries, provides charge and credit payment card products, and travel-related services worldwide. The company operates through three segments: Global Consumer Services Group, Global Commercial Services, and Global Merchant and Network Services."
LNC,0.6163,LINCOLN NATIONAL CORP,"Lincoln National Corporation, through its subsidiaries, operates multiple insurance and retirement businesses in the United States. It operates through four segments: Annuities, Retirement Plan Services, Life Insurance, and Group Protection."
ALL,0.6237,ALLSTATE CORP,"The Allstate Corporation, through its subsidiaries, provides property and casualty, and other insurance products in the United States and Canada. The company operates through Allstate Protection, Service Businesses, Allstate Life, and Allstate Benefits segments."
CINF,0.6262,CINCINNATI FINANCIAL CORP,"Cincinnati Financial Corporation, together with its subsidiary, provides property casualty insurance products in the United States. The company operates in five segments: Commercial Lines Insurance, Personal Lines Insurance, Excess and Surplus Lines Insurance, Life Insurance, and Investments."
MET,0.6363,METLIFE INC,"MetLife, Inc. engages in the insurance, annuities, employee benefits, and asset management businesses worldwide. It operates through five segments: U.S.; Asia; Latin America; Europe, the Middle East and Africa; and MetLife Holdings."
PBCT,0.6418,PEOPLE'S UNITED FINL INC,"People's United Financial, Inc. operates as the bank holding company for People's United Bank, National Association that provides commercial banking, retail banking, and wealth management services to individual, corporate, and municipal customers."
BK,0.6449,BANK OF NEW YORK MELLON CORP,"The Bank of New York Mellon Corporation provides a range of financial products and services to in the United States and internationally. The company operates through two segments, Investment Management and Investment Services."
AIG,0.6554,AMERICAN INTERNATIONAL GROUP,"American International Group, Inc. provides insurance products for commercial, institutional, and individual customers in North America and internationally."
BEN,0.6557,FRANKLIN RESOURCES INC,"Franklin Resources, Inc. is a publicly owned asset management holding company. Through its subsidiaries, the firm provides its services to individuals, institutions, pension plans, trusts, and partnerships."
HIG,0.6642,HARTFORD FINANCIAL SERVICES,"The Hartford Financial Services Group, Inc. provides insurance and financial services to individual and business customers in the United States and internationally."
TRV,0.6671,TRAVELERS COS INC,"The Travelers Companies, Inc., through its subsidiaries, provides a range of commercial and personal property, and casualty insurance products and services to businesses, government units, associations, and individuals in the United states and internationally."
ODFL,0.6765,OLD DOMINION FREIGHT,"Old Dominion Freight Line, Inc. operates as a less-than-truckload (LTL) motor carrier in the United States and North America. It provides regional, inter-regional, and national LTL services, including expedited transportation."
PFG,0.681,PRINCIPAL FINANCIAL GRP INC,"Principal Financial Group, Inc. provides retirement, asset management, and insurance products and services to businesses, individuals, and institutional clients worldwide. The company operates through Retirement and Income Solutions, Principal Global Investors, Principal International, and U.S."
CB,0.7061,CHUBB LTD,"Chubb Limited, through its subsidiaries, provides insurance and reinsurance products worldwide."
GL,0.7145,GLOBE LIFE INC,"Globe Life Inc., through its subsidiaries, provides various life and supplemental health insurance products, and annuities to lower middle to middle income households in the United States."
INCY,0.7941,INCYTE CORP,"Incyte Corporation, a biopharmaceutical company, focuses on the discovery, development, and commercialization of various therapeutics in the United States."
MKTX,0.8046,MARKETAXESS HOLDINGS INC,"MarketAxess Holdings Inc., together with its subsidiaries, operates an electronic trading platform that enables fixed-income market participants to trade corporate bonds and other types of fixed-income instruments worldwide."
TDY,0.8095,TELEDYNE TECHNOLOGIES INC,"Teledyne Technologies Incorporated provides instrumentation, digital imaging, aerospace and defense electronics, and engineered systems in the United States, the United Kingdom, Canada, the Netherlands, and internationally."
RX,0.827,IMS HEALTH HOLDINGS INC,"As of October 3, 2016, IMS Health Holdings, Inc. was acquired by Quintiles IMS Holdings, Inc. IMS Health Holdings, Inc. provides information and technology services to healthcare industry worldwide."
UNM,0.8272,UNUM GROUP,"Unum Group, together with its subsidiaries, provides financial protection benefit solutions in the United States, the United Kingdom, Poland, and internationally. It operates through Unum US, Unum International, Colonial Life, and Closed Block segments."
GMCR,0.8374,KEURIG DR PEPPER INC,"Keurig Dr Pepper Inc. operates as a beverage company in the United States and internationally. It operates through four segments: Coffee Systems, Packaged Beverages, Beverage Concentrates, and Latin America Beverages."
