,dist,conm,busdesc
CMI,0.0,CUMMINS INC,"Cummins Inc. designs, manufactures, distributes, and services diesel and natural gas engines, products worldwide. It operates through five segments: Engine, Distribution, Components, Power Systems, and New Power."
ITW,0.3163,ILLINOIS TOOL WORKS,Illinois Tool Works Inc. manufactures and sells industrial products and equipment worldwide. It operates through seven segments: Automotive OEM; Food Equipment; Test & Measurement and Electronics; Welding; Polymers & Fluids; Construction Products; and Specialty Products.
JCI,0.5275,JOHNSON CONTROLS INTL PLC,"Johnson Controls International plc operates as a diversified technology and multi industrial company worldwide. It operates through Building Solutions North America, Building Solutions EMEA/LA, Building Solutions Asia Pacific, and Global Products segments."
WHR,0.5663,WHIRLPOOL CORP,"Whirlpool Corporation manufactures and markets home appliances and related products. It operates through four segments: North America; Europe, Middle East and Africa; Latin America; and Asia."
MMM,0.6111,3M CO,"3M Company develops, manufactures, and markets various products worldwide. It operates through four business segments: Safety and Industrial, Transportation and Electronics, Health Care, and Consumer."
