,dist,conm,busdesc
GOOGL,0.0,ALPHABET INC,"Alphabet Inc. provides online advertising services in the United States, Europe, the Middle East, Africa, the Asia-Pacific, Canada, and Latin America. It offers performance and brand advertising services. The company operates through Google and Other Bets segments."
GOOG,0.0164,ALPHABET INC,"Alphabet Inc. provides online advertising services in the United States, Europe, the Middle East, Africa, the Asia-Pacific, Canada, and Latin America. It offers performance and brand advertising services. The company operates through Google and Other Bets segments."
AMZN,0.5734,AMAZON.COM INC,"Amazon.com, Inc. engages in the retail sale of consumer products and subscriptions in North America and internationally. The company operates through three segments: North America, International, and Amazon Web Services (AWS)."
FB,0.6526,FACEBOOK INC,"Facebook, Inc. develops products that enable people to connect and share with friends and family through mobile devices, personal computers, virtual reality headsets, and in-home devices worldwide."
BKNG,0.8045,BOOKING HOLDINGS INC,Booking Holdings Inc. provides travel and restaurant online reservation and related services worldwide.
NFLX,0.8484,NETFLIX INC,"Netflix, Inc. provides subscription streaming entertainment service. It offers TV series, documentaries, and feature films across various genres and languages."
