,dist,conm,busdesc
XL,0.0,XL FLEET CORP,"XL Hybrids, Inc. develops and manufactures hybrid electric solutions for the commercial vehicle market."
BAC,0.0121,BANK OF AMERICA CORP,"Bank of America Corporation, through its subsidiaries, provides banking and financial products and services for individual consumers, small- and middle-market businesses, institutional investors, large corporations, and governments worldwide."
MS,0.0367,MORGAN STANLEY,"Morgan Stanley, a financial holding company, provides various financial products and services to corporations, governments, financial institutions, and individuals in the Americas, Europe, the Middle East, Africa, and Asia."
JPM,0.0408,JPMORGAN CHASE & CO,"JPMorgan Chase & Co. operates as a financial services company worldwide. It operates in four segments: Consumer & Community Banking (CCB), Corporate & Investment Bank (CIB), Commercial Banking (CB), and Asset & Wealth Management (AWM)."
C,0.0419,CITIGROUP INC,"Citigroup Inc., a diversified financial services holding company, provides various financial products and services to consumers, corporations, governments, and institutions in North America, Latin America, Asia, Europe, the Middle East, and Africa."
LNC,0.0565,LINCOLN NATIONAL CORP,"Lincoln National Corporation, through its subsidiaries, operates multiple insurance and retirement businesses in the United States. It operates through four segments: Annuities, Retirement Plan Services, Life Insurance, and Group Protection."
STT,0.0601,STATE STREET CORP,"State Street Corporation, through its subsidiaries, provides a range of financial products and services to institutional investors worldwide."
SHLD,0.0791,VICTORYSHARES PR AMERICA ETF,Victory Portfolios II - VictoryShares Defend America ETF is an exchange traded fund launched and managed by Victory Capital Management Inc. It invests in public equity markets of the United States.
ZION,0.082,ZIONS BANCORPORATION NA,"Zions Bancorporation, National Association provides various banking and related services primarily in Arizona, California, Colorado, Idaho, Nevada, New Mexico, Oregon, Texas, Utah, Washington, and Wyoming."
GS,0.0933,GOLDMAN SACHS GROUP INC,"The Goldman Sachs Group, Inc. operates as an investment banking, securities, and investment management company worldwide. It operates in four segments: Investment Banking, Global Markets, Asset Management, and Consumer & Wealth Management."
FITB,0.0943,FIFTH THIRD BANCORP,Fifth Third Bancorp operates as a diversified financial services company in the United States.
AXP,0.0951,AMERICAN EXPRESS CO,"American Express Company, together with its subsidiaries, provides charge and credit payment card products, and travel-related services worldwide. The company operates through three segments: Global Consumer Services Group, Global Commercial Services, and Global Merchant and Network Services."
FOSL,0.0967,FOSSIL GROUP INC,"Fossil Group, Inc., together with its subsidiaries, designs, develops, markets, and distributes consumer fashion accessories in the United States, Europe, Asia, and internationally."
LUV,0.1041,SOUTHWEST AIRLINES,Southwest Airlines Co. operates a passenger airline that provides scheduled air transportation services in the United States and near-international markets.
PFG,0.1062,PRINCIPAL FINANCIAL GRP INC,"Principal Financial Group, Inc. provides retirement, asset management, and insurance products and services to businesses, individuals, and institutional clients worldwide. The company operates through Retirement and Income Solutions, Principal Global Investors, Principal International, and U.S."
WYNN,0.1091,WYNN RESORTS LTD,"Wynn Resorts, Limited designs, develops, and operates integrated resorts."
VIAC,0.1112,VIACOMCBS INC,"ViacomCBS Inc. operates as a media and entertainment company worldwide. The company operates in four segments: TV Entertainment, Cable Networks, Filmed Entertainment, and Publishing."
MTB,0.1232,M & T BANK CORP,"M&T Bank Corporation operates as the holding company for Manufacturers and Traders Trust Company; and Wilmington Trust, National Association that provide banking services."
CFG,0.1304,CITIZENS FINANCIAL GROUP INC,"Citizens Financial Group, Inc. operates as the bank holding company for Citizens Bank, National Association that provides retail and commercial banking products and services in the United States. The company operates in two segments, Consumer Banking and Commercial Banking."
UNM,0.1382,UNUM GROUP,"Unum Group, together with its subsidiaries, provides financial protection benefit solutions in the United States, the United Kingdom, Poland, and internationally. It operates through Unum US, Unum International, Colonial Life, and Closed Block segments."
CIT,0.139,CIT GROUP INC,"CIT Group Inc. operates as the holding company for CIT Bank, N.A. that provides banking and related services to commercial and individual customers. The company operates through Commercial Banking and Consumer Banking segments."
NTRS,0.1391,NORTHERN TRUST CORP,"Northern Trust Corporation, a financial holding company, provides wealth management, asset servicing, asset management, and banking solutions for corporations, institutions, families, and individuals worldwide."
BK,0.1424,BANK OF NEW YORK MELLON CORP,"The Bank of New York Mellon Corporation provides a range of financial products and services to in the United States and internationally. The company operates through two segments, Investment Management and Investment Services."
GM,0.1502,GENERAL MOTORS CO,"General Motors Company designs, builds, and sells cars, trucks, crossovers, and automobile parts worldwide. The company operates through GM North America, GM International, Cruise, and GM Financial segments."
HWM,0.1505,HOWMET AEROSPACE INC,Howmet Aerospace Inc. provides advanced engineered solutions for the aerospace and transportation industries.
KEY,0.1549,KEYCORP,"KeyCorp operates as the holding company for KeyBank National Association that provides various retail and commercial banking services in the United States. It operates in two segments, Consumer Bank and Commercial Bank."
RHI,0.1607,ROBERT HALF INTL INC,"Robert Half International Inc. provides staffing and risk consulting services in North America, South America, Europe, Asia, and Australia."
JEF,0.1634,JEFFERIES FINANCIAL GRP INC,"Jefferies Financial Group Inc., a diversified financial services company, engages in investment banking and capital markets, asset management, and direct investing businesses in the Americas, Europe, the Middle East, Africa, and Asia."
ANF,0.1732,ABERCROMBIE & FITCH  -CL A,"Abercrombie & Fitch Co., through its subsidiaries, operates as a specialty retailer. The company operates in two segments, Hollister and Abercrombie."
HLT,0.1775,HILTON WORLDWIDE HOLDINGS,"Hilton Worldwide Holdings Inc., a hospitality company, owns, leases, manages, develops, and franchises hotels and resorts. It operates through two segments, Management and Franchise, and Ownership. The company engages in the hotel management and licensing of its brands."
KSU,0.1889,KANSAS CITY SOUTHERN,"Kansas City Southern, a transportation holding company, provides domestic and international rail transportation services in North America."
F,0.1907,FORD MOTOR CO,"Ford Motor Company designs, manufactures, markets, and services a range of Ford cars, trucks, sport utility vehicles, electrified vehicles, and Lincoln luxury vehicles worldwide. It operates through three segments: Automotive, Mobility, and Ford Credit."
HOG,0.1956,HARLEY-DAVIDSON INC,"Harley-Davidson, Inc. manufactures and sells custom, cruiser, and touring motorcycles. The company operates in two segments, Motorcycles and Related Products and Financial Services."
HPE,0.1964,HEWLETT PACKARD ENTERPRISE,"Hewlett Packard Enterprise Company provides solutions that allow customers to capture, analyze, and act upon data from edge to cloud."
TEL,0.1984,TE CONNECTIVITY LTD,"TE Connectivity Ltd., together with its subsidiaries, manufactures and sells connectivity and sensor solutions in Europe, the Middle East, Africa, the Asia-Pacific, and the Americas."
BLK,0.2115,BLACKROCK INC,"BlackRock, Inc. is a publicly owned investment manager."
AMP,0.2389,AMERIPRISE FINANCIAL INC,"Ameriprise Financial, Inc., through its subsidiaries, provides various financial products and services to individual and institutional clients in the United States and internationally."
GT,0.2394,GOODYEAR TIRE & RUBBER CO,"The Goodyear Tire & Rubber Company, together with its subsidiaries, develops, manufactures, distributes, and sells tires and related products and services worldwide."
SNV,0.2411,SYNOVUS FINANCIAL CORP,"Synovus Financial Corp. operates as the bank holding company for Synovus Bank that provides various financial products and services. It operates through three segments: Community Banking, Wholesale Banking, and Financial Management Services."
TXT,0.2437,TEXTRON INC,"Textron Inc. operates in the aircraft, defense, industrial, and finance businesses worldwide."
NCLH,0.2479,NORWEGIAN CRUISE LINE HLDGS,"Norwegian Cruise Line Holdings Ltd., together with its subsidiaries, operates as a cruise company in the North America, Europe, the Asia-Pacific, and internationally. The company operates the Norwegian Cruise Line, Oceania Cruises, and Regent Seven Seas Cruises brands."
AFL,0.2522,AFLAC INC,"Aflac Incorporated, through its subsidiaries, provides supplemental health and life insurance products. It operates through two segments, Aflac Japan and Aflac U.S."
ALTR,0.2544,ALTAIR ENGINEERING INC,"Altair Engineering Inc., together with its subsidiaries, provides software and cloud solutions worldwide. The company operates through two segments, Software and Client Engineering Services."
FLS,0.2574,FLOWSERVE CORP,"Flowserve Corporation designs, develops, manufactures, distributes, and services industrial flow management equipment in the United States, Europe, the Middle East, Africa, Asia, and internationally."
RTX,0.2576,RAYTHEON TECHNOLOGIES CORP,"Raytheon Technologies Corporation, an aerospace and defense company, provides advanced systems and services for commercial, military, and government customers worldwide."
SIVB,0.2611,SVB FINANCIAL GROUP,"SVB Financial Group, a diversified financial services company, provides various banking and financial products and services. The company operates through four segments: Global Commercial Bank, SVB Private Bank, SVB Capital, and SVB Leerink."
LIFE,0.265,ATYR PHARMA INC,"aTyr Pharma, Inc., a biotherapeutics company, engages in the discovery and development of medicines based on novel immunological pathways in the United States."
ORCL,0.2671,ORACLE CORP,Oracle Corporation provides products and services that address enterprise information technology environments worldwide.
DYN,0.2694,DYNE THERAPEUTICS INC,"Dyne Therapeutics, Inc., a muscle disease company, operates as a biotechnology company that focuses on advancing therapeutics for genetically driven muscle diseases in the United States."
ADS,0.2694,ALLIANCE DATA SYSTEMS CORP,"Alliance Data Systems Corporation provides data-driven marketing and loyalty solutions in the United States, Canada, Europe, the Middle East, Africa, the Asia Pacific, and others. It operates through two segments, LoyaltyOne and Card Services."
GE,0.271,GENERAL ELECTRIC CO,"General Electric Company operates as a high-tech industrial company in the United States, Europe, Asia, the Americas, the Middle East, and Africa. It operates through Power, Renewable Energy, Aviation, Healthcare, and Capital segments."
IVZ,0.2795,INVESCO LTD,Invesco Ltd. is a publicly owned investment manager.
JBL,0.287,JABIL INC,"Jabil Inc. provides manufacturing services and solutions worldwide. The company operates in two segments, Electronics Manufacturing Services and Diversified Manufacturing Services. It offers electronics design, production, and product management services."
ROP,0.2879,ROPER TECHNOLOGIES INC,"Roper Technologies, Inc. designs and develops software, and engineered products and solutions worldwide."
AES,0.2905,AES CORP (THE),"The AES Corporation operates as a diversified power generation and utility company. It owns and/or operates power plants to generate and sell power to customers, such as utilities, industrial users, and other intermediaries."
AN,0.3026,AUTONATION INC,"AutoNation, Inc., through its subsidiaries, operates as an automotive retailer in the United States. The company operates through three segments: Domestic, Import, and Premium Luxury."
SCHW,0.3135,SCHWAB (CHARLES) CORP,"The Charles Schwab Corporation, through its subsidiaries, provides wealth management, securities brokerage, banking, asset management, custody, and financial advisory services. The company operates through two segments, Investor Services and Advisor Services."
WRK,0.3145,WESTROCK CO,"WestRock Company manufactures and sells paper and packaging solutions in North America, South America, Europe, Asia, and Australia. The company operates through Corrugated Packaging and Consumer Packaging segments."
EMR,0.3148,EMERSON ELECTRIC CO,"Emerson Electric Co. designs and manufactures technology and engineering products for industrial, commercial, and consumer markets worldwide. It operates through Automation Solutions and Commercial & Residential Solutions segments."
HON,0.316,HONEYWELL INTERNATIONAL INC,Honeywell International Inc. operates as a diversified technology and manufacturing company worldwide.
KEYS,0.3189,KEYSIGHT TECHNOLOGIES INC,"Keysight Technologies, Inc. provides electronic design and test solutions to commercial communications, networking, aerospace, defense and government, automotive, energy, semiconductor, electronic, and education industries in the Americas, Europe, and the Asia Pacific."
NCR,0.3405,NCR CORP,"NCR Corporation provides software and services worldwide. The company operates through Banking, Retail, Hospitality, and Other segments."
APTV,0.3471,APTIV PLC,"Aptiv PLC designs, manufacturers, and sells vehicle components worldwide. The company provides electrical, electronic, and safety technology solutions to the automotive and commercial vehicle markets."
TDY,0.3502,TELEDYNE TECHNOLOGIES INC,"Teledyne Technologies Incorporated provides instrumentation, digital imaging, aerospace and defense electronics, and engineered systems in the United States, the United Kingdom, Canada, the Netherlands, and internationally."
XOM,0.3568,EXXON MOBIL CORP,"Exxon Mobil Corporation explores for and produces crude oil and natural gas in the United States, Canada/other Americas, Europe, Africa, Asia, and Australia/Oceania. It operates through Upstream, Downstream, and Chemical segments."
GME,0.377,GAMESTOP CORP,"GameStop Corp. operates as a multichannel video game, consumer electronics, and collectibles retailer in the United States, Canada, Australia, and Europe."
TEX,0.3812,TEREX CORP,"Terex Corporation manufactures and sells aerial work platforms, materials processing machinery, and cranes worldwide. The company operates in two segments, Aerial Work Platforms (AWP) and Material Processing (MP)."
GLW,0.4038,CORNING INC,"Corning Incorporated engages in display technologies, optical communications, environmental technologies, specialty materials, and life sciences businesses worldwide."
RL,0.4211,RALPH LAUREN CORP,"Ralph Lauren Corporation designs, markets, and distributes lifestyle products in North America, Europe, Asia, and internationally."
ADCT,0.4623,ADC THERAPEUTICS SA,"ADC Therapeutics SA, a clinical-stage oncology-focused biotechnology company, develops antibody drug conjugates (ADC) for patients suffering from hematological malignancies and solid tumors."
BUD,0.4677,ANHEUSER-BUSCH INBEV,"Anheuser-Busch InBev SA/NV, a brewing company, engages in the production, distribution, and sale of beer, alcoholic beverages, and soft drinks worldwide."
FLR,0.4769,FLUOR CORP,"Fluor Corporation, through its subsidiaries, provides engineering, procurement, construction, fabrication and modularization, operation, maintenance and asset integrity, and project management services worldwide."
AKAM,0.4872,AKAMAI TECHNOLOGIES INC,"Akamai Technologies, Inc. provides cloud services for delivering, optimizing, and securing content and business applications over the Internet in the United States and internationally."
DELL,0.4881,DELL TECHNOLOGIES INC,"Dell Technologies Inc. designs, develops, manufactures, markets, sells, and support IT hardware, software, and services solutions worldwide. It operates through three segments: Infrastructure Solutions Group (ISG), Client Solutions Group (CSG), and VMware."
BWA,0.5297,BORGWARNER INC,"BorgWarner Inc. provides solutions for combustion, hybrid, and electric vehicles worldwide."
SANM,0.5421,SANMINA CORP,"Sanmina Corporation provides integrated manufacturing solutions, components, products and repair, logistics, and after-market services worldwide. It operates in two segments, Integrated Manufacturing Solutions; and Components, Products and Services."
AE,0.5718,ADAMS RESOURCES & ENERGY INC,"Adams Resources & Energy, Inc., through its subsidiaries, primarily engages in the marketing, transportation, and storage of crude oil in the United States."
WAT,0.6534,WATERS CORP,"Waters Corporation, a specialty measurement company, provides analytical workflow solutions in Asia, the Americas, and Europe. It operates through two segments, Waters and TA."
VAR,0.6639,VARIAN MEDICAL SYSTEMS INC,"Varian Medical Systems, Inc. designs, manufactures, sells, and services medical devices and software products for treating cancer and other medical conditions worldwide. It operates through Oncology Systems and Proton Solutions segments."
CIEN,0.684,CIENA CORP,"Ciena Corporation provides network hardware, software, and services that support the transport, routing, switching, aggregation, service delivery, and management of video, data, and voice traffic on communications networks worldwide."
LIN,0.7005,LINDE PLC,"Linde plc operates as an industrial gas company in North and South America, Europe, the Middle East, Africa, and the Asia Pacific. The company offers oxygen, nitrogen, argon, rare gases, carbon monoxide, carbon dioxide, helium, hydrogen, electronic gases, specialty gases, and acetylene."
DNB,0.709,DUN & BRADSTREET HOLDNGS INC,"Dun & Bradstreet Holdings, Inc. provides business decisioning data and analytics in North America and internationally."
