,dist,conm,busdesc
MPC,0.0,MARATHON PETROLEUM CORP,"Marathon Petroleum Corporation, together with its subsidiaries, engages in refining, marketing, retailing, and transporting petroleum products primarily in the United States. It operates through three segments: Refining & Marketing, Retail, and Midstream."
ANDV,0.3004,ANDEAVOR,"Andeavor, through its subsidiaries, operates as an independent petroleum refining, logistics, and marketing company in the United States. The company operates in three segments: Marketing, Logistics, and Refining."
PSX,0.3028,PHILLIPS 66,"Phillips 66 operates as an energy manufacturing and logistics company. It operates through four segments: Midstream, Chemicals, Refining, and Marketing and Specialties (M&S)."
VLO,0.3041,VALERO ENERGY CORP,"Valero Energy Corporation manufactures and sells transportation fuels and petrochemical products in the United States, Canada, the United Kingdom, Ireland, and internationally. It operates through three segments: Refining, Ethanol, and Renewable Diesel."
HFC,0.317,HOLLYFRONTIER CORP,"HollyFrontier Corporation operates as an independent petroleum refiner in the United States. The company operates through three segments: Refining, Lubricants and Specialty Products, and HEP."
LYB,0.7079,LYONDELLBASELL INDUSTRIES NV,"LyondellBasell Industries N.V. operates as a chemical company in the United States, Germany, Mexico, Italy, France, Japan, China, the Netherlands, and internationally."
