,dist,conm,busdesc
TGNA,0.0,TEGNA INC,TEGNA Inc. operates as a media company in the United States. The company operates television stations and radio stations that deliver television programming and digital content. It offers content and information to consumers across various platforms.
DJ,0.43,DOW JONES & CO INC,"Dow Jones & Company, Inc. offers business and financial news and information globally to consumers and organizations worldwide. It provides solutions through newspapers, newswires, Websites, applications, newsletters, magazines, databases, and conferences."
NYT,0.4659,NEW YORK TIMES CO  -CL A,"The New York Times Company, together with its subsidiaries, provides news and information for readers and viewers across various platforms worldwide."
TRB,0.5381,TRIBUNE MEDIA CO,"Tribune Media Company, through its subsidiaries, operates as a diversified media and entertainment company in the United States."
SPGI,0.6597,S&P GLOBAL INC,"S&P Global Inc., together with its subsidiaries, provides ratings, benchmarks, analytics, and data to the capital and commodity markets worldwide."
BIG,0.7219,BIG LOTS INC,"Big Lots, Inc., through its subsidiaries, operates as a retailer in the United States."
RX,0.7559,IMS HEALTH HOLDINGS INC,"As of October 3, 2016, IMS Health Holdings, Inc. was acquired by Quintiles IMS Holdings, Inc. IMS Health Holdings, Inc. provides information and technology services to healthcare industry worldwide."
