,dist,conm,busdesc
RDC,0.0,ROWAN COMPANIES LTD,"Rowan Companies Limited provides offshore contract drilling services to the oil and gas industry. It operates through three segments: Deepwater, Jack-ups, and ARO. The Deepwater segment operates 4 ultra-deepwater drillships. The Jack-ups segment operates 15 self-elevating jack-up rigs."
RIG,0.1935,TRANSOCEAN LTD,"Transocean Ltd., together with its subsidiaries, provides offshore contract drilling services for oil and gas wells worldwide. The company primarily offers drilling rigs, related equipment, and work crews; and ultra-deepwater and harsh environment drilling services."
NBR,0.2091,NABORS INDUSTRIES LTD,"Nabors Industries Ltd. provides drilling and drilling-related services for land-based and offshore oil and natural gas wells. It operates through five segments: U.S. Drilling, Canada Drilling, International Drilling, Drilling Solutions, and Rig Technologies."
SLB,0.2138,SCHLUMBERGER LTD,"Schlumberger Limited supplies technology for reservoir characterization, drilling, production, and processing to the oil and gas industry worldwide. It operates in four divisions: Digital & Integration, Reservoir Performance, Well Construction, and Production Systems."
HP,0.2146,HELMERICH & PAYNE,"Helmerich & Payne, Inc., together with its subsidiaries, provides drilling services and solutions for exploration and production companies. The company operates through three segments: North America Solutions, Offshore Gulf of Mexico, and International Solutions."
BHI,0.2349,BAKER HUGHES INC,"Baker Hughes Holdings LLC operates as an energy technology company. The company operates through four segments: Oilfield Services, Oilfield Equipment, Turbomachinery & Process Solutions, and Digital Solutions."
HAL,0.2415,HALLIBURTON CO,Halliburton Company provides a range of services and products to oil and natural gas companies worldwide.
CAM,0.2596,CAMERON INTERNATIONAL CORP,"Cameron International Corporation provides flow equipment products, systems, and services worldwide."
