,dist,conm,busdesc
LW,0.0,LAMB WESTON HOLDINGS INC,"Lamb Weston Holdings, Inc. produces, distributes, and markets value-added frozen potato products worldwide. It operates through four segments: Global, Foodservice, Retail, and Other."
PLD,0.3361,PROLOGIS INC,"Prologis, Inc. is the global leader in logistics real estate with a focus on high-barrier, high-growth markets."
CCI,0.3395,CROWN CASTLE INTL CORP,"Crown Castle owns, operates and leases more than 40,000 cell towers and approximately 80,000 route miles of fiber supporting small cells and fiber solutions across every major U.S. market."
BR,0.398,BROADRIDGE FINANCIAL SOLUTNS,"Broadridge Financial Solutions, Inc. provides investor communications and technology-driven solutions for the financial services industry worldwide."
CVG,0.4109,CONVERGYS CORP,"Convergys Corporation provides customer management services to communications and media, technology, financial services, retail, healthcare, government, travel and hospitality, and other vertical markets worldwide."
EQIX,0.4338,EQUINIX INC,"Equinix (Nasdaq: EQIX) is the world's digital infrastructure company, enabling digital leaders to harness a trusted platform to bring together and interconnect the foundational infrastructure that powers their success."
COTY,0.4489,COTY INC,"Coty Inc., together with its subsidiaries, manufactures, markets, distributes, and sells beauty products worldwide."
EFX,0.4636,EQUIFAX INC,"Equifax Inc. provides information solutions and human resources business process outsourcing services for businesses, governments, and consumers. The company operates through four segments: U.S. Information Solutions (USIS), Workforce Solutions, International, and Global Consumer Solutions."
KHC,0.4649,KRAFT HEINZ CO,"The Kraft Heinz Company, together with its subsidiaries, manufactures and markets food and beverage products in the United States, Canada, the United Kingdom, and internationally."
HRL,0.4731,HORMEL FOODS CORP,"Hormel Foods Corporation produces and markets various meat and food products to retail, foodservice, deli, and commercial customers in the United States and internationally."
TRIP,0.4748,TRIPADVISOR INC,"TripAdvisor, Inc. operates as an online travel company. It operates in two segments, Hotels, Media & Platform; and Experiences & Dining."
NVR,0.4821,NVR INC,"NVR, Inc. operates as a homebuilder in the United States. The company operates in two segments, Homebuilding and Mortgage Banking. It primarily constructs and sells single-family detached homes, townhomes, and condominium buildings under the Ryan Homes, NVHomes, and Heartland Homes names."
SBAC,0.4832,SBA COMMUNICATIONS CORP,"SBA Communications Corporation is a first choice provider and leading owner and operator of wireless communications infrastructure in North, Central, and South America and South Africa."
BLL,0.4974,BALL CORP,"Ball Corporation supplies aluminum packaging products to the beverage, personal care, automotive, paint, healthcare, and household products industries."
AMT,0.5016,AMERICAN TOWER CORP,"American Tower, one of the largest global REITs, is a leading independent owner, operator and developer of multitenant communications real estate with a portfolio of approximately 181,000 communications sites."
KSU,0.5187,KANSAS CITY SOUTHERN,"Kansas City Southern, a transportation holding company, provides domestic and international rail transportation services in North America."
EA,0.5365,ELECTRONIC ARTS INC,"Electronic Arts Inc. develops, markets, publishes, and distributes games, content, and services for game consoles, PCs, mobile phones, and tablets worldwide."
AVY,0.5649,AVERY DENNISON CORP,Avery Dennison Corporation produces and sells pressure-sensitive materials worldwide.
THC,0.5707,TENET HEALTHCARE CORP,"Tenet Healthcare Corporation operates as a diversified healthcare services company. The company operates through three segments: Hospital Operations and Other, Ambulatory Care, and Conifer."
TSLA,0.5846,TESLA INC,"Tesla, Inc. designs, develops, manufactures, leases, and sells electric vehicles, and energy generation and storage systems in the United States, China, Netherlands, Norway, and internationally. The company operates in two segments, Automotive; and Energy Generation and Storage."
SUNW,0.5883,SUNWORKS INC,"Sunworks, Inc., through its subsidiaries, provides photovoltaic based power systems for the agricultural, commercial, industrial, public works, and residential markets in California, Massachusetts, Nevada, Oregon, New Jersey, and Washington."
CAG,0.5933,CONAGRA BRANDS INC,"Conagra Brands, Inc., together with its subsidiaries, operates as a consumer packaged goods food company in North America. The company operates through Grocery & Snacks, Refrigerated & Frozen, International, and Foodservice segments."
JKHY,0.6016,HENRY (JACK) & ASSOCIATES,"Jack Henry & Associates, Inc. provides technology solutions and payment processing services primarily for financial services organizations in the United States."
EXPE,0.6064,EXPEDIA GROUP INC,"Expedia Group, Inc. operates as an online travel company worldwide. It operates through four segments: Core Online Travel Agencies, Trivago, Vrbo, and Egencia."
LXK,0.6218,LEXMARK INTL INC  -CL A,"Lexmark International, Inc., together with its subsidiaries, operates as a developer, manufacturer, and supplier of printing, imaging, device management, and document workflow solutions."
CNC,0.6286,CENTENE CORP,Centene Corporation operates as a multi-national healthcare enterprise that provides programs and services to under-insured and uninsured individuals in the United States.
EVHC,0.629,ENVISION HEALTHCARE CORP,"Envision Healthcare Corporation, through its subsidiaries, provides various healthcare services in the United States. The company operates through two segments, Physician Services and Ambulatory Services."
CDNS,0.6318,CADENCE DESIGN SYSTEMS INC,"Cadence Design Systems, Inc. provides software, hardware, services, and reusable integrated circuit (IC) design blocks worldwide. The company offers functional verification services, including emulation and prototyping hardware."
AMD,0.6377,ADVANCED MICRO DEVICES,"Advanced Micro Devices, Inc. operates as a semiconductor company worldwide. The company operates in two segments, Computing and Graphics; and Enterprise, Embedded and Semi-Custom."
MDLZ,0.6405,MONDELEZ INTERNATIONAL INC,"Mondelez International, Inc., through its subsidiaries, manufactures, markets, and sells snack food and beverage products worldwide."
IPG,0.6532,INTERPUBLIC GROUP OF COS,"The Interpublic Group of Companies, Inc. provides advertising and marketing services worldwide. It operates through two segments, Integrated Agency Networks and Constituency Management Group."
AAPL,0.6577,APPLE INC,"Apple Inc. designs, manufactures, and markets smartphones, personal computers, tablets, wearables, and accessories worldwide. It also sells various related services."
ADP,0.6638,AUTOMATIC DATA PROCESSING,"Automatic Data Processing, Inc. provides cloud-based human capital management solutions worldwide. It operates through two segments, Employer Services and Professional Employer Organization (PEO)."
CERN,0.6758,CERNER CORP,"Cerner Corporation, together with its subsidiaries, provides health care information technology solutions and tech-enabled services in the United States and internationally."
ROL,0.6968,ROLLINS INC,"Rollins, Inc., through its subsidiaries, provides pest and termite control services to residential and commercial customers."
JNPR,0.7016,JUNIPER NETWORKS INC,"Juniper Networks, Inc. designs, develops, and sells network products and services worldwide."
TSS,0.7032,TOTAL SYSTEM SERVICES INC,"As of September 17, 2019, Total System Services, Inc. was acquired by Global Payments Inc. Total System Services, Inc. provides payment processing, merchant, and related payment services to financial and nonfinancial institutions worldwide."
SNPS,0.7079,SYNOPSYS INC,"Synopsys, Inc. provides electronic design automation software products used to design and test integrated circuits."
NWL,0.7091,NEWELL BRANDS INC,"Newell Brands Inc. designs, manufactures, sources, and distributes consumer and commercial products worldwide. The company operates through four segments: Appliances and Cookware, Food and Commercial, Home and Outdoor Living, and Learning and Development."
GLW,0.7099,CORNING INC,"Corning Incorporated engages in display technologies, optical communications, environmental technologies, specialty materials, and life sciences businesses worldwide."
IDXX,0.7226,IDEXX LABS INC,"IDEXX Laboratories, Inc., together with its subsidiaries, develops, manufactures, and distributes products and services primarily for the companion animal veterinary, livestock and poultry, dairy, and water testing markets worldwide."
ROST,0.7303,ROSS STORES INC,"Ross Stores, Inc., together with its subsidiaries, operates off-price retail apparel and home fashion stores under the Ross Dress for Less and dd's DISCOUNTS brands. Its stores primarily offers apparel, accessories, footwear, and home fashions."
HOLX,0.7354,HOLOGIC INC,"Hologic, Inc. develops, manufactures, and supplies diagnostics products, medical imaging systems, and surgical products for women's health through early detection and treatment in the United States, Europe, the Asia-Pacific, and internationally."
BKNG,0.7587,BOOKING HOLDINGS INC,Booking Holdings Inc. provides travel and restaurant online reservation and related services worldwide.
TTWO,0.771,TAKE-TWO INTERACTIVE SFTWR,"Take-Two Interactive Software, Inc. develops, publishes, and markets interactive entertainment solutions for consumers worldwide. The company offers its products under the Rockstar Games and 2K labels, as well as under Private Division and Social Point labels."
WCG,0.7797,WELLCARE HEALTH PLANS INC,"WellCare Health Plans, Inc. provides government-sponsored managed care services. The company operates in three segments: Medicaid Health Plans, Medicare Health Plans, and Medicare Prescription Drug Plans (PDPs)."
