,dist,conm,busdesc
MMI,0.0,MARCUS & MILLICHAP INC,"Marcus & Millichap, Inc., an investment brokerage company, provides real estate investment brokerage and financing services to sellers and buyers of commercial real estate in the United States and Canada."
OMX,0.3893,OFFICEMAX INC,"OfficeMax Incorporated, together with its subsidiaries, distributes business-to-business and retail office products."
MOLX,0.5987,MOLEX INC,"Molex, LLC designs, develops, and manufactures electronic components and solutions."
TLAB,0.6291,TELLABS INC,"Tellabs Inc. designs, develops, and supports telecommunication networking products for communication service providers in the United States and internationally. The company operates through four segments: Optical, Data, Access, and Services."
CSX,0.6713,CSX CORP,"CSX Corporation, together with its subsidiaries, provides rail-based freight transportation services."
CDNS,0.7094,CADENCE DESIGN SYSTEMS INC,"Cadence Design Systems, Inc. provides software, hardware, services, and reusable integrated circuit (IC) design blocks worldwide. The company offers functional verification services, including emulation and prototyping hardware."
AVP,0.7367,AVON PRODUCTS,"Avon Products, Inc. manufactures, markets, and sells beauty and related products in Europe, the Middle East, Africa, south Latin America, north Latin America, and the Asia Pacific."
FDO,0.7637,FAMILY DOLLAR STORES,"Family Dollar Stores, Inc. operates a chain of general merchandise retail discount stores primarily for low- and middle-income consumers in the United States."
ABI,0.7684,SAFETY FIRST PRINC PROT DJIA,
