,dist,conm,busdesc
TIE,0.0,TITANIUM METALS CORP,Titanium Metals Corporation produces and sells titanium melted and mill products.
ARE,0.0014,ALEXANDRIA R E EQUITIES INC,"Alexandria Real Estate Equities, Inc."
BMS,0.0033,BEMIS CO INC,"Bemis Company, Inc. manufactures and sells packaging products in the United States, Brazil, other Americas, Europe, and the Asia-Pacific. It operates through three segments: U.S. Packaging, Latin America Packaging, and Rest of World Packaging."
LMT,0.0038,LOCKHEED MARTIN CORP,"Lockheed Martin Corporation, a security and aerospace company, engages in the research, design, development, manufacture, integration, and sustainment of technology systems, products, and services worldwide."
PBI,0.0044,PITNEY BOWES INC,"Pitney Bowes Inc., a technology company, provides commerce solutions in the United States and internationally. The company operates through Global Ecommerce, Presort Services and SendTech Solutions segments."
DRE,0.0053,DUKE REALTY CORP,Duke Realty Corporation owns and operates approximately 156 million rentable square feet of industrial assets in 20 major logistics markets. Duke Realty Corporation is publicly traded on the NYSE under the symbol DRE and is a member of the S&P 500 Index.
AXP,0.006,AMERICAN EXPRESS CO,"American Express Company, together with its subsidiaries, provides charge and credit payment card products, and travel-related services worldwide. The company operates through three segments: Global Consumer Services Group, Global Commercial Services, and Global Merchant and Network Services."
MAA,0.0069,MID-AMERICA APT CMNTYS INC,"MAA, an S&P 500 company, is a real estate investment trust, or REIT, focused on delivering full-cycle and superior investment performance for shareholders through the ownership, management, acquisition, development and redevelopment of quality apartment communities throughout the United States."
SYK,0.0114,STRYKER CORP,"Stryker Corporation operates as a medical technology company. The company operates through three segments: Orthopaedics, MedSurg, and Neurotechnology and Spine. The Orthopaedics segment provides implants for use in hip and knee joint replacements, and trauma and extremities surgeries."
BBY,0.0124,BEST BUY CO INC,"Best Buy Co., Inc. retails technology products in the United States, Canada, and Mexico. The company operates in two segments, Domestic and International."
PEP,0.0132,PEPSICO INC,"PepsiCo, Inc. operates as a food and beverage company worldwide. The company operates through seven segments: FLNA, QFNA, PBNA, LatAm, Europe, AMESA, and APAC."
WEN,0.0138,WENDY'S CO,"The Wendy's Company, together with its subsidiaries, operates as a quick-service restaurant company. It operates through three segments: Wendy's U.S., Wendy's International, and Global Real Estate & Development."
KIM,0.0143,KIMCO REALTY CORP,"Kimco Realty Corp. (NYSE:KIM) is a real estate investment trust (REIT) headquartered in Jericho, N.Y. that is one of North America's largest publicly traded owners and operators of open-air, grocery-anchored shopping centers and mixed-use assets."
LH,0.0158,LABORATORY CP OF AMER HLDGS,"Laboratory Corporation of America Holdings operates as an independent clinical laboratory company worldwide. It operates in two segments, LabCorp Diagnostics (LCD) and Covance Drug Development."
PVH,0.0169,PVH CORP,PVH Corp. operates as an apparel company in the United States and internationally.
KSS,0.0209,KOHL'S CORP,"Kohl's Corporation operates as a retail company in the United States. Its stores and Website offer apparel, footwear, accessories, beauty, and home products. The company provides its products primarily under the brand names of Apt."
HES,0.0225,HESS CORP,"Hess Corporation, an exploration and production company, explores, develops, produces, purchases, transports, and sells crude oil, natural gas liquids (NGLs), and natural gas. It operates through two segments, Exploration and Production, and Midstream."
L,0.0228,LOEWS CORP,Loews Corporation provides commercial property and casualty insurance in the United States and internationally.
TGT,0.0229,TARGET CORP,Target Corporation operates as a general merchandise retailer in the United States.
ESS,0.0236,ESSEX PROPERTY TRUST,"Essex Property Trust, Inc., an S&P 500 company, is a fully integrated real estate investment trust (REIT) that acquires, develops, redevelops, and manages multifamily residential properties in selected West Coast markets."
UDR,0.0247,UDR INC,"UDR, Inc."
BXP,0.0248,BOSTON PROPERTIES INC,"Boston Properties (NYSE: BXP) is the largest publicly-held developer and owner of Class A office properties in the United States, concentrated in five markets - Boston, Los Angeles, New York, San Francisco and Washington, DC."
STJ,0.0254,ST JUDE MEDICAL INC,"St. Jude Medical, Inc. was acquired by St. Jude Medical, LLC. St."
ABT,0.0262,ABBOTT LABORATORIES,"Abbott Laboratories discovers, develops, manufactures, and sells health care products worldwide."
STE,0.0281,STERIS PLC,"STERIS plc provides infection prevention and other procedural products and services worldwide. It operates in four segments: Healthcare Products, Healthcare Specialty Services, Life Sciences, and Applied Sterilization Technologies."
ALK,0.0298,ALASKA AIR GROUP INC,"Alaska Air Group, Inc., through its subsidiaries, provides passenger and cargo air transportation services. The company operates through three segments: Mainline, Regional, and Horizon."
CPRI,0.032,CAPRI HOLDINGS LTD,"Capri Holdings Limited designs, markets, distributes, and retails branded women's and men's apparel, footwear, and accessories in the United States, Canada, Latin America, Europe, the Middle East, Africa, and Asia."
WELL,0.0341,WELLTOWER INC,"Welltower Inc. (NYSE:WELL), an S&P 500 company headquartered in Toledo, Ohio, is driving the transformation of health care infrastructure."
XEC,0.0343,CIMAREX ENERGY CO,"Cimarex Energy Co. operates as an independent oil and gas exploration and production company primarily in Texas, Oklahoma, and New Mexico."
EQR,0.0345,EQUITY RESIDENTIAL,"Equity Residential is committed to creating communities where people thrive. The Company, a member of the S&P 500, is focused on the acquisition, development and management of residential properties located in and around dynamic cities that attract high quality long-term renters."
SRCL,0.0357,STERICYCLE INC,"Stericycle, Inc., together with its subsidiaries, provides regulated and compliance solutions to the healthcare, retail, and commercial businesses in the United States, Europe, and internationally."
DLR,0.0364,DIGITAL REALTY TRUST INC,"Digital Realty supports the world's leading enterprises and service providers by delivering the full spectrum of data center, colocation and interconnection solutions."
EXR,0.0387,EXTRA SPACE STORAGE INC,"Extra Space Storage Inc., headquartered in Salt Lake City, Utah, is a self-administered and self-managed REIT and a member of the S&P 500. As of September 30, 2020, the Company owned and/or operated 1,906 self-storage stores in 40 states, Washington, D.C. and Puerto Rico."
AVB,0.0388,AVALONBAY COMMUNITIES INC,"As of September 30, 2020, the Company owned or held a direct or indirect ownership interest in 294 apartment communities containing 86,676 apartment homes in 11 states and the District of Columbia, of which 19 communities were under development and one community was under redevelopment."
SYY,0.0389,SYSCO CORP,"Sysco Corporation, through its subsidiaries, markets and distributes a range of food and related products primarily to the foodservice or food-away-from-home industry in the United States, Canada, the United Kingdom, France, and internationally. It operates through three segments: U.S."
PSA,0.0391,PUBLIC STORAGE,"Public Storage, a member of the S&P 500 and FT Global 500, is a REIT that primarily acquires, develops, owns and operates self-storage facilities."
CTX,0.0397,QWEST CORP 7.00 NOTES 2052,
DUK,0.0402,DUKE ENERGY CORP,"Duke Energy Corporation, together with its subsidiaries, operates as an energy company in the United States. It operates through three segments: Electric Utilities and Infrastructure, Gas Utilities and Infrastructure, and Commercial Renewables."
WM,0.0411,WASTE MANAGEMENT INC,"Waste Management, Inc., through its subsidiaries, provides waste management environmental services to residential, commercial, industrial, and municipal customers in North America."
NKE,0.0414,NIKE INC  -CL B,"NIKE, Inc., together with its subsidiaries, designs, develops, markets, and sells athletic footwear, apparel, equipment, and accessories worldwide. The company offers NIKE brand products in six categories, including running, NIKE basketball, the Jordan brand, football, training, and sportswear."
ABC,0.0425,AMERISOURCEBERGEN CORP,AmerisourceBergen Corporation sources and distributes pharmaceutical products in the United States and internationally.
DXCM,0.0453,DEXCOM INC,"DexCom, Inc., a medical device company, focuses on the design, development, and commercialization of continuous glucose monitoring (CGM) systems in the United States and internationally. The company offers its systems for use by people with diabetes, as well as for use by healthcare providers."
AGN,0.0455,ALLERGAN PLC,"Allergan plc, a pharmaceutical company, develops, manufactures, and commercializes branded pharmaceutical, device, biologic, surgical, and regenerative medicine products worldwide. The company operates in three segments: US Specialized Therapeutics, US General Medicine, and International."
BAX,0.0466,BAXTER INTERNATIONAL INC,"Baxter International Inc., through its subsidiaries, develops and provides a portfolio of healthcare products. The company operates through North and South America; Europe, Middle East and Africa; and Asia-Pacific segments."
MAC,0.047,MACERICH CO,"Macerich is a fully integrated, self-managed and self-administered real estate investment trust, which focuses on the acquisition, leasing, management, development and redevelopment of regional malls throughout the United States."
DDS,0.0478,DILLARDS INC  -CL A,"Dillard's, Inc. operates retail department stores primarily in the Southeastern, Southwestern, and Midwestern areas of the United States."
AIV,0.0485,APARTMENT INVST & MGMT CO,Aimco is a real estate investment trust focused on the ownership and management of quality apartment communities located in select markets in the United States.
ACAS,0.0508,AMERICAN CAPITAL LTD,"American Capital, Ltd. is a business development company specializing in management and employee buyouts, subordinated debt, leveraged finance, mezzanine, acquisition, recapitalization, middle market, early venture, mature, industry consolidation, and growth capital investments."
DGX,0.0539,QUEST DIAGNOSTICS INC,"Quest Diagnostics Incorporated provides diagnostic testing, information, and services in the United States and internationally."
TFX,0.0554,TELEFLEX INC,"Teleflex Incorporated designs, develops, manufactures, and supplies single-use medical devices for common diagnostic and therapeutic procedures in critical care and surgical applications worldwide."
NVR,0.0605,NVR INC,"NVR, Inc. operates as a homebuilder in the United States. The company operates in two segments, Homebuilding and Mortgage Banking. It primarily constructs and sells single-family detached homes, townhomes, and condominium buildings under the Ryan Homes, NVHomes, and Heartland Homes names."
SRE,0.0619,SEMPRA ENERGY,"Sempra Energy operates as an energy-services holding company in the United States and internationally. The company's San Diego Gas & Electric Company segment generates, transmits, and distributes electricity; and supplies natural gas."
CMG,0.0661,CHIPOTLE MEXICAN GRILL INC,"Chipotle Mexican Grill, Inc., together with its subsidiaries, operates Chipotle Mexican Grill restaurants. As of September 30, 2020, it operated approximately 2,700 restaurants in the United States, Canada, the United Kingdom, France, and Germany."
UST,0.0673,PROSHARES ULTRA 7-10 YR TRES,ProShares Trust - ProShares Ultra 7-10 Year Treasury is an exchange traded fund launched and managed by ProShare Advisors LLC. The fund invests in the fixed income markets of the United States.
TPR,0.0677,TAPESTRY INC,"Tapestry, Inc. provides luxury accessories and branded lifestyle products in the United States, Japan, China, Hong Kong, Macau, Taiwan, Europe, Canada, South Korea, Malaysia, Singapore, Australia, and New Zealand."
MSI,0.0724,MOTOROLA SOLUTIONS INC,"Motorola Solutions, Inc. provides mission-critical communication solutions the United States, the United Kingdom, Canada, and internationally. The company operates in two segments, Products and Systems Integration, and Services and Software."
IDXX,0.0725,IDEXX LABS INC,"IDEXX Laboratories, Inc., together with its subsidiaries, develops, manufactures, and distributes products and services primarily for the companion animal veterinary, livestock and poultry, dairy, and water testing markets worldwide."
MCK,0.0748,MCKESSON CORP,"McKesson Corporation provides pharmaceuticals and medical supplies in the United States and internationally. It operates through four segments: U.S. Pharmaceutical, Prescription Technology Solutions, International, and Medical-Surgical Solutions. The U.S."
PEAK,0.076,HEALTHPEAK PROPERTIES INC,"Healthpeak Properties, Inc. is a fully integrated real estate investment trust (REIT) and S&P 500 company."
DLTR,0.0761,DOLLAR TREE INC,"Dollar Tree, Inc. operates discount variety retail stores. It operates through two segments, Dollar Tree and Family Dollar. The Dollar Tree segment offers merchandise at the fixed price of $1.00."
PNC,0.0772,PNC FINANCIAL SVCS GROUP INC,"The PNC Financial Services Group, Inc. operates as a diversified financial services company in the United States."
REG,0.0816,REGENCY CENTERS CORP,"Regency Centers is the preeminent national owner, operator, and developer of shopping centers located in affluent and densely populated trade areas."
SPLS,0.0871,STAPLES INC,"Staples, Inc., together with its subsidiaries, operates office products superstores. It operates in two segments, North American Delivery and North American Retail."
MMM,0.0874,3M CO,"3M Company develops, manufactures, and markets various products worldwide. It operates through four business segments: Safety and Industrial, Transportation and Electronics, Health Care, and Consumer."
RSG,0.0889,REPUBLIC SERVICES INC,"Republic Services, Inc., together with its subsidiaries, provides non-hazardous solid waste collection, transfer, disposal, recycling, and environmental services in the United States. The company serves small-container, large-container, and municipal and residential customers."
SEE,0.0901,SEALED AIR CORP,"Sealed Air Corporation provides food safety and security, and product protection solutions and equipment in North America, South America, Europe, the Middle East, Africa, and the Asia Pacific. It operates in two segments, Food Care and Product Care."
ANF,0.0911,ABERCROMBIE & FITCH  -CL A,"Abercrombie & Fitch Co., through its subsidiaries, operates as a specialty retailer. The company operates in two segments, Hollister and Abercrombie."
LLL,0.095,L3 TECHNOLOGIES INC,"L3 Technologies, Inc. provides aircraft sustainment, simulation and training, night vision and image intensification equipment, and security and detection systems used on military, homeland security, and commercial platforms in the United States and internationally."
COV,0.0954,COVIDIEN PLC,"As of January 26, 2015, Covidien plc was acquired by Medtronic plc. Covidien plc develops, manufactures, and sells healthcare products for use in clinical and home settings worldwide. The company operates through Medical Devices and U.S. Medical Supplies segments."
WST,0.0959,WEST PHARMACEUTICAL SVSC INC,"West Pharmaceutical Services, Inc. manufactures and sells containment and delivery systems for injectable drugs and healthcare products in the United States, Germany, Ireland, France, Other European countries, and internationally."
PKG,0.0963,PACKAGING CORP OF AMERICA,Packaging Corporation of America manufactures and sells containerboard and corrugated packaging products in the United States. The company operates through Packaging and Paper segments.
CCU,0.0966,COMPANIA CERVECERIAS UNIDAS,"Compania Cervecerias Unidas S.A. operates as a beverage company principally in Chile, Argentina, Uruguay, Paraguay, Colombia, and Bolivia. The company operates through three segments: Chile, International Business, and Wine."
COG,0.0995,CABOT OIL & GAS CORP,"Cabot Oil & Gas Corporation, an independent oil and gas company, explores for, exploits, develops, produces, and markets oil and gas properties in the United States."
EMC,0.1031,EMC CORP/MA,"Dell EMC develops, delivers, and supports information infrastructure and virtual infrastructure technologies, solutions, and services."
VTR,0.1037,VENTAS INC,"Ventas, an S&P 500 company, operates at the intersection of two powerful and dynamic industries - healthcare and real estate."
CHD,0.1069,CHURCH & DWIGHT INC,"Church & Dwight Co., Inc. develops, manufactures, and markets household, personal care, and specialty products in the United States and internationally. It operates in three segments: Consumer Domestic, Consumer International, and Specialty Products Division."
EQT,0.1105,EQT CORP,"EQT Corporation operates as a natural gas production company in the United States. The company produces natural gas, natural gas liquids (NGLs), and crude oil."
HNZ,0.1154,KRAFT HEINZ CO,"The Kraft Heinz Company, together with its subsidiaries, manufactures and markets food and beverage products in the United States, Canada, the United Kingdom, and internationally."
CVH,0.1165,COVENTRY HEALTH CARE INC,"As of January 1, 2014, Coventry Health Care, Inc. was acquired by Aetna Inc. Coventry Health Care, Inc. operates as a managed healthcare company in the United States."
DVA,0.1166,DAVITA INC,DaVita Inc. provides kidney dialysis services for patients suffering from chronic kidney failure or end stage renal disease (ESRD). The company operates kidney dialysis centers and provides related lab services in outpatient dialysis centers.
RL,0.1185,RALPH LAUREN CORP,"Ralph Lauren Corporation designs, markets, and distributes lifestyle products in North America, Europe, Asia, and internationally."
NFLX,0.1252,NETFLIX INC,"Netflix, Inc. provides subscription streaming entertainment service. It offers TV series, documentaries, and feature films across various genres and languages."
RRC,0.128,RANGE RESOURCES CORP,"Range Resources Corporation operates as an independent natural gas, natural gas liquids (NGLs), and oil company in the United States. The company engages in the exploration, development, and acquisition of natural gas and oil properties."
AVY,0.1281,AVERY DENNISON CORP,Avery Dennison Corporation produces and sells pressure-sensitive materials worldwide.
ZBH,0.1324,ZIMMER BIOMET HOLDINGS INC,"Zimmer Biomet Holdings, Inc., together with its subsidiaries, designs, manufactures, and markets musculoskeletal healthcare products and solutions in the Americas, Europe, the Middle East, Africa, and the Asia Pacific."
BIO,0.1349,BIO-RAD LABORATORIES INC,"Bio-Rad Laboratories, Inc. develops, manufactures, and markets products and solutions for the life science research and clinical diagnostic markets in Europe, the United States, Canada, and Latin America."
MAT,0.1352,MATTEL INC,"Mattel, Inc., a children's entertainment company, designs and produces toys and consumer products worldwide. The company operates through North America, International, and American Girl segments."
SIG,0.1364,SIGNET JEWELERS LTD,"Signet Jewelers Limited engages in the retail sale of diamond jewelry, watches, and other products. As of February 02, 2019, it operated 3,334 stores and kiosks. The company operates through three segments: North America, International, and Other."
NEE,0.1397,NEXTERA ENERGY INC,"NextEra Energy, Inc., through its subsidiaries, generates, transmits, and distributes electric power in North America. The company generates electricity through wind, solar, nuclear, coal, oil, and natural gas facilities."
MDT,0.1422,MEDTRONIC PLC,"Medtronic plc develops, manufactures, distributes, and sells device-based medical therapies to hospitals, physicians, clinicians, and patients worldwide."
SIAL,0.1438,SIGMA-ALDRICH CORP,"Sigma-Aldrich Corporation, a life science and high technology company, develops, manufactures, purchases, and distributes various chemicals, biochemicals, and equipment products worldwide."
RMD,0.1444,RESMED INC,"ResMed Inc. develops, manufactures, distributes, and markets medical devices and cloud-based software applications that diagnose, treat, and manage respiratory disorders comprising sleep apnea, chronic obstructive pulmonary disease, neuromuscular disease, and other chronic diseases."
VNO,0.1482,VORNADO REALTY TRUST,Vornado's portfolio is concentrated in the nation's key market - New York City - along with the premier asset in both Chicago and San Francisco. Vornado is also the real estate industry leader in sustainability policy.
PLD,0.1517,PROLOGIS INC,"Prologis, Inc. is the global leader in logistics real estate with a focus on high-barrier, high-growth markets."
JNJ,0.1558,JOHNSON & JOHNSON,"Johnson & Johnson researches and develops, manufactures, and sells various products in the health care field worldwide. It operates in three segments: Consumer, Pharmaceutical, and Medical Devices."
ITW,0.1568,ILLINOIS TOOL WORKS,Illinois Tool Works Inc. manufactures and sells industrial products and equipment worldwide. It operates through seven segments: Automotive OEM; Food Equipment; Test & Measurement and Electronics; Welding; Polymers & Fluids; Construction Products; and Specialty Products.
RRD,0.1581,DONNELLEY (R R) & SONS CO,"R.R. Donnelley & Sons Company, an integrated communications provider, enables organizations to create, manage, deliver, and optimize their multichannel marketing and business communications."
BBBY,0.1584,BED BATH & BEYOND INC,"Bed Bath & Beyond Inc., together with its subsidiaries, operates a chain of retail stores."
HSP,0.1584,HOSPIRA INC,"Hospira, Inc. provides injectable drugs and infusion technologies to develop, manufacture, distribute, and market products worldwide. The company operates through Americas, EMEA, and APAC segments."
PCL,0.164,PLUM CREEK TIMBER CO INC,"As on February 19, 2016, Plum Creek Timber Co. Inc. was acquired by Weyerhaeuser Co. Plum Creek Timber Company, Inc. is a privately owned real estate investment trust (REIT). The trust owns and manages timberlands in the United States."
WPX,0.1655,WPX ENERGY INC,"WPX Energy, Inc., an independent oil and natural gas exploration and production company, engages in the exploitation and development of unconventional properties in the United States. It produces oil, natural gas, and natural gas liquids."
CAG,0.1667,CONAGRA BRANDS INC,"Conagra Brands, Inc., together with its subsidiaries, operates as a consumer packaged goods food company in North America. The company operates through Grocery & Snacks, Refrigerated & Frozen, International, and Foodservice segments."
TE,0.1717,TECO ENERGY INC,"TECO Energy, Inc., an electric and gas utility holding company, engages in the regulated electric and gas utility operations."
AAP,0.1732,ADVANCE AUTO PARTS INC,"Advance Auto Parts, Inc. provides automotive replacement parts, accessories, batteries, and maintenance items for domestic and imported cars, vans, sport utility vehicles, and light and heavy duty trucks."
BMY,0.1736,BRISTOL-MYERS SQUIBB CO,"Bristol-Myers Squibb Company discovers, develops, licenses, manufactures, and markets biopharmaceutical products worldwide. It offers products in hematology, oncology, cardiovascular, and immunology therapeutic classes."
NOC,0.1753,NORTHROP GRUMMAN CORP,Northrop Grumman Corporation operates as a security company.
PCS,0.1785,METROPCS COMMUNICATIONS INC,"As of April 30, 2013, MetroPCS Communications, Inc. was acquired by T-Mobile USA Inc., in a reverse merger transaction. MetroPCS Communications, Inc., a wireless telecommunications carrier, together with its subsidiaries, provides wireless broadband mobile services in the United States."
DVN,0.1798,DEVON ENERGY CORP,"Devon Energy Corporation, an independent energy company, primarily engages in the exploration, development, and production of oil, natural gas, and natural gas liquids in the United States. It operates approximately 3,955 gross wells."
PDCO,0.1812,PATTERSON COS INC,"Patterson Companies, Inc. distributes and sells dental and animal health products in the United States, the United Kingdom, and Canada. It operates through three segments; Dental, Animal Health, and Corporate segments."
EOG,0.1817,EOG RESOURCES INC,"EOG Resources, Inc., together with its subsidiaries, explores for, develops, produces, and markets crude oil, and natural gas and natural gas liquids."
HAS,0.1822,HASBRO INC,"Hasbro, Inc., together with its subsidiaries, operates as a play and entertainment company. The company's U.S."
FE,0.1828,FIRSTENERGY CORP,"FirstEnergy Corp., through its subsidiaries, generates, transmits, and distributes electricity in the United States. The company operates through Regulated Distribution and Regulated Transmission segments."
BDX,0.186,BECTON DICKINSON & CO,"Becton, Dickinson and Company develops, manufactures, and sells medical supplies, devices, laboratory equipment, and diagnostic products worldwide."
CAH,0.1884,CARDINAL HEALTH INC,"Cardinal Health, Inc. operates as an integrated healthcare services and products company in the United States and internationally. It provides customized solutions for hospitals, healthcare systems, pharmacies, ambulatory surgery centers, clinical laboratories, and physician offices."
BIG,0.1885,BIG LOTS INC,"Big Lots, Inc., through its subsidiaries, operates as a retailer in the United States."
