,dist,conm,busdesc
ED,0.0,CONSOLIDATED EDISON INC,"Consolidated Edison, Inc., through its subsidiaries, engages in regulated electric, gas, and steam delivery businesses in the United States."
SO,0.199,SOUTHERN CO,"The Southern Company, through its subsidiaries, engages in the generation, transmission, and distribution of electricity. It operates in four segments: Gas Distribution Operations, Gas Pipeline Investments, Wholesale Gas Services, and Gas Marketing Services."
XEL,0.2338,XCEL ENERGY INC,"Xcel Energy Inc., through its subsidiaries, generates, purchases, transmits, distributes, and sells electricity. It operates through Regulated Electric Utility, Regulated Natural Gas Utility, and All Other segments."
DUK,0.2511,DUKE ENERGY CORP,"Duke Energy Corporation, together with its subsidiaries, operates as an energy company in the United States. It operates through three segments: Electric Utilities and Infrastructure, Gas Utilities and Infrastructure, and Commercial Renewables."
AEP,0.3152,AMERICAN ELECTRIC POWER CO,"American Electric Power Company, Inc., an electric public utility holding company, engages in the generation, transmission, and distribution of electricity for sale to retail and wholesale customers in the United States."
SCG,0.3226,SCANA CORP,"SCANA Corporation, through its subsidiaries, generates, transmits, distributes, and sells electricity to wholesale and retail customers. The company operates through Electric Operations, Gas Distribution, and Gas Marketing segments."
WEC,0.3244,WEC ENERGY GROUP INC,"WEC Energy Group, Inc., through its subsidiaries, provides regulated natural gas and electricity, and nonregulated renewable energy services in the United States."
PNW,0.3397,PINNACLE WEST CAPITAL CORP,"Pinnacle West Capital Corporation, through its subsidiary, Arizona Public Service Company, provides retail and wholesale electric services primarily in the state of Arizona."
PCG,0.3572,PG&E CORP,"PG&E Corporation, through its subsidiary, Pacific Gas and Electric Company, engages in the sale and delivery of electricity and natural gas to customers in northern and central California, the United States."
EVRG,0.3745,EVERGY INC,"Evergy, Inc., through its subsidiaries, engages in the generation, transmission, distribution, and sale of electricity in Kansas and Missouri."
D,0.38,DOMINION ENERGY INC,"Dominion Energy, Inc. produces and transports energy. The company's Dominion Energy Virginia segment engages in the regulated electric generation, transmission, and distribution operations that serve residential, commercial, industrial, and governmental customers in Virginia and North Carolina."
DTE,0.3822,DTE ENERGY CO,"DTE Energy Company engages in the utility operations. The company's Electric segment generates, purchases, distributes, and sells electricity to approximately 2.2 million residential, commercial, and industrial customers in southeastern Michigan."
ES,0.3998,EVERSOURCE ENERGY,"Eversource Energy, a public utility holding company, engages in the energy delivery business. The company operates in four segments: Electric Distribution, Electric Transmission, Natural Gas Distribution, and Water Distribution."
CMS,0.4004,CMS ENERGY CORP,"CMS Energy Corporation operates as an energy company primarily in Michigan. The company operates in four segments: Electric Utility, Gas Utility, Enterprises, and EnerBank. The Electric Utility segment is involved in the generation, purchase, transmission, distribution, and sale of electricity."
AEE,0.4009,AMEREN CORP,"Ameren Corporation, together with its subsidiaries, operates as a public utility holding company in the United States. It operates through four segments: Ameren Missouri, Ameren Illinois Electric Distribution, Ameren Illinois Natural Gas, and Ameren Transmission."
EIX,0.4077,EDISON INTERNATIONAL,"Edison International, through its subsidiaries, engages in the generation, transmission, and distribution of electricity in the United States. The company generates electricity through hydroelectric, diesel/liquid petroleum gas, natural gas, nuclear, and photovoltaic sources."
POM,0.427,PEPCO HOLDINGS INC,"Pepco Holdings LLC operates as a utility services holding company. The company operates through Pepco, DPL, and ACE segments."
EXC,0.444,EXELON CORP,"Exelon Corporation, a utility services holding company, engages in the generation and marketing of energy in the United States and Canada. It owns nuclear, fossil, wind, hydroelectric, biomass, and solar generating facilities."
ETR,0.4664,ENTERGY CORP,"Entergy Corporation, together with its subsidiaries, engages in the production and distribution of electricity in the United States. The company generates electricity through gas/oil, nuclear, coal, hydro, and solar power sources."
CNP,0.4748,CENTERPOINT ENERGY INC,"CenterPoint Energy, Inc. operates as a public utility holding company in the United States. The company's Houston Electric T&D segment electric transmission and distribution services to electric utility."
PEG,0.4783,PUBLIC SERVICE ENTRP GRP INC,"Public Service Enterprise Group Incorporated, through its subsidiaries, operates as an energy company primarily in the Northeastern and Mid-Atlantic United States. It operates through two segments, PSE&G and PSEG Power."
FE,0.4895,FIRSTENERGY CORP,"FirstEnergy Corp., through its subsidiaries, generates, transmits, and distributes electricity in the United States. The company operates through Regulated Distribution and Regulated Transmission segments."
LLY,0.4971,LILLY (ELI) & CO,"Eli Lilly and Company discovers, develops, manufactures, and markets pharmaceutical products worldwide. It offers endocrinology products for diabetes; osteoporosis in postmenopausal women and men; and human growth hormone deficiency and paediatric growth conditions."
NEE,0.5016,NEXTERA ENERGY INC,"NextEra Energy, Inc., through its subsidiaries, generates, transmits, and distributes electric power in North America. The company generates electricity through wind, solar, nuclear, coal, oil, and natural gas facilities."
NI,0.519,NISOURCE INC,"NiSource Inc., an energy holding company, operates as a regulated natural gas and electric utility company in the United States. The company operates through two segments, Gas Distribution Operations and Electric Operations."
PPL,0.5559,PPL CORP,"PPL Corporation, a utility holding company, delivers electricity and natural gas in the United States and the United Kingdom. The company operates through three segments: U.K. Regulated, Kentucky Regulated, and Pennsylvania Regulated."
BMY,0.5634,BRISTOL-MYERS SQUIBB CO,"Bristol-Myers Squibb Company discovers, develops, licenses, manufactures, and markets biopharmaceutical products worldwide. It offers products in hematology, oncology, cardiovascular, and immunology therapeutic classes."
WM,0.6186,WASTE MANAGEMENT INC,"Waste Management, Inc., through its subsidiaries, provides waste management environmental services to residential, commercial, industrial, and municipal customers in North America."
TE,0.6329,TECO ENERGY INC,"TECO Energy, Inc., an electric and gas utility holding company, engages in the regulated electric and gas utility operations."
AYE,0.6494,ALLEGHENY ENERGY INC,"As of January 1, 2014, Allegheny Energy Inc. was acquired by FirstEnergy Corp. Allegheny Energy, Inc. owns & operates electric generation facilities & delivers electric services to customers in Pennsylvania, West Virginia, Maryland & Virginia."
BCR,0.6647,BARD (C.R.) INC,"C. R. Bard, Inc. designs, manufactures, packages, distributes, and sells medical, surgical, diagnostic, and patient care devices worldwide."
FRX,0.7166,FOREST LABORATORIES  -CL A,"Forest Laboratories, LLC develops, manufactures, and sells branded forms of ethical drug products in the United States and Europe."
MRK,0.717,MERCK & CO,"Merck & Co., Inc. provides healthcare solutions worldwide."
PM,0.7621,PHILIP MORRIS INTERNATIONAL,"Philip Morris International Inc., through its subsidiaries, manufactures and sells cigarettes, other nicotine-containing products, smoke-free products, and related electronic devices and accessories."
CCU,0.806,COMPANIA CERVECERIAS UNIDAS,"Compania Cervecerias Unidas S.A. operates as a beverage company principally in Chile, Argentina, Uruguay, Paraguay, Colombia, and Bolivia. The company operates through three segments: Chile, International Business, and Wine."
QCOM,0.9022,QUALCOMM INC,"QUALCOMM Incorporated engages in the development and commercialization of foundational technologies and products are used in mobile devices and other wireless products, including network equipment, broadband gateway equipment, consumer electronic devices, and other connected devices worldwide."
