,dist,conm,busdesc
PAYX,0.6067,PAYCHEX INC,"Paychex, Inc. provides integrated human capital management solutions for human resources (HR), payroll, benefits, and insurance services for small- to medium-sized businesses in the United States and Europe."
VAR,0.6121,VARIAN MEDICAL SYSTEMS INC,"Varian Medical Systems, Inc. designs, manufactures, sells, and services medical devices and software products for treating cancer and other medical conditions worldwide. It operates through Oncology Systems and Proton Solutions segments."
NFX,0.6151,NEWFIELD EXPLORATION CO,"Ovintiv Exploration Inc. engages in the exploration, development, and production of crude oil, natural gas, and natural gas liquids in the United States. Ovintiv Exploration Inc. was formerly known as Newfield Exploration Company and changed its name to Ovintiv Exploration Inc. in 2020."
BSX,0.6164,BOSTON SCIENTIFIC CORP,"Boston Scientific Corporation develops, manufactures, and markets medical devices for use in various interventional medical specialties worldwide. It operates through three segments: MedSurg, Rhythm and Neuro, and Cardiovascular."
R,0.6203,RYDER SYSTEM INC,"Ryder System, Inc. provides transportation and supply chain management solutions worldwide. The company operates through three segments: Fleet Management Solutions (FMS), Supply Chain Solutions (SCS), and Dedicated Transportation Solutions (DTS)."
CME,0.6241,CME GROUP INC,"CME Group Inc., through its subsidiaries, operates contract markets for the trading of futures and options on futures contracts worldwide."
PWR,0.633,QUANTA SERVICES INC,"Quanta Services, Inc. provides specialty contracting services in the United States, Canada, Australia, Latin America, and internationally."
ADP,0.6448,AUTOMATIC DATA PROCESSING,"Automatic Data Processing, Inc. provides cloud-based human capital management solutions worldwide. It operates through two segments, Employer Services and Professional Employer Organization (PEO)."
UNP,0.6495,UNION PACIFIC CORP,"Union Pacific Corporation, through its subsidiary, Union Pacific Railroad Company, engages in the railroad business in the United States."
CVS,0.6497,CVS HEALTH CORP,CVS Health Corporation provides health services and plans in the United States.
JBHT,0.654,HUNT (JB) TRANSPRT SVCS INC,"J.B. Hunt Transport Services, Inc., together with its subsidiaries, provides surface transportation and delivery services in the continental United States, Canada, and Mexico."
VRSN,0.6765,VERISIGN INC,"VeriSign, Inc., together with its subsidiaries, provides domain name registry services and Internet infrastructure that enables Internet navigation for various recognized domain names worldwide."
HRB,0.69,BLOCK H & R INC,"H&R Block, Inc., through its subsidiaries, provides assisted income tax return preparation, do-it-yourself (DIY) tax, and virtual tax preparation services and products to the general public primarily in the United States, Canada, and Australia."
GD,0.7125,GENERAL DYNAMICS CORP,"General Dynamics Corporation operates as an aerospace and defense company worldwide. It operates through five segments: Aerospace, Combat Systems, Information Technology, Mission Systems, and Marine Systems."
DRI,0.7152,DARDEN RESTAURANTS INC,"Darden Restaurants, Inc., through its subsidiaries, owns and operates full-service restaurants in the United States and Canada."
GPS,0.7184,GAP INC,"The Gap, Inc. operates as an apparel retail company worldwide. The company offers apparel, accessories, and personal care products for men, women, and children under the Old Navy, Gap, Banana Republic, Athleta, Intermix, Janie and Jack, and Hill City brands."
GOOGL,0.7226,ALPHABET INC,"Alphabet Inc. provides online advertising services in the United States, Europe, the Middle East, Africa, the Asia-Pacific, Canada, and Latin America. It offers performance and brand advertising services. The company operates through Google and Other Bets segments."
DHR,0.7332,DANAHER CORP,"Danaher Corporation designs, manufactures, and markets professional, medical, industrial, and commercial products and services worldwide. The company operates through three segments; Life Sciences, Diagnostics, and Environmental & Applied Solutions."
SUN,0.7457,SUNOCO LP,"Sunoco LP, together with its subsidiaries, engages in the distribution and retailing of motor fuels in the United States. It operates through two segments, Fuel Distribution and Marketing, and All Other."
NYT,0.7759,NEW YORK TIMES CO  -CL A,"The New York Times Company, together with its subsidiaries, provides news and information for readers and viewers across various platforms worldwide."
A,0.779,AGILENT TECHNOLOGIES INC,"Agilent Technologies, Inc. provides application focused solutions to the life sciences, diagnostics, and applied chemical markets worldwide."
CFN,0.7792,CAREFUSION CORP,"CareFusion Corporation, a medical technology company, provides various healthcare products and services. It offers product lines in the areas of medication management, infection prevention, operating room effectiveness, and respiratory care."
