,dist,conm,busdesc
APA,0.0,APACHE CORP,"Apache Corporation, an independent energy company, explores for, develops, and produces natural gas, crude oil, and natural gas liquids (NGLs)."
APC,0.1643,ANADARKO PETROLEUM CORP,"Anadarko Petroleum Corporation engages in the exploration, development, production, and marketing of oil and gas properties. It operates through three segments: Exploration and Production, WES Midstream, and Other Midstream."
DVN,0.1772,DEVON ENERGY CORP,"Devon Energy Corporation, an independent energy company, primarily engages in the exploration, development, and production of oil, natural gas, and natural gas liquids in the United States. It operates approximately 3,955 gross wells."
XTO,0.1779,XTO ENERGY INC,XTO Energy Inc. extracts natural gas from shale and other tight formations. It also produces crude oil and natural gas liquids in the United States. The company owns interests in various oil and natural gas wells in the United States. XTO Energy Inc.
EOG,0.1932,EOG RESOURCES INC,"EOG Resources, Inc., together with its subsidiaries, explores for, develops, produces, and markets crude oil, and natural gas and natural gas liquids."
NFX,0.2018,NEWFIELD EXPLORATION CO,"Ovintiv Exploration Inc. engages in the exploration, development, and production of crude oil, natural gas, and natural gas liquids in the United States. Ovintiv Exploration Inc. was formerly known as Newfield Exploration Company and changed its name to Ovintiv Exploration Inc. in 2020."
OXY,0.2091,OCCIDENTAL PETROLEUM CORP,"Occidental Petroleum Corporation, together with its subsidiaries, engages in the acquisition, exploration, and development of oil and gas properties in the United States, the Middle East, and Latin America."
RIG,0.2238,TRANSOCEAN LTD,"Transocean Ltd., together with its subsidiaries, provides offshore contract drilling services for oil and gas wells worldwide. The company primarily offers drilling rigs, related equipment, and work crews; and ultra-deepwater and harsh environment drilling services."
NBL,0.2302,NOBLE ENERGY INC,"Noble Energy, Inc., an independent energy company, engages in the acquisition, exploration, development, and production of crude oil and natural gas worldwide. The company also owns, operates, develops, and acquires domestic midstream infrastructure assets in the DJ and Delaware Basins."
RDC,0.2373,ROWAN COMPANIES LTD,"Rowan Companies Limited provides offshore contract drilling services to the oil and gas industry. It operates through three segments: Deepwater, Jack-ups, and ARO. The Deepwater segment operates 4 ultra-deepwater drillships. The Jack-ups segment operates 15 self-elevating jack-up rigs."
MRO,0.2449,MARATHON OIL CORP,Marathon Oil Corporation operates as an independent exploration and production company in the United States and Equatorial Guinea.
HES,0.2451,HESS CORP,"Hess Corporation, an exploration and production company, explores, develops, produces, purchases, transports, and sells crude oil, natural gas liquids (NGLs), and natural gas. It operates through two segments, Exploration and Production, and Midstream."
NBR,0.2475,NABORS INDUSTRIES LTD,"Nabors Industries Ltd. provides drilling and drilling-related services for land-based and offshore oil and natural gas wells. It operates through five segments: U.S. Drilling, Canada Drilling, International Drilling, Drilling Solutions, and Rig Technologies."
COP,0.2527,CONOCOPHILLIPS,"ConocoPhillips explores for, produces, transports, and markets crude oil, bitumen, natural gas, liquefied natural gas (LNG), and natural gas liquids worldwide."
COG,0.2529,CABOT OIL & GAS CORP,"Cabot Oil & Gas Corporation, an independent oil and gas company, explores for, exploits, develops, produces, and markets oil and gas properties in the United States."
XOM,0.2669,EXXON MOBIL CORP,"Exxon Mobil Corporation explores for and produces crude oil and natural gas in the United States, Canada/other Americas, Europe, Africa, Asia, and Australia/Oceania. It operates through Upstream, Downstream, and Chemical segments."
HAL,0.2701,HALLIBURTON CO,Halliburton Company provides a range of services and products to oil and natural gas companies worldwide.
RRC,0.2722,RANGE RESOURCES CORP,"Range Resources Corporation operates as an independent natural gas, natural gas liquids (NGLs), and oil company in the United States. The company engages in the exploration, development, and acquisition of natural gas and oil properties."
NOV,0.2745,NATIONAL OILWELL VARCO INC,"National Oilwell Varco, Inc. designs, constructs, manufactures, and sells systems, components, and products for oil and gas drilling and production worldwide. It operates through three segments: Wellbore Technologies, Completion & Production Solutions, and Rig Technologies."
SLB,0.2751,SCHLUMBERGER LTD,"Schlumberger Limited supplies technology for reservoir characterization, drilling, production, and processing to the oil and gas industry worldwide. It operates in four divisions: Digital & Integration, Reservoir Performance, Well Construction, and Production Systems."
HP,0.2772,HELMERICH & PAYNE,"Helmerich & Payne, Inc., together with its subsidiaries, provides drilling services and solutions for exploration and production companies. The company operates through three segments: North America Solutions, Offshore Gulf of Mexico, and International Solutions."
BHI,0.2796,BAKER HUGHES INC,"Baker Hughes Holdings LLC operates as an energy technology company. The company operates through four segments: Oilfield Services, Oilfield Equipment, Turbomachinery & Process Solutions, and Digital Solutions."
CVX,0.2909,CHEVRON CORP,"Chevron Corporation, through its subsidiaries, engages in integrated energy, chemicals, and petroleum operations worldwide. The company operates in two segments, Upstream and Downstream."
VLO,0.2954,VALERO ENERGY CORP,"Valero Energy Corporation manufactures and sells transportation fuels and petrochemical products in the United States, Canada, the United Kingdom, Ireland, and internationally. It operates through three segments: Refining, Ethanol, and Renewable Diesel."
PXD,0.2995,PIONEER NATURAL RESOURCES CO,"Pioneer Natural Resources Company operates as an independent oil and gas exploration and production company in the United States. The company explores for, develops, and produces oil, natural gas liquids (NGLs), and gas. It has operations primarily in the Permian Basin in West Texas."
MUR,0.3087,MURPHY OIL CORP,"Murphy Oil Corporation operates as an oil and natural gas exploration and production company in the United States, Canada, and internationally. It explores for and produces crude oil, natural gas, and natural gas liquids."
WMB,0.3147,WILLIAMS COS INC,"The Williams Companies, Inc., together with its subsidiaries, operates as an energy infrastructure company primarily in the United States. It operates through Atlantic-Gulf, Northeast G&P, and West segments."
CAM,0.3246,CAMERON INTERNATIONAL CORP,"Cameron International Corporation provides flow equipment products, systems, and services worldwide."
ANDV,0.3332,ANDEAVOR,"Andeavor, through its subsidiaries, operates as an independent petroleum refining, logistics, and marketing company in the United States. The company operates in three segments: Marketing, Logistics, and Refining."
SWN,0.3634,SOUTHWESTERN ENERGY CO,"Southwestern Energy Company, an independent energy company, engages in the exploration, development, and production of natural gas, oil, and natural gas liquids (NGLs) in the United States. It operates through Exploration and Production, and Marketing segments."
HFC,0.3977,HOLLYFRONTIER CORP,"HollyFrontier Corporation operates as an independent petroleum refiner in the United States. The company operates through three segments: Refining, Lubricants and Specialty Products, and HEP."
XEC,0.4043,CIMAREX ENERGY CO,"Cimarex Energy Co. operates as an independent oil and gas exploration and production company primarily in Texas, Oklahoma, and New Mexico."
CNX,0.4562,CNX RESOURCES CORPORATION,"CNX Resources Corporation, an independent oil and gas company, explores for, develops, and produces natural gas properties primarily in the Appalachian Basin. The company operates through two divisions, Exploration and Production (E&P), and Midstream."
STR,0.461,QUESTAR CORP,Dominion Energy Questar Corporation operates as an integrated natural gas company in the United States.
MEE,0.4657,MASSEY ENERGY CO,"Alpha Appalachia Holdings, Inc., through its subsidiaries, operates coal mines and processing facilities primarily in the United States."
EP,0.5746,EL PASO CORP,"El Paso LLC offers natural gas transmission, and exploration and production services primarily in the United States."
EQT,0.5796,EQT CORP,"EQT Corporation operates as a natural gas production company in the United States. The company produces natural gas, natural gas liquids (NGLs), and crude oil."
OKE,0.6652,ONEOK INC,"ONEOK, Inc., together with its subsidiaries, engages in gathering, processing, storage, and transportation of natural gas in the United States. It operates through Natural Gas Gathering and Processing, Natural Gas Liquids, and Natural Gas Pipelines segments."
NRG,0.7061,NRG ENERGY INC,"NRG Energy, Inc., together with its subsidiaries, operates as an energy company in the United States. It operates through Generation and Retail segments."
NEM,0.7817,NEWMONT CORP,"Newmont Corporation engages in the production and exploration of gold, copper, silver, zinc, and lead. The company has operations and/or assets in the United States, Canada, Mexico, Dominican Republic, Peru, Suriname, Argentina, Chile, Australia, and Ghana."
