,dist,conm,busdesc
CMCSA,0.0,COMCAST CORP,"Comcast Corporation operates as a media and technology company worldwide. It operates through Cable Communications, Cable Networks, Broadcast Television, Filmed Entertainment, Theme Parks, and Sky segments."
CMCSK,0.0364,COMCAST CORP,"Comcast Corporation operates as a media and technology company worldwide. It operates through Cable Communications, Cable Networks, Broadcast Television, Filmed Entertainment, Theme Parks, and Sky segments."
CVC,0.5639,ALTICE USA INC,"Altice USA, Inc., together with its subsidiaries, provides broadband communications and video services in the United States, Canada, Puerto Rico, and the Virgin Islands. It offers broadband, video, and telephony services to approximately 4.9 million residential and business customers."
TWX,0.7329,TIME WARNER INC,"Warner Media operates as a media and entertainment company worldwide. It operates in three segments: Turner, Home Box Office, and Warner Bros. The Turner segment creates and programs branded news, entertainment, sports, and kids multi-platform content for consumers."
PRGO,0.8716,PERRIGO CO PLC,Perrigo Company plc provides over-the-counter (OTC) health and wellness solutions that enhance individual well-being by empowering consumers to prevent or treat conditions that can be self-managed.
