,dist,conm,busdesc
CCI,0.0,CROWN CASTLE INTL CORP,"Crown Castle owns, operates and leases more than 40,000 cell towers and approximately 80,000 route miles of fiber supporting small cells and fiber solutions across every major U.S. market."
AMT,0.577,AMERICAN TOWER CORP,"American Tower, one of the largest global REITs, is a leading independent owner, operator and developer of multitenant communications real estate with a portfolio of approximately 181,000 communications sites."
RHT,0.676,RED HAT INC,"Red Hat, Inc. provides open source software solutions to develop and offer operating system, virtualization, management, middleware, cloud, and storage technologies to various enterprises worldwide."
AMG,0.7244,AFFILIATED MANAGERS GRP INC,"Affiliated Managers Group, Inc., through its affiliates, operates as an asset management company providing investment management services to mutual funds, institutional clients, and high net worth individuals in the United States. It provides advisory or subadvisory services to mutual funds."
BKNG,0.7343,BOOKING HOLDINGS INC,Booking Holdings Inc. provides travel and restaurant online reservation and related services worldwide.
SBAC,0.7361,SBA COMMUNICATIONS CORP,"SBA Communications Corporation is a first choice provider and leading owner and operator of wireless communications infrastructure in North, Central, and South America and South Africa."
LXK,0.7817,LEXMARK INTL INC  -CL A,"Lexmark International, Inc., together with its subsidiaries, operates as a developer, manufacturer, and supplier of printing, imaging, device management, and document workflow solutions."
