,dist,conm,busdesc
TGNA,0.0,TEGNA INC,TEGNA Inc. operates as a media company in the United States. The company operates television stations and radio stations that deliver television programming and digital content. It offers content and information to consumers across various platforms.
NYT,0.6531,NEW YORK TIMES CO  -CL A,"The New York Times Company, together with its subsidiaries, provides news and information for readers and viewers across various platforms worldwide."
TRB,0.6708,TRIBUNE MEDIA CO,"Tribune Media Company, through its subsidiaries, operates as a diversified media and entertainment company in the United States."
DJ,0.7133,DOW JONES & CO INC,"Dow Jones & Company, Inc. offers business and financial news and information globally to consumers and organizations worldwide. It provides solutions through newspapers, newswires, Websites, applications, newsletters, magazines, databases, and conferences."
SSP,0.7478,EW SCRIPPS  -CL A,"The E.W. Scripps Company, together with its subsidiaries, operates as a media enterprise through a portfolio of local and national media brands. The company operates through Local Media, National Media, and Other segments."
SVU,0.7986,SUPERVALU INC,"SUPERVALU INC., together with its subsidiaries, operates as a grocery wholesaler and retailer in the United States and internationally. It operates through two segments, Wholesale and Retail."
MDP,0.8088,MEREDITH CORP,"Meredith Corporation operates as a diversified media company primarily in the United States. It operates in two segments, National Media and Local Media."
SPGI,0.9026,S&P GLOBAL INC,"S&P Global Inc., together with its subsidiaries, provides ratings, benchmarks, analytics, and data to the capital and commodity markets worldwide."
